,title,body,is_image,id,author,url,num_comments,num_upvotes
0,Does anyone else with a knowledge of programming get the urge to get into cybercrime and become a digital Robin Hood?,"The more I look at my other options the more shit they seem. In-house tech support pays like shit and gets no respect, working for a major tech company means terrible hours, and independent development doesn't pay enough to live on. I just want to do something that pays enough to live on, doesn't make wanna die, and leaves me with plenty of time to live my actual fucking life for fuck's sake.",False,j0ivgc,r0binh00dthrowaway,https://www.reddit.com/r/antiwork/comments/j0ivgc/does_anyone_else_with_a_knowledge_of_programming/,11,1
1,Plan your annual leave right!,"Hey guys, 

Been reading this thread a lot more recently and found it helps when I’m feeling unmotivated or frustrated about working. Sometimes get a good laugh and it cheers me up. 

It’s ‘nice’ knowing others feel the same, but I found something that helped me feel better today. I put in all my annual leave (30 days) around all the busiest times during work so I will be working the bulk of my hours during the “low season” if you will and have lots of days off on Mondays and Fridays attached to the weekends during the peak busy times of year. This really mentally splits up the drudgery and weeks of what feels like monotony and endless work.

Working 3/4 day weeks makes such a difference if you’re really going through it. I find staggering my holidays through out the year helps, I’d get seriously depressed if I knew I didn’t have annual leave for 6+ months. Too scared to touch any sick days until I reach 5+ years continuous service. 

Remember to take care of yourself first!",False,j0xvme,Bluetaggeo,https://www.reddit.com/r/antiwork/comments/j0xvme/plan_your_annual_leave_right/,2,1
2,What does Covid-19 mean for Capitalism?,,False,j0urbw,i-like-tortoises,https://youtu.be/gqUhsWdieis,1,1
3,This is really sad,,False,j0xis5,reseday,https://v.redd.it/9q2qcq6ewop51,9,1
4,Sick Time = Poor people vacation days,"   

* LDONT FEEL WELE

TIME OFF FOR WHEN I FEELBENTER

imgfiipiéom
",True,j0u3e7,Shalashaskaska,https://i.redd.it/dllorgsaamp51.jpg,16,3
5,"""Class"" division among countries","As a ""developing"" country citizen I get bombarded everyday with media and people in general stating how great capitalism is and how wonderful it works for Europe, the US and many former british empire  colonies,  and how our countries in the south emisphere are shitholes and should instead embrace their free market system.  These people never stop and  guess what would happen to the wealthy countries if someday Africa, Latin America Asia and the middle east decided to stop giving their resources for nothing and providing cheap labour... how long the living standard of the global north could be mantained if suddendly their governments and corporations had to retreat from the third world? Would they be as rich and powerful if they had to play fair instead of sinking peaceful nations into debt  with the world financial system or burn to ashes those that do not participate in this global scam?",False,j1q4mj,CallCenterDweller,https://www.reddit.com/r/antiwork/comments/j1q4mj/class_division_among_countries/,9,1
6,Just venting,"I use to work at a beauty store. I have moved around states a lot. This specific chain is all over the nation. Since working retail, it has riddled me with anxiety to the point I can’t stick with anything for more than 3 months. 

Working with the public has destroyed me. I have been called racist for telling customers to please not try on nail polish if they’re not going to buy it. I’ve also been bitched out by my managers for not following black customers all throughout the store. I’ve also been bitched at for not chasing thieves down in the parking lot. I’m not risking my life for a fucking tube of lipstick! 

It’s so fucked. I want to make money but I don’t want to be miserable doing it. I envy people who can grind it out. My family thinks I’m super weak for not being able to &amp; I’m often the topic of conversation so they can deflect when it comes to their flaws. 

I understand why some people equate work ethic to productivity, but I don’t think employment should define a persons value.",False,j26i1s,kzeash,https://www.reddit.com/r/antiwork/comments/j26i1s/just_venting/,5,2
7,What if you could choose between a pay raise or that percentage of time off?,"Say for example, you’re due for a promotion. What if you could choose instead of a 10% raise (example only lol) you took 10% of your pay period off? 
And you can continue to do so each raise/promotion cycle until you’re working part time for that same salary or take the raise one year and the reduction in hours another. I would like to have the option. It kind of falls apart when most of us don’t get raises and they’re less than 5%, but anyway, just a thought. 
Personally, 40 more years in front of a computer screen for 40 hours a week makes me pray for an option like this.",False,j1v052,goodstuffsamantha,https://www.reddit.com/r/antiwork/comments/j1v052/what_if_you_could_choose_between_a_pay_raise_or/,8,1
8,My request for a better work computer got denied. This works to my advantage.,"I deal with maps. One of the projects I'm attempting to work on for example uses topography of my county with a 1M resolution. It takes a decent computer to do that in a reasonable time. I have a decent computer aside from a graphics card. I asked for a better one but they denied it. So literally any time I do something like pan the map it takes a solid two minutes to reload. Doing anything more intensive can take an hour and the computer is pretty much unusable.

(Now I also am severely underpaid for my skillset. It's roughly half as much and a promotion was also denied because of budget constraints thanks to COVID.)

So I guess I have a legitimate reason to be on my phone all day. I have the golden anti-work ticket. 🤷‍♂️",False,j21nq0,VerneAsimov,https://www.reddit.com/r/antiwork/comments/j21nq0/my_request_for_a_better_work_computer_got_denied/,9,1
9,How to supplement income online,"Got my first job, it’s contract work, no benefits I hate it. I get anxiety attacks and cry every day from lack of direction/high potential to mess up. 

I can’t drive (yet) and don’t live within walkable distance of town. 

Any online suggestions on easy ways to make money online? I do some writing on Medium but that’s it at the moment. 

Favorite sites, ideas, etc. thank you",False,j15a7r,rachelolga,https://www.reddit.com/r/antiwork/comments/j15a7r/how_to_supplement_income_online/,2,1
10,Explosive Amazon warehouse data suggests serious injuries have been on the rise for years and robots have made the job more dangerous,,False,j2n8ky,Kazemel89,https://www.businessinsider.com/explosive-reveal-amazon-warehouse-injuries-report-2020-9,1,1
11,Office politics are absolutely killing me. I work at a grocery store.,"It's a higher-end store similar to Whole Foods. I'm a cashier there, I've been there for a few years. It's a job that a lot of people don't want and most people don't hold onto for long. It's a loud, busy environment working with customers ranging from friendly to hostile to aggressive. Sadly, there's an internal conflict in the store over who has to backup the cashiers when we start getting lines. My manager won't help us out unless she really has to and immediately returns to her office when she can. There are some staff that just refuse to have anything to do with it. Others will help out, but are unhappy about it and become short with customers. 

The whole thing is so demoralizing because my employer is basically saying that my job sucks so bad that people fight over who will have to do it for a few minutes. But, acknowledgement of the work I do is nonexistent and compensation is restricted as much as possible. There was one employee who made a big deal about it and argued a lot with upper management about my manager not helping out. They fired him over it so now talking about it is totally taboo. 

I just keep thinking, god damn, this is a grocery store, how can there be so much conflict?",False,j2dzme,TooFatToMatt,https://www.reddit.com/r/antiwork/comments/j2dzme/office_politics_are_absolutely_killing_me_i_work/,9,1
12,5 Tips For Remote Networking,,False,j2hcoo,FrankMarkovic,https://www.adeccogroup.com/futuhreinsight/5-tips-for-remote-networking/,1,1
13,Pizza shop boss hits me up about meeting he wants me to attend a couple hours before my shift on a day I’m working my 9-5.,,False,j0t0ax,Rafaelow,https://www.reddit.com/,0,1
14,Thinking about opening an Etsy store or selling from home,"Anyone on here making a living selling from home? I'm thinking of getting an Etsy store set up as an alternative to work but I don't know how well Etsy sellers do financially. Also thinking about volunteering too someplace like a theater, animal shelter, ect. I want to go more into the route of supporting the arts and I don't know where to start. I bought some canvases and I'm thinking about seeing if I can put my art in some local galleries. Any artist in this community that have had success stories? Love to hear them.",False,j199sc,Individual-Ask-7141,https://www.reddit.com/r/antiwork/comments/j199sc/thinking_about_opening_an_etsy_store_or_selling/,6,1
15,The biggest thing that annoys me about work/school culture is the Lack of Sleep,"So many things annoy me about our current work/school system in the US. Working Fast Food while getting my bachelors in accounting/finance bachelors sucks. 

All in all, out of everything the biggest thing I hate about our system is how a lack of sleep is normalized, accepted, and even used as bragging rights among people to show how hard-working they are. What's so great about feeling like shit all day cause you didn't give your body the 8 hours of sleep that it needs? I know that I personally feel like shit on days I don't get 8 hours. 

I would have to say that that attribute of our system is what makes me the most frustrated. God I  don't know how people do these 40-60 hour work weeks, raise children, cook, clean, laundry, etc. I think I'd kill myself if I ever tried to raise a child (gay anyways tho lol)

Increasingly thinking about just running off to Taiwan or Vietnam after college with my bachelors to teach english (TEFL) for 2-3 years. Clear my head. Work 20-30 hour weeks. No school. Plenty of sleep. Asian street food. 

Ugh sorry for the rant. What is the single most thing that annoys you about our system?",False,j12yfm,optimisticgay80,https://www.reddit.com/r/antiwork/comments/j12yfm/the_biggest_thing_that_annoys_me_about_workschool/,6,1
16,Working Goals.,,False,j1x433,AccoSpoot,https://www.nbcsandiego.com/news/national-international/secret-man-cave-discovered-below-grand-central-platform-3-mta-employees-busted/2411770/,0,1
17,Work or starve," 

    
  

a
es

—""

    

    
 

(

7.

by
Age

ne)

Work or
starve

 
",True,j1luxg,KoolAidDrank,https://i.redd.it/e0t9539ovup51.png,9,1
18,Remember pre-1500s North America when people were allowed to just go and like... live in a place," 

 

 

 

 

 

 

 

 

 

 

 

 

 

 

 

 

 

 

 
",True,j0szf9,Polestar-Lemniscate,https://i.redd.it/7234rzf6lpp51.jpg,27,1
19,My job is making everyone sign a Constitutional Oath [Florida],,False,j2ua1m,DumbNeurosurgeon,/r/legaladvice/comments/j2soq7/my_job_is_making_everyone_sign_a_constitutional/,0,1
20,Work slave work. 'I monitor my staff with software that takes screenshots' https://www.bbc.co.uk/news/business-54289152," 

|) Shibu Philip

Shibu Philip's firm has used the software Hubstaff for
the last year and a half

‘I monitor my staff with
software that takes screenshots'

By Dora Bones

Business reporter, BBC News

8 hours ago | Business

Shibu Philip admits he knows what it's like to
""maybe waste a bit of time at work"".

Shibu is the founder of Transcend - small London-
based firm that busy beauty products wholesale
and re-cells them online.

For the last year and a half he has used Hubstaff
software to track his workers’ hours, keystrokes,
mouse movements and webster visited.
",True,j1vm30,fletcheyyy,https://i.redd.it/eyfnqajuw1q51.jpg,31,1
21,"Are you struggling to find a (decent) job? Well, the folks at LinkedIn have helpful advice for you","[It's YOUR fault if you can't find a job.](https://www.linkedin.com/pulse/you-cant-find-job-its-your-fault-li-lin) That's right, no matter the systemic reasons (ratio between openings and applicants, employer-set pay rate vs responsibilities or risks employee assumes...) for your unemployment, all you have to do is ... know the right people, prepare for the interview, have money to **pay a professional for their job-hunt services**, and, above all, not be a (whiny) victim. Let's all send the writer(s) at LinkedIn a big Thank-You for their invaluable insight.",False,j25ab7,EfraimK,https://www.reddit.com/r/antiwork/comments/j25ab7/are_you_struggling_to_find_a_decent_job_well_the/,9,1
22,Arme Boomer: '(,"v

borders built their dream homes. Now they

the All street Journal @ (VVoU ° 20
Fifteen years ago, a generation of baby
can't sell them.

   

A Growing Problem in Real State: Too
Any Too Fig Houses
was.com

© 1928 7211194 © 4294 <&

‘e) Toe's Arab Hack

Is @YourFriendCrud

Replying to @WSJ

They should spend less money on
coffee and try pulling themselves up
by their bootstraps and accepting a
low offer just to get some experience
selling houses under their belts.
",True,j2vbxb,AdeptnessTime,https://i.redd.it/pkzv7r1ytcq51.png,1,1
23,Dreams of Quitting,"Ever get into a position where you’re hard to replace, do a lot but it’s not recognized and your boss is a total douchebag? I seriously stay awake at night sometimes fantasizing about quitting and how screwed over my employer would be for a while until they managed to hire and train someone in like, six months to a year. 

I want to hear your stories of when you did just that so I can live vicariously through you.",False,j2nryg,Telomera,https://www.reddit.com/r/antiwork/comments/j2nryg/dreams_of_quitting/,9,1
24,Even my dissatisfaction is a commodity.," 

| Late By Mob.

in) He)""

of SPOTIFY - 2,060 FOLLOWERS
",True,j2q8pd,thumz,https://i.redd.it/sxkb66l1ibq51.jpg,3,1
25,"Anybody here ""raised"" by workaholic parents?","How was your situation growing up? What impact did it have on your childhood? Any persisting emotional baggage or mental health issues - psychological, philosophical or behavioral? 


How did it shape your attitude towards work, leisure, friends, relationships? 


Feel free to add anything else you feel relevant to bring up.",False,j2hqt3,TsaoxiChizuguPhukLam,https://www.reddit.com/r/antiwork/comments/j2hqt3/anybody_here_raised_by_workaholic_parents/,1,1
26,When I keep getting promotions despite being actively disengaged from work.,,False,j28g22,TofuTank,https://i.imgur.com/uvlNrxO.jpg,8,1
27,A laptop sticker I got for myself a couple of months back - relatable?,"AER
he

 
",True,j2l4va,icemyheart99,https://i.redd.it/t794s1fg3aq51.jpg,41,1
28,Your Reward," 
     

  

YOU'of DOING
A GREAT JOB!
",True,j2joko,bakura693,https://i.redd.it/hb8lgcrigwp51.jpg,1,1
29,Seen on Seek. How to make sure job applicants have low wage expectations.,"¢ His is a Graduate role where we will
invest in YOU, the salary reflect that
massive investment in YOUR training on
OUR part. Realistic expectations here
WILL rule your application out
IMMEDIATELY. Please answer that
question carefully.
",True,j31bom,waterproofraincoat,https://i.redd.it/g50spi4an8q51.jpg,5,1
30,We Shouldn’t Have to Work So Damn Much,,False,j2wat9,ketzal7,https://jacobinmag.com/2020/09/overwork-overtime-workfare-unions-socialism,5,1
31,Real talk from a successful entrepreneur: 'I was stupid lucky',,False,j2vump,SuborbitalQuail,/r/TrueOffMyChest/comments/j2qily/i_grew_up_poor_as_hell_and_managed_to_bootstrap/,16,1
32,I just don't care,"I just don't care about my company's success.
I just don't care about how much money they make and how they will perform in the future.
I just don't care about pointless things, that have nothing to do with my personal life.

Sitting in a whole lot of meetings discussing things that don't interest me is abysmal. I want to work and go home. A lot of my colleagues are so invested in what they do. They seem to live to work, not work to live. I just can't.",False,j2mafg,loltyp3,https://www.reddit.com/r/antiwork/comments/j2mafg/i_just_dont_care/,44,1
33,Taking advantage of government covid programs to not work,I have a *cough!!* “friend” that got laid off in March. And he is taking advantage of our governments covid relief money so much he won’t have to work for a whole year and he doesn’t fuckin care because he believes the government owes him the money because he used to work his ass off for over 20 years and got nothing but stress. He plans to travel the world after covid is done next year or when there’s a vaccine. What do you guys think? Freeloader? Or anti work hero?,False,j2rdml,thealphachoco,https://www.reddit.com/r/antiwork/comments/j2rdml/taking_advantage_of_government_covid_programs_to/,5,1
34,Pizza shop manager hits me up about a meeting he wants me to attend a couple hours before my shift on a day he knows I’m working my 9-5,,False,j0tawu,burntbagelbandit,https://www.reddit.com/gallery/j0tawu,38,1
35,So many things wrong with this picture 🤮," 
",True,j1yr57,RenitheGreat,https://i.redd.it/l9jiqc5a50q51.jpg,9,1
36,"It really does bother me that as far as we know, this is the only life we get, and that for many people it's hell","Just imagine the one shot you get at life, and you're either born into unchanging poverty or forced to wageslave your entire life. There are such beautiful and breathtaking places in the world, which most people will never be able to see. There are so many constructive and healthy ways to occupy your time, but most people will never get that luxury. There are so many opportunities and experiences that are paywalled behind socioeconomic status. Of course, I could put the blinders back on and turn off the empathy, but I can't do that.





""You can only be worried about yourself and what you can control"". Yes, I could do that, but worrying about ourselves is exactly why we're in this mess to begin with. We, as a supposedly ""intelligent species"", absolutely do not look out for each other. And it's sad to say that it's all by design. If people actually had the ability to help each other without putting their own security at risk, the system wouldn't function. It thrives on brutal competition. What good is capitalism if people aren't stepping all over each other, right?





It's just frustrating, because it's not like this is a unique struggle. Throughout human history there's always been a ruling class and some sort of oppressed, working-serf class. And every single time, the working class is slowly broken over and over and over again. Dead ass though, this story gets old as hell. Like how many times are we gonna do this same song and dance? At what point in time does the human species finally breakaway from these broken and unfair systems forever? And why in the hell did I have to be born into it? I don't want this shitty timeline.",False,j25g9n,JediKnightKeylo,https://www.reddit.com/r/antiwork/comments/j25g9n/it_really_does_bother_me_that_as_far_as_we_know/,13,1
37,How to Make It Look Like You're Working From Home When You're Not,,False,j2a1nk,jacksonadamsa,https://lifehacker.com/how-to-make-it-look-like-youre-working-from-home-when-y-1842273907,4,1
38,The bliss before the storm,"THAT FIRST HOURIORTHEDAY,

 
",True,j1ja6l,Extinctathon_,https://i.redd.it/wyg7tdeb2wp51.jpg,4,1
39,Don't impose this existence onto anyone else. Don't reproduce slavery.," 
",True,j1avtb,Snoo--69420,https://i.redd.it/uyglzga0drp51.jpg,36,1
40,honestly at a loss for words at this one," 

at) of&T I-I 8:46 of @©256%a

\ Q Search By @

Development. | bring RESULTS!
d-®

a
i Social Media War! and commerce Web

| interview a candidate through Type last week.

During the call, | heard kiss crying in the background. His wife was
also talking. The experience was too noisy.

The room he sat was clumsy. | was a bit disappointed.
| expected a more professional approach from him.

Somehow, he felt my disappointment while answering my questions
and became unsettled. He shuttered several times.

After the interview, | told him | wasn't impressed with how he
presented himself.

He burst into tears, ""| am sorry, Air. | live in a room with my family.
There's nowhere they could have stayed.

“He used to live in a bigger apartment before | lost my job three
years ago. His is all | can afford for now. | have failed my family. |
know | have."" He said in tears.

| felt bad. | had no idea that he was going through a tough time.
| apologized and encouraged him not to feel heartbroken. After all,
he's trying his best. i attic dense

 

 

Besides, he did well in the interview
| gave him the contract and asked if he'd like to start next month.

He couldn't believe it because he thought | was going to dismiss
him.

He shouted out for joy, ""Key baby, | got the job.""

| saw his wife came to hug him.

| was moved.

| learned never to judge anyone. Life isn't balanced. Met's try to make
someone smile.

#human

a

Some By Network Most Modifications Sobs

   

 
",True,j1470w,thegr8fuldead,https://i.redd.it/xydzuscuysp51.jpg,19,1
41,David Graeber – corona(virus) and bullshit jobs,,False,j291j4,Esperaux,https://youtu.be/qGtT2EWtdW4,0,1
42,Corporalism and Grey Skies,"Currency floats in our society, so much that currency is technically both in an absurd abundance as well as simultaneously being invisibly transparent. The 80/20 rule is very much so evident in the case of corporalism and currency. As a cohesive society, we spend our absolute most significant resources both in the form of technology and humans themselves, in order to scrape on and off floating currencies out of corporalist jobs. Some humans are brilliant; their value lies in their skillsets and mind. Most humans are hard-working; their value lies in their numbers and lack of voice.

Considering the topic and reflecting, it would be easy to conclude that this is in fact just how it is. We spend our resources both individually and collectively to satisfy the corporal. There is constantly a corporal cog that requires motion in the form of human fuel. To break the cog would not singly do good nor singly do harm; there is no longer any distinction between them. A person X free of the cog is a person free of civilization, and any person that X desires to interact with also has to be a person free of civilization, too. As minimal as the act of existing within a country’s borders would threaten the person X’s freedom, as well would the act of purchasing an egg for breakfast.

Despite unable to achieve freedom from the cog, there are people thriving and blossoming. One explanation would be to label the thriving as members of the 20. They are on the forefront when it comes to corporal interests, meaning they have skillsets of actual use to the rest of the 20. The thriving ranges from the happy independent freelancers that makes enough money to sustain themselves, to the ultrawealthy oligarchs that lives in unbelieveable luxury. In common is their service to the cog. The oligarch’s money is a symbol of time, quite literally translating to a member’s ticket that is consumed constantly but never exhumed due to its near infinite pool of content. The cog does not operate in morality; fuel is fuel. Meanwhile the freelancer is granted the privilege of a single ticket every once in a while, completely independently as opposed to a worker from the 80s. The freelancer celebrates the usage of the ticket and experiences both the joy of individual labor as well as the relief of cog duty.

To differentiate between the individual laborers of the 20s and all of the 80s, one has to look at the source of one’s labor. While the 80s’ labor is very rigidly given from a higher hierarchical position, the 20s’ labor is always operating as equals devoid of hierarchies. This gives enormous power and often a sense of pride to the 20s, granting individual, creative freedom. If one pictures the cog duty ending by physically inserting one’s ticket into it, the 20s are always the ones doing the inserting, as opposed to the never-included 80s. In that sense, cog duty could be entirely similar and even worse off for 20s compared to 80s, meaning a member of the 20s could have labor so horrible and soul-drenching while the member of the 80s could work in offices of gold and glitter with aesthetics luxurious. The difference lies in the freedom of the two. The 80s member owns nothing of value to the cog. The 20s member has value and opportunities. 

This symbolical ended cog duty is another word for time given. Because of this definition one can further include another set of members to the 20s: the hobbyists. As time given is a signal for your mind to turn towards personal interests, one could kill two birds with one stone by working with hobbies within 20s conditions. As one goes to insert one’s ticket into the cog, one could already be filled with hours and hours of eustress and satisfaction only personal projects could grant. One could even argue one would not need the time given at all, because the time taken is all one needs. There is no point in differentiating freelancers and hobbyists. One could be both and one could be either, but the most important is to differ them from the 80s.",False,j2165p,yung_pupper,https://www.reddit.com/r/antiwork/comments/j2165p/corporalism_and_grey_skies/,0,1
43,Fucking Mondays amiright?,,False,j12ggs,suspiciouselipsis,https://v.redd.it/0prhkew2ipp51,3,1
