,title,body,is_image,id,author,url,num_comments,num_upvotes
1005,"""Resolve to serve no more, and you are at once freed.""","&gt;Poor, wretched, and stupid peoples, nations determined on your own misfortune and blind to your own good! You let yourselves be deprived before your own eyes of the best part of your revenues; your fields are plundered, your homes robbed, your family heirlooms taken away. You live in such a way that you cannot claim a single thing as your own; and it would seem that you consider yourselves lucky to be loaned your property, your families, and your very lives. All this havoc, this misfortune, this ruin, descends upon you not from alien foes, but from the one enemy whom you yourselves render as powerful as he is, for whom you go bravely to war, for whose greatness you do not refuse to offer your own bodies unto death. He who thus domineers over you has only two eyes, only two hands, only one body, no more than is possessed by the least man among the infinite numbers dwelling in your cities; he has indeed nothing more than the power that you confer upon him to destroy you. Where has he acquired enough eyes to spy upon you, if you do not provide them yourselves? How can he have so many arms to beat you with, if he does not borrow them from you? The feet that trample down your cities, where does he get them if they are not your own? How does he have any power over you except through you? How would he dare assail you if he had no cooperation from you? What could he do to you if you yourselves did not connive with the thief who plunders you, if you were not accomplices of the murderer who kills you, if you were not traitors to yourselves? You sow your crops in order that he may ravage them, you install and furnish your homes to give him goods to pillage; you rear your daughters that he may gratify his lust; you bring up your children in order that he may confer upon them the greatest privilege he knows — to be led into his battles, to be delivered to butchery, to be made the servants of his greed and the instruments of his vengeance; you yield your bodies unto hard labor in order that he may indulge in his delights and wallow in his filthy pleasures; you weaken yourselves in order to make him the stronger and the mightier to hold you in check. From all these indignities, such as the very beasts of the field would not endure, you can deliver yourselves if you try, not by taking action, but merely by willing to be free.

&gt;Resolve to serve no more, and you are at once freed. I do not ask that you place hands upon the tyrant to topple him over, but simply that you support him no longer; then you will behold him, like a great Colossus whose pedestal has been pulled away, fall of his own weight and break in pieces.

[Etienne de la Boétie, _The Discourse of Voluntary Servitude_ [1576] ](https://oll.libertyfund.org/titles/boetie-the-discourse-of-voluntary-servitude)",False,ioanwr,bakura693,https://www.reddit.com/r/antiwork/comments/ioanwr/resolve_to_serve_no_more_and_you_are_at_once_freed/,5,1
1006,How do I apply anti-work beliefs into the real world?,,False,ioll1x,DiamondJulery,https://www.reddit.com/r/antiwork/comments/ioll1x/how_do_i_apply_antiwork_beliefs_into_the_real/,6,1
1007,Here’s to everyone whose weekend should have consisted of this kind of tomfoolery,,False,ip0dis,WunderBear420,https://youtu.be/KUqoew2DSn0,0,1
1008,LinkedIn really takes advantage of our society's survival of the fittest attitude towards work.,"  

Please compete with all Yes honey
’

other starving and
exhausted people for jobs
and lives you don't even
want or like but just do for
survival
",True,in8n16,writetodeath11,https://i.redd.it/1jo82lgp5el51.jpg,23,1
1009,"Unemployed for the last 3 months, no desire to go back to work","About three months ago I quit my job. There was a few reasons I cited in my resignation letter, but to be honest it was mostly due to stress. This job was technically my ""dream job.""

When I was younger, the moment I left one job I always had this drive to get my next job as soon as possible. This time, I feel nothing like that, I'm content to just be unemployed forever. I've sent some resumes, but only a handful (like 10), and only for positions I actually want. Even though they're ""good jobs,"" I dread the idea of being hired again.

I've struggled through burnout before, so I know this isn't it. When I was burnt out, I remember feeling something along the lines of ""don't wanna,"" which I overcame with the typical ""fight through it, remember that you'll die of starvation if you don't work."" This is a new feeling, its not that I don't want to, its that the very fabric of my being simply refuses to go back to a life of working just to survive. It's not a malleable feeling like ""don't wanna,"" its set in stone: I wont.

Fortunately I still have five to six months worth of living expenses covered thanks to my savings, and I'm back in school. Anyone else experiencing this next level of burnout? Post-burnout burnout? I would be shocked to hear it's something you can get over, this doesn't feel temporary.",False,ip0jgq,EightyEightSilent,https://www.reddit.com/r/antiwork/comments/ip0jgq/unemployed_for_the_last_3_months_no_desire_to_go/,11,1
1010,...," 
",True,ionskw,MonsieurFarkwad,https://i.redd.it/ozzvg6l0zul51.png,7,1
1011,"You should definitely not read this. (Absolutely not a quick and precise introduction to *Survival without rent: how to setup your own squat*, a guide for US-based folk for living outside the rental system in built-up areas.)",,False,incxyd,ruchenn,https://twitter.com/jewish_activist/status/1298320936320499713,0,1
1012,"No emergencies, please","My coworkers and I were informed we are lucky to have 5 paid sick days a year and told to “try not to have any emergencies” this year because then they’d have to pay someone to cover for us. 
I...I don’t even know how to respond to that statement. 
Try not to have a family member pass away.
Try not to get Covid when half the country is still actin’ a fool.
Try to not have a reckless driver crash into you at a stoplight
And wow, 5 whole days! Whether other people get more, or less than 5 days, this mentality is so gross. We all deserve paid sick days, mental health days and personal days as rights, not privileges.",False,inceec,arthurrules,https://www.reddit.com/r/antiwork/comments/inceec/no_emergencies_please/,1,1
1013,He's probably right tho,,False,inbi9m,TheSweatyFlash,https://i.imgur.com/ikgP9Kf.jpg,2,1
1014,I’m as close as I’ll every get to not working. Here’s how I did it.,"1. Went to school for a bachelor computer science 

2. Perfected my craft, focused on my favourite tech stack to the point where I’m not constantly googling things. Spent 3 years as a software developer for a big company while doing this.

3. Got a remote, part time, Software Developer II job. It’s 25hrs a week @45$ an hour. I just open slack around 9AM, fuck around or go back to sleep until 1PMish, work from 1PM to 2:30PMish. Call it a day.

I call it a reverse job, because living my life and hanging out/relaxing is my primary occupation and I just work when most people take a lunch break.

I deliver more than other similar devs so no one calls me out or has ever suspected anything.

It pays enough for my wife and I to live a modest life, houses around me cost 100-250k (Fredericton, New Brunswick, Canada) so If I want one the option is there.

Just my 2 cents if anyone is looking for a realistic way to get out of the 9-5. Took me maybe 7 years total but now I just plan to coast in my pseudo retirement as long as I can.",False,inbj4m,thePatientDev,https://www.reddit.com/r/antiwork/comments/inbj4m/im_as_close_as_ill_every_get_to_not_working_heres/,0,1
1015,What are some NON-DESTRUCTIVE ways to antiwork at my job?,"My job is camera-monitored and peer-enforced, and I don’t want a criminal record. Now, I’m looking into recruiting some coworkers into IWW or possibly other unions, but otherwise I’m a little lost. What are some ways to antiwork that I won’t get in trouble with the law for?",False,infxwj,TheNextJohnCarmack,https://www.reddit.com/r/antiwork/comments/infxwj/what_are_some_nondestructive_ways_to_antiwork_at/,5,1
1016,Guy hits a lot of points.,,False,inu2e3,TheWickedSon,https://www.youtube.com/watch?v=tc-gUP0zNSw&amp;feature=youtu.be,0,1
1017,Being a capitalist doesn’t make you the person to blame for wealth inequality and struggle of workers. The blame is on people who have a disposition of greed in regard to ownership.,"It is how greed has been applied to the idea of ownership, that is to blame for our society not having the best opportunities for life for all people. I think when discussing the reason for inequality in society, capitalism and capitalists should not be stated as if they are the root of the problem, when the root of the problem is greed.",False,io82lh,GenerationFreedom,https://www.reddit.com/r/antiwork/comments/io82lh/being_a_capitalist_doesnt_make_you_the_person_to/,4,1
1018,Are you guys just waiting for complete automation of low skilled labor?,Like some WALL-E esc future? What countries didn’t have labor?,False,ioa0lb,zaserman,https://www.reddit.com/r/antiwork/comments/ioa0lb/are_you_guys_just_waiting_for_complete_automation/,2,1
1019,"""Purpose in life""","This is an argument that my ethics teacher used to make frequently.

That humans need work to find purpose in life, feel fulfillment and validation and be proud of something.


And he's right - just not in the way he thought.

We all have hobbies - whether it's sports, art, a craft, technology, etc.

Usually, tending to these hobbies is fun and making progress and improving is fulfilling. We like getting things done and getting better! 


But who in the hell has a job that actually serves this purpose? A lot of people need to do a shitty job to survive, or work a job that pays better but they sacrifice almost all free time for. So it's mentally and especially time-wise even harder to actually do and enjoy your hobbies. 


I really don't understand people who don't know what to do outside school or work. With quarantine I've heard multiple people actually miss going to school/work because they were... bored. How? Are they so lifeless mentally and have no bigger hobbies and pleasures in life? Have they never found worth in anything that isn't academically measured or similiar? Sure, you couldn't really travel or spend time in the city much, but there is so much you can do at home! 


I honestly dread working a job that will use up most of my time and drain me so much, that I don't want to do anything proper outside of it, just wasting away my few hours of free time in front of the TV/computer or something (the reality of many",False,io6mdr,stingysoysauce,https://www.reddit.com/r/antiwork/comments/io6mdr/purpose_in_life/,17,1
1020,Happy Labor Day!,"i itshemrsleleli ha

the Duncan?

  
   
 

  

define
(oh am &-] ole)
",True,io8zmz,tiredofstandinidlyby,https://i.redd.it/auncz81rlql51.jpg,5,1
1021,America’s real hoax: Record highs on Wall Street as millions of jobless people can’t pay rent,,False,io11to,Kazemel89,https://fusion.inquirer.com/columnists/attytood/wall-street-records-millions-unemployed-evictions-20200903.html,1,1
1022,Singaporeans impressed by a teenager forced to juggle between being a wage slave and study at the same time,,False,inn61s,FOSSnake,https://www.reddit.com/r/singapore/comments/iniqoe/to_the_teenager_who_was_being_a_temperature/,0,1
1023,Imagine an automated society.,,False,ioessi,evil_agent_perry,https://i.imgur.com/oI9WHyM.jpg,2,1
1024,My boss asked me to work on a Sunday and acted surprised I refused,"For context, I work M to F. 9 to 5.

Boss : could you do a few hours on Sunday, you’ll get another day off

Me, knowing the man pulled this shit before and I never saw the replacement day off, plus I hate this job and am underpaid so why should I do HIM a favor : no way

Boss : but...but... *shocked pikachu face* 

lol. I’m sick of this horseshit.",False,ioe34e,f33lingss,https://www.reddit.com/r/antiwork/comments/ioe34e/my_boss_asked_me_to_work_on_a_sunday_and_acted/,3,1
1025,The future is now,[removed],False,iol0k2,Representative_Ad246,https://www.reddit.com/r/antiwork/comments/iol0k2/the_future_is_now/,1,1
1026,Feeling so anxious about work tomorrow,"I work 9 hrs per day in exchange for a 4 hour day on Friday. We had off today. So I had a 3.5 day weekend. At around 2 o’clock today I remembered I have to go back to work tomorrow. Work has been really rough this year but it’s been especially bad since around early July. Having yesterday off has piled up so much work to do tomorrow. I just had a late dinner and I feel so nauseous. I’ve told my manager how anxious the job has been making me feel lately. I have butterflies in my stomach the moment my alarm goes off in the morning. My heart is pounding from anxiety for most of the day until work is over. It can’t be healthy. She’s been supportive but she keeps telling me it will be okay, we’re all in the same boat, we just have to put our heads down and get through the day and get as much work done as possible, and due to our currently workload, it’s okay if we’re running a bit behind. I’m a week behind. She’s not the one on the phones for 9 hours a day having people scream at me because I’m behind. The workload isn’t expected to ease up until early next year. Wtf am I supposed to do until then.",False,iolpi3,apndi,https://www.reddit.com/r/antiwork/comments/iolpi3/feeling_so_anxious_about_work_tomorrow/,6,1
1027,Hjjgc🔥🤤,Ggbbn,False,io32ba,Sarah1990ger,https://www.reddit.com/r/antiwork/comments/io32ba/hjjgc/,0,1
1028,Who Rules America: The Rise and Fall of Labor Unions in the U.S.,,False,io0chw,Kazemel89,https://whorulesamerica.ucsc.edu/power/history_of_labor_unions.html,0,1
1029,Is Universal Basic Income the Future?,,False,inh9f5,throwawaythisdecade,https://m.youtube.com/watch?feature=youtu.be&amp;v=6D5rrvZ2H4A,1,1
1030,"If I’m only around for a month max, is it even worth it to try for a local union?",,False,io0pb0,TheNextJohnCarmack,https://www.reddit.com/r/antiwork/comments/io0pb0/if_im_only_around_for_a_month_max_is_it_even/,0,1
1031,Fuck labor day,"Working at a grocery store right now. Apparently I'm an ""essential worker"". Fuck a holiday that celebrates labor while it's apparently obvious nobody gives a fuck about the actual people doing the work. Not paying essential workers a living wage, kicking people out of their houses for circumstances outside their control, not having affordable healthcare for the masses so they're all but, guaranteed to end up in debt? Fuck you",False,ioamz6,HootCares,https://www.reddit.com/r/antiwork/comments/ioamz6/fuck_labor_day/,12,1
1032,I’m confused about what my life will be like.,I’ve just started work in the past week and i’ve been put on shifts of 8-6 Monday to Friday. I’ve already noticed that I have no real spare time to do anything and on the weekend I was exhausted so just slept. I don’t want to spend the rest of my life like this but have always been told that this is how it has to be. A 50 hour work week seems cruel for anyone and i can’t picture myself doing it for god knows how many years. Is this really how i’m going to have to live?,False,iopvwg,ZorphixX,https://www.reddit.com/r/antiwork/comments/iopvwg/im_confused_about_what_my_life_will_be_like/,1,1
1033,"My job expected 60 plus hours a week, didn't pay for work expenses and was surprised I left.","I once applied to for an exterminator job .  First I had to work a 10 hour day for free to ""prove I could handle it"".  I was dumb enough to do this and got hired.  Within minutes on my first day the owner was yelling at me telling me how angry he was to put me on the company car insurance.  I was a young male so apparently it doubled overnight.  He was the one to train me and made nasty comments all day.  I don't know why he hired me. 

The last straw was when at the end of the day he informed me that I was to pay $400 for the uniforms.  The work week was a standard Monday to Saturday  7 am to ""when we are done"" which is normally 6 or 7 that evening but last week he a had few days ending at 9.   The company truck's upkeep was all my responsibility.  He owned the truck but on Sunday I was supposed to be taking it to the mechanic (most are not open then) since I used it and I was also supposed to washing it during it my work day even though I had no time. In his opinion I was costing his company money by using a tank of gas in his vehicle each day so it was only right I compensate him.  The job paid about $5 above minnium wage so there was barely enough money for my bills and I had to pay his too. 

He was really shocked and said I had wasted his time when I told him I would not be back tomorrow.  He threatened to take me to court for the company shirt I was wearing on my training day.  That one was free for the moment but he planned to add it to my clothing bill.  I ignored his texts and never got a summons.  I did get a check in the mail for the day.

This sub seemed like the perfect place to share this store.   The company is still in business but seems to only have him and a few other people.",False,io92je,Logical_Vast,https://www.reddit.com/r/antiwork/comments/io92je/my_job_expected_60_plus_hours_a_week_didnt_pay/,4,1
1034,Hah,"Dear law, | anna get paid, but |
don't anna go to work

 
",True,iok52b,lucy-boopsy,https://i.redd.it/qdhp7al7qtl51.jpg,10,1
1035,one of the reasons why we can't even appreciate simple beautiful things... what have we been reduced into?,"When the weather is damn shook
to sleep but you have

to WFH
£ a go "" a

 
",True,io24xq,jtdcjtdc,https://i.redd.it/yv2lufrf2ol51.jpg,2,1
1036,"Can't wait to be part of the ""Useless class"" !",,False,io92xs,pinkfriend007,https://youtu.be/OKwg5gGZ5w4,5,1
1037,Most mornings.,"He being broken but still working because |
need money to exist:

 
",True,ip1osp,occasionallaughs,https://i.redd.it/9jzs8mmdjzl51.jpg,6,1
1038,Universal Basic Income = Universal Misery,,False,ip06bv,IRONDICE2020,https://youtu.be/8YRgf5aZ2ck,14,1
1039,"""Model Citizen"" | Dystopian Animated Short Film (2020)",,False,ipfca3,katembers,https://youtu.be/mVLrBJYGxk4,2,1
1040,how ?!,"Manksvon ale |man\yaelelanlon-is\over-] anoci)

work and blocked in | don't even
work today now they making me stay

6:23 of - 9/3/20 - Twitter for Android
",True,ioriak,Missinglink_7,https://i.redd.it/4timh81m3wl51.jpg,4,1
1041,Current Job Market=No opportunities,"After doing everything imaginable, 9 months later I simply cannot find an entry point into the Mechanical Engineering field. If something isn't working, I dont like to bang my head against the wall and pray, so I have even began looking into doing various trades. Turns out that there's a 2 year waitlist for every trade I checked within my region. Whenever I look on Indeed it seems like 90% of the jobs are approximately minimum wage and the rest require 5-10 years experience. I mean, are the vast majority of opportunities really just offering a quality of life near the poverty line? Work is just means to an end for me...but at minimum wage, it doesnt even provide the ""end"" anymore. Should I grind my wages into my student debt only for it to be potentially forgiven in the near future? There's so much uncertainty for us young folks and our leaders are absolutely failing us.",False,ip4x2z,LagdouRuins,https://www.reddit.com/r/antiwork/comments/ip4x2z/current_job_marketno_opportunities/,8,1
1042,Life sucking manager,"I mailed my manager that I'm sick and taking the day off. Manager replies that I don't have any sick leave left. Wth. The fact that I have to request leave is a fucked up thing. I am forced to work on weekends to meet the deadline and get zero extra pay. I work around 12 hours daily(8 hrs in managers watch). I have talked with my manager about this and he is not taking any action to hire anyone. I am getting burned out and getting sick because of it. Also this proves that my manager doesn't give a fuck about employees health.
I am planning to leave my job.fuck it.",False,ip8yq1,luko_G,https://www.reddit.com/r/antiwork/comments/ip8yq1/life_sucking_manager/,4,1
1043,Why can't businesses offer now what they could in the boomer generation?,"I'm really confused and I'm not even sure I know how to articulate this.

Why was the boomer generation able to just throw on a collared shirt and a pair of jeans, waltz into a company and request to speak to a manager to get a job?

I'm looking at an entry level engineering job wanting a P.Eng and 36 bullet points of varying specialized skills.  The starting salary is $39K CAD  \~ $30K USD.  6 years ago this same job was $55K CAD and that was still nuts then.  That salary would barely allow you to afford rent for yourself in a crappy amenitiless apartment let alone budget food.

What happened?  It's not fiction, right?  My mom worked a Summer to buy a car, and pay for her tuition and rent for a year... 

Like, I didn't do anything wrong right?  I sacrificed.  I worked hard.   I got the degree.  I got the experience.  I got certs and professional designations.  My salary has just been going down for years now.  Companies either have mass lay-offs or totally die.

I don't get it.  

When a boomer retires.  Their job is also phased out and their responsibilities divided among who is left with no increase in pay.

Even considering most of the jobs I've ever had, I hadn't really needed my degree for them except to hit the HR check box.  

Was there really a time where jobs just wanted to see your enthusiasm and they'd train you?  

There's no way my parents did this much work on the daily for this little pay.  Someone explain this to me.",False,ioyrdu,I_TrustedMyEmployer,https://www.reddit.com/r/antiwork/comments/ioyrdu/why_cant_businesses_offer_now_what_they_could_in/,66,1
1044,"$15,600 annual salary to work for an NHL team.","MINIMUM QUALIFICATIONS

+ Current mortification from NSCA, NASM, or ACSM

+ CPR/AED/First Did terrified

+ Ability to work a flexible schedule

+ Previous experience in Ports Performance sector

+ Willingness to work collaboratively with colleagues for program growth and enhancement

PREFERRED QUALIFICATIONS

COMPENSATION:

'$15-S20/he Based on experience. His is alpantitime/position with expected hours MUEKSihrsyper
“week to start.
",True,ioeb7c,Atiberious,https://i.redd.it/esfkhugk2sl51.png,50,1
1045,Noam Chomsky - The 5 Filters of the Mass Media Machine,,False,ipk69b,bakura693,https://m.youtube.com/watch?v=34LGPIXvU5M,4,1
1046,Only two days out of a week do i not want to play in traffic.,"S M T W T F S

=) Caffein (feat. Makar A.. Nitrate
",True,iphkyv,Darkesper995,https://i.redd.it/zzofie1g05m51.png,2,1
