,title,body,is_image,id,author,url,num_comments,num_upvotes
380,I hate my job and I've stopped doing work,"I'm one of the few lucky ones that is completely working from home during covid.
For me it was quite easy because I was as a designer.
Originally I thought my job was a dream job, I was working as a designer, in a field where I thought I'd he helping children's rights across the world.
I don't believe we are helping anyone, the entire company feels like a scam and my boss is awful.

During covid I stopped pretending to be working. I got my tasks I do them, and then spend the rest of the company time doing nothing. For the past few days I've had no new tasks send to me. I even tried reaching out but they don't care enought to reply to me so I'm not doing shit anymore.

This company has drained my passion for design.
All I wanted was to be make some art and help people, and all I do is waste time and mentally get more and more unstable.

I want out. I just wish I could go solo sell my art, I hate that a job tells me how to dress, I hate that I can't have tattoos where I want because of job opportunities.
I hate how money controlls everything

When I was still in school they told me the world would be my oyster because of my talent. God I hate it here in the industry.
Anyone owns a design agency where creativity is rewarded and I can get treated like an adult?

I feel like my boss tries to exploit me all the time because I'm young, but I'm done. I'm over it.

I'm sorry for this rant life has been incredibly difficult these past few years and I'm lost and I have like no friends because everyone is too busy working at jobs they hate",False,iy7sl7,sarlach,https://www.reddit.com/r/antiwork/comments/iy7sl7/i_hate_my_job_and_ive_stopped_doing_work/,29,1
381,Civilized to Death,"You guys obviously hate the idea of working, but there’s a lot of stuff that’s just terrible about our modern day consensus of reality. You all should check out Chris Ryan’s book “Civilized to Death” and listen to his podcast “Tangentially Speaking”. There’s a lot of stuff this guy says that we all really need to pay more attention to.",False,iv8wko,riseabove4love,https://www.reddit.com/r/antiwork/comments/iv8wko/civilized_to_death/,0,1
382,"""Work is not attractive"" -Eugene Debs, 1886"," 

1886

Why Right Your sg
8 for a May?
_
July 1886 oe

see
of boris

+ nasi have select eat up
The inquiry we ted as a caution for this article

food for reflection.

May what i will about the dignity of labor, of work—and

has not been said—human nature is so constituted that eau nd too much
avoided, would not be sought after as a means of increasing elias he Boa
felicity. By the term “work,” we do not mean employment ‘that human
cal. He have reference to a condition which involves toil, dincepee he phase-
physical and Biepial bondage from which there is no escape, and Taken, _
ready eomironts the worker, demanding of him, like a Shylock, the Fulften
of the letter of the bond.” He have reference to the worker at wages Is
in multiplied instances barely supplies the unremittable necessities of life, the

man who is the daily ligated of the same hard fortune.

In the school of experience, he is taught lessons of economy which render
us, for it is economy which means privation. It is the school-
to a scarce supply of coarse food; it is the education of the
body to resistance of pitching cold in the winter and the torture of summer
heat; it is the training of the eye to scenes of squalid, relieved by a single
redeeming ray of beauty in the house where he has his dwelling place.

Work, under such conditions, is not attractive. The worker enters upon

the struggle early in life, and seldom lays down his burden except at the grave.
See him anywhere, and the battle is raging. He is contending, against formed-
be odds, for life. Early and late, often into the darkness, he toils on to keep his
soul within its clay tenement, and if there are others, wife and children, depend-
went upon him for subsistence, then the situation puts to a test which defines
ton the strength of every obligation that binds the worker to his task.
He know that the great mass of mankind have employment, which in
a certain sense means work, the rich as well as the poor, but we know, also,
that the difference between the work of a Would, in his palatal office at a
thousand dollars a day, and that of a foreman on one of his engines, is as the
difference between a diamond and a lump of coal. It is said sometimes that
men of | great wealth are hard workers. He are quite willing to admit that with

s in
supplies abundant

the term obnoxious
ing of the stomach

Locomotive Firemen’ Magazine, vol. 10, no. 7 (July 1886), 394-397.

 
",True,iv9r3q,WinterTrabex,https://i.redd.it/yb1sbalarxn51.jpg,0,3
383,Watched “The Founder” on Netflix last night and it got me thinking. My thoughts...,"Released in 2016 but somehow I’d missed it til now. It’s based on the story of how McDonald’s became the mega Corp we know today.

Basically, the “background” given in the exposition of the movie is that two brothers (Dick and Mac McDonald) opened their first McDonald’s restaurant in San Bernardino in the 30s (during the Great Depression) after many years of struggling to make a living. By the 50s, they had a booming business model as the first successful “fast food” restaurant that challenged the outdated drive-in model. They worked hard, and their restaurant was a high success that they cared for and loved deeply. They put their hearts and passion into the restaurant, and were very content with their success.

The entire arc of the movie, however, focuses on Ray Kroc, a sleazy business man hell-bent on turning McDonald’s into a franchise. Through lots of complicated twists and turns, he eventually gets the brothers to agree to a contract to let him expand the restaurant and he starts opening franchises in cities across America. At first he seems to share the love and passion of the brothers, caring as deeply as they do about the restaurants and just wanting to spread the name. But over the course of the film, he becomes blinded by greed, money influence and power. He starts screwing over the brothers and “bastardizing” McDonald’s standards in order to make more money. He starts recruiting his friends and trying to shimmy his way up the status ladder. His marriage begins falling apart and all he can focus on is how to make more money and gain more influence. At one point in the movie, he says to his wife “wow look at how happy this husband-wife couple I recruited to run one of my restaurants is! So great how they work together as a team” completely oblivious to his wife’s heart breaking because he can’t see the irony in his admiration for someone else’s relationship. Truly, he gets off on watching other happy couple generate more money for him, while brushing his wife and their marriage to the side.

Long story short, he fucks over the brothers, basically forces them out of their position as the true owners of McDonald’s by creating a new corporation and stealing the McDonald’s brand name. He forced the brothers the change the name of their restaurant, and then opened his own “McDonald’s” in San Bernardino to compete with the brother’s original restaurant, and puts them out of business.

Watching it got me thinking about how this corporatized, rat race, dick measuring contest mentally is now at 100000x what it was 70 years ago. The hard of small business owners, like the brothers, is getting stamped out by vicious power-hungry, greedy fucks like ray kroc who exploit the hardest workers who are just following their dreams and trying to do something meaningful with their lives. I’m just thinking about how WORK itself isn’t the problem. Long hours and blood sweat and tears isn’t the problem. The brothers had something that they’d built with their own hands, and they were very happy to have what they did. The problem is that there are just enough greedy rich bastards like Ray Kroc who all love themselves and their money so much that they’re willing to crush other people without so much as a moment of hesitation. And all for what? Money? Power? Influence? What’s the point. Also worth noting that this motherfucker hoard his massive wealth of billions until his sorry ass kicked the bucket. It wasn’t until after he died that his new wife (for whom he divorced his first wife, after having a long affair) eventually became a philanthropist and donated everything to the Salvation Army and other charities. He was probably a controlling piece of shit and wouldn’t let her touch his riches til he died.

Anyway Sorry just rambling my thoughts. Def recommend the movie even though it made me angry, it was well paced with very little filler content and the acting was good. The actual events in the movie are mostly fictitious but basically representative of the actual story. Thanks for reading.",False,iut80v,dashingtoast,https://www.reddit.com/r/antiwork/comments/iut80v/watched_the_founder_on_netflix_last_night_and_it/,1,1
384,Lmfao,,False,ivew6a,eercelik21,https://v.redd.it/oq7ockf63yn51,0,1
385,The Biggest Crook In The Bunch - Alan Watts,,False,ivflj0,GuRuGriZZly,https://youtu.be/nDDwqYuc11k,0,1
386,This is what I think every time I need to interview for a job...,,False,iuui1s,jamiew86yooooo,https://imgur.com/a/omWyxem,4,1
387,"Apple’s New Work From Home Ad Is Appalling - the video is an explicit demonstration of dictatorship sold as uncaring, poor leadership. What kind of draconian, dystopian world do we live in when the leaders of Apple think it’s a good idea to get children to ask Siri to read them a bedtime story?",,False,ivrfzs,gholemu,https://www.forbes.com/sites/danpontefract/2020/07/15/apples-new-work-from-home-ad-is-appalling/,0,1
388,Sorta confused about this sub....,"Is it people who hate their jobs? Is it people who are against capitalism? Is it people who just hate working for “the man”?

I honestly don’t understand what brings you together",False,iv83mf,11ro25,https://www.reddit.com/r/antiwork/comments/iv83mf/sorta_confused_about_this_sub/,41,0
389,"David Graeber: 'To save the world, we' re going to have stop working'",,False,iv893p,testosteronnie,https://www.bigissue.com/latest/environment/david-graeber-to-save-the-world-were-going-to-have-to-stop-working/,7,11
390,The expression is perfect,"When you visit your
old job:

 

 
",True,ivbag9,CulturedHollow,https://i.redd.it/dabezzoyitn51.jpg,3,4
391,"Originally posted in r/funny, relevant here...","| DON'T KNOW

of LIFE Of WORTH
LIVING ANYMORE... of ABSOLUTELY Is!
eh

of

WHO SAID THAT?!

MRLOVENSTEIN.COM

 

Posted in r/funny by u/spookysketiton & credit
",True,iw1ssw,evansmatthew_au,https://i.redd.it/7lsbzvcch6o51.png,0,1
392,"In this current time, life never made less sense.","We just live in a fucked up world and fucked up system. I can’t imagine, that this is life. This can’t be life, life has to be more. You go to school, you probably study, you are stressing yourself because of exams and all that other bullshit and pressure from your parents. You go to work, slave away and you’re pretending to love your work. Hah funny. Think about it one second, what’s after work?

what’s there? Death. You’re just gone. Disappearing from earth, rotting under the ground. 

And what has life given you?

Some minutes, of enjoyable moments. But think about it…on a regular day, are you happy? Most people arent.",False,ivkkn4,Brokenladder65,https://www.reddit.com/r/antiwork/comments/ivkkn4/in_this_current_time_life_never_made_less_sense/,4,1
393,A friend just sent this to me lol,"if you find a job
you love, you
never work a
day in your life

  
 
 
 
 
 
 
 

There is no perfect job for me! you
romanticize a career to feel better about
selling or best years to wage slavery.
To not indoctrinate me into your cult of
complacency old man!
",True,iut8qp,bgngbg,https://i.redd.it/es7v91z44sn51.jpg,16,1
394,A poem I thought you might enjoy,"&amp;#x200B;

https://preview.redd.it/5q0kq79knwn51.png?width=468&amp;format=png&amp;auto=webp&amp;s=e3b62a10a9839e43cbef782fc37eb4ef0620dddd

If you like it, i just self-published a chapbook that touches on this topic a bit more. The name is Who the f&amp;ck am I? by Gabriela Cabezas Borja, you can find it on Amazon. Searching for my name is easier.",False,iv5r2c,Gabskiwii,https://www.reddit.com/r/antiwork/comments/iv5r2c/a_poem_i_thought_you_might_enjoy/,2,1
395,I’m starting to see this kind of stuff everywhere now. Spread the word.," 

toe
\ @zoeb_02

Now mad is it that out of 7 days a
week we spend 5 of them in work to
get 2 in return to actually live our lives.
Like. Now has this been normalized.
He spend 5/7 days a week working so
that our boss can live a better life in
return for 2 days of our own life
",True,ius1ib,lady_in_grey95,https://i.redd.it/di8q012rsrn51.jpg,94,1
396,I got my first job ever and 2 months in I already can't stand it,How do you folk put up with this shit I literally lost 80% of my life to give some asshole more profit. This sucks.,False,iv9eus,zealshock,https://www.reddit.com/r/antiwork/comments/iv9eus/i_got_my_first_job_ever_and_2_months_in_i_already/,9,5
397,I got a new job,Sixteen days ago I posted that I got fired. Well now I got a new job and overall it seems like this job will provide me with a better quality of life in terms of work/life balance. I just want a job that I can leave at work. It’s hard since I’m a licensed mental health therapist but I also think it’s stupid as hell to allow work to weigh on me so heavily. I’m excited for this new position and I’m not going to allow my job to define me. I’m 28 and going to continue to set firm boundaries and expectations around my work/life balance. I refuse to be a slave to the system.,False,ivekkl,Pandailla,https://www.reddit.com/r/antiwork/comments/ivekkl/i_got_a_new_job/,7,1
398,"You are damned if you do, damned if you don't",,False,ivdesj,iamaddictedtocock,https://www.reddit.com/r/antiwork/comments/ivdesj/you_are_damned_if_you_do_damned_if_you_dont/,8,1
399,Stock markets keep rising as many millions go jobless. Output &amp; profits are down; machines idle. Growing gaps between stock prices and economic reality = bubble near bursting. And after the election?,,False,ivwkfa,failed_evolution,https://twitter.com/profwolff/status/1307364328815779841,0,1
400,"Anyone else hate the saying “work hard, play hard”?","To me, it’s like saying that in order to have a lot of free time or to get your own time to enjoy you need to work harder?? Idk.. this saying doesn’t resonate with me. And I know a lot of people who put this as their quote or saying in their bio or profile..",False,iv9k28,chococatc,https://www.reddit.com/r/antiwork/comments/iv9k28/anyone_else_hate_the_saying_work_hard_play_hard/,21,3
401,One of my friends shared this. This is the most bullshit way of spinning a commute.,"ha that. Talking male
Narentare| on the none.
roe see elareilare may
length of the platform. Camel are! a
the yellow line. Hearing the a Lane sca
from your favourite of worker. ce one
Half-reading a newspaper. The flick = a
through tunnels. Giving up a seat. Oak a
(old ole leoijum Yelled aitalefolU ill Molle SSIS e He
there are other people. Saying He/ To} of late)

of the gap.

Key=warfare,

    
   
   
   
     
 

     
  

King the right again. Rapp
ing an hour to yourself in the laatelaaitare R

 
    
    
  
    

again tomorrow. The little t

things we do help
Protect the little things we

love. Deep Protecting.

Use disinfectant safely, Always read the label and product information before use.

LATE STAGE CAPITALISM of BEIN
THANKFUL FOR To HOU MUTE

of HOUR COM
BECAUSE of'S TIME To u lee

   

OURSELF?

he

 
",True,iv2wcs,randomuser-384,https://i.redd.it/q2lo8j9ikvn51.jpg,35,31
402,"Are You Really ""Free"" Under Capitalism?",,False,ivbigs,marc_a09,https://www.youtube.com/watch?v=4xqouhMCJBI,5,3
403,Survey: The average worker experiences career burnout - by the age of 32!,,False,iw84vh,Zermelane,https://www.studyfinds.org/average-worker-career-burnout-age-32/,0,1
404,Entry Level / Minimum Wage Jobs that Require Experience,"Seriously fuck off. 

Not only are you keeping newcomers from gaining paid experience and training but you are also lowballing desperate people who should be getting a higher pay grade. 

I’m trying to switch fields and have tons of job experience but am still not “qualified” enough for a minimum wage job that would give me a bunch of skills. 

I hate this job economy so much. 

I’d rather not work for solely money but at this point I’m considering just working at random jobs that have nothing to do with my passion but pay way better. And guess what? They will hire and train you as long as you can speak English and have a HS Diploma.",False,iv75ay,littlemissmoxie,https://www.reddit.com/r/antiwork/comments/iv75ay/entry_level_minimum_wage_jobs_that_require/,3,5
405,"Just a friendly reminder that we cannot ""eat"" money","Money Doesn't
Grow on Trees!

 
",True,ivaklt,AnonymousEbe,https://i.redd.it/e0uzx58xyxn51.jpg,2,2
406,"In other words, coast by at work and save your effort for the shit that matters 👏🏾👏🏾","To not ask your children

to strive for extraordinary lives.

Such striving may seem admirable,

but it is the way of foolishness.

Is Colomaarcsvowtetjrer-Kelmcom cbeCemmeCemaVoretelorn
and the marvel of an ordinary life.

How them the joy of wasting

potatoes, apples and years.

How them how to cry

when pets and people die.

How them the infinite pleasure

in the touch of a hand.

And make the ordinary come alive for them.
The extraordinary will take care of itself.

- William Martin
",True,ivx6ho,RenitheGreat,https://i.redd.it/1th81sr132o51.png,0,1
407,The Truth | [Stolen from r/libertarian],"| just think people shouldn't be
subjects and should live how they
want. To long as they do so
peaceful

   
",True,ivark2,AnonymousEbe,https://i.redd.it/oue5uorm0yn51.jpg,1,6
408,"""...better for the company if he would have died.""","I work at a large home improvement company. A couple of weeks ago I was talking with one of the managers and he brought up that a door had fallen on a customer paralyzing him. He said, ""it would have been better for the company if he would have died, he will be getting so much compensation for the rest of his life."" When he said that I became speechless. I feel terrible for the man who became paralyzed, he 100% deserves to be compensated for the carelessness of corporate. Safety is rarely ever seen as top priority to these companies. This encounter made me realize that this company doesn't care about anyone, all they care about is money and getting as much of it as they can. They don't care as long as it doesn't affect them.",False,iwtvmy,lessie1998,https://www.reddit.com/r/antiwork/comments/iwtvmy/better_for_the_company_if_he_would_have_died/,7,1
409,Fuck this.,"I work a classic shitty office job that doesn't pay me nearly enough. Today we had a couple web meetings (one all company and one with my individual team) where they went over the class ""unprecedented times"" bit for way longer than they needed and some other bullshit. In our smaller team meeting our department head/manager (who has missed the past several meetings because who fucking knows why) recognized we've been busy and then mentioned buying us sandwiches from somewhere and having a zoom lunch. 

my team has been busting ass and putting in OT to try and just stay afloat and not fall behind to the point where things would be un-salvageable. During the company meeting they stated no one would be getting raises this year and on top of that we finally had our full pay reinstated from a pay cut that was previously issued. I DON'T WANT A GOD DAMN SANDWICH. I WANT TO BE TAKEN CARE OF AND PAID FOR THE FUCKING WORK I DO.

&amp;#x200B;

In conclusion fuck this fucked up mess that's been shoved in our faces as the only way to live. there fucking has to be something else. Keep fighting for a different future, maybe we're actually approaching some sort of turning point. Who knows? I only know that if things don't get significantly better soon I might fucking jump off a building.",False,ixs4i1,SluggsMetallis,https://www.reddit.com/r/antiwork/comments/ixs4i1/fuck_this/,4,1
410,Age in this subreddit,"Hi theree,

I wonder how old you are in this sub. I am really curious. 
I am 29 and i hate work.",False,iwjtl2,Lakukaratscha,https://www.reddit.com/r/antiwork/comments/iwjtl2/age_in_this_subreddit/,27,1
411,"Has anyone ever got so fed up with a job that you just didn’t show up for work one day, and quit right then? I’m talking about more “career” based jobs, not fast food/retail.",,False,ixeboi,MeDumbButNotStupid,https://www.reddit.com/r/antiwork/comments/ixeboi/has_anyone_ever_got_so_fed_up_with_a_job_that_you/,7,1
412,What would/will you choose as an early 20s w no kids?,"I'm super interested in what you would do if you were 20/21 again or what you'll try to do once you're about to join the work force. 

I can only speak from a non-US perspective and say I'm aiming for the second option long term, but I'm also from a country with a bit more safety net.

Feel free to share why you choose what or if you would do/recommend it completely differently.

[View Poll](https://www.reddit.com/poll/iv9xkb)",False,iv9xkb,rayowag,https://www.reddit.com/r/antiwork/comments/iv9xkb/what_wouldwill_you_choose_as_an_early_20s_w_no/,16,2
413,America the land of the not-so-free (and every other 'free' nations),,False,iwf6va,Fuarian,https://www.youtube.com/watch?v=4xqouhMCJBI&amp;ab_channel=SecondThought,4,1
414,(UPDATE:) I just found out the guy I trained is making 20%+ more than me!,"Pressed for an answer today, got nothing.

&amp;#x200B;

However, I did get a response from HR (who I had of course copied in to the conversation), and IMO this was a big mistake on their part - their response basically amounted to ""your pay will not be increased based on what this other guy makes.""

&amp;#x200B;

So I said understandable have a good day, call me if you change your mind, peace out otherwise.

&amp;#x200B;

Maybe they'll change their minds by Monday, but unfortunately I doubt it. I'll update this post if something should change, but I'm most likely going to be working in a kitchen again soon, and as much as i hate that, I couldn't be more excited. If I get a choice in how I'm exploited I might as well be working in a kitchen I guess.

&amp;#x200B;

Thanks for all of the feedback, it really was helpful.

&amp;#x200B;

[OP](https://www.reddit.com/r/antiwork/comments/iuyem7/i_just_found_out_the_guy_i_trained_is_making_20/)",False,ivkx3v,KabuGenoa,https://www.reddit.com/r/antiwork/comments/ivkx3v/update_i_just_found_out_the_guy_i_trained_is/,38,1
415,Work gives me anxiety. Not working gives me anxiety + existential depression,"I'm 25 and slogged for 6 months at an IB. My boss told me right at the start that even if I went for a movie on the weekends I had to tell him so he could make alternate arrangements in case some urgent work came up.

I toiled like this day in, day out for 6 months before I burnt out, quit, and moved back to my parents'. I thought of taking some time off before taking my next move. Then Covid hit and quarantine has meant I've been stuck at home without being to go out, meet friends, etc.

I got sucked into frivolous social media debates and arguments and triggered my OCD again. I spent the last few months in complete agony with multiple hours in a day spent having imaginary arguments in my head.

A psychiatrist advised me to take meds but have avoided it so far. I felt I needed the distraction of work to get my mind to avoid thinking again, so I have taken up another job recently.

It's been a double whammy. I hated work, but my anxiety issues are so bad that I cannot be left free to think. I'm having to take a job purely to numb my brain ! The one thing I've decided is to not have kids. Don't want to pass on my genes for anxiety to anyone.

 I'm not able to find a purpose in life or connect with society either. Everything seems so polarized and filled with irreconcilable differences between various groups who can barely agree on a shared view of reality. Our innate penchant for tribalism is rearing its ugly head at a time of potential existential threats like climate change. Is there any hope?

 Are we naive to even think about hope ? As for me, I'm just hoping to use my work as a crutch to numb my brain and earn enough for me to survive until my inevitable death.",False,ix18d1,Hari484,https://www.reddit.com/r/antiwork/comments/ix18d1/work_gives_me_anxiety_not_working_gives_me/,0,1
416,Should I call?,"I quit fast food within a day. I can't understand why people are allowed to come in, and eat with out a mask, then I need to wipe their germy food crumbs off the table. I didn't show up to work the 2nd day, which is today, and I didn't call either. I don't want to get corona from working a $9 an hour job.

I don't want to call because last time I called after not showing up, my old boss yelled and cussed at me trying to make me feel sorry. Already got my parents making me feel guilty for not calling. I guess I need to get my 6 hours of pay some how, but I honestly rather lose $50 than have an angry phone call with an employer, I can't tolerate angry people.",False,ix48ja,Your_Time,https://www.reddit.com/r/antiwork/comments/ix48ja/should_i_call/,0,1
417,Death to the gig economy and its enablers.," 

Fig Economy Company
Haunches Ober, But for
Evicting People

A company called Civil says existing people
is the ""FASTEST GROWING MONEY
MAKING GIG DUE of COVID-19.""

c By Ashwin Rodrigues

September 21,2020,6:am of w @&
",True,ix9hke,Esperaux,https://i.redd.it/1h1o39rs9ko51.jpg,0,1
