,title,body,is_image,id,author,url,num_comments,num_upvotes
0,People just don't understand when you tell them you dont want to work your life away.,"From being told you're a lazy freeloader, to ""what'll you do if you dont work?""




I just want to live on a homestead, and not have to work years on end before i can finally have the opportunity to do what i want. 




It seems this sub is the only place people actually understand.",False,fbnvmb,LifesPotential,https://www.reddit.com/r/antiwork/comments/fbnvmb/people_just_dont_understand_when_you_tell_them/,26,1
1,Are we all just slaves?,"What truly is freedom, what makes one free?",False,fbmtbo,Keyboardtyper57,https://www.reddit.com/r/antiwork/comments/fbmtbo/are_we_all_just_slaves/,14,1
2,Wish I could spend that much a month on stuff I like," 

Most J. Part @JoseJuMarti - d

""To the capitalist, every luxury of the worker
seems to be reprehensible, and everything
that goes beyond the most abstract need —
be it in the realm of passive enjoyment, or a
manifestation of activity - seems to him
luxury."" — Marx

 

@ USA TODAY @ @USATOD... - 5/7/19

The average adult in the USA spends
$1,497 a month on nonessential items.
All told, that's roughly $18,000 a year on
things we can all do without. bit.ly/
2vlIbNZZ
",True,fbhx7q,legend1nfamous,https://i.redd.it/5311n6uwcvj41.jpg,14,1
3,What activities do you like to do on the weekends?,,False,fbfz2u,GenerationFreedom,/r/FreeCollar/comments/fbcxbi/what_activities_do_you_like_to_do_on_the_weekends/,2,1
4,Just found this sub and holy shit I don't feel like I'm alone,"That's it, really, I've felt osticized and guilty about hating money, corporations, and my 10 hour work days in data entry. Thank you for making me feel like my ideals aren't ridiculous and over the top.",False,fbgfqk,d0ctorsmileaway,https://www.reddit.com/r/antiwork/comments/fbgfqk/just_found_this_sub_and_holy_shit_i_dont_feel/,20,1
5,WE'RE BEING RIPPED OFF...,"“Of machines produce everything
we need, the outcome will depend
on how things are distributed.
Everyone can enjoy a life of luxurious
leisure if the machine-produced
wealth is shared; or most people
can end up miserable poor

if the machine owners successfully”
lobby against wealth redistribution.
To far, the trend seems to be toward
the second option, with technology
driving ever-increasing inequality.”
",True,fbf5y3,Anarchist23,https://i.redd.it/urp3aklx2uj41.jpg,93,1
6,The boss that pushed me over the edge,"Hit your bowl and grab a snack, this is lengthy. 

I've always been vaguely aware of my exploitation, and, until now, have been able to grin and bear it. Not anymore. 

My degree is in the arts. After college, I took a few office admin jobs to pay the bills. And I was good! I was a busy little worker bee that seldom complained, worked diligently, met deadlines, and always took initiative. I was quite proud of my work ethic, but not a fan of the work. It was dull-- and I felt like I was paid too little to do so much nothing, if that makes sense. 

When I got sick, I had to find an alternative to the office day job. I spent too many breaks puking in the office bathroom.

I was able to find remote work through a staffing company that was offering much more than I currently made. It was contract work, but I was sure that the pros of working from home would outweigh the cons of paying self-employment taxes. (This is not a story about the horrors of gig work-- s can talk about that later.)

Eventually, after a couple months of working with this staffing company, they offered me a contract with their top client. It was an Executive Assistant role, and the client had enough money to pay top dollar, they told me. However, I had to complete a few weeks of work at a training rate with this client before we could renegotiate a rate. 

Well. During my first month of working with this client, while I am supposed to be training, he disappeared for a road trip on the other side of the planet. He spent the month traveling by motorbike, staying in expensive hotels and resorts, and eating exotic food. (This was all billed as a business expense somehow.)

I was put through the ringer during this month. He would Slack/WhatsApp me outside of my working hours. On one occasion, he called me, noticeably drunk, on a day I had requested off because I had family visiting, to give me a time sensitive task. When I told him that I would be taking the following day off to make up for the lost time, he proceeded to Slack/call me on THAT day as well. 

He gave me a slew of impossible tasks, and never seemed to be aware of the lengths I had to go to to make them possible. 

For example, he asked me to order his Mother's Day flowers for him-- at 9pm the evening before Mother's Day. To top it all off, he scolded me for not ""shopping local"" when he found out I had ordered from 1-800-FLOWERS-- the only florist that would take my order with the expectation of same day delivery. 

Ok, fucking ridiculous. I complain to the staffing company. They tell me that sometimes ""busy executive types"" don't understand the work that has to go into making these things a reality. Nice non-answer. Despite my better judgement, I forge ahead. 

He begins to ask crazy tasks of me-- to order flowers for a stranger in Switzerland. To call a ferryman in Azerbaijan. To check on a rural road closure in Turkmenistan. I speak none of these languages, have no contact info provided by him,  and have to purchase Skype minutes for all of these overseas phone calls, something that was NOT in my contract. To top it off, I was given about ~6-10 hour turnaround times for the bulk of these tasks. And, miraculously, I made them happen. 

I contact the staffing company again. This is getting out of hand, and I tell them that I'm going to ask for a high hourly rate. Don't worry, they say, it will be better when he's not traveling. (Um? I manage his calendar. I can see that he's nearly ALWAYS traveling.)

So he gets back from his trip, and he and the staffing company negotiate my rate, and come back to me with a number that is significantly-- SIGNIFICANTLY-- lower than I asked for, reasoning that I have proven to be a good PERSONAL assistant, but I haven't done anything to establish myself as an EXECUTIVE assistant. 

Again, against my better judgment, and with loved ones begging me to quit, I forged ahead. I put an emphasis on getting involved in my client's business, but the bulk of my portfolio was still personal assistance. And the unwieldy demands with zero appreciation continued. 

It was during this time that I started to notice my enthusiasm for work slipping dramatically. I quarter-assed everything I did, and I didn't give a single shit. The busy little worker bee was no more. He crushed her. 

On a particularly bad week, I was loaded up with projects. I wasn't making any headway with these dead-end projects. My client was NOT completing tasks on time (even after I implemented a new system), and I was getting an earful from project managers and the staffing company. 

So, fuck it. This job isn't going anywhere. And it's clear to me that the staffing company cares more about keeping this guy as a client than actually offering me any support. My contract doesn't require me to give two weeks notice, but I do anyway. (To which the staffing company referred as ""dropping a bombshell"". Excuse me? I've been complaining about this client for months.) 

I explain to the client that I'll finish up the projects I'm working on, but I won't be taking on any new projects. Guess what he does right away? Yes, gives me another project. I put it on the to-do list, say yessir, and I don't touch it. Fuck you.

The story ends with me giving him a half-assed ""I need medical leave"" in my exit interview. It's true, but I don't tell him that the leave is to recuperate from severe depression after months of his abuse. Not worth it. Fuck you, goodbye forever. 

Months. It takes me literal months to find passion for life again. And I felt completely robbed of any sense of a work ethic, which uses to be a huge part of my personality. I found myself bungling and half-assing jobs I actually did care about. It wasn't until I had the chance to step into a role in the arts-- the job I went to school for-- that I found the person he killed again. Aha! My life had purpose once again. 

I feel forever changed. I'll never be able to look at work or bosses the same way again. And it astounds me that so many Americans are living their lives that way, feeling unappreciated and alienated from their labor, and continuing on like that for years... How?

When I was debating whether or not to quit, I came up with this metric: 

A job can offer you three things: compensation, satisfaction, and ease. A job should AT LEAST offer you enough of one to compensate for a lack of the other two. If it lacks in all three, it is time to quit.

P.S. I have it on good authority that his new assistant makes the same complaints I made. Some people never learn. 

TL;DR My shitty boss's outrageous demands zapped me of any work ethic I had. The staffing company that placed me only cares about keeping him as a client. Work culture fucking SUCKS. Quit your job and smoke more weed.",False,f9rk8s,DepersonalizingCow,https://www.reddit.com/r/antiwork/comments/f9rk8s/the_boss_that_pushed_me_over_the_edge/,10,1
7,"The doctor gave me the saddest, knowing smile","GP Doctor: it doesn't seem to to me that you are well enough to return to work, do you feel well enough?

Me: No

GP Doctor: Can you afford to take more time off?

Me: Unfortunately not

GP Doctor: I see... *sadly writes ""Fit for work note""*.",False,fabz24,IsThereAnyWorth,https://www.reddit.com/r/antiwork/comments/fabz24/the_doctor_gave_me_the_saddest_knowing_smile/,13,1
8,"Venting, venting, venting...","I am beyond mad. I just drove for over half a day and spent a week working full-time for a fairly well-known animal rights organization (to hell with it, it’s PETA) and was basically given the boot. It was a “working interview,” as they like to call it. They provided me with food (during my stay) and a house to sleep in, but that’s it. I had to pay for transportation and anywhere I stayed between travels. 

I did the assignments they gave me and interviewed with the higher-ups, but I had a bad feeling as soon as I left. I emailed my “boss” in a joking manner, basically explaining how I felt and trying to determine whether or not they were willing to train me for the job in spite of my “shortcomings,” and they said it sounded like I was withdrawing my application and that I should continue to support them and to keep looking. And they even had the audacity to say that the application process was an investment for them as much as it was for me. I’m not the one who invited me to do the interview and wasted my time and money. I was just stupid enough to think that anything would come of it. I replied back to the “boss” saying that I wasn’t withdrawing, but essentially that if they can’t see my worth then to hell with them. I wish that they cared about the people that they’re supposedly investing in as much as they claim to care for animals. I am a human being and I have worth too. Instead, I was treated as if I was trash. 

I don’t care about money, otherwise I wouldn’t have applied for the job, but I do care about my time. Time is not guaranteed and I applied for this job for that very reason. I want to spend my time on Earth doing something to benefit the world. Maybe PETA isn’t the place for that, especially considering their reputation. But I want to do something fulfilling in some way that pays the bills that I’m forced to pay. I’m fortunate enough that I could go for the whole week without sacrificing another job or income, but think of all of the other people that they’ve snubbed. Who thought that they had a chance and missed a week of work that they really couldn’t afford to miss. And it’s not as if I went into this with only a resume. I gave them references and they did a background check and I had a phone interview beforehand. I’m pissed at them for leading me on and at myself for being so stupid and naive. I hate people, man",False,fbl2id,oldhazelburke,https://www.reddit.com/r/antiwork/comments/fbl2id/venting_venting_venting/,19,1
9,"With Historic Win, Foodora Couriers a Big Step Closer to Union Certification | Canadian Union of Postal Workers",,False,f9jop5,CremationLily,https://www.cupw.ca/en/historic-win-foodora-couriers-big-step-closer-union-certification?fbclid=IwAR3W92yJG-as2NItDoEGAH0g9TwYH-1DcIy-pNDdniGtClFM1G6hwJNN95A#.XlV6591Eay0.facebook,0,1
10,Schools brainwash you and waste your life away.,,False,f9o84t,GigiVadim,/r/unpopularopinion/comments/emnvyd/schools_brainwash_you_and_waste_your_life_away/,4,1
11,"This should really be the sub’s anthem | Utah Phillips ‘Hallelujah, I’m a Bum!’",,False,f9uepf,GenuinelyLenin,https://youtu.be/E5Ll51kcbjo,1,1
12,Pretty accurate...,"Manager Assistant Manager

 

Employee Enter
",True,f9r1ap,Pistache2,https://i.redd.it/85ygwnq0j8j41.jpg,2,1
13,Time in our lives as humans should be prioritized as valuable to us. It should be used for things that we enjoy and that benefit us in our lives.,,False,f9l3jd,GenerationFreedom,https://www.law.com/therecorder/2020/02/13/high-court-orders-apple-to-pay-workers-for-time-spent-searching-their-bags/,0,1
14,Lying on your resume - The reality | #grindreel,,False,f9xvpa,Husonaut90,https://www.youtube.com/watch?v=6ufwxkurKKg,1,1
15,"This is what people will do for money in the future, when jobs are replaced",,False,f9svrn,HierEncore,https://www.ambrosiaplasma.com/,0,1
16,"TIL that in 1995, Theo Müller - head of yoghurt company Müller - was kidnapped and held at gunpoint. Müller threw himself out of the car and promptly returned to work that afternoon.",,False,f9m99l,Zenreich,https://en.wikipedia.org/wiki/Theo_M%C3%BCller,4,1
17,This is an incredibly toxic mindset to have regarding your career,,False,f9yziy,destructor_rph,https://www.reddit.com/r/financialindependence/comments/f9vae0/lets_talk_about_side_hustles/fiu1mpz/,1,1
18,I miss and also fucking hate college for not preparing me.,College was such a bubble compared to the work force and did not teach me any applicable skills. I miss the idealistic atmosphere that promoted the idea of changing society and having meaning in your future career. I guarantee I work with people who never even went to college. Now I have debt and I don't think my degree prepared me for my job at all.,False,f9kc3j,aimlesssouls,https://www.reddit.com/r/antiwork/comments/f9kc3j/i_miss_and_also_fucking_hate_college_for_not/,5,1
19,The Divine Transcendence of Slacking Off,,False,f9wer9,YuriRedFox6969,https://medium.com/the-weird-politics-review/the-divine-transcendence-of-slacking-off-1fe7bccb57d2?source=friends_link&amp;sk=64d1a8a89740eadbcc677a4600fa8da8,0,1
20,I finally quit,"It took me forever. I was going to do it last year but I didn't know if I had enough money or a good enough backup plan to save myself. Finally, I started a plan to move to another city and work there instead. 

I picked the perfect time. Everyone has been complaining about management lately. The difference is, everyone has to stay because they don't have a plan. Well, this project ends eventually and they'll have to find another job then. Me, on the other hand, I'm getting out of this shit. No more policing our lunches and our conversations. No more shouting matches over papers. No more subtle insults from assholes. No more gossip. It's done. 

I don't know if my next job will be good to enjoyable. Work is work. But I can hopefully find something better than I had.",False,faaowx,ProblemPenis,https://www.reddit.com/r/antiwork/comments/faaowx/i_finally_quit/,1,1
21,One chart shows the dire state of America's middle class,,False,f9n0fe,WinterTrabex,https://www.businessinsider.com/america-middle-class-living-expenses-family-of-four-2020-2,8,1
22,Im on training for 3 days now and cant sleep at all.,"I hate it. I havent even started working. I work at kitchen (amigos chicken wings) for 4 hours a day and i assume if i pass ill get the job and then ill have to start 8h shifts 5 days a week. 

I hate already going for 4 hours, how on fucking earth ill survive 8h a day? Im depressed, social anxiety, i hate buses because there is so many people in and i just hate socializing in all general.

The place i work is also quite busy and i just cant catch up. Most of the work i do and some clumsy guy while the other guy just watches over us doing nothing.. (he is leaving in few days, might be cuz of that).

I never really worked. Ever since highschol i stayed at home doing nothing but playing games whole day. 

I cant even sleep. I slept like 4 hours maybe in past 3 days. Idk whats wrong with me. I think too much about how hard will it get once im 2nd shift (today...) because apparently they have so much job that they cant even take break.. 

It seems in this place is when there are no orders thats your break lol. There are 3 people in kitchen. I dont see why we cant rotate and let 1 go have 30 min break while others 2 work and so on. Just bullshit.

When there are no orders, im hoping that nobody orders anything for at least 15-20 min so i can chill.

Whats worse is because i have goal. I want to save money and get enough for a plane ticket to visit my boyfriend in UK and live with him one day and youd think having such big goal would make everything easier but not for me. 

I honestly dont know whats wrong with me. I just want to go sleep but im not allowed to for some reason. Please help someone. I ocassionaly thought about killing my self as well. Seems like easy route eh?",False,fa8cb1,RengS_1998,https://www.reddit.com/r/antiwork/comments/fa8cb1/im_on_training_for_3_days_now_and_cant_sleep_at/,11,1
23,Passwords for every application,"Does anyone else get annoyed by the fact that you have to create a new username and password for every single place you apply to? I don’t even want to work, why is it so complicated to get a job. Why does working for people exist? Why does labor exist? Why do I exist? Why😐",False,fa6f0h,okbuddyheadass,https://www.reddit.com/r/antiwork/comments/fa6f0h/passwords_for_every_application/,6,1
24,"""I got my check and I laughed at it""",,False,fa13ls,finalbowlingpin,https://www.youtube.com/watch?v=QobacO2RqVQ,1,1
25,"This post made me feel accompanied in my pain, at least. When I say my 9-5 leaves me too tired to do anything else, people look at me weird.",,False,fb8ttr,vigoae,https://i.imgur.com/344kTXw.jpg,0,1
26,"""Sign or starve"" This trailer for the addon of Stellaris reminds me of todays company philosophy",,False,fawggr,Responsible-Elk,https://www.youtube.com/watch?v=L5urgu6C-PM,2,1
27,Let’s discuss ideas for opening up a location for a service without money.,,False,fbgk24,GenerationFreedom,/r/FreeCollar/comments/fbgj7b/opening_up_a_location_for_service/,0,1
28,Has anyone successfully passed an Assessment Day?,,False,fbliju,lvcv2020,/r/Unemployed/comments/fbcsdz/has_anyone_successfully_passed_an_assessment_day/,1,1
29,More like - social disorder.,"“Am opposing a social order
in which it is possible for one
man who does absolutely
nothing that is useful to >
amass fortune hundreds ‘

of millions of dollars, while

  
  
 
   

millions of men and women , me)
who work all the days 4

of their lives secure

hardly enough for

wretched existence.”

— Eugene V. Debs

he
",True,f9u4eb,Fearless_Ser,https://i.redd.it/frezpian4aj41.png,24,1
30,Homeless guy &amp; pregnant girlfriend are above a job that pays above minimum wage!," 

=e 2 mind -

By family member and his girlfriend are homeless in their car. Not only are
they homeless in an registered and uninjured car, not only that but she
also found out last week that she pregnant

| talked to my boss about it and he said they have an open position and
would do me the favor of giving them the job to help out. Edit- this job is 2
dollars above minimum wage with tips. Not a bad job at all

Am all excited to tell them, call them and tell them I have a job lined up and
they can start this weekend and they responded with ""no thanks vinesse, |
worked a similar position ten years ago while | was in highschool and | didn
like it. To offense to your boss but I can see myself as kitchen help again.”
Like what?!

They are coming to my place today to have a shower and do some sundry
and I'm actually repulsed and don't even anna help them anymore.

117 Comments

 

© Comment
",True,falmce,dumblederp,https://i.redd.it/gmjs0k5d1ij41.jpg,9,1
31,Is Vancouver BC a good place if you don’t wanna work?,I heard they have a good homeless community,False,fbiogn,tobyburger,https://www.reddit.com/r/antiwork/comments/fbiogn/is_vancouver_bc_a_good_place_if_you_dont_wanna/,1,1
32,"If anyone tells me I’m not suited for a typical work environment, I don’t think that’s a bad thing. Just because I would prefer a happier environment doesn’t mean I lack talent. Mister Rogers agrees.","In lots of toxic and unhealthy work environments that is thrown around a lot. They put a certain pressure on fitting in. Living up to the potential. Being perfectly suited for it, and implying that you are a loser if you’re not.

Unfortunately I haven’t heard of many nice work environments. Out of all the people I know, I can’t even tell you one. The problem isn’t the job itself. Different careers could be really cool and incredibly rewarding. The problem is the work environment that turns a really cool career into a mentally unhealthy work environment where the hours and demand for lack of input could drive anyone insane.

So, we studied in college, wrote papers clearly stating our own ideas to join a job where we have to conform and rarely have our own ideas acknowledged? For most of our school life we were constantly asked what our ideas were. Shit on school all you want, but they trained us to be bosses not employees. Or, in the very least, not employees that only followed orders without truly contributing to our job in a way that mentally satisfies us.

Of course, there are some exceptions depending on what field you’re in. But, you get what I mean.

To be honest, I thought I was crazy until I heard that Mister Rogers felt the same way. I heard Mister Rogers had a job where people treated him horribly, and he never forgot that. 

I’m sure most of the people who belong to the subreddit have the same feeling – being incredibly happy to be an adult, only to be disappointed with how awful every day work environments are. Mister Rogers made his dream career happen. Sometimes when your preferred environment doesn’t exist, you have to create it for yourself. Remember that.",False,fb7fbs,redbirdlovespopcorn,https://www.reddit.com/r/antiwork/comments/fb7fbs/if_anyone_tells_me_im_not_suited_for_a_typical/,5,1
33,"sorry if this is a repost, hate that this is real life","BBC News (World) @ @BBCWorld - Dug 17, 2018 a
Teachers donate 100 sick days to colleague with cancer

 

 

100 sick days donate to teacher with cancer

When Florida teacher Robert Footman ran out of sick leave during
chemotherapy, colleagues came to his aid.

be.com

O 82 of 398 O 22K a

He Velvet Funny v
@kimmy629

Replying to @BBCWorld

| had triple pass surgery in 1999. | didn’t have enough
time either to cover the days | needed before my short
term disability kicked in. By co-workers gave up some

of their days off to cover it for me. | will never forget their
gifts and how much it meant to me!
",True,fbfqkr,catmasterfunk,https://i.redd.it/32tkyuqzbvj41.png,63,1
34,Capitalism is created by the rich for the rich,"A local restaurant in my neighbor hood that I used to patronize just raised prices for its entire menu by 2 times to cater towards rich customers. It is just sad that it ended up this way. The restaurant had its humble beginnings and initially, started its business by serving tasty meals at an affordable price for the common working class. Over the years it has build a solid reputation by earning the trust and loyalty from its customers. It is common to see long queues during breakfast, lunch and dinner. Everyone was willing to spend time queuing for the meal and no one is complaining about the waiting time. 

Eventually all the buzz surrounding the restaurant started to attract the attention of people with too much cash to throw around. They started to get their meals from the restaurant and it is obvious that they enjoyed what they ate.But apparently these people didn't want to spend their time waiting for a spot in the restaurant. Since well, you know they are rich.

To solve their issue, they decide to strike a deal with the owner - they are willing to pay twice the amount to avoid the long queue. So now the restaurants serves these rich folks and everyone else is left with nothing. This deal is a betrayal of all the loyal customers that have help built up the restaurant's brand and reputation. 

This is how capitalism works. Businesses catering only to the people with money. Can you imagine what will happen essential services such as healthcare gets privatized? They would turn down all everyone who cannot afford to pay. Yet somehow capitalist love criticizing how the government shouldn't get involved in businesses. Leave the free market and society alone alone, they say. Yeah, I wonder what would happen it a 100% free market world? Oh that's right, you get class cleansing where the poor are left to fend for themselves while the capitalist class exchange wealth with one another.",False,f9tmgf,OceanRaver,https://www.reddit.com/r/antiwork/comments/f9tmgf/capitalism_is_created_by_the_rich_for_the_rich/,2,1
