,title,body,is_image,id,author,url,num_comments,num_upvotes
745,EMT in the ER continued...,"I made a post recently where I basically just complained about my job.  I know people have it worse than me so I'm sorry for that.  

Anyways, there was an incident recently where the charge nurse sent alot of people home because we were slow.  She also sent home the unit secretary, so we effectively had no secretary.  She looked at me and said you're gonna be the secretary for the day.  Now this isn't a kush easy position where you just answer phones.  You have to talk to doctors and surgeons at various facilities and know who to transfer where, and also make sure forms and various paperwork is signed correctly and given to the right people.  It's alot of work and knowledge that I have no experience in.  Also the only reason they asked me is because my pay is the lowest in the ER so she could save the hospital money by having me cover two positions. I told her no.  I said I wasn't hired to be a secretary, I wasn't trained to be a secretary, and you don't pay me more for having crosstrained in two positions.  She was mad but there was nothing she could do about it and she had to play secretary for the day.  My point is that sometimes you have to stand up for yourself and say no, otherwise they'll walk all over you.  We also ended up getting crazy busy so we would have drowned with me trying to learn that position on the fly.  Thanks for listening, this is strangely cathartic for me to write it all out.",False,f00qt9,ImJustAGuyCantSleep,https://www.reddit.com/r/antiwork/comments/f00qt9/emt_in_the_er_continued/,5,1
746,Happy at work? No? Lock yourself in! Now corona virus proof!,"= a happy
| workplace
people ke 66%

less sir leave
]
fe

Mind happiness

Advertisement

 
",True,eztc90,SergeantStoned,https://i.redd.it/72fmy4nhgbf41.jpg,9,1
747,"People are brainwashed into being obedient slaves that love their own chains beyond saving. It's the kind of thing that has been learned through generations, there's no undoing this.","Sometimes I feel like I'm the crazy one. I look around me, or even on the internet, and people are actively arguing against their own interests, and being smug and condescending about it too! It's as if I'm just immature or spoiled.

Every little facet of life is affected by this brainwashing. It's creepy once you see it, it's at every corner.

 In a recent post I read about standardizing online applications/CVs, the most upvoted comments were basically saying ""well, even when we filter all the candidates, there's just too many and so we have to work extra hours, so the process has to be tedious so that the people who put in the effort actually want the job"". At no point did these people stop an think that maybe the fucking company should hire more people to deal with the hiring process. The few that mentioned it were downvoted and patronized, like they just didn't understand the realities of business. Being understaffed and making your slaves work overtime and do the job of 5 people has become normal, every penny must go to the shareholders after all.",False,eziaxi,ano1418,https://www.reddit.com/r/antiwork/comments/eziaxi/people_are_brainwashed_into_being_obedient_slaves/,4,1
748,"""Ending a Pregnancy Because I Had No Sick Leave""","   

""Feminist economics

The hardest decision of my
life: to end a pregnancy
because I had no paid leave

Despite my job at a college and my husband's job
at a grocer store, neither of us would get paid
parental leave. To we made a difficult choice
",True,ezsiuz,WinterTrabex,https://i.redd.it/1pljgdbt4bf41.jpg,2,1
749,ADHD and professional job hunting don't mix,,False,ezpjxz,lvcv2020,/r/ADHD/comments/ezj6ne/adhd_and_professional_job_hunting_dont_mix/,3,1
750,"Today Indiana's oldest employee retired at age 102. Imagine working till you're 102, he's also WW2 veteran.",,False,f06gwr,catchasingcars,https://imgur.com/o1h17Jh,3,1
751,"Plan A - freelancing, plan B - death, plan C - wage slavery.","It will sound extreme to some, but if I was given a choice to spend my entire life in prison without possibility of parole or death penalty, I would choose death...
I quit my job a couple of months ago to pursue my hobby which is music, I’ve researched and planned on how to make money from it so I could make a living from it.
Now I have a couple of songs ready to be published, but the thing is that I’m truly scared of putting it out there because I know there are many thousands of doing just that to compete with and if it doesn’t work, I’ll be forced to be a wage slave my entire life either by working in a dead end job or by studying a profession, doesn’t matter, still a bootlicker.
I’m not some capitalistic pig that plan on lots of money, I just need 583$ monthly to pay the bills and buy some food.

Does someone here is in a similar situation and afraid to try, or can relate?.",False,f09kj2,landedonfire,https://www.reddit.com/r/antiwork/comments/f09kj2/plan_a_freelancing_plan_b_death_plan_c_wage/,3,1
752,Here’s how you’re being manipulated as a consumer.,,False,f03cre,JohnJonJaunJahn,https://blog.hubspot.com/marketing/psychology-of-excitement,0,1
753,"""Hey...you gotta minute?""","(& Laurazepam Iv
by @andlikelaura
my favorite part about having a
job is assuming you're fired every
time your boss calls you into their
office
",True,ezxmwb,YuriRedFox6969,https://i.redd.it/ygoal7d2laf41.jpg,2,1
754,"Wow.... These people are amazing, they think giving a good childhood to a baby is worth it because they will be taxpayers....",,False,ezg02w,ADevils_Advocate,https://www.reddit.com/r/worldnews/comments/ez93vu/_/fgm62mr?context=1000,0,1
755,The Company is Doing Well,"  

COMPANY PROFITS ARE

of of ALL-TIME HIGH?
To WHY po £ NEVER °
GET A RAISE 2?

of you PRODUCTIVITY
ALSo of of All-Time
HIG-Of

      

 
",True,f08p5v,dooby1,https://i.redd.it/mbvma5cfbhf41.png,7,1
756,Grumble grumble.,"2 weeks into a new job that says
they value a work/life balance

 

Lhosesbastards lied to me
",True,ezw6hl,techknight486,https://i.redd.it/t67fwued4bf41.jpg,6,1
757,this is the most pathetic sub I've ever seen. Bunch of losers lol,,False,f141fn,fartbox1969,https://www.reddit.com/r/antiwork/comments/f141fn/this_is_the_most_pathetic_sub_ive_ever_seen_bunch/,13,1
758,"Good morning, fuck work",Also fuck communists and anarchist. Y'all stupid.,False,f0q9uq,Stage3GuildNavigat0r,https://www.reddit.com/r/antiwork/comments/f0q9uq/good_morning_fuck_work/,0,1
759,death is my best friend. i'm waiting for his coming every night.,,False,f1equ9,GoldJello,https://www.reddit.com/r/antiwork/comments/f1equ9/death_is_my_best_friend_im_waiting_for_his_coming/,0,1
760,"What a, sick way, to live", Well it's Friday night I'm stuck at work till 11pm pretty much the weekend is over and back to it on Monday this is disgusting,False,f0kot4,mwhit85,https://www.reddit.com/r/antiwork/comments/f0kot4/what_a_sick_way_to_live/,5,1
761,How do you guys not get bored?,doing same shit over and over till you are ready to retired.,False,ezkb24,caods,https://www.reddit.com/r/antiwork/comments/ezkb24/how_do_you_guys_not_get_bored/,19,1
762,Getting sent home early because I have to remain “busy”,"TL:DR my job sucks horse dick. 

I work at a Freddy’s fast food chain. I completely hate my job and I pretty much don’t need it but having some income isn’t completely worthless while I’m learning my trade. Anyway I got my first fast food job and it’s a complete joke. There is so much work to be expected to finish but I make  25 cents over minimum wage in my state. Which is 7.50 (lmfao) today an employee asked why I even applied here after she made a joke about me getting fired. I straight up told her and the supervisor I didn’t care because I’d find another job that pays more rather quickly so I wouldn’t care. Few hours later I get sent home about 20 minutes before so they didn’t have to pay me another 7.50 lmao. I plan to quit right before on Saturday because that’s their busiest day of the week lol.",False,f1kqp5,Wobblewobblegobble,https://www.reddit.com/r/antiwork/comments/f1kqp5/getting_sent_home_early_because_i_have_to_remain/,0,1
763,"Excellent Interview: Dr. Richard Wolf. From the intro: ""The irony is when you are done with work on your way home you pass a place that says 'Happy Hour' as if to underscore that the others aren't.""",,False,f17nj1,quietpilgrim,https://youtu.be/ikTZaMhWW1Y,4,1
764,The number of people who come to work when they are sick means that the coronavirus will be spread nomatter what.,"Sick days must be enforced to save millions of people from getting sick and dying, but I don't think they will be. I think we are too greedy to save ourselves. I think every country on earth is doomed. It's going to be similar to  [https://en.wikipedia.org/wiki/Spanish\_flu#Spread](https://en.wikipedia.org/wiki/Spanish_flu#Spread)",False,f0quvr,HierEncore,https://www.reddit.com/r/antiwork/comments/f0quvr/the_number_of_people_who_come_to_work_when_they/,9,1
765,What do you think about my plans?,"Plan A:

Become a practical teacher in my High School, until 2025 there will no need to get a degree to do this job, but after that year I'll have to get it. If I'll like teaching maybe I'll become a theory teacher. I don't really care about IT but I think that I would like teaching. 

Plan B:

Get employed at the post office. Post office are managed by the government (just like schools) so the working conditions are generally good. The pay is basically the same one as a teacher, but it's a job with a far more relaxed working rhythm. 

Plan C:

Get employed at a funeral agency. Almost nobody want to this job so it should be easy to get employed. The pay is really good, but the working hours may be a lot (because it's the canonical 40 hours + extra hours if someone dies when you're not working).

These 3 jobs are actually very useful to the society so I wouldn't mind doing one of them. 

Also I have a plan regarding bullshit jobs, but I don't want to share it right now because I need to refine it.",False,f0rupr,RedemptiveChem,https://www.reddit.com/r/antiwork/comments/f0rupr/what_do_you_think_about_my_plans/,4,1
766,Just Called a Union Rep,"I'd had it at my job: crushing workload, crap pay, backbiting management, slashing benefits year after year. So I called the local union to discuss organizing. 

Gonna meet with them on Monday. Wish me luck.",False,f0cytx,kwahteN,https://www.reddit.com/r/antiwork/comments/f0cytx/just_called_a_union_rep/,67,1
767,"Stalin was the HR boss. (Or, anti-work is Communism; the Soviet Union was capitalist.)","https://www.marxists.org/reference/archive/stalin/works/1951/economic-problems/ch04.htm

&gt;In our country, the sphere of operation of the law of value extends, first of all, to commodity circulation, to the ex-change of commodities through purchase and sale, the ex-change, chiefly, of articles of personal consumption. Here, in this sphere, the law of value preserves, within certain limits, of course, the function of a regulator.

**But the operation of the law of value is not confined to the sphere of commodity circulation.** It also extends to production. True, the law of value has no regulating function in our socialist production, but it nevertheless influences production, and this fact cannot be ignored when directing production. As a matter of fact, consumer goods, which are needed to compensate the labour power expended in the process of production, are produced and realized in our country as commodities coming under the operation of the law of value. It is precisely here that the law of value exercises its influence on production. In this connection, such things as cost accounting and profitableness, production costs, prices, etc., are of actual importance in our enterprises. **Consequently, our enterprises cannot, and must not, function without taking the law of value into account.**

...

&gt;Is this a good thing? It is not a bad thing. Under present conditions, it really is not a bad thing, **since it trains our business executives conduct production on rational lines and disciplines them. It is not a bad thing because it teaches our executives to count production magnitudes, to count them accurately, and also to calculate the real hings in production precisely, and not to talk nonsense about ""approximate figures,"" spun out of thin air. It is not a bad thing because it teaches our executives to look for, find and utilize hidden reserves latent in production, and not to trample them under-foot. It is not a bad thing because it teaches our executives systematically to improve methods of production, to lower production costs, to practise cost accounting, and to make their enterprises pay. It is a good practical school which accelerates the development of our executive personnel and their growth into genuine leaders of socialist production at the present stage of development.**",False,f16yo1,AndrewEldritchHorror,https://www.reddit.com/r/antiwork/comments/f16yo1/stalin_was_the_hr_boss_or_antiwork_is_communism/,8,1
768,People who are proud that they leave their 9-5 desk job to “travel the world” and making it seem like everyone else is doing it wrong.,,False,f0zhqa,spicy_stew,/r/travel/comments/f0rf9a/people_who_are_proud_that_they_leave_their_95/,8,1
769,PeopleSoft - Wikipedia,,False,f1q5uq,Aristarchus_ofSamos,https://en.wikipedia.org/wiki/PeopleSoft,1,1
770,Bad Dialectics,,False,f25alu,IunderstandMath,https://imgur.com/Jhab9jY,8,1
771,Is this what life has become?,"I quit my job today because I couldnt stand the corporate horseshit anymore. Now my entire family and fiance is doubting me...

Whats easier... Killing myself or starting this. We are beautiful creatures but this planet sometimes. Anyway love you all.",False,f21hjp,infiniteprogress,https://www.reddit.com/r/antiwork/comments/f21hjp/is_this_what_life_has_become/,18,1
772,I feel like so much of my life was wasted in an attempt to get me indoctrinated into this corrupt society.,"I've lost countless hours, starting from 1st grade all the way through college, gradually being indoctrinated into thinking it's OK to force myself to be somewhere I don't want to be for 8 hours a day. ""Learning"" and doing things that 98% of the time don't interest me or benefit me in any way. The reward being a dangling carrot in the future - if you try hard enough, you can get into a good school and get a good job. 

Sounds so familiar to - if you work hard enough, you will shine enough to climb the corporate ladder and be rewarded.

When I think about that cumulative time, I want to die.  

Because none of it is/was true.

But I'm supposed to believe the lie for 40 more years and keep hoping.",False,f1sfdf,fikafikke,https://www.reddit.com/r/antiwork/comments/f1sfdf/i_feel_like_so_much_of_my_life_was_wasted_in_an/,43,1
773,How to Prevent Carpal Tunnel Syndrome,"Prevent
He Tunnel

 

X Touched «of

shoulders
X Went wrists —e

72
YES ""~~

Iv Running
into woods
Iv

Never to be
seen again
",True,ezmdlk,antihostile,https://i.redd.it/i4d8ujz088f41.jpg,52,1
774,My anti-work song,"Hey, thought I'd share this as lyrically it's basically about system collapse and hating work culture/society. I used my job to fund this mwuhahahaha

https://youtu.be/Zc2v9bsEhmk",False,f0ti94,TheCassiniProjekt,https://www.reddit.com/r/antiwork/comments/f0ti94/my_antiwork_song/,2,1
775,Oof,"When your body naturally wakes you
up early on the weekend

 
",True,f0vsff,bunnyFYG,https://i.redd.it/j2fbg1iy8pf41.jpg,0,1
776,Be a good slave,,False,f18gj6,Gethighwithcoffee,https://www.yegor256.com/2015/10/06/how-to-be-good-office-slave.html,0,1
777,Disability - Know Your Rights,"Me: \*Gets migraine. Calls off.  Plenty of PTO, so shouldn't be a problem.  Makes up time on the weekend anyway.

Me: \*Gets migraine the next week.  Calls off.   Makes up time on the weekend.  


Company: You need to show up for work when you are scheduled.

Me: \*Finds out that migraines are considered a disability.  Files paperwork. Now, no matter what's wrong with me, or even if I need just to have some ""quality time"" with the wife when our son is in school I call in a migraine.  I can do it up to 90 times a year and I can't be fired for it. In fact, if I haven't called out in a while I do it just so that if they fire me I can sue for violating my disability protection.",False,f12f8d,-NoOneYouKnow-,https://www.reddit.com/r/antiwork/comments/f12f8d/disability_know_your_rights/,0,1
778,"Capitalism makes life worse for everyone, but it makes life most hellish, more quickly for women, children, and minorities.","Utah girls choosing a career path

Support |

 
",True,f0dtlh,minoltagirl,https://i.redd.it/kfl9po982df41.jpg,13,1
779,Today Indiana's oldest employee retired at age 102,,False,f029ab,newsposts,https://imgur.com/o1h17Jh,28,1
780,Angry workers spurn Ethiopia's 'industrial revolution',,False,f1vvs9,Crazy-Red-Fox,https://www.france24.com/en/20200204-angry-workers-spurn-ethiopia-s-industrial-revolution,0,1
781,Why do I feel so bad for resigning,"Using alt account because to many people know my main reddit account...

so I picked up a new job 5 months ago at this place I thought was going to be bearable for a job.  
They did things that my last job doesnt offer such as offering 4 x 10 hour days instead of the old 5 x 8 work weeks as well as bonuses.

Unfortunitly I just havn't enjoyed going to work at all, my depression and anxity have gone up, I have started smoking again, I just feel like an outsider.

I have gone back to my old boss and asked if I can have my old job back as I used to work with some real good friends and most of the day kinda felt like I was just hanging out with some friends.

My old boss said I could come back, but somehow I just feel so god damn awful handing in my resignation even though going to work litrally makes me want to kill myself.. Why?

Please help give me advise/confidance to resign

thanks,

L",False,f1m5vm,sh1ttp0st3r123,https://www.reddit.com/r/antiwork/comments/f1m5vm/why_do_i_feel_so_bad_for_resigning/,6,1
782,I quit and here are my reasons,"Time to vent.

1. Boss paid some of the wage in cash, some in transfer to the bank account (tax evasion).

2. Five hours of public transportation every day (and really **really** crowded public transportation) is unbearable and gives me back pain. And I have no free time left after 9 hours of work and 5 hours of commute in total and 8 hours of sleep.

3. The manager is unmanageable. I feel like I have to manage the boss while doing my job and it gets on my nerves. He tells me that I'm taking too long and I'm really slow (impossible to explain to him that if I rush and don't double check there will be mistakes that he won't know how to fix). Eventually I turn in my work, he says he'll look into it and give me revision instructions and further things to do. He took 3 fucking days and every day I kept asking if he looked into my work and what he thinks. He said he didn't get around to that yet. Bitch why the fuck then do you keep hounding me for being slow if you are gonna take 3 fucking days to review my shit? 3 fucking days of sitting around and doing nothing being bored out of my mind.

4. Co-workers are snitches who will snitch your every little mistake to the boss while smiling to your face with all the fake smiles and shit. I'll return it with a fake smile as well but I'm onto you fuckers. Well, I was, I quit, so you guys have fun. You have a ""tip-of-the-tongue"" phenomenon one time while talking to a customer on phone and co-workers act like you don't know how to talk. I came 3 minutes late from lunch break once and had to endure my co-worker's passive-aggressive bullshit, while she did worse herself.

5. Boss and co-workers gossiping behind customers. No big deal honestly but seems a bit unprofessional for my taste. There are plenty of other things to gossip and complain about in life.

6. Boss demanding that I should be clean-shaven and dressed sharp always even though I have little to no contact with customers. Literally I form at most like 4-5 sentences every day to customers. If I'm going to sit in front of a computer for 9 hours I'm doing it with comfortable clothes (within reason of course). And I'm not going to wear a tie to make minimum wage.

7. It is physically impossible for me to fall asleep before 3 AM and wake up at 6 AM. All my life I did my shit at night. I'm used to starting to work at night until the sun starts rising. It's also impossible for me to not be in a semi-conscious state dreaming while awake when I'm sleepy. Combine those and I got a boss scolding me for being sleepy at work. What about society as a whole works, sleeps and eats according to MY circadian rhythm instead, and I scold you if your body isn't used to that?

8. Boss telling me I should socialize with my co-workers. This complaint of his came right after him scolding me for being slow at my job so that was surprise. I'm this fast by pretending to listen to my co-workers, how fast I'm gonna be if I actually interact with them? What about you give me a fucking task to do, and I fully concentrate on it without having to listen to some inane bullshit my co-workers wants to spew at me, and you give me something else to do afterwards so I don't feel like wasting my time at least? Just give me a task and a deadline and fuck off.

9. Now this reason enters luxury area a bit and I can understand why you'd disagree with me or think I'm being bratty, but I require certain amounts of cigarettes and alcohol to function. I'm not going to drink at work, but boy, I really understood the value of having short breaks to smoke. Too bad boss is vehemently against that. Solution: I chain smoked at lunchbreak instead. I never feel hungry at lunch break times anyway.

10. Meager pay, little benefits, boss treating you like a kid, but I guess most people complain about this anyway. It's one of those problems in work life that should be fixed, but everyone else complains about it anyway, so it kinda becomes the standard.

I recognize that I'm financially secure at least to a point where I afford to be unemployed for some time and not suffer a dramatic drop in my quality of life. Those who have to stick with their jobs, my heart goes goes out to all of you.",False,f1j692,Elatra,https://www.reddit.com/r/antiwork/comments/f1j692/i_quit_and_here_are_my_reasons/,5,1
783,Good excuse to use sick leave,"Hey, work is really pissing me off recently. I want to take 2/3 days off soon, I've used up too much of my vacation days already. What would be a good excuse to use for sick leave. Like what's believable enough that also wouldn't require evidence or follow up questions.

There's always a quick ""interview"" after a period of sick leave where you talk about why it was you took sick leave with the line manager.",False,f1idr5,prabhjit94,https://www.reddit.com/r/antiwork/comments/f1idr5/good_excuse_to_use_sick_leave/,13,1
784,"Oh, boy. Cant wait for other players to exploit my labor.","Harvest Time plays out a little like Farmville; it's a free-to-play game where
players in the world of Gamedec can log in, grow crops, milk cows, and do fairly
simple farmyard tasks. Margin Przybylek, the author of the Gamedec books,
explains that having a farming him isn't unusual at all because in the Gamedec
universe people are afraid of nature, so being in a world where you can touch
plants and help them grow is an appealing fantasy for some.

However, there is a sinister side to the happy-go-lucky players in Harvest Time.
Layers don't actually own a farm due to a lack of in-game money, so they work
for someone else. The farming simulate has its own loot box system in the form
of chests that players can get from simply playing the game. These two features
create a hierarchy where players get addicted to getting chests and powerful
farm owners are explaining their manual labour. His need for chests means that
working in Harvest Time, as Przybytek describes it, is like having a second job to
players in the Gamedec universe.
",True,f1tmpk,YuriRedFox6969,https://i.redd.it/593qkou3t4g41.jpg,1,1
785,It all starts with football.,"Team sports indoctrinates humans from a very early age to think of their fellow men as competitors in an imaginary game with imaginary rules. To give all of themselves, and risk permanent injury for no other purpose but to serve a goal to a team or a trainer or owner... It also indoctrinates humans from a young age to take pleasure from watching strangers have pleasure and be successful and accept that some people will lose everything.

In other words, it's perfect to prepare them for a lifetime of servitude to the corporate world, and a lifetime of stepping over homeless people without another look, because, you know... they ""lost"" at life... fair is fair... when it comes to imaginary rules.",False,f1pu3s,HierEncore,https://www.reddit.com/r/antiwork/comments/f1pu3s/it_all_starts_with_football/,2,1
