,title,body,is_image,id,author,url,num_comments,num_upvotes
740,I have no problem working to contributing to a community/society but our current ways are so boring and unhealthy,"I don't know how this varies from country to country... But the 8+ hours a day is so exhausting and just strains any creative juices one has. I have a decent job and decent team but it's just so boring and it gets dull fast.

Plus there is barely any time for socializing and recreation. The pandemic has made this harder but long work hours have been around much longer. I really don't mind doing something and working but I want it to serve a more meaningful purpose.

I want to have a healthy relationship with people and a strong community. I want my work to serve this community. Right now it's just mundane tech shit and I don't even get to go out and talk to other people because I don't have enough money, time or energy. Other people are probably exhausted to do the same too.

Less resources and this social gap that we see is just killing us. Some of us can't even get out of this shit. This overworked social media obsessed society is not healthy at all and it's going to cause more damage if we keep going on.",False,irxrwf,YourDailyGinAndTonic,https://www.reddit.com/r/antiwork/comments/irxrwf/i_have_no_problem_working_to_contributing_to_a/,30,40
741,"Just found out about this sub, what does being ""anti-work"" mean?",,False,itdirz,fague_doctor,https://www.reddit.com/r/antiwork/comments/itdirz/just_found_out_about_this_sub_what_does_being/,7,1
742,University of Michigan graduate students vote to extend strike as opposition erupts at campuses throughout the US,,False,ita3ey,Zolan0501,https://www.wsws.org/en/articles/2020/09/14/umic-s14.html,3,1
743,My job is holding me back from my career change. Should I quit?,"For the past year I’ve been trying to change careers, get out of the industry I’m in, and build a solid portfolio so I can start applying to jobs. I was going to quit in March and coincidentally covid happened and I got a great promotion from a new boss and WFH made work better for a while. 

I just spent 2 straight months on 1 project for my portfolio and I worked 30-40 extra hours after work and on the weekends to get it done. It completely burned me out and I know it’s because I’m working full time. I made it my goal to make time to work on 1-2 more before the end of this year. 

My job is completely unfulfilling and I hate it, but I worry about resume gap or not being able to get another job if I just leave...My job is holding me back because it’s not the industry I want to be in and it’s not allowing me to focus completely on the switch. Money isn’t an issue if I quit. 

Should I just get out?",False,isb4iv,potatomari,https://www.reddit.com/r/antiwork/comments/isb4iv/my_job_is_holding_me_back_from_my_career_change/,19,4
744,applied for a minimum wage job for the first time in 2 months and got rejected right after my interview,"meanwhile my bf had his interview the day before me and got hired on the spot? he doesn’t even have open availability because he has school and i don’t, i told the interviewer i can work whenever, so what the fuck? i never should’ve told him to apply i seriously fucked myself over with that because of course he scheduled his interview the day before me. rejected from fucking target that is actually pathetic. this is why i don’t fucking bother. i legitimately hate myself i’m so awkward i bet that’s why she rejected me. why can’t i just have one fucking thing in my life work out? i’m done trying i give up i seriously am done. i haven’t been this mad in so long, i don’t even know if i’m angry or embarrassed or jealous over my own bf? it’s pathetic.",False,ityvir,tarantula-slut,https://www.reddit.com/r/antiwork/comments/ityvir/applied_for_a_minimum_wage_job_for_the_first_time/,15,1
745,US labor law,"Thought this might of interest from the ""jobs/work-related struggles"" angle, at least for my fellow Americans: ""[No One Knows Their Legal Rights at Work](https://slate.com/human-interest/2020/09/labor-law-usa-know-your-workers-rights.html)."" It's a pretty short read over at Slate but I found it illuminating. The author also writes the Ask A Manager blog. Anyway, I thought this bit from the Salon piece was interesting and I just keep kind of turning it over in my head:  


&gt;I suspect the root of the disconnect is that people assume employment laws are there to hold employers to a bar of reasonable behavior. But in fact, the employment laws we have are more of a bare minimum. When you expect labor law to do more than that, you’ll usually come away disappointed. (In fact, I wouldn’t be surprised if the reason anti-union sentiment is so strong in the U.S. is at least partly because people assume they’re protected by far more laws than actually exist.)",False,ithbm7,Suedeltica,https://www.reddit.com/r/antiwork/comments/ithbm7/us_labor_law/,4,1
746,Job Negotiations,"Your salary won't be very good starting out.

Is that okay?

By performance won't be very good until it is.
That okay?

 
",True,itrwc2,Metaethic,https://i.redd.it/2hq43m3m4hn51.jpg,5,1
747,"Do you think it would be possible for people to crowdfund a ‘Land held in commons’ or ‘commoners’ district’ project for the unemployed, anti-workers and homeless to set up a place? Any ideas?","Since common land in a way was essentially like ‘privatisation’ without an owner (Meaning subject from enclosure by one person). Any ideas how we would get them to open sectors again for all of us?

We would mainly need to push for laws to make enclosing the land not allowed, have it be subjected from enclosure or have it in the terms. It belongs to everyone living there. 

Instead of being homeless you would become a commoner if you moved there for example to live.

Anyone who moves onto it can set up there and maybe with the help of others if they need to find space, get somewhere to live.

It would be regulated or managed by common law, the community and possibly city council depending.

It would be optional of course, just so there’s a place you can go if you can’t find a job.",False,isheni,Dragon3105,https://www.reddit.com/r/antiwork/comments/isheni/do_you_think_it_would_be_possible_for_people_to/,4,3
748,"For the Daria fans. I've been working on the railroad, every pointless day. I've been working on the railroad, while my life gets pissed away. Can't you hear the whistle blowing, shattering my dreams in the morn. Can't you hear the captain shouting ""wish I was never born"""," 
",True,isaii3,amcken13,https://i.redd.it/g9w3nzyif0n51.jpg,1,25
749,Please take care of yourself! You deserve to be happy!,"To put things into perspective, I work as a lead software developer at a very small early startup and I've been working like a dog these past few months while the world was burning down due to COVID-19. I've put in more than the required 8hrs every day. Never skipped a day of work or called in sick.

A few days earlier, I wasn't feeling well. I was kind of depressed and tired of coding tbh. I called my employer to let him know that I will be off for a few days since I wasn't able to focus on my work and was in need of a breather. I was expecting to get a few days off without any hassle. But guess what was his response... He said: ""I would love to give you a few days off buddy, but I just set up an appointment with a potential client and we need to finish the following features as soon as possible "".  

I was like why did you set up an appointment with a potential customer without even letting me know? And he then proceeds to tell me that he mentioned it the day before, which I'm pretty sure he didn't, and that we need to start making money as soon as possible.

Making money? Is that all he cares about? What about all that work that I've just put in? Can't the client wait a few more days? 

Those are all the questions I've asked myself after my call with him and I came to the conclusion that no employer cares.  I've been working all these kinds of odd jobs, cashier, barista, cook, and every single one of my employers had an excuse as to why I can't take the day off to myself. 

I became aware that I am just a resource. A resource to be used to generate cashflow. A resource to be squeezed until the last drop. A resource to be thrown away when it's no longer productive. I am not a human but just a resource.

As a young child, I was always scared to voice my opinions. I grew up like most other kids and have been told to go to college, get good grades so you can find a good job.  So I followed that path. Went to college. Worked all sort of jobs to pay my bills. I worked during the day and improved my coding skills during the night. I was always exhausted and thought to myself that once I get into software development everything will be better. I just followed my parent's advice...

Now, I find myself spending my Monday to Friday in front of a computer close to 12hrs a day. I am gaining weight and becoming unhealthy &amp; depressed. Is this what I was meant to do with my life? Am I gonna spend 50 years in this stupid job writing and debugging code all day? Is this what adult life feels like?

This is what I've found myself listening to while working: [https://www.youtube.com/watch?v=QI68giYtnXs](https://www.youtube.com/watch?v=QI68giYtnXs)

Pretty sad, isn't it? I broke down and went for a walk outside while holding my tears. I was bent &amp; broken. I've decided that even though my boss didn't want to give me a couple of days off. I was gonna take them anyways. He can go to hell for all I care. I turned my phone to airplane mode. Turned off Slack. Logged out of my work email. And most importantly, I allowed myself to breathe.

I've never felt better in my life. That breathing room allowed me to start exercising &amp; eat healthier. I've started smiling more and I became more enjoyable to be around.

I think that as humans we are not meant for this kind of life. We are meant to help each other in times of need and we feel fulfilled when we make each other happy. I just helped my neighbor haul some stuff home and it gave me more fulfillment than my bullshit job ever did.

I think we need to value happiness more that we value money. We need to stop pushing people into jobs that kill their souls for the sake of money.

Remember that it doesn't matter if you are a blue-collar worker or a white-collar worker... You are still on leash.

To sum this up, I just want to remind you to please take care of yourself &amp; always put yourself first no matter the situation. You are a valuable member of our society and deserve all the best. 

I would love to hear from you. Let me know your story by commenting below.",False,isy9au,Nicholas--s,https://www.reddit.com/r/antiwork/comments/isy9au/please_take_care_of_yourself_you_deserve_to_be/,11,1
750,What do you think of universal basic income?,,False,it8400,MessiahOf21Century,https://www.reddit.com/r/antiwork/comments/it8400/what_do_you_think_of_universal_basic_income/,25,1
751,let me go home man...,") Line Art Lionheart
@notalogin

People who say ""go big or go home""
seriously underestimate my willingness
to go home. Like, it's literally my only
goal for most of the day.
",True,iuhixh,eercelik21,https://i.redd.it/ese4ov270pn51.jpg,75,1
752,My anti work story,"Im currently working as a teacher, I like teaching but HATE all the politics and extra stuff that goes along with it. I dread going to work every single day. I’m thinking about being a teacher aide. I can help with interventions and not have to do the parts of teaching I hate (deal with parents, plan, grade, make lessons) but I’d be taking about a 50% pay cut. Id only be making around $18k a year. I probably can’t live off of that. I feel like a teaching aide would be the most tolerable job for me. Getting the summers off is so nice. I wish I could live off of $18k a year. :/",False,iuqa7b,megs167,https://www.reddit.com/r/antiwork/comments/iuqa7b/my_anti_work_story/,3,1
753,So uhh. Just got fired,"Got fired for not being ""available enough"" while depressive episodes made it hurt to even exist. 

I don't really feel bad about this, till I remember the job hunting process is absolutely ridiculing",False,isxrr0,SquidCultist002,https://www.reddit.com/r/antiwork/comments/isxrr0/so_uhh_just_got_fired/,35,1
754,Remember when occupations other then 'Business Owner' were promoted and encouraged in our society?,"When I was a kid it was always like, ""Wow that person's successful, they must be a doctor, lawyer, scientist, engineer, writer or something!""

Now it's just ""Start a business, start a business, start a business."" like that's the only way to get out of poverty now. I don't want to own a business, I have no passion for it and I'm better at other things, so the idea that I have to do something I'm not suited for or suffer in poverty seems like such a waste.",False,isfvh9,Qwerty-Hurty,https://www.reddit.com/r/antiwork/comments/isfvh9/remember_when_occupations_other_then_business/,38,20
755,Sad world we live in,"1970 The Reality For Our due
South

all
fn |
of (Inflation Adjusted)
£77,537 Average House Price £224,000
3.x average (Inflation Adjusted) 9.x average

salary salary

unemployment rate
Of) Study| § to) 0) -10)0)
Debt 6.1% Interest

http://news.sky.com/story/house-prices-bounce-Back-to-new-all-time-high-says-nationwide-12061493
http://www.unlike.co.up/articles-guides/your-money/the-price-of-a-home-in-britain-then-and-now/
http://www.instantoffices.com/blow/reports-and-research/average-up-salary/
http://apt.parliament.up/historic-harvard/commons/1971/jan/28/average-weekly-Age.
http://www.bc.com/news/education-40493658
http://core.ac.up/download/put/6908289, of
House of Commons Library, Grieving Paper Number 5971, August 2010
",True,it5y1r,Lunanney,https://i.redd.it/m4yv0ianxrk51.jpg,42,1
756,I soend telework listening music and do nothing,Shame rhose shitty a holes want to remove it but i can say im proud i used to do nothing but music i even napped a bit one time hahaha,False,iptvaa,jealouskaren,https://www.reddit.com/r/antiwork/comments/iptvaa/i_soend_telework_listening_music_and_do_nothing/,0,1
757,COVID Radicalized Me,[removed],False,iprouf,sanfoale,https://www.reddit.com/r/antiwork/comments/iprouf/covid_radicalized_me/,0,1
758,A three-time cancer survivor who reached out to Senator Thom Tillis (R-NC) for help with her health insurance was told by a staffer for the Senator that she didn't deserve healthcare if she couldn't afford it. Tillis blocked Medicaid expansion in his state and strongly opposes universal healthcare.,,False,iprj0e,ResistTrumpism,https://www.wral.com/coronavirus/cancer-survivor-pleading-for-help-with-health-insurance-angry-and-hurt-over-tillis-staffer-s-response/19276097/,0,1
759,"Come Join Kropotkistan, the Minecraft Leftist Server!"," 
",True,ipq4je,PeacefulChaos94,https://i.redd.it/vr9pwxiv17m51.png,2,1
760,Sieh so dumm aus. Sieh so ziegelig aus.,"Took at this dumb shit. Took at it.

ape rome

=e her

 

West Buy Valued Partner Induction Training

 

@) True

Incorrect
False

You did not select the correct response. He

Welcome our customers, not greet them,

 
",True,ipw599,BedHopeful,https://i.redd.it/jdocmdilv8m51.png,22,1
761,How is this inspiring? It's borderline obsessive and unhealthy. Yuck 🤢," 

 

of MISSION,

of OBSESSION,
of of WORK of
ASS OFF

of ORDER 10
BECOME THE BEST

 

THAT | CAN of........

 
",True,iq4uh2,JeffreyDhmer,https://i.redd.it/t4zdjvxnn7m51.jpg,4,1
762,"I didn't even bother looking at the comments, I didn't want to know.",,False,ipwoje,KlutzyNinja0319,https://v.redd.it/xgfpn0n5d5m51,18,1
763,The Wagie Life,,False,iqdrvj,Artie-Spliff,https://www.youtube.com/watch?v=YRT0Typtbto,2,1
764,Shitty are wage slogs and peek into what I saw,"I worked for a finance corp. which is here since 1850s for a while. So let me share with you how it culminated to this post.
I was hired for a analyst role  which I later come to know has nothing related to what it was supposed to be. Now before even I joined these people having no regards keep calling me many weeks prior asking me to start to gain knowledge about the technology stack they work in, like come on shit turds. Like they call me at fucking  night for long calls about how I should start looking into stuff and later I came to know yada this job requires to work in shifts. Now fast-forward I joined the company and ny belief that I wanna leave this job asap was confirmed. 
Some fuckery listed in points if u wanna laugh and cringe at their degeneracy :
* Once I reported sick at the exact starr of my shift and the manager says you couod have planned it better 😱. No regard for privacy too. 
* Inspite of being a fresh graduate the manager keeps talking shit about how I need to catch up and comparing with others. 
*The constant micromanagement and short deadlines such that I cannot even do lunch and had to work 5h overtime manytimes. 
* Now once a colleague fell ill and damn they fucking talked like  they could report it. Also calling the sick person again n again and asking them to come as a person from headquarters had come🤮.This continued till the said person came back. 
*Now the director is one shit who consider themselves some wonder person or what, like they made fun of other person's choice to leave the company to move out of the country and saying that they are doing a suicide by doing this.
*The colleagues are I don't know what species of sheep they slog throughout and act elated on their work which is nothing but slavery to their foreign masters to increase the company's revenue. Everytime they chuckle on video meetings I get disgusted by them.
*Also you know the ""team"" is supposed to ask doubts compulsorily in meetings like rofl. The manager kept sending messages to ask but you know fuck them, never did.


I got more ammunition but that's it for now.",False,iqn96h,satya_ki_khoj,https://www.reddit.com/r/antiwork/comments/iqn96h/shitty_are_wage_slogs_and_peek_into_what_i_saw/,0,1
765,When your workplace is short staffed.,"We work on teams of ""4"" however for the last 9 months+ its only been 2 including myself in my team.

No one from the 3 other teams has ever come to do overtime to help out.

So, when i get a text on my day off from management asking for people to come in and help:

Gee, that's too bad. I'd like to feel some sorrow for you, however my job isn't hiring people.

I don't even text back.",False,iqqkxg,Irezumi_Fan,https://www.reddit.com/r/antiwork/comments/iqqkxg/when_your_workplace_is_short_staffed/,0,1
766,My boss is literally breaking the law,"So in the netherlands if you're under 18 (i'm 16) you're not allowed to work more than 9 hours a day, however the time you spend in school also counts as worktime. So for example if I get out of school at 4 pm i'm only allowed to work 1 hour yet my boss scheduled me from 5-9 pm 3/5 schooldays. The person in charge of making the schedules literally told me herself that it's against the law but they don't give a fuck. When I get out of school I usually have 1-2 hours of homework plus graded assignments and studying to worry about on top of having to work. I don't know how i'll get home at 4 pm go to work from 6-9 do homework for another 2 hours plus studying, I would have absolutely no free time left whatsoever. This is all not even counting in overtime.

Sorry for this rant I just wanted to get it off my chest and hear your opinions on it.",False,iq7e48,ThatRandomGuy1S,https://www.reddit.com/r/antiwork/comments/iq7e48/my_boss_is_literally_breaking_the_law/,5,1
767,Serious question,What are you supposed to do if you don’t work? Where does the money come from?,False,ir9hl5,chaspich,https://www.reddit.com/r/antiwork/comments/ir9hl5/serious_question/,10,1
768,"Young, middle class and a 3rd world country resident: Rant","I just left my English teaching part time job that pays me $2/hour. I can’t stand it anymore. Such a low pay for teaching that requires a lot of effort and they imposed a mandatory meeting on a SATURDAY. 

The pay is enough to live a “basic” lifestyle in my country if I work at least 5-6 hours per day but it’s impossible for me as I am still studying on the side. 

I’m just so frustrated. I was working to save money for my master’s degree abroad and an IELTS test (English test for non-English speakers) alone costs me about $195. Not to mention all the other “extras” I have to do to prove that I am worthy. I have to be the best at everything.

The other option is not as good either. Working a professional office job will get me so much more pay, but I can also say goodbye to my free time, free will and free thinking.

This sucks!!

Not to mention I have an autoimmune disease that makes me feel tired easily and have to live off pills for the rest of my life. Great! More expense as the healthcare system in this country barely exists.

I am 20 years old and since I was a child all I do is working and studying hard in order to build a good career. 

But how if that good career never exists?? I see the people in so-called good jobs around me getting laid off anyway during pandemic. Or being forced to work defying all the health risks. 

I don’t want to work like a horse for the rest of my life just to be able to have a decent life. I don’t want a big mansion nor a sport car, just the freedom to relax in a piece of land I can call mine while drinking wine and not worry about money.

Is that even too much to ask? 

People around me are just saying that I should be grateful that I can find a job, etc but that’s bollocks.

Fuck this. Whatever this game called life is, I am quitting.",False,iqiozo,wellthatsffffup,https://www.reddit.com/r/antiwork/comments/iqiozo/young_middle_class_and_a_3rd_world_country/,8,1
769,99% HU$TLE 1% SLEEP,"4:55 we >)

hustlegod.pox
Sponsored x

 

The Motto He Abide by of

Visit Instagram Profile V

 
",True,iqzzp7,Quipelotious,https://i.redd.it/57os6ivp9lm51.jpg,2,1
770,"What's a ""bootlicker""?","I see a lot of you using that term but what's a bootlicker reallly mean? Someone whos prowork, someone who genuinely enjoy their job and dont need antidepressants to get uo?",False,iq8zfr,Rage-Xion,https://www.reddit.com/r/antiwork/comments/iq8zfr/whats_a_bootlicker/,31,1
771,“When the machines replace us”,"I love that I found this sub and how validating it is. I was randomly thinking about the prospect of AI taking over a lot of low-level service jobs (kind of already has with self checkout), and how people feel threatened by that. They’re threatened to lose their dead end job because they literally know nothing else and the corporations have beat them into thinking that’s a bad thing. Personally I think it would be wonderful because it eliminates human error. Correct change back, no strange personalities, efficiency, etc.",False,iqzxmo,Realitytvtrashpanda,https://www.reddit.com/r/antiwork/comments/iqzxmo/when_the_machines_replace_us/,5,1
772,"Here’s an idea, how about requiring companies to match overtime hours with sick/personal time hours?","If the company has an unforeseen need for extra work, fine, but the time being taken last minute should be paid back. A company should never depend on overtime labor for their low skill/low pay jobs when unemployment is high and there is no difficulty finding more workers. Overtime should be for emergencies, just like companies expect us to use sick time for emergencies.

I might not fit all the way in here since I think gainful work at its core is a good thing, but I am against exploitative work practices and I’ve spent the better part of my young adult life working in manufacturing environments where opting out of overtime was not an option.",False,iquavn,voiceofonecrying,https://www.reddit.com/r/antiwork/comments/iquavn/heres_an_idea_how_about_requiring_companies_to/,3,1
773,"Congratulations on your years of wage slavery, enjoy this cup, you earned it!"," 
",True,ipn006,Xenthys,https://i.redd.it/l9wuz9xzb4m51.png,10,1
774,To sum it all up!,,False,ipq1g7,fashion_info_finder,https://i.imgur.com/KRXRvgr.jpg,22,1
775,I can’t have hobbies,"Today I realized that I can’t have hobbies. I’m so brainwashed by capitalism that when I’m interested in something (graphic design, photography, crafts) I can’t just enjoy it. I’m thinking about how I can make money off of it.",False,iqrdrn,kge92,https://www.reddit.com/r/antiwork/comments/iqrdrn/i_cant_have_hobbies/,9,1
776,Just shot down a double shift,"(Graveyard security for reference)

My job’s scheduling department just tried to get me to pull 16 hours in a row because someone else decided to call off at the last minute.

I politely declined and told them I work another job in the morning and can’t stay behind. Was it a lie? Sure. Do I feel bad? No.

I’ve already had to make major alterations to my sleep schedule and lifestyle to accommodate the switch to full time overnights. 

I will *not* be wrecking my health for $14/hr and if they feel the need to shit can me for it...I’m at a point where I do not care. They’ve been struggling to find people for my job site and they were struggling to find someone to fill a 40 hr overnight slot before I accepted as it’s piss easy money and I can get away with far more than I could on 1st or 2nd. All I would tell them is “good luck”.

I’m glad I’m learning to put my foot down. I don’t think I would’ve been able to say no to this kind of nonsense a couple years ago.",False,iqowg6,zomboycolor,https://www.reddit.com/r/antiwork/comments/iqowg6/just_shot_down_a_double_shift/,10,1
