,title,body,is_image,id,author,url,num_comments,num_upvotes
239,"People or r/antiwork, why don't you create passive income source or build own business?","Hey, I don't mean to offend anyone on this sub reddit so I'm sorry in advance if this post triggers anyone.

Im an entrepreneur/former employee who came across this sub reddit for the first time and spent the last few hours going through the posts. I enjoyed the memes and my entrepreneur mindset just wanted to spam all these posts with the same answer so I decided to make a thread

Instead of working 9-5 for someone else, why don't you earn online/freelance or go for passive income source like affiliate marketing to help you live the life you want, in your own terms?

I also noticed this sub reddit is filled with americans and was wondering have you ever thought about saving and shifting to a country with less expenses?

In my opinion, freelancing + shifting to a 3rd world country could solve all your problem. Where as just freelancing initially is slow and requires stable career till you get your few freelance clients. Its better to suffer and live life like a king, rather than suffer whole life.

There's a solution to every problem I believe and was wondering what have YOU done to get out of the situation?",False,f7gsgq,Neoguy396,https://www.reddit.com/r/antiwork/comments/f7gsgq/people_or_rantiwork_why_dont_you_create_passive/,11,1
240,What happened that made you go from peak performer to just the bare minimum at work?,,False,f7w1mk,Kinglens311,https://www.reddit.com/r/antiwork/comments/f7vmse/what_happened_that_made_you_go_from_peak/?utm_source=ifttt,1,1
241,Coworkers,"My coworkers are gay as fuck. They’re all older than me. They’re all obsessed with my personal business. And they suck eachothers cocks all day. Cliquey old dogs.

I’m not even trying to hear what they’re saying about me. I don’t care. But they neeeeed me to know their opinion. And it’s to the point that can’t turn my headphones up loud enough. They’re condescending, they talk loud, they creep around me. It’s ridiculous.",False,f80v0a,lipitor666,https://www.reddit.com/r/antiwork/comments/f80v0a/coworkers/,6,1
242,You should not work for more than four hours day.,"Hours left at work fig

 
",True,f7lunq,BlueWoof,https://i.redd.it/362ovey4vdi41.jpg,6,1
243,Obsession With Leadership,"I work in one of worlds biggest engineering companies right, it's a massive corporate cesspool of bullshitters and people just hanging week by week to get that pay check.

What is becoming more and more apparent is this obsession with leadership, and forcing everyone in to these bullshit training on how to become a leader. Everyone is a leader...leadership...how to lead...how to become a role model... It's just pure madness on an epic scale, we are supposed to fuckin build bridges and tunnels not lead an army or whatever. Then you have these managers who buy in to this or just follow the crap to climb up the corporate ladder. They all read those books with tips how to become leader, their speeches are fucking same bland template shit with mandatory joke right on cue that feels painful to hear.

If we are all leaders...who will do the actual work then? You cannot train a leader just like you can't train someone to become Mick Jagger...you either have the carisma or not. 

So now I have to attend this leadership seminar again next month and I am already feeling sick about it, I just wanted to be an engineer. Not a fuckin corporate psycho talking business leadership lingo.

God I hate how work environment killed all my enthusiasm and passion for engineering...I just don't give a shit anymore. It's same old bullshit and clock punching excercise with a pinch of leadership.",False,f7nz4l,Trontotron,https://www.reddit.com/r/antiwork/comments/f7nz4l/obsession_with_leadership/,13,1
244,"""You live to work for me""",,False,f88tlh,KailReed,https://imgur.com/ZzThG4a,0,1
245,Anand Giridharadas - The Billionaire Election: Does the world belong to them or to us?,,False,f7jin7,pokap91,https://www.nytimes.com/2020/02/21/opinion/sunday/billionaires-inequality-2020-election.html,1,1
246,Thought this might fit here lol,,False,f8xxx9,iodinequeen,https://www.youtube.com/watch?v=YJ3BcjXKKFQ,0,1
247,there's no point of working when u don't enjoy anything,"I don't care about owning name brand items, I don't care about vacations anymore. What I understand about traveling, it's the same everywhere you go. The food is different, language and culture is different but it's not a life changing or that exciting once you traveled a bit.

There's nothing I enjoy anymore. I have no incentive to work or to chase money. Nothing makes me happy, hobbies are no longer enjoyable. sex isn't enjoyable, paying for expensive meals is no longer enjoyable, latest technology is no longer interesting. I'm so detached from materialistic things. I don't see the reason to stay alive anymore.",False,f859jv,caods,https://www.reddit.com/r/antiwork/comments/f859jv/theres_no_point_of_working_when_u_dont_enjoy/,22,1
248,"""Man begs for change but everyone keeps giving him money.""","change/

man legs for change
” but everyone

     
",True,f8rvvp,ae516,https://i.redd.it/gnqfuszdsvi41.jpg,8,1
249,How do you cope with work pulling you away from the potential you used to believe you have?,,False,f8fpuw,MassiveSwingingCock,https://www.reddit.com/r/antiwork/comments/f8fpuw/how_do_you_cope_with_work_pulling_you_away_from/,8,2
250,Work Less= better mental health?,,False,f94k7w,lvcv2020,/r/simpleliving/comments/f8tn8r/work_less_better_mental_health/,1,1
251,"""I'll pay double for your soul"" - Henry",,False,f7h18q,tobbitt,https://www.wsws.org/en/articles/2014/03/05/ford-m05.html,0,1
252,Without internet all that's left is loneliness and boredom.,,False,f7r84t,JorSum,/r/nosurf/comments/f7ilho/without_internet_all_thats_left_is_loneliness_and/,0,1
253,Without internet all that's left is loneliness and boredom.,,False,f7r7vt,JorSum,/r/nosurf/comments/f7ilho/without_internet_all_thats_left_is_loneliness_and/,0,1
254,"Boss needs a ""note"" for a family emergency (rant)","I'm a busser at a dine-in movie theater on the weekends (college student during the week). This morning I got a call saying my mom was in the hospital which is a 2 hour drive from the city I'm currently in. I called my manger to let him know I won't be able to make my shift tonight because I'm not sure how long I'd be at the hospital and the drive back would be a couple hours. First thing he says ""well you're gonna need a note proving this when you come back"" ...... I just agree and hang up. 

First of all, really? I get people make excuses to miss days, but since when do I owe my manager a damn note for an emergency? I'm a busser. 

Second, the hospital I'm in right now doesn't give us visitor passes and who do I ask for a note? The doctor? And say ""hey my boss is being a dick, and I need a note saying I'm here."" 

Third, this just pisses me off. It already annoyed me that he didn't even say ""ok I hope your mom feels better"" he immediately assumed I was lying. This is why I hate the food/service industry. This is a part-time, low paying job that I do in my spare time, not a career. If I call out, I call out. Find someone else to cover my shift. You don't need a note and I don't owe you shit. My family is more important. 

Last, they just started asking for notes from employees since one guy lied about a car accident. Now we're ALL expected to provide proof for any reason we call out. I really don't like jobs being in my personal business at all, let alone my family's. 

Smh. I see why this place makes folks quit.",False,f7jf1b,darkndarker,https://www.reddit.com/r/antiwork/comments/f7jf1b/boss_needs_a_note_for_a_family_emergency_rant/,4,1
255,If We Are Compelled to Suffer: A Nihilist Intervention for the Left and Cultural Studies - Zooey Sophia Pook,,False,f7q9u4,beinfertile,/r/antinatalism/comments/f7q96d/if_we_are_compelled_to_suffer_a_nihilist/,0,1
256,Anyone here who was treated badly at work but was begged to stay after they gave their notice?,Whats your story?,False,f7pnm7,lovesprite,https://www.reddit.com/r/antiwork/comments/f7pnm7/anyone_here_who_was_treated_badly_at_work_but_was/,2,1
257,Wage slave nearly killed me (literally),"Hi, so I'm about as anti-work as they come. Im really school smart and active at my college, so when I applied for Americorps, I got in even though only 1 in 3 applicants are hired. I dint even get through the orientation (about a month in) before I felt hopelessly overwhelmed. Even though this was going to be the best paying job I've ever had, I felt that I couldn't do it. I was already pretty depressed, so this job threw me overboard. I decided to commit suicide. My husband (bf at the time) felt that he couldn't stop me so he did it with me. Obviously we failed bc I had posted a goodbye on Tumblr, which like Reddit no one is supposed to be able to find u IRL, but someone did &amp; alerted my sister. So long story short, now I'm thrown right back into the wage slave system.",False,f7osw9,Splashlight2,https://www.reddit.com/r/antiwork/comments/f7osw9/wage_slave_nearly_killed_me_literally/,5,1
258,Do you have a poor focus at work?,,False,f7t1g4,blackupsilon,https://www.reddit.com/r/antiwork/comments/f7t1g4/do_you_have_a_poor_focus_at_work/,3,1
259,I haven’t even started my “career” and I’m already done with it.,"I just got back to the US from traveling for a month. Was able to save up enough money to just walk a trail through a country day in and day out, worrying about nothing but food, lodging, and what the weather was going to be like the next day. I lived on the bare minimum, with everything I need just on my back and in my pockets.

It was wonderful, and felt like complete freedom.

Now here I am, job searching to attempt to start my engineering career, and after my first interview I am left completely flabbergasted that I have to do this. I haven’t been this stressed out since college just because of one interview. It was terrifying by the way, being interviewed by engineering professionals while I’m just a hatched egg. I’m not ready to dedicate my life to something that mentally destroys me so much. I thought it would get better after college, but I really don’t know how I’m going to do this. 

I guess it was a bad choice experiencing how wonderful some freedom can feel BEFORE having to start slaving away at a post-graduate career, because now I’m never going to be able to sit still behind a desk and under a boss ever again.",False,f7no4x,dmcknig3,https://www.reddit.com/r/antiwork/comments/f7no4x/i_havent_even_started_my_career_and_im_already/,9,1
260,MUH JOB CREATION,"People who dismiss the unemployed
and dependent as ""parasites"" fail to
understand economics and parasitic.
A successful parasite is one that is not
recognized by its host, one that can
make its host work for it without
appearing as a burden. Such is the
ruling class in a capitalist society.

 
 
   

— Mason Head
",True,f7ovaj,-Pre_,https://i.redd.it/6a3tkfxrhei41.jpg,4,1
261,Autocorrect Strikes Again!,,False,f7wcuy,AbolishWork,https://twitter.com/pilau/status/1230894451796725760?s=20,0,1
262,Autocorrect Strikes Again!,"&amp;#x200B;

    &lt;blockquote  class=""twitter-tweet""&gt;&lt;p lang=""en"" dir=""ltr""&gt;boss: care to  explain the text I got last night?&lt;br&gt;&lt;br&gt;me: omg I’m so  embarrassed, it was autocorrect &lt;br&gt;&lt;br&gt;boss: autocorrect  wrote “fuck you and you’re stupid job”?&lt;br&gt;&lt;br&gt;me: yeah it’s  supposed to say your&lt;/p&gt;&amp;mdash; tom (@pilau) &lt;a  href=""https://twitter.com/pilau/status/1230894451796725760?ref_src=twsrc%5Etfw""&gt;February  21, 2020&lt;/a&gt;&lt;/blockquote&gt; &lt;script async src=""https://platform.twitter.com/widgets.js""  charset=""utf-8""&gt;&lt;/script&gt;",False,f7w8uz,AbolishWork,https://www.reddit.com/r/antiwork/comments/f7w8uz/autocorrect_strikes_again/,0,1
263,Can I not be a wage-slave?,"He: ""An I have an extra $1.25 an hour
just to meet my basic needs for survival?""

By boss:

 
",True,f8lm84,quavokareem,https://i.redd.it/bpk2w6ra0ri41.png,2,1
264,Work and money is the main reason I don’t want kids,"Work and money is the main reason Why I don’t want kids. It’s not that I don’t want to be domestic it’s that I can’t afford to and expecting parents, especially the mother to be superwoman at work and home isn’t fair or healthy.

A lot of millennial women are choosing not to have kids and many of us say “Oh I prefer to choose my career” but that really is a professionally and socially acceptable way of saying “I will never have enough wealth and security to afford the support needed to take care of home and children properly. I will never be able to enjoy a maternity leave without knowing my pregnancy might get me laid off (creatively of course, they’ll state another reason) or skipped over for promotions and pay increases.”

And further more, as a wage slave, I believe whole heartedly it is a sin to create another. I can’t see myself working full time to 75 which is when many of us will be working until if not longer. Most of the people I know who had kids my age or younger are not properly ensured and won’t be able to maintain life insurance after a job lose. If anything happens to one of the parents then the family is really up shit’s creek. So many millennials men and women have suicide in the back of their minds. Maybe they want to wait until after their own parents pass. Maybe they are waiting to see how something career or relationship wise plays out. I think this is also another reason many of us don’t want kids. It ruins the exit strategy. 

Our government (U.S.) doesn’t care about our well being or wealth when it comes to abortion laws. They only care about having enough slaves.",False,f7k7u0,Magicpaper2018,https://www.reddit.com/r/antiwork/comments/f7k7u0/work_and_money_is_the_main_reason_i_dont_want_kids/,14,1
265,I think this sign on the boss's door says it all," 
",True,f8wj38,Literally_A_Vampire,https://i.redd.it/1feqbsreaxi41.jpg,2,1
266,What are the options?,"What are some realistic, or semi-realistic, options for avoiding work and living at least a basic existence in the modern world? Do you have a source of income (or all needed goods and services) that is low-stress and gives you plenty of free time?

Here's what I've done: I'm a night front desk worker at a 2 star motel. I've had two other similar jobs, one as another night audit and also at a 24 hour gym. They have all been very easy, relaxed jobs with minimal interference from management where I can bring my laptop or a book and spend most of the time just doing whatever as long as I'm at the front desk. While none of them have paid well, they haven't made me want to kill myself either, unlike the other low-wage jobs I've had. Also, relatively easy to get without experience.

So, what other ideas are there for things like passive income, jobs with minimal input, etc.?",False,f8gb2w,anunexpectedturnip,https://www.reddit.com/r/antiwork/comments/f8gb2w/what_are_the_options/,10,2
267,Petition airlines to seat families together without charging extra,,False,f8uxga,mg18_2020,https://www.usatoday.com/story/travel/airline-news/2020/02/24/american-delta-united-airline-family-seating-consumer-reports-starts-petition/4823602002/,5,1
268,Commuting to work is a scam.,,False,f86dxw,Karnami,/r/uberdrivers/comments/f7yzdv/the_amount_of_people_using_rideshare_to_get_to/,4,1
269,This sign on my boss's door says it all," 
",True,f8wror,Literally_A_Vampire,https://i.redd.it/0cbl0f52dxi41.jpg,2,1
270,"""They took a risk"" is not a coherent justification for hierarchy.",,False,f8k5jf,sensuallyprimitive,/r/CapitalismVSocialism/comments/f8ic74/they_took_a_risk_is_not_a_coherent_justification/,3,1
271,"poor people, why haven't you killed urself?",my life isn't going to change. it hasn't changed and it never will. It's just not possible to find a decent job now days.,False,f8q8ip,caods,https://www.reddit.com/r/antiwork/comments/f8q8ip/poor_people_why_havent_you_killed_urself/,13,1
272,"Meanwhile at Bob’s Red Mill, retiring founder Bob Moore transfers ownership of business to his employees",,False,f8kr71,leavingNYCforwhere,https://www.oregonlive.com/clackamascounty/2010/02/bobs_red_mill_natural_foods_ro.html?fbclid=IwAR0NF81Kfm6gn0n8H0lffQit3rl-stSuY5pwDAPYP-AW_GuK52T4cA0_5L8,7,1
273,"Wait, are you guys getting paid?","He: ""An | have an extra $1.25 an hour
just to meet my basic needs for survival?""

By boss:

 
",True,f8rgy8,lrlOurPresident,https://i.redd.it/6g4f2nmxkvi41.png,0,1
274,So I was wanting to do some research on unions within franchise companies and I stumbled upon this article.,,False,f8cdbf,WTB_Death,https://www.usnews.com/opinion/economic-intelligence/2015/01/13/labor-unions-take-aim-at-franchise-model,5,1
275,What are your favorite activities to do?,What are your favorite activities to do outside of work? Let’s get a discussion going about activities that we enjoy doing.,False,f8wi8j,GenerationFreedom,https://www.reddit.com/r/antiwork/comments/f8wi8j/what_are_your_favorite_activities_to_do/,11,1
276,What would you do if you suddenly had lots of money?,"Genuine question, for example if you won the lottery, or not even that, it's only hypothetical. Of course you'd quit work, but would you use it for anything in particular? I agree with this sub's ideology btw. I think we live in a fucked up, robotic system.",False,f9i4j8,Boingo0220,https://www.reddit.com/r/antiwork/comments/f9i4j8/what_would_you_do_if_you_suddenly_had_lots_of/,14,1
277,This. This is why companies suck.,,False,f980wz,neo_neo_neo_96,/r/TrueOffMyChest/comments/f8ybm6/my_wife_went_into_active_labor_and_i_lost_my_job/,8,1
278,Starbucks making an example out of this person.,,False,f9fd33,TheHoneySacrifice,https://www.theguardian.com/business/2020/feb/25/starbucks-worker-labor-unions-organizing,3,1
279,I need the money but not the mental anguish being at work any longer does to me,,False,f981im,KailReed,https://imgur.com/v3r3GQt,3,1
280,Just go home,,False,f98z79,elizadi,https://gfycat.com/cornyspectacularblackfly,21,1
281,Either way I don't have to go to work,"22) r/AskReddit
far” u/TheBeastBoud «
a He

AYYfolU] To MVolUM c-1,(-e- of 0)hold Her al-pale-e-) 1
$5,000,000 or death? Why or why
salol to

® 573k % @ 14.k it, Share
if) TOP COMMENTS ©

whurpurgis « oh

@ of & #3 15 Wards

Yeah. Either way | don't have to go to work
tomorrow.

* Reply #4 53.k
",True,f8lr0b,PM_ME_YOUR_TUTURUS,https://i.redd.it/tdc1jt2ftsi41.jpg,14,1
282,PRoOf THaT CAPitALIsTs Are jOB CreAtOrS. LOoK At Him puLlinG HimSElf Up by his BoOTSTrApS. LEt ThIs be AN examPLe to ALL. tHAt ChILD WOuLd oTHErwiSe BE stARving. TRiCkle Down IS WorKinG aS iNtendeD.,,False,f9cmpp,YuriRedFox6969,https://imgur.com/PP2Muj7,2,1
283,Sick of being called lazy and entitled,"I'm so sick of being told I need to stop being lazy or that I have an unearned sense of entitlement. Just because I hate working to make other people rich. 

I am 34 and have held atleast one job since I was 15.  Why is it so hard to understand that I just hate doing work that a robot could do? I want to feel like my work means something and I'm sure I'm not alone here when I say that if I quit my job right now the only people who would care are my family and the poor guy that has to pick up the hours I used to work. Then on the rare occasions that I make sense to someone it's ALWAYS  the same thing. 

""So why not just get a new job?"" 

Maybe because it's all the same shit. Anything that would make me feel meaningful to society won't pay enough or won't hire me because I don't have an education or background in that area of work. 

""So go back school"" is what anyone who's made it this far in a conversation with me says. 

Ok when? I work 12 hours 5 days a week. Day 6 I sleep most of it. Day 7 I spend with my family so my kids can actually know their father. 

Nobody can give me an answer, because there isn't one. And the entitlement conversation pisses me off the most. 

""You and your generation have this false sense of entitlement.""

 What do you mean??? Am I not entitled to have any joy in my life? Am I not entitled to want to spend time with my family? Am I not entitled to actually want to do work that I like doing instead of mind numbingly repetitive horseshit? I don't have a problem with working I have a problem with working for someone who

 A. Is already far more wealthy than me. 

B. Doesn't give a shit about me, my coworkers, or anything other than their own profits so that that they can actually live the life the rest of us dream of. 

No its not me and my generation that are entitled, it's the people who are at the top and have always been there trying to keep the rest of us down. 

""Oh come on now CEOs and big business owners have had to work hard to get there.""

 Have they? Is delegating other people to do the actual work for you hard work? 

Anyway I'm sorry for the ranting wall of text but I desperately need to get that out there and this seemed like the best place for it.",False,f84ah2,ShabbyPath,https://www.reddit.com/r/antiwork/comments/f84ah2/sick_of_being_called_lazy_and_entitled/,48,1
284,Steve Harvey joins Anti-Work,,False,f9glfv,BanDerUh,https://www.youtube.com/watch?v=osyMna3cbjM,0,1
285,Second day on a new job and my boss (owner of company has had a go at me 3 times).,Fuuuuuuuck this! You can’t hold on can’t behaviour for a week and I’m outta here.,False,f99lcz,The_Talking_Mags,https://www.reddit.com/r/antiwork/comments/f99lcz/second_day_on_a_new_job_and_my_boss_owner_of/,10,1
286,“Cure” for a tough workweek,"To anyone that says the cure is “more social interaction and planning fun activities for yourself on the weekend,” my answer is this: Why. Why tf would I subject myself to more planning and more work just so I can enjoy my time away from work? 

Fuck that. Maybe life would be easier if I could just rip out the conscious part of my being and live life as a wage automaton.",False,f98g6k,complain_about_work,https://www.reddit.com/r/antiwork/comments/f98g6k/cure_for_a_tough_workweek/,4,1
287,Government Jobs,"A few times I have seen people bring up switching to government work to get away from making money for someone else, so I thought I'd share my experience being in the public sector.  Based on what I've read on this sub, there are a few things that government jobs certainly do better.  We have a union that regularly increases our wages and protects our benefits/insurance.  You cannot be asked to stay late or work on days that you are not scheduled.  It's a different environment when the goal isn't to make a profit.

However, there are still plenty of problems.  If you work at a desk, you are given the most uncomfortable workspace you could imagine.  They're generic setup can't be adjusted enough to suit anybody, and as a result people are always getting injuries.  You can ask to get replacements that fit you better, but not until the pain has already set in.  Even when you do ask for a replacement, it could be months before you get your new equipment.  The schedules are also extremely rigid.  You can never leave early, even if you have absolutely nothing to do, because it is ""not giving taxpayers what they paid for.""  Some days, you can sit there for 8 hours with nothing to do but watch the clock.  In addition to that, you have to constantly keep up your image because it would look bad to the taxpayers.  So have fun fake working for a few hours because there isn't anything for you to work on.

Ranting aside, a government job is still a job.  You will be wasting your life away sitting in traffic, sitting in an office, sitting in traffic, sleeping, and repeating.",False,f8nc7m,Senderender,https://www.reddit.com/r/antiwork/comments/f8nc7m/government_jobs/,14,1
288,Why isn’t the weekend longer?,,False,f8ly94,AlpacaLoco,https://www.economist.com/the-economist-explains/2018/09/21/why-the-weekend-isnt-longer?utm_source=LinkedIn&amp;utm_medium=Economist_Films&amp;utm_campaign=Link_Description&amp;utm_term=SocialIssues&amp;utm_content=Whytheweekendisn%27tlonger_Databite&amp;linkId=100000010608277,13,1
289,Quit my job,I quit my job by just not going today. Time to find a job I hate just as much.,False,f7vkfz,blacklightjesus_,https://www.reddit.com/r/antiwork/comments/f7vkfz/quit_my_job/,7,1
290,A Train Conductor Fired for Posting Sexy Photos Just Won Her Lawsuit,,False,f7ym5u,WinterTrabex,https://www.vice.com/en_ca/article/wxep5z/a-train-conductor-fired-for-posting-sexy-photos-just-won-her-lawsuit,5,1
