,title,body,is_image,id,author,url,num_comments,num_upvotes
182,I don't give a fuck about work ethic and I cheat the system every time I can,"I originally posted this on the confession sub but I think it fits better here


TL;DR I don't feel any bad about cheating but being around passionless drones seems to be bad to my wellbeing. I'm not from the USA.

I work in HR I'm a recruiter/administrative. My CV says that's I have 3 years of experience, all a lie, well, technically now I have 8 months of experience. I'm very good at faking it in the interview and in my CV, I only need maximum 2 weeks to get a new job. My degree is a easy but very creative trick. I went to university but for a very different degree.

I've fired 4 times this year, either because I stopped caring to pretend that I do the bare minimum or because management caught me before. I spend not more than 2 months in every job. I don't give a flying fuck about my job or anything related to it, at the beginning it was fun to watch how most of my coworkers cared too much about their ""bullshit"" job while I just chilled and said fuck it. But now is starting to be a burden; seeing how my coworkers don't have a life of their own, seeing how they are just drones that think that their bullshit job is appreciated outside of their meaningless circle of ""human resources bullshit"" now it seems an insult to life, an insult to living a life that is worth living.

Those bullshit jobs are just a stepping stone to me, I only need a little more money (2 months more) to invest and then I'm going to stop working full time, I'm going to use most of time on my personal projects and maybe in some eventual part time jobs. Being a bartender seems interesting. I do this kind of jobs because they are easy to get and I can slack most of the time. Getting a job related to my degree might take more time and maybe I will have to work seriously.

Have you received one of those annoying calls where someone try to sell you some garbage that you don't need and you clearly see how what they are selling is garbage and they are just waiting to get someone dumb enough to buy their garbage? I'm in the HR department in charge of this kind of positions. My coworkers think that finding someone desperate enough to take this kind of disgusting job is somehow and important duty.

I don't feel bad about cheating to get a job, I'm proud of finding holes in any kind of system and exploit them to my benefit (...and hoo boy, I've exploited a lot of different holes). But being around passionless drones seems to be bad to my wellbeing.",False,biscly,The_Pimp_Arcana,https://www.reddit.com/r/antiwork/comments/biscly/i_dont_give_a_fuck_about_work_ethic_and_i_cheat/,15,85
183,Posted at my minimum wage retail job where I only get 16 hours a week. But ya dude I’ll be sure to bring more passion /s.," 
",True,bg50ob,DonutsAreEthnicFood,https://i.redd.it/hbzuqfcsrut21.jpg,87,432
184,What advice would you give to 18 year old you?,,False,bhexhy,Verstappen3363,https://www.reddit.com/r/antiwork/comments/bhexhy/what_advice_would_you_give_to_18_year_old_you/,27,6
185,And you pay meticulously kept taxes why?,,False,bfbq7l,Twysted_Irish,https://www.mintpressnews.com/audit-pentagon-cannot-account-6-5-trillion-dollars-taxpayer-money/219246/?fbclid=IwAR199FBvTjWoaGiUmlfoOiD_ngek4PrX6SF5-wUozJp9OTVB_ygVqM_1sTk#.XLZ5gU1-vPF.facebook,9,0
186,I'm young but want to quit working forever,"In my early 20s working in Japan. All I see are old, worn out faces of workers, both men and women who are stuck in a culture of overtime and hard work every day. 
I still only work 40 hours at most a week, some days more like 6 or 7, but I'm done with it. I've lost all the time I had to focus on my own life, instead it's all for the sake of my job and obligations. 
So many things get pushed to the side since I dont have time to sort any of it out.

Once my contract is up or I get fired I'm just moving back home and not working. I'll either make money for myself or just not spend hardly any. 

I've thought about it a lot as I've been working the past several months; it's in no way worth it to sacrifice most of your day almost everyday for the sake of work and money. 

I don't care if I'm poor or seen as lazy to others, I'm gonna spend the short life I have focusing on my mental and physical health and wellbeing, work is something I'll do for my own sake by my own accord.",False,bhkbad,Syflan,https://www.reddit.com/r/antiwork/comments/bhkbad/im_young_but_want_to_quit_working_forever/,90,425
187,How many of you feel suicidal about the idea of having to work?,"Just a thought that got trough my mind about this subreddit lately. I see many of you are desilusional about your future and your life, describing it as ""numb"" or ""dull"" in  a lot of posts. 

I honestly feel a bit suicidal when i think about that sometimes. I mean, giving away my life and energy to shitty jobs so my boss can buy a new sports car in the end of the year doesn't seem like a very good deal.

Sometimes i think there's nothing worth enough to live for, if all my days are going to be like that. What are your thoughts about this subject? What do you feel?",False,biqzqm,gasmaskgopnik,https://www.reddit.com/r/antiwork/comments/biqzqm/how_many_of_you_feel_suicidal_about_the_idea_of/,154,27
188,And so it begins...,,False,bakg4y,Flurman,https://www.theguardian.com/technology/2019/apr/07/uk-businesses-using-artifical-intelligence-to-monitor-staff-activity,8,17
189,"A man chooses, a slave obeys.",That is all,False,ban6fg,GeorgeTheMonkeyMan,https://www.reddit.com/r/antiwork/comments/ban6fg/a_man_chooses_a_slave_obeys/,1,0
190,"""It is a civilization of noise, smoke, smells, and crowds of people content to live amidst the throbbing of its machines""","It is a civilization of noise, smoke, smells, and crowds of people content to live amidst the throbbing of its machines; the smoke and smells of its factories; the crowds and the discomforts of the cities of which it proudly boasts. 

The places in which the people work are noisy. The factories are filled with the recurring, though not the rhythmic, noises of machines and the crash and clatter incidental to their operation. The offices, too, are noisy with the rat-tat-tat of typewriters, the ringing of telephones, the grinding of adding machines. The streets on which the people move about, and around which they work and play, resound with the unending clatter of traffic - the roar of motors, the squeaks of brakes, the shrieks of sirens, and the banging of street cars. And even the homes in which they are supposed to rest are noisy because they are not only packed close together but built tier on tier so that the pianos, phonographs, and radios in them blare incongruously above, below, and on all sides of them. 

The people of this factory dominated civilization accept its noisiness. For noise is the audible evidence of their prowess; the inescapable accompaniment of their civilization's progress. The greater the noise, the greater the civilization. Above all, this civilization is ugly because of the subtle hypocrisy with which it persuades the people to engage in the factory production of creature comforts while imposing conditions which destroy their capacity for enjoying them. With one hand it gives comforts - with the other hand it takes comfort itself away. 

The servitude to the factory which it enforces uniformly upon all men harnesses skilled workers and creative individuals in a repetitive treadmill which makes each muscle in their bodies, every drop of blood in their veins, the very fibres of their being, cry out in voiceless agony that they are being made to murder time - the irreplaceable stuff of which life itself is composed. For America is a respecter of things only, and time, why, time is only something to be killed or butchered into things which can be bought and sold.

 • Ralph Borsodi, 1929",False,bap6xb,svetambara,https://www.reddit.com/r/antiwork/comments/bap6xb/it_is_a_civilization_of_noise_smoke_smells_and/,1,20
191,Changed jobs 3 times during my 8 year career - interviewer said a job hop too much.,"Ok, so this is more of a rant than anything, but certain notions in the head of HR interviewers are getting ridiculous. 

I don't get this notion that we have to be loyal to a certain company for no good reason. It is obvious that if a company pays their employees well enough and provide a good work environment, they won't be changing jobs. But usually they don't do neither.

Of course, I can see why it would be convenient for companies if employees just stuck working with them ignoring the job market, but it is not fair when they will 100% fire you in less than a month's notice if you don't perform or behave according to their expectations. 

This kind of thing is one important factor why most office workers are so unhappy - they are literally chained to their jobs as later it will be frowned upon at interviews if they just decide to quit or if they change jobs frequently. 

I'm absolute sure I'd be more happy if I could work for, say, two years, quit my job, travel for six months and then work two years more &amp; repeat this ad infinitum. But the way things are (at least in my industry) I'd simply become unemployable.",False,bbzb5n,c4vitesse,https://www.reddit.com/r/antiwork/comments/bbzb5n/changed_jobs_3_times_during_my_8_year_career/,0,1
192,"""I'M NOT YOUR SLAVE, YOU BASTARD!"" (PT-BR audio, translation and explanation in the comments section)",,False,bbgmb5,korrakas,https://v.redd.it/721f0n74var21,2,13
193,How Tesla and its doctor made sure injured employees didn’t get workers’ comp,,False,bccaym,The_Ebb_and_Flow,https://www.revealnews.org/article/how-tesla-and-its-doctor-made-sure-injured-employees-didnt-get-workers-comp/,1,17
194,Yet another motivating and highly fulfilling week comes to an end!!!!,"I already despise my job enough as it is but usually it's enough work to make the days go by. 

This week however....

Nothing. 

Just strapped to my desk and chair literally counting the clock until I can fuck off.",False,bcit19,anon17543,https://www.reddit.com/r/antiwork/comments/bcit19/yet_another_motivating_and_highly_fulfilling_week/,2,12
195,Happiness is Mandatory,"Existential Topics @existentialcoms - oh
The demand that you must be passionate about your job just means that not
“Z only do you have to obey and do the job, but you have to mentally obey — you

have to buy in. Capitalism is now trying to make sure you have the right set of
[To [-F- (a) ce (-in Old of- = 10) (COM 0) He

© 40 t) 500 @ 1.Of in)
",True,bcjld4,SenpaiStirner,https://i.redd.it/winossmxqwr21.png,2,53
196,Restaurant closes from 3pm-4:30pm every day so the staff can eat together,"There is this Korean restaurant that I love to eat at nearby my workplace.  The problem is, they're always closed whenever I am free to go there.  When I finally got there one day (2:30pm) before they closed, the full Asian staff would gather around the table and eat and shoot the shit for 1 1/2 hours while finishing up with the rest of their guests.  

I wasn't even mad at them.  It might disappoint me that I can't enjoy their restaurant due to their weird hours, but my hate for this capitalistic society far exceeds their need to relax.  More props to them.",False,bdlvah,CreativeThought88,https://www.reddit.com/r/antiwork/comments/bdlvah/restaurant_closes_from_3pm430pm_every_day_so_the/,9,38
197,What can Ahold-Delhaize afford?," 

That An Stop &
Shop Afford?

Were's what we know about Hold Delhaize,
Stop & Shop's parent company:

Tax Breaks Over 2 Years $507.1 million
Profits in 2018 $2 billion
Approved Share

Buybacks in 2019 $1.1 billion

of Operations Met Tales
2018 $44 billion

Dividend Layout to
Shareholder in last decade $5.2 billion

bit.ly/supportSSworkers

 
",True,bdksxk,WinterTrabex,https://i.redd.it/ry4rvv56jhs21.png,0,10
198,Politely tell my boss ‘as a cheap labour worker I don’t see a single benefit to working non-paid hours in research to be better at my paid hours’ ?,"Bartender, been working with this guy for 12 weeks and I got an angry tone last week saying I must be better and show why I prefer working in the bar (as opposed to waitressing or barback) and learn all the 79 cocktails. 

I must know 20, and I’m quite the no complains, always there worker, definitely always 5 minutes late, on the clock, but never ask for a break regardless of working 5,7, or 10 hours and when asked to cover a shift at another establishment, I do without asking questions. Would say I’m a pretty solid employee, who also happens to work on a minimum wage, also “I dont owe you any hours” scheme. Its cool, I study during the week and I need the money but me being better at my job makes him, the people above him, and the owners, happy. They make more money, I never do. I like this job because it’s close to home but I really won’t spend my non paid hours memorising drinks to be better at a job that makes me overworked, stressed, and caused a shoulder injury I still haven’t recovered from. Any tips?",False,bbj88k,acherryonyourdesk,https://www.reddit.com/r/antiwork/comments/bbj88k/politely_tell_my_boss_as_a_cheap_labour_worker_i/,5,14
199,Is there any hope I will one day find a job that I will actually like?,,False,bdsnzp,sutrauboju,https://www.reddit.com/r/antiwork/comments/bdsnzp/is_there_any_hope_i_will_one_day_find_a_job_that/,5,1
200,Job Interview (I made a weeird video),"&amp;#x200B;

![video](xelkkzpqoms21 ""Job Interview (realistic)"")

I'm not sure why but I created a (very weird &amp; short) video about the Kafkaesque nature of job interviews. Here's the [link to my new channel](https://www.youtube.com/channel/UC8DjxDxs_NY3sBIpZaTEAuw) with more crazy stuff to come.

&amp;#x200B;

Cheers!",False,bdtynk,realrentner,https://www.reddit.com/r/antiwork/comments/bdtynk/job_interview_i_made_a_weeird_video/,0,2
201,Hitch Hiker's Guide to the Galaxy got it right,"""On earth, man thought he was much smarter than dolphins because he had achieved so much - fire, the wheel, New York City, wars, and so on - while all the dolphins had done was muck about in the water having a good time. Conversely, the dolphins believed that they were smarter for exactly the same reasons.""",False,bdjuk6,Sehtriom,https://www.reddit.com/r/antiwork/comments/bdjuk6/hitch_hikers_guide_to_the_galaxy_got_it_right/,4,76
202,RIP," 

“ WHOSOE VER BELIEVES THAT MAN SHOULD WORK AND EXHAUST HIMSELF
ALL DAY of 'PROVE HIS WORTH' of A FOOL. of FAILS of RECOGNIZE THAT,
WHERE THERE of _ VALUE of WORK, THERE of ALSO VALUE of LAZINESS.
THROUGH RELAXATION, THE WORKING MAN MAY FIND PEACE AND COMFORT,
AND THOUGH THIS NEED NOT of ETERNAL, of SETS THE STAGE FOR HIM of

FIND SOMETHING EVEN GREATER: HIMSELF.""
of (0) =) =) |= on By
",True,bdzb49,GloomyFeature,https://i.redd.it/aouqmizpzos21.jpg,7,175
203,My problem with work is not work itself but having to wake up early and commute in.,"When I worked 11-7, I was very happy....",False,bcqfrj,CarolSwanson,https://www.reddit.com/r/antiwork/comments/bcqfrj/my_problem_with_work_is_not_work_itself_but/,23,15
204,Happiness This Way (from Steve Cutts 'Happiness' short film)," 
",True,bdf8nb,bm96,https://i.redd.it/xnbx90526fs21.jpg,4,93
205,Telltale co-founder says crunch was necessary to keep studio afloat,,False,bdclwl,The_Ebb_and_Flow,https://www.pcgamer.com/telltale-co-founder-crunch-was-necessary-to-keep-studio-afloat/,0,1
206,More than half of Americans say they didn’t get a pay raise this year,,False,bb8800,cadehalada,https://www.marketwatch.com/story/the-majority-of-americans-did-not-get-a-pay-raise-this-year-2018-12-12,3,10
207,Films about work,"I had the joy of watching Look &amp; See last night, a docu-film about author Wendell Berry and the industrialisation of farming in Kentucky and the US as a whole. A very interesting film which I can highly recommend (people in America: see Netflix).

The film scratches the surface of the joy of working for one's self, of how industrialisation has made debt-slaves of many people that once loved their work so much and how that has, in turn, crippled communities and destroyed lives in the mismanaged name of ""progress"". It's also beautifully shot.

Now, interestingly, this doesn't really cover ""anti work"" and is kind of more ""Pro-work"", though more for loving the work you do, which I feel is an important tangent to the discussion. 

Do you have any films you've seen that have really influenced your philosophy on work?",False,bco8zj,Craigj0812,https://www.reddit.com/r/antiwork/comments/bco8zj/films_about_work/,2,5
208,I'm tired of people being fed nonsense about college and the role that it has on their lives,"Society harasses people into going to college and honestly I'm sick of it.  High school students always hear this nonsense from their ""guidance"" counselors and parents about how they need to go to college after they graduate.  They just promote it like it's the end-all to all the troubles in life.  These kids are being fed BS.  When I was a freshman in high school, instead of being mislead for 4 years by the assumption that I needed to go to college right away, I much rather would have had someone telling me to take a gap year to figure out what I wanted to do with myself. 


As someone who has spent the past 5 and a half regretful years in college, the best advice that I can give to anyone younger than me is to take a year off after high school and to do some serious introspection.  Figure out who you really are, what you want your life to look like, what you're good at, and what going to college really means. Don't let society, your friends, or even your parents harass or guilt trip you into going to college.  What nobody tells you is the following:


**1.) Nobody is going to be helping to pay off your student loans.  And thanks to predatory practices, you'll be paying them off until you die.**




**2.) Nobody tells you about how more than half of your college experience is a repeat of high school courses that you don't need.**




**3.) Nobody tells you how it physically, mentally, and emotionally feels to be a holder of debt.**




**4.) Nobody tells you how even after wasting your mind, body, and soul on degree, that you're not entitled to any job opportunities or a sustainable living.**




I cannot stress enough, if you have a skill that will allow you to operate outside the norms of this system, please find it and hone it.  This isn't a post telling people not to go to college, this is a post telling people not to let society guide that decision for them without considering their options first.  There's too many people who think they need degrees when all they really need is their individuality and creativity.  You don't need a degree to highlight pre-existing talents, you just need to find them.




",False,bar12p,JediKnightKeylo,https://www.reddit.com/r/antiwork/comments/bar12p/im_tired_of_people_being_fed_nonsense_about/,19,56
209,Who knew? Overwork is bad for the poor capitalist!,"The Guardian: Longer working hours do not mean higher profits, say economists.
https://www.theguardian.com/money/2019/apr/15/longer-working-hours-do-not-mean-higher-profits-say-economists",False,bdnlka,commiejehu,https://www.reddit.com/r/antiwork/comments/bdnlka/who_knew_overwork_is_bad_for_the_poor_capitalist/,9,54
210,"I'm 47, been working since graduation at 22...still fucking hate work","Yes, after 25 years, three career changes, re-training up the wazoo and two Masters, I can still, hand on heart, say that working sucks donkey balls. The earliest I can get out of this hell will be 60 if I'm lucky...You can't begin to imagine the resentment and anger I feel about how this damn system has eaten up the best years of my life.",False,bdddh4,RexMortisRexVitae,https://www.reddit.com/r/antiwork/comments/bdddh4/im_47_been_working_since_graduation_at_22still/,18,68
211,Free Talk Friday,Rant and vent thread + discussion thread.,False,bcdx30,onedayitwillbedaisy,https://www.reddit.com/r/antiwork/comments/bcdx30/free_talk_friday/,43,7
212,Keynes biographer: Economists committed to scarcity and wage slavery,"Project Syndicate: The Good Life After Work | by Robert Skidelsky.
https://www.project-syndicate.org/commentary/managing-automation-intelligent-definition-of-wellbeing-by-robert-skidelsky-2019-04",False,bdx10t,commiejehu,https://www.reddit.com/r/antiwork/comments/bdx10t/keynes_biographer_economists_committed_to/,2,3
213,*Sunday dread intensifies*,"BIZARRO.COM Facebook.com/BizarroComice List Y Mind fares

I got into the human world to find
purpose, but this whole thing i¢ just
an elaborate version of fetch.

 

 

 
",True,bczfqi,Shadows-of-Hiroshima,https://i.redd.it/85rxlzr0v5s21.jpg,8,347
214,Im 17 and feel 40 because of work.,"I have been balancing work amd highschool for the last year. I don't mind my job at all. I wash dishes at a restaurant and I'm being promoted to back up cheif next week and that means i have to wake up 2 hours earlier on weekends. I'm excited for the training I guess but I have this sense of impending doom. I have a decent GPA and my parents are pressuring me to do good at school and keep a job so i can pay for my gas amd car insurance. I feel like im spread thin and i might be stuck flipping burgers(not that cookimg for a living is a bad thing) instead getting to go to a good college. I'm also worried that i might fail the SAT's because i have no time to study without giving up some hobbies. Also im feeling physically weaker with more aches and pain, ive been having trouble sleeping for the last month and a half, and i think my anxiety is getting worse. I guess this was more of a rant than anything i was just wondering if any of you have been in or are currently in a similar situatuon.",False,be140k,granakthefighter,https://www.reddit.com/r/antiwork/comments/be140k/im_17_and_feel_40_because_of_work/,4,10
215,"French Article, but I thought this sub would like this : ''Man walks 259 miles to candidate for Nike, gets rejected anyway'' made me sad and cynical at the same time.",,False,bbltgd,caramelbeurresaley,http://m.leparisien.fr/economie/emploi/il-parcourt-418-km-pour-postuler-chez-nike-qui-le-recale-09-04-2019-8049936.php,5,3
216,Fuck Jobs... I'm going to do my own thing,"I allowed life to screw me over. I bought into the whole going to college and accumulating degrees for promises of getting good jobs. So far I've worked five jobs and they all sucked. College was a scam!

I quit my job back in February. Not sure where my life is going but I wont lose hope. I'll find a better way to make money for myself instead of working for someone else. Wish me luck!",False,bbr9lm,BlueThoth,https://www.reddit.com/r/antiwork/comments/bbr9lm/fuck_jobs_im_going_to_do_my_own_thing/,27,76
