,title,body,is_image,id,author,url,num_comments,num_upvotes
0,Have to quit my bullshit job,"I have posted about my job before. I really dislike it, I’m a glorified administrator working on a military base. 

Before the base closed, my line manager (a military officer and all round dickhead) said I am in stage one of the formal disciplinary process as he is concerned I’m not working my full time hours. Nor do I have the formal qualification for the job. A boring health and safety certification. So why hire me then idiots? I never pretended to have the qualification but they’ve decided I need it. 

As I don’t want to be dismissed after their little kangaroo court, I resigned and turned in my 4 weeks notice on the spot which he looked really surprised at. 

The kicker is, he said my work is of very high quality. I spend 90% of my time at work reading my Kindle, playing games on my iPad or browsing the Internet. Sure I take long lunches and I don’t have any timesheet or anything to track my hours. 

Fuck it. I hated that pointless job anyway. The salary was pretty good though.",False,bgg727,QueenMangoPolarBear,https://www.reddit.com/r/antiwork/comments/bgg727/have_to_quit_my_bullshit_job/,9,43
1,Universal Basic Income — the Ontario story,,False,bghsv8,ericgj,https://winvisibleblog.wordpress.com/2019/04/23/universal-basic-income-the-ontario-story/,0,10
2,[Discussion] I quit my job after one day of work.,"Hey everyone. I am really curious to know How many hours a week do you work? 
I accepted a job that was 1 hour away (each way) for pretty good money. But I’d be working 5 10 hour days of physical manual labor (and half saturdays!). A part of me feels guilty but it was so hard! Leaving at 6 am and coming home at 630pm still having to make dinner and prepare for the next day. Id never see my family as I would be in bed at 9.

It was too much. I was on my feet all day landscaping.  My co workers were so happy to work 50 hr weeks-it’s just....so sad! Do you not have a family or hobbies? Others would call it laziness....but I am too young to work my life away while my body and health are in good shape. I want to walk in the parks, garden, do things FOR ME!

Just...what the hell happened to a 40 hr work week. My spouse is also working just as much. No wonder people get divorced!",False,bghdib,yayabrazie,https://www.reddit.com/r/antiwork/comments/bghdib/discussion_i_quit_my_job_after_one_day_of_work/,56,190
3,Do you discuss work with with your significant other?,"My wife and I usually talk about our days when we get back home from work. We both think that it's good to know how your partner's day went. Over the years, however, we can go through periods of time where work was too much to bear, and we tell each other to not even ask about it. We've lived it, and don't want to spend time talking about it. 

I'm conflicted on how to feel about this. On the one hand, when work has particularly sucked that day, the last thing I want to do is talk about it, but on the other, if I can't talk about it, have I given work too much power over me?

Anyone else go through this?",False,bgfj5x,Gilead_1999,https://www.reddit.com/r/antiwork/comments/bgfj5x/do_you_discuss_work_with_with_your_significant/,11,20
4,"As a dishwasher, fuck Easter.",Faster day had to for 5 to 2 without breaks. Now I gotta work 9 to 7 (probably won't get out for much later). Fuck my life. Just want to ctb 🙃🔫,False,bfoiwk,SnowHunter9000,https://www.reddit.com/r/antiwork/comments/bfoiwk/as_a_dishwasher_fuck_easter/,7,51
5,"As we all know food, heat, houses, phones, cars, gasoline, electricity, etc. Are all magically generated for free out of nothing, and therefore we all have the right to be lazy fucks and sit on our asses all day.",,False,bgv59r,AntifaAreFascists,https://www.reddit.com/r/antiwork/comments/bgv59r/as_we_all_know_food_heat_houses_phones_cars/,34,0
6,Moving to cheap countries with savings?,"I'm becoming more and more drawn to the idea of moving to countries where one can live for around £250 a month all in, I've got some savings which could last me at least a few years at that amount. I like the idea of leaving the rat race, and just moving around cheap countries for a month here, few months there...etc. And when my money runs out, I could just move back home to save up and do it again?

Does anyone have any experience with this type of lifestyle?",False,bfo2uc,d-s-m,https://www.reddit.com/r/antiwork/comments/bfo2uc/moving_to_cheap_countries_with_savings/,24,17
7,That's about the size of it.," 

kimzee
@lifeiscrazZy

| could die and my job would get a
Ouija board and ask if | got someone to
cover my shift
",True,biwxaa,WinterTrabex,https://i.redd.it/e98ytivoqav21.jpg,21,922
8,Burn out is wild,Burn out is so real and I didn't realize until it pushed me into a manic episode. Trying to get money in a way that makes sense.,False,bj87d8,dovahalexander,https://www.reddit.com/r/antiwork/comments/bj87d8/burn_out_is_wild/,9,5
9,"Getting angrier over the years, because of work","I’ve had a series of jobs that had a strong confrontational element in them: customer service, tech support (even if advanced level) etc. I’ve only recently realised the extent of the emotional it caused me. 

Whenever a company searches someone with “good people skills”, it’s because your real job is essentially to argue with others, or convince them to do things they don’t want to do - but you have to be polite and nice during. The amount of repression, “positivity” and fake-smiles and such is really, really spirit crushing. 

I think I was a nice person once. I aspired to be one, at least. Now I’m just angry and bitter all the time. The myth about “bastardised operator from hell” that’s often used to described techies? That’s because their job made them this way: 

I can’t show this true face at work, so I end up taking it out on people in my personal life, sadly. They don’t deserve this.",False,bjbcm2,DrowningUpsideDown3,https://www.reddit.com/r/antiwork/comments/bjbcm2/getting_angrier_over_the_years_because_of_work/,6,34
10,What have you internalized?,"""I am a hard worker.""

I was rummaging through some of my elementary school assignments, and found this as a common theme in how I described myself. And, it's very much true. I always chuckle whenever I read a post about how much so-and-so hates the super productive worker; the worker who goes above and beyond; who voluntarily takes on extra work; who sacrifices their self-interest for the betterment of the group (the Company). Because I was that person.

I started working once I was legally able to do so -- at age 14. I worked a minimum of 31 hours weekly. I was so loyal and productive for the Company that I'd even voluntarily work through my break time. Years later, when I landed a factory job, I remember feeling very useless and irritated whenever there was nothing for me to do.

This has all changed recently after a few life experiences and realizations.

The psychological influences that shaped my behaviour are so complex that I can't possibly write it all out here, but to put it simply:

I feared alienation. All the environments I grew up in, the culture was: Your value is what you produce, what your status is, how useful you are, and how closely you obtain what *we* deem valuable. You needed these things to be 'accepted' and 'humanized'; otherwise, you were an outcast. And, that disconnect from community, your peers, hell -- even from your parents and family, leaves a deep psychological scar. So, I learnt and internalized to accept authority, and to submit to its demands. I learnt that everything that I was to be had to be aligned with others' values. I internalized that my worth and value as a human being was solely derived from my economic output, my productive labour, and attaining those things which others ascribed social value to.

So yeah, that's a very, very simplified version of my experiences. What have you internalized?",False,bj1plq,Shadows-of-Hiroshima,https://www.reddit.com/r/antiwork/comments/bj1plq/what_have_you_internalized/,5,21
11,sounds about right,"     
   

 
 

You Have just won 2 million dollars. You
will be paid in hours installments of $8
| You must be present to collect.

 
",True,bj5ubw,isnt_existence_crazy,https://i.redd.it/2ab7q1coqev21.jpg,14,607
12,Someone took my computer off the docking station and went through my stuff,"So, the VP is making us take our laptops home and very single day. After staying an hour and a half late yesterday, I forgot to take my computer. Oh well, no big deal, right? 

Well when I came into work this morning, my computer was on and on my log in screen. Weird. So I log in, and my last file was moved from my laptop screen to the main monitor. Also weird. So at this point I know someone went into my computer. Don’t know why anyone would need to, but whatever. What’s bothering me the most is that I also noticed all my icons were fucked up. This is one of the reasons I hate taking my laptop home. Every time I disconnect it, it moves all my organized icons over to a random jumble on the laptop. I noticed that all my icons looked as if I had taken my computer home. 

It seriously looks like my manager took my computer home and went through it. Which, cool, there’s nothing to hide. But.... why? Why is she such a micromanager..? What was she trying to do?",False,bj2u6v,these-rmyconfessions,https://www.reddit.com/r/antiwork/comments/bj2u6v/someone_took_my_computer_off_the_docking_station/,2,4
13,Found this comment under an 80s Japanese funk song and it reminded me of this sub,"Charlie At 11 months ago

Oh yes, Japan in before the bubble burst in the early 1990's. It was the beginning of the
end of Japan's infallible economy. Everybody, including the Japanese thought it would
never end. Only a few short years later, Japan's economic bubble would pop and
lifetime employment as they knew it would be over. Suddenly, we found that the
Japanese workers were not so much unlike American workers or British workers or
other workers. They didn't necessarily enjoy being owned by the company and giving all
of their lives to the company either.

Most Japanese men of that generation retired with few hobbies or interests beyond
work, yet they were forced to retire young. They were like living ghosts. The Japanese
workforce of today is not like this. They are much more like their western counterpart -
working to live instead of living to work.

How less

i 168 9! REPLY
",True,biqw3l,Vorty-Vort,https://i.redd.it/ep6953ui38v21.jpg,2,19
14,Does anyone else feels this ?,"Does anyone else find questions like ""what's your passion?"" ""What's your niche?"" ""Don't you wanna grow and become successful?"" ""Do you wanna die poor""?  very irritating and frustrating ? 

And seriously this ""startup"" trend has ruined everything. Now everyone is working 12hrs a day because one asshole thinks he can be next jeff bezos or bill gates.",False,bj0xv5,anonymousguy271103_1,https://www.reddit.com/r/antiwork/comments/bj0xv5/does_anyone_else_feels_this/,13,27
15,"""Our employees' wellbeing isn't in our budget.""","Have been approached by a FTSE
KOLO Nexoynater-lananvitaneni=1m01010H 0101)
employees to talk about mental
Lie)life=liable a oh old(e(e(=mon o-\Anna-manila
a mental welling workshop
company with one and half
employees, and | pay. Of | have no
|o)¥(o{@{=1 mo by-\Am el=he) ©)(o of ar=\Senate)
business doing business.

10:29 - 29/04/2019 - TweetDeck

201 Retweets 1,673 Likes
",True,biutc1,daviosy,https://i.redd.it/o5xxr83528v21.jpg,5,40
16,For the next time someone tries to make this toxic work culture seem normal,,False,biz9hs,thatscorpioguy,https://nypost.com/2017/09/03/americans-work-harder-than-any-other-countrys-citizens-study/,2,4
17,China's billionaires to workers: Work until you die working...,"Bloomberg: Next China: So Much For That Work-Life Balance.
https://www.bloomberg.com/news/articles/2019-04-19/next-china-so-much-for-that-work-life-balance",False,bfgo5u,commiejehu,https://www.reddit.com/r/antiwork/comments/bfgo5u/chinas_billionaires_to_workers_work_until_you_die/,2,10
18,"I don't consider America to be a ""free country""","Alright, I live in a free country, sweet, that means I should be able to stay home tomorrow anddd that's impossible because I *have* to work against my will to have the right to shelters that are already built, food that human no longer struggle to find and my favorite, *water.*

Might as well we charge each other for air. 

There's nothing free about this place, physically or financially.",False,bi9w3s,nbatman,https://www.reddit.com/r/antiwork/comments/bi9w3s/i_dont_consider_america_to_be_a_free_country/,0,1
19,"that was honestly my first thought. ""so the others are gonna work the whole school year now?""","( d mm CNN @

Key can
A teacher ran out of sick days
to stay with his cancer-stricken
daughter, so fellow educators
whipped in with their sick days
-- adding up to a a

S Like Horsey
2 @DorseyFilm
Tales from the working class

dystopia repacked as ""feel
good"" stories are getting old.

 
",True,bi9b3e,CreativeThought88,https://i.redd.it/0d8acn6x2yu21.jpg,8,103
20,"It sucks that easy ""starter"" jobs all require lots of social interaction",,False,bi94w7,nbatman,https://www.reddit.com/r/socialanxiety/comments/bi94nr/it_sucks_that_easy_starter_jobs_all_require_lots/,0,1
21,Anyone ever had a problem getting a job after a period of being able to not have to work?,"So me and my wife both hate work.  Just the concept of how it's structured is so terribly demoralizing that I wonder how I'm going to make it through the rest of my life.  I've had several kinds of jobs and they are all terrible.  The bosses, corporate, bootlicking employees, etc.  You guys know the drill.  

Over the past 6 years me and my wife have taken turns at being the sole provider while the other takes some time off, usually 5 months to a year, to try to enjoy the better aspects of life.  We have 6 animals but no kids so we are pretty good at budgeting to accomodate the sort of lifestyle we find worthwhile.

I got laid off from my last job and got a pretty nice severance package plus unemployment.  At the same time my wife got a decent paying job so I've lived without the burden of work for the past year and a few months. The times coming up though I can tell my wife is really starting to hate her job so I'm on the depressing quest to pick it up from my end.  

I'm a little worried about how to get another job with a 14 month period on my resume where I can't account for.  ""Playing with and raising newborn kittens while exploring artistic endeavors"" unfortunately doesn't appeal to HR or hiring managers.

Do I lie on the resume? And if so, how?  What do you guys do? I didn't even get Walmart to call me back about a position and a lot of my resume is filled with grocery and grocery vendor experience. 

Anyways thanks for reading. I wish all you the best, comrades.




""And if you must, go to work, tomorrow

Well, if I were you I wouldn't bother

For there are brighter sides to life

And I should know, because I've seen them, but not very often""

-""Still Ill"" by The Smiths",False,bhnh10,PhilosophicalToilet,https://www.reddit.com/r/antiwork/comments/bhnh10/anyone_ever_had_a_problem_getting_a_job_after_a/,12,22
22,New Sub r/LifeAfterSchool for Discussing Life Post-Graduation,"Hi everyone,

I recently created a new sub r/LifeAfterSchool for anyone who wants to talk in general about life after high school/college, whether you graduated or you didn't.

Thought some people here might be interested.",False,bihkqy,Comrox,https://www.reddit.com/r/antiwork/comments/bihkqy/new_sub_rlifeafterschool_for_discussing_life/,0,4
23,"Has anyone here read ""Homo Ludens""? - a book on the profound use of play (opposite to work?)","What really is the root issue I take with work is how it claims to be meritocracy but actually perpetuates toxicity and misanthropy. Instead it's a broken meritocracy that values how well you fit as a cog in the system, how obedient you are even at the expense of skill, quality or wisdom, and how likely you are to willingly bully those under you if you move up in the chain. To me, being so anti-autonomy in work culture is ultimately anti-play and destroys purpose. If I discover enough workplaces are this way, which appears true in the 7 years I've worked, then my goal is to boycott and do something valuable based on true wisdom that actually is supportive to the lives of other people. I won't go to work everyday, I'll go to play.   


"" In Homo Ludens, Johan Huizinga defines play as the central activity in flourishing societies. He identifies five characteristics of play: it is free; it is not “ordinary” or “real” life; it is distinct from “ordinary” life both as to locality and duration; it creates order; it is connected with no material interest, and from it no profit can be gained. ""  
 [https://www.amazon.com/Homo-Ludens-Study-Play-Element-Culture/dp/1621389995](https://www.amazon.com/Homo-Ludens-Study-Play-Element-Culture/dp/1621389995)",False,bikyht,CurryDurry_bo,https://www.reddit.com/r/antiwork/comments/bikyht/has_anyone_here_read_homo_ludens_a_book_on_the/,0,4
24,"If there are any, what are some things that would make you like your work or a job?","I see a lot of posts here of people fed up with their work, and I assume you're all familiar with David Graeber's Bullshit Jobs, and it seems most of the work you're describing falls into the category of bullshit jobs. So I totally get it. 

But I was just wondering if there were any circumstances where you'd either like or could live with your current job or if there's any kind of work that would make you not feel that way.

I know I'm rather 'privileged' in a sense that I've never had to do work I hate to keep a roof over my head (privileged in quotes because the reason for that is that I'm eligible for a bunch of financial support from the state for disabilities). I've never had more than the absolute bare minimum either, but that was trade-off I was willing to make. I'm opposed to the concept of work on an ideological, intellectual and emphathetical basis, not emotionally from personal experience. I delivered mail for 4 years which I honestly loved, pretty much total freedom, but I do think the fact that it was only 10 hours a week contributed a great deal to me not getting fucking sick of it. I'm back in school now getting my high school diploma because I never finished because of the aforementioned disability, and I'm planning to go into teaching, which, if the disinterest for a subject I love from teenagers that don't want to be there doesn't make me want to kill myself in 3 months, would seem like a pretty fulfilling job.

Would any of that apply to you? Would a substantial reduction in hours make it at least bareable? Would you hate your job and work in general as much if it was only 20 hours a week or 10 and you'd still have enough to live? Do you think that there's any work, that if in a magical perfect reality, you could pick exactly what you wanted and make a living, you'd enjoy, find meaningful? If not these things are there any conditions which would make you like (your) work?",False,bf3wah,AliceDiableaux,https://www.reddit.com/r/antiwork/comments/bf3wah/if_there_are_any_what_are_some_things_that_would/,20,9
25,Background Documents: How Washington convinced America to pursue the Cold War instead of shorter hours (NSC-68),,False,bhb4fp,commiejehu,https://drive.google.com/drive/folders/1HOk34vUk_Lg0g4Jl6ue7IWJMbHvGzrOQ?usp=sharing,4,12
26,Antiwork Japanese Culture,"Posted by u/Syflan 1 hour ago

In my early was working in Japan. All

see are old, worn out faces of

workers, both men and women who are stuck in a culture of overcome and
hard work every day. | still only work 40 hours at most a week, some days

more like 6 or 7, but I'm done with it.

‘ve lost all the time | had to focus on

my own life, instead it's all for the sake of my job and obligations. To many
things get pushed to the side since | dont have time to sort any of it out.

Once my contract is up or | get fired

‘m just moving back home and not

working. I'll either make money for myself or just not spend hardly any.

I've thought about it a lot as I've been working the past several months; it's

 

in no way worth it to sacrifice most o
of work and money.

your day almost everyday for the sake

| don't care if I'm poor or seen as lazy to others, I'm donna spend the short

life | have rousing on my mental and

physical health and welling, work is

something I'll do for my own sake by my own accord.
",True,bhpq64,NemoTheEnforcer,https://i.redd.it/cqv43wot7lu21.png,4,65
27,“You should be grateful to have a job”,"Argh I hate hate hate this. 

https://www.mumsnet.com/Talk/am_i_being_unreasonable/3566531-To-skive-off-work-tomorrow?pg=6&amp;order=

Why wouldn’t you skive off work?

“I’m with Hic - there is no hierarchy of who gets to skive and who doesn’t. If you are employed to do a job then you turn up and do it unless you are unwell.”

“Is nobody just really grateful to actually have a job? I have crippling anxiety, and some days I am in tears on the bus on the way to work... but I still always turn up because that is my reasonable duty to my employer. They are being kind in employing me.. I'm not being kind by turning up. It's their right to expect that of me.”

“Yes, they employ me because they need me to do the work I do - but they don't need ME specifically -they could employ a million others to do the job .. so it IS a kindness on their part that they chose me rather than someone else.”

“Life and the universe don't owe you employment. It's not a difficult concept. Employers can always employ someone else instead of you. Therefore if you have a job you are in fact very lucky. Again, not difficult.”

I just want to slap these docile little drones.",False,bhkk35,QueenMangoPolarBear,https://www.reddit.com/r/antiwork/comments/bhkk35/you_should_be_grateful_to_have_a_job/,17,62
28,Woman killed after falling into meat grinder at food processing plant,,False,bh9fhy,WinterTrabex,https://www.nbcnews.com/news/us-news/food-processing-plant-employee-killed-after-falling-industrial-sized-meat-n998026,9,15
29,It is crazy if you zoom out and look at our life,"We get born, we goto school to spend whole day there till our teenage and then college for another few years. Die hard to get a job that requires us to know everything on the universe. Then we use all those knowledge we learned for some fucking investors to steal money from people. Those bosses live a completely different life than us. They don't need to work. Their children don't need to work. We work fucking hard for them until we become old and out of energy. We don't even have time to play with our children or spend time with family like other animals do. Besides that whatever we call knowledge or work is only destroying this planet. Most of the things we produce is just waste that benefits only the capitalists. Many animals are getting extinct because we invade nature like anything. 

&amp;#x200B;

So we are neither useful for the planet nor did we live a good life for ourself.",False,bgwv16,KindDeer,https://www.reddit.com/r/antiwork/comments/bgwv16/it_is_crazy_if_you_zoom_out_and_look_at_our_life/,42,128
30,I had the privilege of talking to a C-suite executive on the phone,"Like a lot of companies nowadays we have internal company social media, which presents a fabulous opportunity for shitposting. I'm quite proud to say I've had memes taken down for being too critical of the soul crushing corporation. Anyways, a bit of sarcastic shitposting on a post by one of the many bland corporate white guys got a response, which lead to a phone call. I gladly took the opportunity to speak my mind.

He tried to seem all personable asking me about my history with the company, saying how he relates since he started at the bottom 25 years ago so he knows what it's like. Whatever. I got into my list of grievances, like why is it that the store does tens of thousands of dollars in sales weekly but I don't even get $1000 on my biweekly paycheck? How come a pregnant coworker had to cancel her company health insurance because it was far too expensive? Why do I have a full time coworker struggling to make ends meet between paychecks? Non answers all around. ""Well we've introduced paid maternal/paternal leave! Such great benefits!"" ""If you work hard you'll be able to move up in the company and make more money!"" Shit like that. I straight up asked how much he and the other executives are making but he dodged that question at breakneck speed. 

I despise these corporate douchebags. Getting rich off the labor of store and warehouse employees while they sit in their cushy offices abd boardrooms. All that conversation did was motivate me to slack off at work and unionize my coworkers. Get fucked corporate man.",False,bhyffj,WJ_Amber,https://www.reddit.com/r/antiwork/comments/bhyffj/i_had_the_privilege_of_talking_to_a_csuite/,156,304
31,Is It Time for America's Industries to Strike All at Once? (Teen Vogue),,False,bhhg98,ericgj,https://www.teenvogue.com/story/general-strikes-explained,9,81
32,Mortal Kombat Developer Accused Of Abusive 100-Hour Work Weeks | Jim Sterling,,False,bhx2ir,Shadows-of-Hiroshima,https://www.youtube.com/watch?v=V_f_qe1-75w,3,39
