,title,body,is_image,id,author,url,num_comments,num_upvotes
310,"Ladies and gentlemen, I present to you: my inbox!","**Please don’t try to guess which company** (this is based on both my current and previous workplaces), all the major tech giants are about the same anyway. 

I recently had a chat with another new recruit, and he said, “the day I logged in the first time to my work PC, I already had 300 emails waiting for me”. The percentage of real emails among them was close to nil. 
He inspired this post, in a way. 

Here’s what’s in my inbox in any given day:

1. Mass-distribution email from CEO of Hooli, which includes the words “innovation” and “excited”. 

2. Multiple mass-invitations to video-conferencing sales team meetings at 3am my time. Nope nope nope.

3. An invitation for a tech talk about someone’s project, teaching lizard how to code.

4. An invitation to join the beta program of a new Hooli device, which records every thought that runs through your brain offers you appropriate ads integrated into your dreams! Also uses the words “excited” and “innovation”.

5. Someone named Derek is leaving the company and wrote a long goodbye email to everyone, which is also the first evidence I have for his existence. Regrettably, he will continue said existence elsewhere, so it was a useless effort to learn that there’s a Derek who works here.

6. Another Derek is leaving, but he’s in the Hooli office in Japan. I’ll refer to him as Derek no. 2. I still get his goodbye email, for some unapparent inexplicable reason.

7. An automated alert email from a system with a mysterious code name, which has a lot of three-letter acronyms. Apparently the Fjarnskaggl TLA level is above the ABC of XTC. This looks important, but I have NFI, and I CBA. 3,000 other people got it too, I hope someone knows what the heck.

8. Email from a customer who has supposedly-irrefutable proof that our hardware is faulty and crashes. I refute it, by showing the log line that says they actually pressed the power button to turn it off. This is the only email in my inbox that’s actually aimed at me. 

9. Bob is sick today and will be out of the office.

10. Another Bob is sick today.

11. Automated permission system: “you have been added to the permissions group “Blargh-engineers-Hooli” - good to know.

12. Remember all the Dereks who left before? We hired a new one to replace some! There’s a welcome email, in which he tells us his hobbies are roller-snorkeling and snorkel-rolling, and that he has 2.4 kids. 

13. Another email about customer feedback, with reports, statistics, tables and graphs about user adoption of some Hooli product. It says “[Message clipped]  View entire message”. I’m extra-cautious and make sure not to click the ‘view’ button by mistake.

14. [Win-wire]: Hooli marketing people send everyone an email whenever they sign a customer or get them to renew their contract (“a win”), so it seems. They never send one if we lose a customer. I’m considering emailing them back about my own wins - for example, I found a $2 coin on the light rail today. 

15. Someone is asking if anyone is traveling to Malasya, Micronesia or Euthanasia soon, they have a package to deliver to their family there, and can you please carry it for them?

16. Some email about a Hooli tech conference ‘19, with lots of product announcements and keynote speakers and whatnot.

17. Marjorie replies-to-all on Derek no.2’s goodbye email, wishing him good luck.

18. James replies-to-all on Derek no. 3’s welcome email, to ensure Derek 3 is welcomed. This process can probably be automated.

19. Marjorie replies-to-all on James’ reply-to-all, and welcomes Derek no.3 for joining Hooli. There are about half a dozen more Marjorie/James emails of this sort from the rest of the team, but it gets old fast so I’ll spare you the details. 

20. About 2,853 filtered emails about bug reports that relate to products I don’t work on, but still CC everyone who ever walked into a Hooli building. I’m certain that the cleaning staff get CCed on that too. They’re just as equipped as I am to action them.",False,bbigzp,DrowningUpsideDown,https://www.reddit.com/r/antiwork/comments/bbigzp/ladies_and_gentlemen_i_present_to_you_my_inbox/,15,41
311,Being a stripper is the most free I have ever felt,"As a stripper, I’m no longer an “employee” - I’m an independent contractor. I am 27 and hated every job I have ever had (retail sales, fry cook, cashier, waitress, barback, bartender, non-profit intern, tech writer, marketing assistant...) until now. 

My schedule is flexible. I never clock in or out. I feel happy to bring joy and personal connection to customers. I wear whatever I want. I have financial freedom instead of living paycheck to paycheck. If I’m tired, I sit down. I eat when I want, go to the bathroom when I want, take breaks when I want. I never have to talk to anyone I don’t want to. I work as hard or as lazily as I like.

Yes, there are a lot of rough things about the job and I am lucky to work in such a good club. But I never want to go back to a regular job again. When I get too old for this I’m going to work for myself. I never want to work for anyone else ever again.

Just had to rant because I feel fulfillment at work for the first time in my life.",False,bdqe2e,Danger_Dancer,https://www.reddit.com/r/antiwork/comments/bdqe2e/being_a_stripper_is_the_most_free_i_have_ever_felt/,28,34
312,Every goddamn day at work,,False,bd3wfm,JinxSphinx,https://imgur.com/rTPk4Kd,13,389
313,This hit home hard,,False,bc0ofg,Sehtriom,https://i.imgur.com/4geFu5D.jpg,112,715
314,lbr,"Able
@kkunta_

why is being alive so expensive, i'm not even
having fun
8:33 of - 14 For 19 - Twitter for Android

66.Of Retweets 200K Likes

to) a iv) x
",True,bdnx13,chaosmosis_1,https://i.redd.it/c447gl5k1js21.jpg,22,716
315,"Its strange how being unemployed is looked down upon and yet, people who have jobs generally don't like their jobs.","I guess judging makes them feel better about themselves and their situation.

The whole idea of spending most of your waking hours doing something you hate so you can go on living (which is mostly doing something you hate) is absurd. It's gotten to the point where what you do for work defines you, which is crazy.

The irony is if the average person were to somehow get enough money that they'll never have to work again, they wouldn't  know what to do with themselves. They're just used to being a cog in a wheel. That's why alot of people who retire tend to go back to work.

Things don't have to be the way they are right now, but humans are conditioned to accept their enslavement and not to rebel.",False,bc16g3,Jax_Gatsby,https://www.reddit.com/r/antiwork/comments/bc16g3/its_strange_how_being_unemployed_is_looked_down/,39,130
316,My plan is to leave the rat race,"I always thought that my idea of leaving the rat race was a delusion, a sickness in me that only I had. A laziness some would call it.  
But I want to be free and a life of getting up and going to a 9 to 6 job will be the death of me, and hey, I am only 31 years old. I would not be able to take it more than 2-3 years tops.  
I'd rather die than survive like this.  
So my plan is to use my saved up money and buy some land, build my own home in a warm country in europe (cheaper one like Greece) and work my own land, build an AIRBNB next to my own house and make some money from there.  


Is this a sick idea, considering that most people will tell me I am crazy and that real life is here, in the centre of work, aka London, New York etc.  
I want to live London and live like a f#cking peasent. Is it insane, or do you guys think that it's God's gift for us to be free on the land, alas we endure the hardship of the land, but we will know tranquility and forgive ourselves for the misery we have put ourselves through ever since that very first day - the day we were given a birth certificate and with it came our parent's debt, society's expectations and where our place should be in this machine that society is.  


Should I get this break for the rest of my life, even though I am 31? Or should I stay in the rat race and die?",False,bc4y9t,alexdd88,https://www.reddit.com/r/antiwork/comments/bc4y9t/my_plan_is_to_leave_the_rat_race/,15,23
317,I talk the talk but don't walk the walk.,"I'm currently very career-focused, working a salaried job, living in a big apartment with a view and supporting my wife while she goes to grad school. It's strange being subscribed to this sub, because it reflects my values while my actions don't. I guess I have this fantasy that my current work situation is a temporary hardship that I have to endure before I have enough money saved up to walk the walk. I've talked with the wife about living in a tiny house or even a fancy house-van, and she used to be willing, but I think the comfort has gone to our heads (hers more than mine) and now we feel stuck. I feel like if I give up this lifestyle I'll never be able to come back to it, and that loss of options terrifies me.

I feel a certain tension in our culture, where I must buy into the capitalist system fully or risk being shunned by it and losing out on its many material comforts and conveniences. It feels like there's no place for moderation, like the system won't tolerate it. Maybe I'm just too soft to tolerate it.

Some of the same feelings that motivate posts in this sub would be very familiar to the ""financial independence""/""passive income"" crowd, even though the goals and values seem very different. Maybe the values are actually the same, but the financial independence people think the system has a clear path out while the antiwork crowd seems to think that that the only path out is to reject the rewards that money brings.

I have no particular point to make here. I'm just sharing my thoughts.",False,bc99ux,RobertWarrenGilmore,https://www.reddit.com/r/antiwork/comments/bc99ux/i_talk_the_talk_but_dont_walk_the_walk/,6,6
318,"We are constantly exploited to sell our labor for less than its worth because the rich believe in a false meritocracy in which everyone should be a copy of their most idealized self. They are desperate as we are. Us with money, them with validation. All of us suffering physically and spiritually.","Just want to rant out my feelings.

I understand the need for idealism and that “puritan work ethic” but damn... its getting bad. Real bad out there. The rich and their systems want to convince us that they want to cull the herd and wipe out all weakness, but that is just an illusion. The real goal? Think. Whats the worst possible goal of this system? I tell you, the worst possible goal is that there is NO GOAL. Just plain tit-sucking immediate pleasure. The eternal throb of how to alleviate the pain of living. Thats it. No goal and no direction, just a mindless machine of a projector shooting out movies of a perfect world. All that will be left are the mindless mumblings of a rich guy recorded on some diamond encrusted USB drive, talking about “progress” and “we are doing this together :)” bullshit, when really he was paying armies of lobbyists to rig the game so that he can fight the endless battle against the “hungry masses” so that he can keep sucking the tit and nobody else can. Its not even greed at this point, just plain fucking “I dont want things to change” bs. Baby wants the silver bottle.

The thing I want to emphasize is that we shouldn’t make this about us/them. Even if they are evil (they fucked the planet and all of its natural resources), that anger will hold us back. The only validation left for despots and evil fucks is our anger. Dont give it to them.
Be angry, but turn it down so that its not blinding, not the central focus. Dont become THEM.",False,bbz9ns,whatoneaarrrthisthat,https://www.reddit.com/r/antiwork/comments/bbz9ns/we_are_constantly_exploited_to_sell_our_labor_for/,16,60
319,Retire Now!,,False,bbx3h0,an_thr,https://www.youtube.com/watch?v=TCCkzHQz8Y0,3,6
320,"Safety is important, unless it’s inconvenient","After helping a coworker I like take down a weather shield that was built around a register in our garden section, I got some sawdust in my eyes. I went all the way back to our receiving area to the eyewash station, and i couldn’t figure it out at all. I asked another coworker that was back there and she pulled a tube out  and a little water got around the floor before I could put the tube back in couldn’t figure it out, so I went and got my supervisor. 

The entire short walk over to the station be bitched at me for getting sawdust in my eyes and not knowing how to work the station. And as he’s turning the thing on, he goes 

“Have you like never had a job before?! This things isn’t a fucking toy to play with, and it’s not hard.”

I told him I was just gonna go to he bathroom, but I didn’t wanna waste extra time, because receiving is busy. 

“Well then why the fuck didn’t you? We have to drain this every time it’s used, and you cant even turn it on.”

All this bitching and moaning because I just wanted to clean the wood out of my eyes that only got in there because of this garbage fucking job.",False,bc23x2,Live4NVR,https://www.reddit.com/r/antiwork/comments/bc23x2/safety_is_important_unless_its_inconvenient/,2,13
321,No privacy in our personal lives. None. At all. Job interviewers don’t even consider people who don’t offer their entire life to the job.,"It’s honestly ridiculous that you can’t even mark your availability to your own needs. You have to match your availability to what the company wants or else they will not even look at you. 

I remember when applying for a fast food job, I had marked Saturday off of my available days. (They were closed on sundays, im sure you can guess what this place is lol) so I was trying to get.. you know.., a weekend. I already wasn’t keen to working another fast food job, but I needed to pay my car note at the time. During the interview, the manager said “well I noticed here that you said you aren’t available on Saturdays, why?” Like what am I supposed to say? If I tell you that I just want that day off, you’ll look at me like I’m lazy and entitled for wanting a weekend. I can’t lie and say I have another job or they would’ve probed me for details about that job. Thinking back, it is a Christian company, so I should’ve come up with a lie that I do some sort of church volunteer work on Saturdays and that probably would’ve gotten them off my ass. Didn’t think about it at the time because I wasn’t expecting them to be so invasive about why I wanted Saturdays off. 

Like... and the worst part of it is, that day you wanted off ends up being on your schedule EVERY WEEK. They scheduled me almost every Saturday. 

The complete disregard for our schedule preferences is disrespectful as hell if you ask me. To me, it just says “we know you are full grown adults who would like to have some control over your own schedule, but we don’t care because we need everyone here to be our personal lackey who we can call in whenever we want!” Also, if you tell them “hey please stop scheduling me at 5 am... I don’t like it”, they will probably schedule you more at 5 am. This also happened to me at this same company. I asked to switch to more afternoon shifts because I think it’s absolutely ridiculous to get up at 4 am to be at a fucking fast food job at 5 am (I gave a different excuse) and they kept scheduling me at 5 am. Then got mad when I called in constantly lol. Like sorry dude... I told you already I don’t like going in at 5. 

Like, find someone who WANTS to go in at 5 am. And if NO ONE wants to go in at 5 am, WHY are we opening so early? So people can come get their precious breakfast sandwich at the asscrack of dawn every morning?",False,bcdyyu,these-rmyconfessions,https://www.reddit.com/r/antiwork/comments/bcdyyu/no_privacy_in_our_personal_lives_none_at_all_job/,26,40
322,Quit my labor job for some R&amp;R,"I've been working at this warehouse doing physical labor work for $9 an hour for almost 3 years now. Unfortunately I've never gotten a raise because I go to school during the week and miss 2-3 days a week. I finally had enough of the back and knee pain that I've endured, on top of that my boss informed me I wasn't making enough hours and he'd have to fire me soon, so I quit. I'm tired of seeing people who work the same hours as me and make twice as much money. Unfortunately my family and my girlfriend are pissed at me, my friends on the other hand are on my side, so that's something. I'm never doing any physical labor work again unless theres a fat fucking paycheck. Any suggestions on places that'll be high paying but low physical work? I'm fine with mental work, that doesn't bother me as much.",False,bckpm2,jab8484,https://www.reddit.com/r/antiwork/comments/bckpm2/quit_my_labor_job_for_some_rr/,2,4
323,Ugh,,False,bco489,HedgeFundamentals,https://www.youtube.com/watch?v=2WLuuCM6Ej0,2,14
324,Need advice hoping to get some feedback,"I am writing this as I am mere minutes from going to bed to wake up for work in the morning. Yes, I work on weekends only and though it might be only 2 days of the week, I work at a factory job doing the same monotonous task for 11 hours with only two 30 minute breaks which I have no control of when to take.

I am currently a full-time student (23 male living in Toronto) in computer science and I work full time to help pay for my expenses which is mostly for my car. For those wondering why I have a car as a student, let me explain. I originally went to college for two years to become an electronics technician. I landed a full time job after graduating which I didn’t mind (just the manager sucked). After working there for a year and a half, I paid my student loans and had enough money to pay for a car. I paid for a car from my dad however I currently pay an outrageous insurance (despite never being in an accident). 

After some time I was hoping to go back to school to advance my knowledge to get a degree in computer science. I asked my current employer if I could work part time with them while I was in school and they originally said yes but than changed their mind and said no. As a result I need to find a job fast to help pay for my car insurance which made up 50% of my monthly expenses alone. So I took a job at a warehouse. 

Again, although I only work two days a week, I dread this job so much. I wish to do some about it but I don’t know what.

Side note: let me also say that I throughly enjoy university and don’t regret going back. I love what I’m doing, my grades are great and everyday I enjoy coding, doing mathematics and photoshop. I hope to get a self-made career doing these things that I love. I also volunteer when I can. I give food to the elderly and use my coding skills for good to help charities design their websites.

Thank you all for reading. Sorry if the grammar or spelling is broken, I am writing this quickly before bed.",False,bcywxc,Kypriako,https://www.reddit.com/r/antiwork/comments/bcywxc/need_advice_hoping_to_get_some_feedback/,2,2
325,If I was a boss I’d give myself more than 17$ an hour...,"He your own boss = Getting paid by
the hour??

   

own boss.
Barn up to

$17/he. ————
",True,bba5rc,RighteousAwakening,https://i.redd.it/xq97y2dmo9r21.jpg,16,45
326,A classic scene from The Sopranos,,False,bdefnf,shadycharacter2,https://www.youtube.com/watch?v=YUgHDXOdUos,2,20
327,Emotionally clingly fucking co workers,"No i don't want to go to the casino with you.

No i don't care that your white boyfriends mom and sister hate you. They're racist.

No i don't want your number. Im married and  i don't shit where i eat.

No i don't have extra money/headphones/snacks. Plan ahead like any other adult.

No i can't calculate your hours worked. They have apps for that. 

&amp;#x200B;

The list goes on and on. I hate that I work in a male dominated industry but since it's i'm a woman, I'm expected to be free therapy/ lunches,etc. To top it off most of the people that i work with are homeless temp workers and therefore are easy to ignore in most places. I just look forward to getting into my new apartment, getting my car and savings padded and get the hell away from these needy ass men.

&amp;#x200B;

UGHH!",False,bdnsw3,GigiReddit,https://www.reddit.com/r/antiwork/comments/bdnsw3/emotionally_clingly_fucking_co_workers/,2,2
328,Live to work. Work to die.,,False,bdobuz,Chipp_in,https://www.youtube.com/watch?v=7E_I74pG--I,0,13
329,"Surprise! A ""business magistrate"" wants you to love working 12 hours a day, 6 days a week. That's not too much to ask, is it?",,False,bdlhem,Hateno_Village,http://fortune.com/2019/04/15/jack-ma-996-culture/?utm_campaign=fortunemagazine&amp;utm_medium=social&amp;xid=soc_socialflow_facebook_FORTUNE&amp;utm_source=facebook.com,14,37
330,Max Stirner - All Things Are Nothing To Me - Todas las cosas son nada para mí,"&amp;#x200B;

https://i.redd.it/rfzqdurslir21.png",False,bbslqu,solartegd,https://www.reddit.com/r/antiwork/comments/bbslqu/max_stirner_all_things_are_nothing_to_me_todas/,0,3
331,"Employees who force themselves to smile and be happy in front of customers -- or who try to hide feelings of annoyance -- may be at risk for heavier drinking after work, according to a new study (n=1,592).",,False,bbiodl,The_Ebb_and_Flow,https://www.eurekalert.org/pub_releases/2019-04/ps-fas040919.php,0,1
332,Truly a sad state...,,False,bbkpy7,Haqwss,https://www.reddit.com/r/self/comments/bbiudy/no_you_cannot_fucking_wear_jeans/,10,47
333,Trucker Strike on April 12 - The Organic Prepper,,False,bbzgnd,WinterTrabex,https://www.theorganicprepper.com/what-would-life-be-like-without-trucks-well-find-out-when-truckers-strike-april-12/,2,9
334,“Uplifting” Snapchat story I recently saw.,"When you just gave birth but you have
an exam tomorrow &

   

 
",True,bbh003,apost54,https://i.redd.it/qgdh2tpvpcr21.jpg,61,483
335,Stop and Shop Strike,"Key Acts for Stop & Shop
Customers
— AHOLD/DELHAIZE SUCCESS

Top operating supermarket in New England
$8 billion share buybacks since 2010
Over $2 billion in profit last year

 

 

 

13.4% increase in operating income last quarter

Putting workers take-home pay

 

 

Huge reductions in retirement benefits

 

Drastic cuts to healthcare

 

Elimination of holidays and personal days

Increase in poverty in your communities
Longer lines at checkout

 

 

 

Less customer service

 

Higher employee turnover

 
",True,bccp05,WinterTrabex,https://i.redd.it/dfq08appotr21.png,28,230
336,"AliBaba Founder: “To be able to work 9-9-6 (9 to 9, 6 days a week) is a huge bliss. If you want to join Alibaba, you need to be prepared to work 12 hours a day, otherwise why even bother joining.”",,False,bcnqn0,KindDeer,https://www.bloomberg.com/news/articles/2019-04-12/jack-ma-draws-controversy-by-lauding-overtime-work-culture,8,34
337,John Holt &amp; The Paragons - I've Got To Get Away,,False,bd6uql,paximperius,https://youtu.be/kRDILYQqUkM,1,1
338,Purpose of life,"Do you even feel like you are stuck in this job schedule and this is not your true calling. You want to take 2 -3 months complete off from this schedule of m-f , waking up early , commute and think about next step in life. But you cannot do that as you cannot afford it so thinking about it just makes you depress. What do you do in those situation ? How do you snap out of it ?",False,bcvqrb,Quest4Peace,https://www.reddit.com/r/antiwork/comments/bcvqrb/purpose_of_life/,7,19
339,Toxic management cost an award-winning game studio its best developers: How the $36 billion video game industry burns out its best employees,,False,bdf107,The_Ebb_and_Flow,https://www.theverge.com/2018/3/20/17130056/telltale-games-developer-layoffs-toxic-video-game-industry,0,23
340,Need life advice,"With the help of the government I found a new depressing office job. They saw that I don't have a degree and said I need to do one or else i'll get fired (degree= 45h per week working incl. 2 days school for 3 years straight). I don't have any other options since a degree in my country is EVERYTHING. If you don't have one, you can only find a ""humane"" job with rare luck or work in badly paid places. Since they're paying for the costs, I agreed. I will quit as soon as it gets too much.

&amp;#x200B;

But now i'm not sure if I did the right thing. I already signed all the documents and I don't have any other plans for life. I thought maybe with time i'll get an idea that I can earn money with, live a good life in another country or find a partner who wouldn't have a problem with me not working, but I kinda doubt it now. I really don't want to spend the best years of my life (early 20) wasting 3 entire years in a delusional capitalist place. They tell me ""oh it's just 8h a day"" (of course forgetting the 1h way to work + the 1h unpaid lunch break, the studying AND the work-induced depressions). My parents are kinda forcing me too to get this degree. Everyone here has done their degree at 16yr olds but my lazy ass tried to avoid it at all costs. I don't know what to do. I saw so many posts here of older people regretting how they wasted their best years with +40h jobs

&amp;#x200B;

What would you do in my situations? And if you're comfortable to share, what are your plans or projects to avoid the 9-8 bullshit? I'm sadly bad with arts, music or programming.",False,bddos7,agony4ever,https://www.reddit.com/r/antiwork/comments/bddos7/need_life_advice/,4,4
