,title,body,is_image,id,author,url,num_comments,num_upvotes
100,Chip in your sick leaves..,"( d mm CNN @

Key can
A teacher ran out of sick days
to stay with his cancer-stricken
daughter, so fellow educators
whipped in with their sick days
-- adding up to a a

S Like Horsey
2 @DorseyFilm
Tales from the working class

dystopia repacked as ""feel
good"" stories are getting old.

 
",True,biefyy,just_a_random_userid,https://i.redd.it/0d8acn6x2yu21.jpg,1,8
101,Any movies which sums up this sub ?,,False,bi7z3l,anonymousguy271103_1,https://www.reddit.com/r/antiwork/comments/bi7z3l/any_movies_which_sums_up_this_sub/,18,13
102,False Knees 124," 
",True,bihyti,ProlapsedUrethraWorm,https://i.redd.it/5w1abyd1j3v21.png,7,91
103,US Uber drivers plan shutdown over pay,,False,bise1k,WinterTrabex,https://www.bbc.com/news/technology-48051646,0,11
104,"Work as identity, burnout as lifestyle from The Ezra Klein Show",,False,bidagq,munchler,https://www.stitcher.com/podcast/the-ezra-klein-show/e/60197403,0,3
105,So.. have any of you broken free from this hellish cycle we're stuck in? How?,"Give us some success stories, a light at the end of this tunnel.",False,bifg0s,sillysorbet,https://www.reddit.com/r/antiwork/comments/bifg0s/so_have_any_of_you_broken_free_from_this_hellish/,7,4
106,"The pressures of becoming an ""adulting""","I just had my 25th bday a couple of months ago (the quarter life crisis) and ever since I was 19 I have trying to figure out this whole (work thing) I have tried multiple job industries and even tryied being self sufficient by having my own online drop shipping business. After years of trying both I have come to the conclusion that 99% of jobs are unfulfilling and boring as f**k. Going down the entrepreneural path doesn't seem that flash ethier, 60-80 hour weeks, constantly working having no time for other things in life. The only way I can see this working is having your own business but actually being passionate about and not just in it for the money since no amount of money can compensate for the unfulfilling ratchet exsistence you feel with being at work. I honestly don't know what to do, also I have these annoying high school friends that are echo chambers constantly saying nonsense such as ""Got to get off the mums tit someday""  ""gotta grow up and get your own place one day"" ""when are you going to finally become an adult"" etc etc. This annoys the shit out of me as they are trying to convince themselves by thinking that there is a rational way of living like a f**king robot for 50 years! But I'm not getting any younger and the pressures is getting to me! Anyone else feel this way? Have any advice? 

bluepillergonerogue over and out [face mask](https://i.imgur.com/cwUgVtK.jpg)",False,bivwzt,bluepillergonerogue,https://www.reddit.com/r/antiwork/comments/bivwzt/the_pressures_of_becoming_an_adulting/,17,11
107,Probation,"Anybody here on probation? I just started my first month and not really sure what to make of it. It's for a DWI and is 3 years but one of the requirements is to be working or in school. I quit my job last June just 3 months after I got it, irrelevantly, but also terrible timing......and have a had a hell of a time finding work ever since, in part due to transportation and in part due to my ever growing negative attitude on the whole system (why I'm on this sub) and general displeasure with the type of work I do. Having my first meeting with probation today was a reminder that I'm stuck in this system, and I literally can't opt out right now. I almost wonder if jail would just be better.",False,biydsv,AnAlienFrom1955,https://www.reddit.com/r/antiwork/comments/biydsv/probation/,5,0
108,"Bukowski - “ How in the hell…” Hasn’t been posted in more than 3 years, so I thought I’d remind the sub what wisdom he shared. (Repost)",,False,biwz31,fresnel-rebop,https://i.imgur.com/KfdR1d7.jpg,13,213
109,So this is a sub for the lazy?,,False,bj55po,einz_goobit,https://www.reddit.com/r/antiwork/comments/bj55po/so_this_is_a_sub_for_the_lazy/,17,0
110,amirite?,"BUILD MEA
THOUSAND SHIPS

 
",True,biuw96,mehawhaw,https://i.redd.it/6fgt9fr7s9v21.png,4,47
111,Feeling so beat down,"I feel like no matter how much I work I cant get ahead. Everytime I come into some money from busting it some big dumb ass expense comes up. I'm tired of the rat race. I don't buy anything anymore pretty much just food. Everytime I spend money on something non essential hell even food sometomes I feel like its being taken from me. I don't know if any of this makes sense. I'm just so tired, demotivated, and lethargic. I hardly even want to do the things in passionate about because of how beat I feel about having to work so much.",False,biximk,neo-dan,https://www.reddit.com/r/antiwork/comments/biximk/feeling_so_beat_down/,3,6
112,"Let's talk about this ""impostor"" syndrome","I have been struggling at my current job and have been hunting for a new, less stressful job on the side.  I finally landed a promising interview this week, and I am nervous as fuck – specifically, I am nervous about having to answer the inevitable question of why I am jumping ship.  The truth is that I am bailing because I am simply not good at it, and I want a job that I am better at and that will stress me out a lot less.  That's really all there is to it, but I can't really say that, right?  Nobody ever wants to admit their faults, especially in an interview.  We are supposed to inspire confidence in our abilities, make ourselves seem like the perfect gear to be slotted into the machine.  So, I will pretend to be that fully functional gear.

Is it any wonder that so many people suffer from this so-called ""impostor syndrome""?  I think that even if you aren't in a particular situation like mine, i.e. struggling to come to terms with personal limitations which are disrupting your life in a very real way, chances are you still have to make some sort of alteration to your individuality in order to work.  Even the people who are good at their jobs face the pressure to *continue* to perform, to hide their fatigue or moments of discouragement.  Work *always* posits a productive reality against an immanent reality, a hierarchy of uses and values against a chaos which can only be described as inherently human.  We are forced to hold out our association with the former as the true core of our identity, while obscuring our relationship to the latter.

Can we imagine a work culture in which I could show up to an interview, put my personal flaws on the table alongside my strengths, and *not* feel like I have put my neck on a chopping block?  Can we imagine an employer telling us ""we are totally okay with your flaws, because work isn't actually that important – what's important is that your existence isn't a total fucking nightmare, so just do your best and we'll stick with you""?  A guy can dream, right?

 ",False,bivy5q,DrinkyDrank,https://www.reddit.com/r/antiwork/comments/bivy5q/lets_talk_about_this_impostor_syndrome/,4,11
113,At my whit's end. How do you guys handle it?,"I work a very demanding IT support job. I'm required to be available 24x7 on salary. Night or day I get phone calls and I'm required to drop whatever I'm up to and fix various issues. I commute 45 minutes daily and whatever I do it seems to never be enough. I have lost all motivation so my work is just piling up. 

Then when I am home I don't want to do anything, I usually end up scrolling through Netflix for 3 hours then go to bed. I'm gaining tons of weight since I don't want to cook so I usually just order out. I'm no longer interested in hobbies and I never want to spend time with my friends or family anymore. I got sucked up in the ""American Dream"" so just leaving it all really is no longer an option since I have a mortgage to pay and I gotta eat. 

&amp;#x200B;

How does the like minded, anti-work community deal with it? I'm feeling a bit of the existential crisis coming on where I think I'm just going to be like this till the day I die.",False,bj8zn0,biohacker53,https://www.reddit.com/r/antiwork/comments/bj8zn0/at_my_whits_end_how_do_you_guys_handle_it/,11,8
114,"So here's an idea to reduce government, bullshit jobs, climate change and work all in one proposal","Say we get a referendum on the ballot in a state that allows referendums next year.  The referendum states that anyone in public employment who believes they can do their 40 hours job in 21 hours can opt to work only 21 hours per week (3 days times 7 hours) for a full forty hours pay. If the employee chooses this option, they can no longer qualify for overtime and their department or unit cannot hire additional staff to cover the hours lost due to the employee working less. 

More work has to be done to flesh this idea out,  but could it work?",False,biwzja,commiejehu,https://www.reddit.com/r/antiwork/comments/biwzja/so_heres_an_idea_to_reduce_government_bullshit/,11,1
115,I just handed in my 2 weeks notice,"I can’t take it anymore. It’s got to the point where I was seriously considering driving head on into a tree or something on the way in so I could deliberately put myself in the hospital, rather than go to work. It was a college job to begin with and then I just got really sidetracked and I’ve been there for 2 and a half years now. It was stacking shelves overnight at a large retail store 

I haven’t got a plan or anything, and I know it’s stupid to quit without having anything lined up, but that’s the least of my concerns right now, I had to do it for my mental health. I’ve got a fair bit of cash saved up because I’m in the fortunate position of still living at home, so money won’t be a problem for a while 

I already feel a huge weight taken off my shoulders, and I have an application currently being processed for a job that’s tied into one of my hobbies. I’m a big motorcycle guy, and it’s a tech apprenticeship. The pay isn’t great for qualified motorcycle techs, but that doesn’t bother me. It’s got to be better than being stuck in a cubicle all day doing bullshit tasks that ultimately don’t mean anything. So hopefully I hear back soon

In the meantime though I’m going to use this period of not being in work to focus on my fitness, mental health and general wellbeing.",False,bj49ru,comedgygenius,https://www.reddit.com/r/antiwork/comments/bj49ru/i_just_handed_in_my_2_weeks_notice/,16,64
116,middle management and HR are fake professions,Ever notice companies who employ these parasites both suck to work for and do business with?,False,bj9dkj,fartliberator,https://www.reddit.com/r/antiwork/comments/bj9dkj/middle_management_and_hr_are_fake_professions/,24,58
117,Who gets high at work to pass the time?,I do. Maybe 2-3 times a week. It helps that I work from home. Helps get me through the day sometimes when I can plug in my headphones and just cruise through some boring work shit while catching a little buzz.,False,bj4pj6,mzakflip40,https://www.reddit.com/r/antiwork/comments/bj4pj6/who_gets_high_at_work_to_pass_the_time/,17,23
118,"'League of Legends' Studio Faces Employee Walkout, Promises Changes | Vice",,False,bj1b7j,Shadows-of-Hiroshima,https://waypoint.vice.com/en_us/article/gy4qv7/league-of-legends-studio-faces-employee-walkout-promises-changes,2,3
119,Future Corpse - Monitor Faced. An antiwork song.,Buried alive from 9 to 5 (or worse for some poor folk).,False,bjam1v,heisenbergaus,https://www.reddit.com/r/antiwork/comments/bjam1v/future_corpse_monitor_faced_an_antiwork_song/,0,1
120,I felt free for seven months and now I feel like I want to die everyday.,"I don’t know what I expect to get out of this post, but after lurking for so long, I feel like i could at least feel some kind of better after saying it out loud. 

I worked for a retail chain for a little over seven years. During that time I slowly climbed the ladder from a cashier up to an assistant store manager. It was a long and arduous process, but it was also my first and only job during that time. I started off at minimum wage of 7.35 and made it to 12 during my time there.
The way our stores were oriented only allowed two, and on rare occasions three, employees in a store on a day to day basis. My day’s were a constant waiting and worrying that the next employee would even show up to work. Everyone wanted a pay check and not a job. A concept I didn’t understand until now....but at the time it helped add to the pile of mental anguish I had to endure. 
Towards the end of my work life, I was working 60-70 hours a week. Paid overtime is a perk, but it wasn’t worth my mental health anymore. So I finally decided to quit. 

I enjoyed seven months of a job free life. I had a nest egg that helped supplement my life with my girlfriend, but it only lasted so long until I needed to get back into the market. 

So I started a job at another retail chain. They started me out at the same twelve an hour I was making before doing twenty times less work...


But the problem now is that I’m having panic attacks everyday. I feel forced to do this just to be able to live my life. I feel forced to do this to provide for the woman I love. And all of these things combined drive me insane everyday and I don’t know what to do with myself to cope with it. 

I want to quit, but I feel so stuck. 
I have dreams of maybe making video games someday, maybe try twitch streaming. I just want to do something with my life that I enjoy and can sustain me at the same time and I feel like I’ll never get to that point. 

Rant over. Thank you for hearing me out.",False,bixn6f,riolay,https://www.reddit.com/r/antiwork/comments/bixn6f/i_felt_free_for_seven_months_and_now_i_feel_like/,15,20
121,Why shift work can be tough on your health | CBC News,,False,bh6w2w,Shadows-of-Hiroshima,https://www.cbc.ca/news/health/shift-work-1.5103619?fbclid=IwAR00RzdPN0bYMrG5aZyrRCOeILBpptibZUE7WLJIL-zW_s5ZPL5MTT7X1Ec,4,18
122,"So I have 1 month working at a new job, and I’m already ready to quit.","So last month I got a new job as a bank teller, compared to my old job working in the medical field(I ended up figuring out the Medical Field wasn’t for me). 
 Well, being a bank teller is less stressful than working for Doctors, so that’s a plus. But as my time at the bank continues, I’m realizing I’m done with working for people. I honestly HATE it, don’t get me wrong, I love talking, I love conversations. But DAMN are all these people’s/patients/customers attitudes very entitled...so now I’m wondering...is there any legitimate good “work from home” jobs...?(US, TX)
I understand that this might not be “antiwork” but it’s still kinda antiwork in the sense that I don’t like working in public anymore...? Any help would be very appreciated!",False,bgk0uu,YOUAREHERE-,https://www.reddit.com/r/antiwork/comments/bgk0uu/so_i_have_1_month_working_at_a_new_job_and_im/,11,5
123,[x-post] The average life of a Japanese 20-year-old,"Posted by u/Syflan 1 hour ago

In my early was working in Japan. All

see are old, worn out faces of

workers, both men and women who are stuck in a culture of overcome and
hard work every day. | still only work 40 hours at most a week, some days

more like 6 or 7, but I'm done with it.

‘ve lost all the time | had to focus on

my own life, instead it's all for the sake of my job and obligations. To many
things get pushed to the side since | dont have time to sort any of it out.

Once my contract is up or | get fired

‘m just moving back home and not

working. I'll either make money for myself or just not spend hardly any.

I've thought about it a lot as I've been working the past several months; it's

 

in no way worth it to sacrifice most o
of work and money.

your day almost everyday for the sake

| don't care if I'm poor or seen as lazy to others, I'm donna spend the short

life | have rousing on my mental and

physical health and welling, work is

something I'll do for my own sake by my own accord.
",True,bhq9wz,fiskiligr,https://i.redd.it/cqv43wot7lu21.png,3,0
124,Me (the horse) trying to get through the workday,[The swamp of sadness - Never Ending Story](https://www.youtube.com/watch?v=y688upqmRXo),False,bfqjfr,blueberrypancake33,https://www.reddit.com/r/antiwork/comments/bfqjfr/me_the_horse_trying_to_get_through_the_workday/,2,6
125,A place to be critical of nonprofits,,False,bfqud7,workplace_democracy,https://www.reddit.com/r/nonprofitcritical/comments/bfqh43/a_place_to_be_critical_of_nonprofits/,2,14
126,You can pretty much get people to protest anything except the one thing that underlies all social ills: wage slavery,"The Independent: When the government says 'nah' to everything, taking direct action on climate change is the only option.
http://www.independent.co.uk/voices/extinction-rebellion-climate-change-protests-direct-action-petition-adam-boulton-a8878006.html",False,bfj9zu,commiejehu,https://www.reddit.com/r/antiwork/comments/bfj9zu/you_can_pretty_much_get_people_to_protest/,2,54
127,The True Meaning of Easter.,"An
@ThatConnArtist

AND of EASTER SUNDAY JESUS DID
RISE DECREEING THAT THE BIG TESCO
MUST CLOSE of HIS HONOUR BUT THE
EXPRESS STORE CAN STAY OPEN FOR
ESSENTIALS

16/04/2017, 10:05 am
",True,bfssbc,AccoSpoot,https://i.redd.it/ojve3x3t8ot21.jpg,0,141
128,"""Since VICE management has yet to explicitly say so, we will: VICE LIVE has been cancelled, and our union is working hard to ensure members losing their jobs get fair severance packages. Media unions cannot prevent layoffs, but they can soften the blow. Organize your newsroom."" - VICE Union","1208 He B~ + Old one

< Sweet

 

VICE VICE Union
UNION viceunion

Since VICE management has yet
to explicitly say so, we will: VICE
LIVE has been canceled, and our
union is working hard to ensure
members losing their jobs get

fair severance packages. Media
unions cannot prevent layoffs, but
they can soften the blow. Organize
your newsroom.

12:13 of- 17 For 19 Twitter Web Client

 

Sweet your reply

< © a
",True,bfsq51,workplace_democracy,https://i.redd.it/i8a4ia5p5ot21.png,2,81
129,"In the Automated Age, Democracy will need Socialism",,False,bfxf64,Chrristoaivalis,https://youtu.be/bLnQ8k82CGE,1,32
130,“National Drivers Day of Action” planned for Uber’s Public Offering Debut on 5/8 at the Uber HQ in San Francisco," 
",True,bibvf7,workplace_democracy,https://i.redd.it/s711wp01jvu21.jpg,0,7
131,Ali Wong - Hard Knock Wife (relatable)," 
",True,bi9esa,AbolishWork,https://i.redd.it/4hodg27v0zu21.jpg,1,24
132,The Man Who Inspired The Dude in The Big Lebowski Needs $25K to Pay Medical Bills,,False,biatm5,RadicalZen,https://people.com/health/the-big-lebowski-the-dude-gofundme/,6,10
133,Bullshit Jobs (book) by David Graeber,"My first post here, I just discovered this sub. 

I recently read this book Bullshit Jobs
Has anyone else read it?
I highly recommend it to everyone in this sub.
It goes really in depht to pointless jobs and why they exists. 

Personally, the book just blew my mind
I'm kind of perfectionist who would probably keep myself busy even without job, and I have been so frustrated with every single job I had. 

I'm studying programming because I think it as best way to make ends meet and have possibility to change jobs and spend longer periods of time unemployed and work at home. And I'm actually interested in it. 

I feel like all my previous jobs have just drained my energy and creativity to make something actually meaningful. Now I have been unemployed for 9 months thanks to social security system in my country and some money I inherited and never before have I been so focused on my personal goals and needs so much in my life. 

I believe this kind of chance to explore one self with enough time should be possible for everyone. I understand it wouldn't work if everyone just stopped working, but everyone should have a year in their life when they can focus on themselves and figure out a plan for their future that they don't hate.

I would love to hear your thoughts about the book or your relationship with this world where everyone is expected to grind all their life.",False,bhnp7n,S13Ni,https://www.reddit.com/r/antiwork/comments/bhnp7n/bullshit_jobs_book_by_david_graeber/,5,21
134,Mandatory 1 hour unpaid breaks should be illegal.,"You're extending the time a worker has to be at their company for a whole hour.  

Yes you can ""leave the premises"" but that just involves you taking off your uniform and commute time. By the time you get home you have to head straight back to work.  1 hour unpaid breaks are degrading and pointless. You have no time to do anything and spend more time waiting for the break to end than anything.

It's a huge waste of time and takes out any meaningful hours you could've spent at home.  Great, now instead of 3 hours of free time you will have 2 hours.",False,bhkoto,FuckWorkingAJob,https://www.reddit.com/r/antiwork/comments/bhkoto/mandatory_1_hour_unpaid_breaks_should_be_illegal/,24,151
