,title,body,is_image,id,author,url,num_comments,num_upvotes
0,"You don’t have to be stupid to work here, but it helps – André Spicer | Aeon Essays",,False,55amgx,madcapMongoose,https://aeon.co/essays/you-don-t-have-to-be-stupid-to-work-here-but-it-helps,1,7
1,Upvote if you're currently reading this at work!!,Stick it to the man bruh,False,54wjzh,GeorgeBushi,https://www.reddit.com/r/antiwork/comments/54wjzh/upvote_if_youre_currently_reading_this_at_work/,3,31
2,Congratulations! You've Been Fired | NY Times,,False,54rmhx,AbolishWork,http://www.nytimes.com/2016/04/10/opinion/sunday/congratulations-youve-been-fired.html?_r=0,2,12
3,Workaholism and Mental Health,,False,51p1dk,AbolishWork,http://abolishwork.com/2016/09/07/workaholism-mental-health/,0,8
4,A(Laurie) Penny for Your Thoughts on Work,,False,52oj7e,AbolishWork,http://abolishwork.com/2016/09/13/a-laurie-penny-for-your-thoughts-on-work/,0,6
5,Biography of Paul Lafargue?,"Is there any definitive biography of Lafargue? He was such a fascinating character, I'm surprised there arent a plethora of them...",False,52ghc4,israelregardie,https://www.reddit.com/r/antiwork/comments/52ghc4/biography_of_paul_lafargue/,1,3
6,What America Lost as Women Entered the Workforce,,False,53jnut,diversity_is_racism,http://www.theatlantic.com/politics/archive/2016/09/what-women-lost/500537/,2,0
7,"Leisure, the Basis of Culture: An Obscure German Philosopher’s Timely 1948 Manifesto for Reclaiming Our Human Dignity in a Culture of Workaholism",,False,53cum0,madcapMongoose,https://www.brainpickings.org/2015/08/10/leisure-the-basis-of-culture-josef-pieper/,0,8
8,How Companies Are Using Technology to Make Workers 'Happy' in Their Crappy Jobs,,False,51adnm,phoenix--insurgent,https://motherboard.vice.com/read/big-data-social-physics-humanyze-tenacity-employment,2,15
9,Why Your Facebook Habit At Work Makes Economists Worry,,False,51i646,phoenix--insurgent,http://tpr.org/post/why-your-facebook-habit-work-makes-economists-worry,0,1
10,"Against work, but who’s gonna clean the bathroom?",,False,54fw8j,phoenix--insurgent,http://www.luchanofeik.club/2016/09/10/against-work-but/,1,14
11,"When your boss is an algorithm: ""Algorithmic management, meet algorithmic rebellion.""",,False,520bzl,phoenix--insurgent,http://www.ft.com/cms/s/2/88fdc58e-754f-11e6-b60a-de4532d5ea35.html?siteedition=intl#axzz4JnrG2SSt,1,17
12,A world without work is coming; it could be utopia or it could be Hell.,,False,53gfkt,diversity_is_racism,https://www.theguardian.com/commentisfree/2016/sep/19/world-without-work-utopia-hell-human-labour-obsolete,2,22
13,"Death, discrimination and despair in N.J.'s temp industry",,False,53qjap,phoenix--insurgent,http://www.nj.com/news/index.ssf/page/invisible_workforce_temp_workers_face_abuse_in_nj.html,0,9
14,Workers of the world... Relax!,,False,52z3la,172917291729,https://www.youtube.com/watch?v=Ie5zO-mF31M,2,14
15,"Type, ""Going to work feels like..."" into google.","Go ahead, what is the only autocomplete to come up?",False,51w947,DontBanMeForAsking,https://www.reddit.com/r/antiwork/comments/51w947/type_going_to_work_feels_like_into_google/,3,10
16,'My shift has finished': Spanish train driver abandons 109 passengers in the countryside,,False,537tap,phoenix--insurgent,http://www.telegraph.co.uk/news/2016/09/14/my-shift-has-finished-spanish-train-driver-abandons-109-passenge/,7,21
17,is there any actual original discussion in this subreddit?,[deleted],False,538vzr,[deleted],https://www.reddit.com/r/antiwork/comments/538vzr/is_there_any_actual_original_discussion_in_this/,0,1
18,Doing Nothing Has Become a Sport in South Korea | VICE,,False,5472tp,AbolishWork,http://www.vice.com/read/doing-nothing-has-become-a-sport-in-south-korea,5,7
19,This software startup can tell your boss if you’re looking for a job,,False,51h5y9,phoenix--insurgent,https://www.washingtonpost.com/news/on-leadership/wp/2016/09/06/this-software-startup-can-tell-your-boss-if-youre-looking-for-a-job-2/,4,22
20,Why 'Modern' Work Culture Makes People So Miserable,,False,51igne,punkthesystem,http://fortune.com/2016/04/12/modern-work-culture/,0,13
21,Knocker uppers: Waking up the workers in industrial Britain,,False,51a8df,phoenix--insurgent,http://www.bbc.com/news/uk-england-35840393,0,1
22,"We need jobs because ""there are only so many video games you can play, or daytime TV shows you can watch.""",,False,50we83,phoenix--insurgent,http://www.floridatoday.com/story/money/business/2016/09/02/live-jobless-society/89768232/,7,23
23,Should a Post-Work World be Modeled on Hunter Gatherers?,,False,53vcsr,AbolishWork,http://abolishwork.com/2016/09/21/post-work-world-modeled-hunter-gatherers/,5,8
24,Against happiness | Companies that try to turn happiness into a management tool are overstepping the mark,,False,547tom,phoenix--insurgent,http://www.economist.com/news/business-and-finance/21707502-companies-try-turn-happiness-management-tool-are-overstepping-mark,0,14
25,Are we actually meant to be happy at work?,,False,537q76,phoenix--insurgent,http://www.theglobeandmail.com/report-on-business/careers/career-advice/life-at-work/are-we-actually-meant-to-be-happy-at-work/article31934038/,0,6
26,Towards a Post-Work Society,,False,53kdaz,punkthesystem,https://roarmag.org/magazine/towards-a-post-work-society/,0,13
27,"Employee badge knows where you are, who you talk to",,False,52a7n4,phoenix--insurgent,https://www.dailyherald.com/article/20160911/business/160919956/,13,18
28,People work too much to think • /r/Anarchism,,False,559z3s,172917291729,https://www.reddit.com/r/Anarchism/comments/558aee/people_work_too_much_to_think/,0,14
29,Technologically Unemployed | A Podcast for the Anti-Work Techno-Utopian in you!,,False,5533vd,AbolishWork,https://www.facebook.com/technologicallyunemployed/,4,6
30,Study finds young men are playing video games instead of getting jobs,,False,54si08,alassion,http://www.chicagotribune.com/business/ct-video-games-jobs-emploment-20160923-story.html?ref=yfp,4,16
31,Is Not Working Worse Than Working Less?,,False,54fmq3,The_World_Turtle,http://abolishwork.com/2016/09/22/not-working-worse-working-less/,9,8
32,Workplace wellness programs are a sham.,,False,51bf80,Cyclone_1,http://www.slate.com/articles/health_and_science/the_ladder/2016/09/workplace_wellness_programs_are_a_sham.html,0,13
33,Book Announcement - Abolish Work: A Philosophical Exposition of Ergophobia,,False,50ptv5,AbolishWork,http://abolishwork.com/2016/09/01/book-announcement-abolish-work-philosophical-exposition-ergophobia/,2,10
