,title,body,is_image,id,author,url,num_comments,num_upvotes
0,MFW,,False,64g0of,kijib,http://i.imgur.com/XeBnpNU.png,3,49
1,Wait for it...,[deleted],False,64lo8a,[deleted],https://www.youtube.com/watch?v=8kCbYxubO-I,0,1
2,Nike Ad Gets REAL,,False,64locl,ummyaaaa,https://www.youtube.com/watch?v=8kCbYxubO-I,1,7
3,Work Culture as a Foundation for Exhaustion Culture | Abolish Work,,False,658g5e,AbolishWork,http://abolishwork.com/2017/04/13/work-culture-foundation-exhaustion-culture/,0,10
4,Debatte Veränderte Arbeitsmoral: Es gibt ein Recht auf Faulheit [German],,False,671thv,NoeticFragment,http://taz.de/Debatte-Veraenderte-Arbeitsmoral/!5399052/,3,6
5,A Critical Review of “Should Libertarians Support a Universal Basic Income?”,,False,685orq,AbolishWork,http://abolishwork.com/2017/04/28/critical-review-libertarians-support-universal-basic-income/,0,6
6,A Socialism that Universalizes Work is a Socialism not worth Having - Abolish Work,,False,63wq53,AbolishWork,http://abolishwork.com/2017/04/06/socialism-universalizes-work-socialism-not-worth/,2,22
7,How can you survive without working?,"If were up to me, I'd just read almost all day.",False,646y5z,jointventuredan,https://www.reddit.com/r/antiwork/comments/646y5z/how_can_you_survive_without_working/,6,16
8,Fully Automated Luxury Individualist Anarchism,,False,64sch0,AbolishWork,https://c4ss.org/content/47950,0,10
9,"Many [antivirus] vendors have already moved to AI/ML models, and usually for a price much cheaper than the new ‘ML/AI only’ vendors",,False,65funz,cyber_hacked,http://www.csoonline.in/features/can-ai-and-ml-slay-healthcare-ransomware-dragon,0,1
10,A growing number of people think their job is useless. Time to rethink the meaning of work,,False,657w8v,DontBanMeForAsking,https://www.weforum.org/agenda/2017/04/why-its-time-to-rethink-the-meaning-of-work,0,8
11,A World Without Work | The Atlantic,,False,65n1qp,AbolishWork,https://www.theatlantic.com/magazine/archive/2015/07/world-without-work/395294/,3,9
12,Don’t Kid Yourself – It isn’t just the Gig Economy that Celebrates Overwork,,False,66kjok,AbolishWork,http://abolishwork.com/2017/04/20/dont-kid-isnt-just-gig-economy-celebrates-overwork/,1,10
13,Emotional labor: Politeness isn't enough; we now demand friendliness. And it's destroying authenticity | Quartz,,False,66yqfm,AbolishWork,https://qz.com/947514/politeness-isnt-enough-we-now-demand-friendliness-and-its-destroying-authenticity/,9,25
