,title,body,is_image,id,author,url,num_comments,num_upvotes
0,HAPPY WORK BIRTHDAY!!,,False,d8re5w,worldwidescrotes,https://youtu.be/Tf5Vc9gbcUU,0,3
1,Spongebob had it right,,False,d94u3u,ACIIDWIIZARD,https://www.youtube.com/watch?v=CDnNcDE3Lbs&amp;feature=share,0,1
2,"$700 million dollars today (more now) that could have given us all the means to do purposeful work and dignified lives, wasted on subjugating the rest of the world under our master's boots. For resources, for oil, for markets. All to make them richer while we wage slave the best years of our lives.",,False,d97j32,AniMerrill,https://v.redd.it/fs63xaa5qio31,2,96
3,"Well, I think I’m ready to say fuck it","
Call center job (though I am privileged to work from home as the last month) with quotas that put your job performance in the hands of others depending on if they comply with scheduling workers comp appointments..
If I don’t schedule X amount of people and work Y cases I am penalized for lack of performance. Kicker is that you can work a significant amount of cases and schedule less that a half of them. It’s dependent of if you can reach the patient, if they are willing to schedule, and a bunch of other factors like state laws. Not to mention the network loses connection so that interferes with performance. It’s just shitty.
In regards to my job, I feel like that guy from office space. I’ve been working there as my first full time job for the last year and I feel like I’m just dead inside because of it. I thought that it was the long commute wearing me down. It is actually fact that the job is a boring day after fucking day same pile of shitty work.
So, I think I’m just done. It’s boring, not intellectually stimulating AT ALL, I am stuck at a desk for 8hrs a day, the security I have is a regular (and decent) paycheck and health insurance.
I am young, smart, and well-appearing human. I feel that I am resourceful enough to make money in other ways. My boyfriend advised I can always hop on his health insurance. We’ve been together 6 years now and I’m pretty sure the only reason we aren’t engaged is due to that we have been getting out of debt for the last 2 years while also spending more than we should on little things here and there. 
Anyway,
I believe my bills are minimal enough that I could make due until November. All of my October bills are paid. 
I know I could call my creditors and let them know if I needed extension days for later in November for bills at the beginning of the month.
I live in a nice middle-upper middle class area where being a nanny and grocery delivery service person is possible.
I’ve applied back w my old part time position as well due to that the work I had there was at least bearable, though low wage.
Idk, stand-by, I’ll let you folks know how it goes.",False,d97c4v,atticus_finch25,https://www.reddit.com/r/antiwork/comments/d97c4v/well_i_think_im_ready_to_say_fuck_it/,2,7
4,I cover so many shifts a week I'm well into over-time but God forbid I ask for time off. WEEKS IN ADVANCE.,"Here's advice, do no favors for your place of work. When they find out you can't work like a mule or come in whenever they want you to you're ""replaceable""",False,d93w1i,SpicyHashbrowns,https://www.reddit.com/r/antiwork/comments/d93w1i/i_cover_so_many_shifts_a_week_im_well_into/,3,42
5,What are your guys opinions on manual labor vs office jobs?,"I worked retail, paving driveways in a family friends small company and now i work a 8-4:30 office job. Tbh i miss working outside and always being at a new house doing work everyday, working with my 2 close friends. I make about $12 more per hour in the office job but im so miserable, its becoming hard for me to even find motivation for the gym.. i still go to the gym everyday though because of the physique ive built. I cant stand fake laughing at everyones stupid jokes and acting like i care about this job, im in it for the money and thats it. Also whats with office jobs acting like middle school? “team bonding games” and what not. I might just work here for another 7 months, get my 1 year experience then quit and go back to paving driveways.",False,d93n2c,ZadarskiDrake,https://www.reddit.com/r/antiwork/comments/d93n2c/what_are_your_guys_opinions_on_manual_labor_vs/,16,14
6,Nobody should have to come to work sick.,"I'm sick. Like real sick. There's been a flu going around the farm for a week or so and it finally got me. I'm not upset with my coworkers, they need money, too. I'm angry that only a few higher ups have PTO. I'm also angry that the farm owner is also landlord to most of us. I work ten hour days just to give a significant portion of my paycheck back to this guy every month. 

I'm also upset, scratch that, I'm pissed off at the level of guilt tripping that happens any time someone can't be at work. It's an established fact that I go above and beyond to pick up other folk's slack. My bosses joke about it all the time. That sucks. Watching people who make more money than me slack off and bask in the bounty of my labor is bad for me in every way. I haven't been sleeping or eating well for months, and I weigh significantly less than I usually do. My body isn't healthy and this illness is kicking my ass. In spite of all of this, one of the guys who does have PTO made me feel like absolute shit for leaving this morning. He knows how hard I work. He knows my body isn't healthy because of the job. Still, he had to make me feel like shit after our boss told me to go home. I'm still working from home (spreadsheets for seeding, cultivation, and harvest). I'm working from home while sick, already not getting paid for two days this week, and on top of it all I feel like I'm about to have a panic attack because I don't want my team to think that I'm ""lazy"" or ""wimpy"".

I am amazing at my job. I don't deserve to be put in this situation. I don't deserve to feel this way about myself. 

This has been a rant, thank you for coming to my rant.",False,d92yqo,farmkidLP,https://www.reddit.com/r/antiwork/comments/d92yqo/nobody_should_have_to_come_to_work_sick/,8,68
7,Completely Original Solution,"Bryan Schwellinger

| love how people think their
completely original solution that they
thought of in under am hasn't
occurred to you at all since you
started working.

Justnow Like Reply O:
",True,d9oh9a,WinterTrabex,https://i.redd.it/a0p8t13wozo31.jpg,3,12
8,6:04 Competitive Smash player ZeRo talks about anti-work sentiments.,,False,d9rld9,BobbBobby,https://www.youtube.com/watch?v=LIGigsUmbnA,0,1
9,I skipped two of my three classes today to combat stress yet I still feel extremely guilty,"I have an especially brutal schedule on Thursdays: two classes in the morning, one from 9:00-10:15am and the other from 10:30-11:45am. Next, I have a gap from 11:45am-1:30pm. Last class is out at 2:45pm. Knowing that I couldn't cope with the first two, I made I deal with myself that I would wake up later and then go to the library and chill out, then only go to the last one, since I like it. 

I told my buddy I wouldn't be in class number two today and his response was ""lol does it even matter you don't ever pay attention anyway."" Like yeah, dude, I don't because I don't know what the hell is going on in the class. It goes all right over my head. I think this exchange ruined the rest of my day. He just said the root cause of the problem is my not paying attention. IT FUCKING ISN'T. I'm tired, exhausted, and dead.

I'm tired of these schedules. I'm tired of the homework. I'm mad at the job I had to get to afford nice things I'd like for myself. 

Why can't we ever rest? Why can't I ever have peace? This is not a kind of life I can keep on living without losing my mind. I feel sorry for those of you forced to work full time, because that's ten times worse than my predicament.",False,d9stcs,apsconditus_,https://www.reddit.com/r/antiwork/comments/d9stcs/i_skipped_two_of_my_three_classes_today_to_combat/,6,7
10,"How do you get up in the morning? Answer: Chuck coffee, go through the motions and don't think about your life :)",,False,d9d910,JorSum,https://old.reddit.com/r/NonZeroDay/comments/d96wdp/how_do_you_get_up_in_the_morning/,7,7
11,r/worldnews gets into antiwork discussion with a post at over 12k upvotes,,False,d9n4bw,nmkd,http://www.reddit.com/r/worldnews/comments/d9is6s/ireland_joins_international_call_for_a_fourday/,5,11
12,"In a party-line vote, every Republican Senator just voted to confirm corporate lawyer and lobbyist Eugene Scalia to be Secretary of Labor, the head of the U.S. Department of Labor.",,False,da0koa,no-militarism,https://www.senate.gov/legislative/LIS/roll_call_lists/roll_call_vote_cfm.cfm?congress=116&amp;session=1&amp;vote=00313,2,14
13,Does anyone on social media have a job?,It seems to be full of people born to rich parents who don't seem to have jobs at all. I check fb and insta on my lunch break and nobody bitches about work. All I see are pics and videos of everyone unchained from labor. Pisses me right off.,False,d9xzo9,rave2grave,https://www.reddit.com/r/antiwork/comments/d9xzo9/does_anyone_on_social_media_have_a_job/,7,31
14,Am I missing something in this Labour proposal for a 4 day work week? Throwing this out there.,"CROSSPOST: In this Forbes article, a Labour guy drops some interesting fine print in the Labour Party proposal for a 4 day work week: businesses are expected to increase productivity of labor first. 

As the article puts it:

&gt;The implementation of McDonnell’s plan will depend on companies successfully automating processes and improving worker productivity...

In other words, the Labour Party is promising that after workers have been rendered redundant by improvements in the productivity of labor, the party will allow a modest reduction of hours to four days. 

But no promise appears forthcoming on converting the increased productivity of the last 90 years into free time!

Do I have this right?

READ: This Is What U.K. Business Owners Think Of A Four-Day Workweek.
https://www.forbes.com/sites/barnabylashbrooke/2019/09/27/this-is-what-uk-business-owners-think-of-four-day-work-weeks/",False,da1vzm,commiejehu,https://www.reddit.com/r/antiwork/comments/da1vzm/am_i_missing_something_in_this_labour_proposal/,0,15
15,The process of calling in sick at my workplace,"You need to go to the doctor the first day of being sick to get a sickness certificate. So if you are so sick that you can't leave the house it's an unexcused absence. At the doctors office you have to wait 2 hours till you can see a doctor, and while you're waiting you're catching all the germs from other sick people in the waiting room that also want their sickness certificate. Sometimes I think if you're healthy enough to go through that ordeal you might as well show up to work and make everyone sick out of spite. Because I've been at my workplace for less than three months, all sick days are unpaid. 

I am thankful that healthcare is free in my country, but because going to the doctor is free, all the boss scumbags are paranoid that someone might take a sick day without being sick.",False,d9if06,Kivijakotakou,https://www.reddit.com/r/antiwork/comments/d9if06/the_process_of_calling_in_sick_at_my_workplace/,17,34
16,"Friday, day 5/5 , slow business and Bored","Sitting here at my corporate sales job , watching my boss play on his phone while I take the most bullshit calls in existence, just no motivation, don’t give a fuck about this shit anymore.  If I didn’t have bills I would be bouncing so fast .  Freest country in the world my ass.",False,da1nuh,moonheron,https://www.reddit.com/r/antiwork/comments/da1nuh/friday_day_55_slow_business_and_bored/,2,32
17,I had to leave work 2 hours early because my chest was starting to hurt badly,"When I told my boss, all he said was ""are you here tomorrow?""

I said ""yes""

And then he said ""Let us know well ahead of time if you won't be able to make it. Don't go bailing out 2 hours before your shift starts.""

I know employers and companies don't care about your health or wellbeing but he didn't have to make it so obvious lmao. What a great work culture we've created, where health problems are just an inconvenience. I don't get it. I haven't had to leave early until now, and I've always given notice way ahead of time for any shifts I won't be able to cover.

Just ranting. Laying on my bed now and hoping that this pain goes away on its own because I can't afford to go to the hospital",False,dal3lu,i-am-guy,https://www.reddit.com/r/antiwork/comments/dal3lu/i_had_to_leave_work_2_hours_early_because_my/,18,121
18,Against Dystopia: Imagining a Better World,,False,dahamp,elektrybaut_trurla,https://revolutionaryleftradio.libsyn.com/lrsh,0,12
19,Thought I'd finally found good work,"But that really doesn't exist anymore, huh? Been at a new job for roughly 3 months. It paid well for what it was, and I felt like I was getting paid fairly enough for what I was doing and I was actually satisfied about it, which I thought was surprising.

Of course, management changes just ruined all of that for me. They cut my wages but claimed I would get roughly the same amount due to tips. I definitely did not. New manager got mad at me for not coming in this Friday when I said beforehand I was never available on Fridays and even emailed her when the shift came up. She never answered me. They ended up cutting my days too, now I barely work. Whenever I try to talk to the manager I just get brushed off. I think it's time to take my leave.",False,dagibo,AmbrosiaSynth,https://www.reddit.com/r/antiwork/comments/dagibo/thought_id_finally_found_good_work/,3,34
20,"The Facebook employee who committed suicide was under a “performance improvement plan”, which is code for other to getting fired",,False,d8vsyc,Styrofoam_Boots_,https://youtu.be/VbEQriZEfoI,16,21
21,My boss says mental breakdowns help you grow,"They're a normal part of a job, so you just cry and move on!

... #killmenow",False,d8pxbt,Talkahuano,https://www.reddit.com/r/antiwork/comments/d8pxbt/my_boss_says_mental_breakdowns_help_you_grow/,14,44
22,My boss thinks it's normal and expected to work +12 hours a day and I'm pissed,"I am an hourly teacher and I have already told my boss if she schedules me to teach, it needs to be only two shifts a day, not the whole because it's too fucking tiring and I'm not a morning person. So basically everyday I work from 1:30PM to 9PM and now she wants me to cover for another coworker in the mornings too!!

When I told her ""when am I gonna sleep and rest?"" she laughed and said ""I teach EVERYDAY from 7 AM till 9PM, why can't you?"". I'm so fucking pissed. If I had another job lined up, I wouldn't even bother going back.",False,d8p0w4,naoquemvoceespera,https://www.reddit.com/r/antiwork/comments/d8p0w4/my_boss_thinks_its_normal_and_expected_to_work_12/,8,24
23,"I love how in my school they tell us that they care about us and our well being, and that they are here for us if we need help, but then they proceed to give us enough homework and stuff to study to make sure we are not okay",,False,d8k48s,974747484848483,https://www.reddit.com/r/antiwork/comments/d8k48s/i_love_how_in_my_school_they_tell_us_that_they/,14,57
24,Can I Convince HR to Just Freaking Lay Me Off?,"I honestly don't see how anyone unless they are just a social mega star could thrive in the rotten work situation that I'm in. 

I am in a small agency and our IT department is just me and two other guys.  The IT director and the network admin.  Two years ago, they changed my job role and expected me to just know this network shit when my background is data analytics and software support.  The admin began my new boss and this guy went to town uses his new found powers against me.  He would get pissed if I asked him for help on what felt like a very simple thing to him and take it out on me by writing me up if I made one small mistake.

Even worse,  I now have to submit an hour by hour log report showing that I am constantly busy.  Problem is the role has 90% downtime and they are like that's not our problem, figure out on your own how to contribute.  I'm a very shy person so getting out among the people and forging my own path is terrifying.  I feel I only have one card to play.  Convince HR that my job isn't needed and lay me off.  The anxiety over not having a clear job role plus working under this asshole boss has me constantly having panic attacks at work and calling in sick more and more.  The advice to just get another job doesn't cut it.  I've tried for years to switch jobs.  It's hard as hell to beat competition on a job interview these days.",False,d8wo6f,TWD41,https://www.reddit.com/r/antiwork/comments/d8wo6f/can_i_convince_hr_to_just_freaking_lay_me_off/,3,6
25,I am becoming increasingly depressed,"Last time I held a long term job (\~1 year) I felt what most everyone did, I was afraid of starting somewhere new and disappointed that I'd lose my free time and I wasn't exactly happy, but my displeasure plateaued after about three weeks. However, 90 days into this new job and I feel as if I'm slipping deeper and deeper every single day and I can't stop it. Every night becomes a little bit more excruciating and every morning I have to ask myself why I'm still bothering to wake up. 

I'm honestly not sure what to do, I'm at a loss. Unfortunately, I need to leave the state ASAP for numerous personal reasons as well as a strong dislike for it in general, so I need at least another four months of steady income to make it to the marker where I can leave finally. While there is a definite end goal (February of 2020), I'm becoming increasingly concerned that I'm not going to make it there. The ultimate idea is to hop to Alaska for a year or two then finally leave the country, but Alaska needs to be the first step and I'm at the earliest of steps with barely anything in my savings. I'm not sure I can endure another five months of this if the downward trend keeps going

I suppose this is just a rant/vent post but this community is the one that dragged me from the right to the left and I feel like you all understand very well.",False,d8ggy0,PigMasterHedgehog,https://www.reddit.com/r/antiwork/comments/d8ggy0/i_am_becoming_increasingly_depressed/,6,19
26,having a tough day. wrote this up on company time.,"**slices.**

\-----------------

the world is filled with beautiful things; why am i here at work?

there are books to read, food to eat, places to explore; why am i here at work?

there are people that need help. I need help. Work doesn't help. why am i here?

why?

to get money. money. i like nice food and cool things, but i am chained to it. i can't escape it.

cant i just care for my plants, read about cool things, and be with my wife and daughter?

i want to study about plants. about fungi. about weather. about computers. about statistics.

i want to ride my bicycle and learn and cook and help.

and yet I am here. working. working for a machine that will spit me out when i am no longer considered useful.

working in order to ""enjoy"" a small amount of time away from work.

working in the hope that one day i won't need to work. that i can pursue my interests solely under time constraints and not financial ones.

when will that day come? will it ever come? when will i be finished exchanging my life for money?

this exchange is leeching strength from my body, mind, and soul. when will it end?

i'm a coward because five days a week, i wake up and willingly trade away another slice of my life.",False,d8n989,curelom_herder,https://www.reddit.com/r/antiwork/comments/d8n989/having_a_tough_day_wrote_this_up_on_company_time/,4,37
27,"AFL-CIO is mobilizing around ""shorter work days and workweeks with no reduction in pay for workers.""",,False,d8pith,joonuts,https://aflcio.org/reports/afl-cio-commission-future-work-and-unions,5,108
28,Fuck this system: The Manga,"SWEETIE?
BABE
of'S

SOMEBODY
SOMETHING!

PRODUCTIVITY

WAGES

PERCENT CHANGE SINCE 1948

 

2000

 
",True,d8i1wx,YuriRedFox6969,https://i.redd.it/3a9nssdm8ao31.jpg,1,133
29,I have hope," I have hope in the young generation (my generation) that they will get fed up and do something about it ...Or maybe do nothing about it . The bullshit education systems , bankers , politicians , Housing crisis , Minimum wages that can barely support one child ..you get the point. They don't really have much to lose . If they can barely make ends meet do you really think they will care that much about modern conveniences like being able to stream 4k video. I hope they will be able to see the vastness of the planet earth and its natural resources that can be harnessed to meet the needs of everyone in their lifetime .

When will enough ever be enough ? Isn't it time that humanity sat back and enjoyed the fruits of their labor ?  Does the world truly need more engineers ? The major reason there was  a lot of progress in technology during the world wars is that before that  most people were happy with having a roof over their head , food to eat and lots of free time and new technology wouldn't affect their day to day lives . 

If the young decided not to do the grunt work of society it would simply collapse without firing a single bullet . There is no other way (See Hong Kong protests). Police would refuse to fight people seeking their freedom from bullshit laws etc.",False,d99hnn,FlatElk,https://www.reddit.com/r/antiwork/comments/d99hnn/i_have_hope/,1,9
30,The need to get a job both infuriates me and terrifies me.,"Maybe this post will be too venty, if so it can be deleted. 

I recently dropped out of college after a few talks with my dad, and he told me it would be better if I came home, and that college wasn't doing any good for me. I'm incredibly grateful that my dad is so kind, but on the day I came back, he told me about a job prospect he heard about. I just brushed it off at the time, but internally I felt terrified and almost shut down. I've had 3 jobs before, all of which were in fast food, so obviously they were awful, but that's given me a lasting impression and has made me absolutely terrified of any sort of job. I tell him that I feel this way, and he just doesn't get it. He tells me that he found having a job at my age was liberating, that it gave him purpose. I tell him I feel the opposite way, and he tries to argue with me, trying to convince me I somehow don't know what I'm feeling. I think he's doing his best, but it's like there's a barrier that prevents him from considering that I have a different opinion. I feel trapped and scared because I have to get a job in order to achieve my dreams, but I don't want to.  


I guess there's no real end message with this post, just me getting my thoughts out there.",False,d9aowh,Diabeerus,https://www.reddit.com/r/antiwork/comments/d9aowh/the_need_to_get_a_job_both_infuriates_me_and/,13,65
31,Student loans are basically potentially decades long labor contracts,,False,d8shlc,YuriRedFox6969,https://i.imgur.com/tPt5QQ3.jpg,11,184
32,Fuck this lib shit.,"Why crying employees can
sometimes be a sign of a
healthy workplace

Last Company / by Dizzy Will / oh

 

Occasionally crying at work is normal—
and can sometimes indicate an honest
work culture. But there are some best
practices to follow when dealing with a
worker’s tears.
",True,d9fruz,YuriRedFox6969,https://i.redd.it/xg773qcltvo31.jpg,34,203
33,"updating resume, cover letter","it makes me sick figuratively speaking. also my lower eyelid is literally twitching right now as I'm writing this. it all feels so fake, I hate it. technically I have zero work experience bc I'm finishing university right now and I didn't need to work until recently. so beside my studies and 1 summer job and 1 internship I can only list my abilities which is not much honestly, just the usual bullshit. bc I had been educated in art and art history (I know, I know) and now I'm just trying to get a shitty office job. (btw these jobs usually list ""no experience is required"" so that shouldn't be a problem). 

but gosh I hate this. I looked up resume examples, keywords and only picked out the ones that are mostly true about me. b**ut it still feels fake**. 

bc it is fake honestly. yes I'm genuinely caring and empathetic person. but that's when I see someone cry, or there's someone that needs some support, they could be strangers and I would still care. hell I have approached a crying girl before asking her if she is alright even though I didn't know her. but I'm not caring or empathetic when it's an entitled customer who gets off on verbally abusing employees.",False,d9ke4a,raindampened,https://www.reddit.com/r/antiwork/comments/d9ke4a/updating_resume_cover_letter/,3,7
34,"If working wasn’t mandatory just for you, how would you spend all your days?","I like to fantasize about a world where I’m not forced to work, but everyone else is. So I’d be the freest man in America.  

I’m curious how everyone would spend their days of freedom. Would it lead to madness? Would it lead to enlightenment? Discuss.",False,d99jup,Lamentably,https://www.reddit.com/r/antiwork/comments/d99jup/if_working_wasnt_mandatory_just_for_you_how_would/,12,6
35,Asshole boss is upset because an employee he forced to come in with a migraine won’t contact him back.,,False,da94ld,BadWordBadWord,https://www.reddit.com/r/RBI/comments/da8d9k/unable_to_contact_no_show_employee/,8,28
