,title,body,is_image,id,author,url,num_comments,num_upvotes
545,I have a good job. But still hate it.,"My current job don't have much pressure. I love what I'm doing. Getting paid above average.

But the concept of working 40 hrs a week for somebody else's dream makes me tired everyday. I hate when I shower every morning and commute so I can go and make money for others with my knowledge. I literally hate Monday mornings. 

I realized that we've been trained like monkeys from childhood itself to work for rest of the life.

If there's no concept like Job, I'll do the same work but for good purpose and with love. I'll takes rest in-between my work like an hour, a day or even months before resuming the work. There'll be no weekends. The very concept of weekends need to die. Everyday should be relaxing and rewarding to us. 

It's all the fucking capitalism that makes us hate everything about this world.

Technology, science, schools are beautiful when they are not plagued by capitalism.

Yeah this post is just my random thoughts. Because I'm at work living someone else's dream so I can survive.",False,d1o0z4,0nm201wasb,https://www.reddit.com/r/antiwork/comments/d1o0z4/i_have_a_good_job_but_still_hate_it/,54,135
546,resignation card/poem.,,False,d40rit,YuriRedFox6969,https://np.reddit.com/r/LateStageCapitalism/comments/d3f4hw/my_nieces_resignation_cardpoem/,0,3
547,"So, what do you want to do with your life?",Fast forward a few decades. You're wrapping up your affairs and dictating your memoir so that there will be some record of who you were. What would you like the memoir to say?,False,d3v471,AuthorTomFrost,https://www.reddit.com/r/antiwork/comments/d3v471/so_what_do_you_want_to_do_with_your_life/,9,3
548,Strikkkkeeeee !,,False,d41hqj,anonymousguy271103_1,https://www.reddit.com/r/Showerthoughts/comments/d3ty0r/no_ones_ever_changed_the_world_on_40_hours_a_week/,0,24
549,Thought this would fit here,,False,d45ck3,logan-is-a-drawer,https://www.reddit.com/r/Showerthoughts/comments/d43xft/looking_for_a_job_is_about_convincing_a_bunch_of/,0,24
550,Christian Sharia Law,"ACLU @
@ACLU

BREAKING: The Department of Labor
just proposed a rule that aims to let
government contractors fire workers
who are LGBTQ, or who are pregnant
and unmarried, based on the
employers’ religious views.

His is taxpayer-funded discrimination
in the name of religion. Period.

10:05 of - 8/14/19 - Twitter for shone
",True,d38v8a,YuriRedFox6969,https://i.redd.it/vrwrzrq8d6m31.jpg,10,161
551,"French court rules fatal heart attack during sex on a business trip as an occupational accident. Employer owes now surviving family workman's compensation, which is 80% of salary until retirement.",,False,d32ql3,YuriRedFox6969,https://www.linkedin.com/pulse/arr%25C3%25AAt-cardiaque-dun-salari%25C3%25A9-apr%25C3%25A8s-une-relation-sexuelle-sarah-balluet,3,26
552,most of white collar jobs requires a college degree,"I am 100% convinced that i was born semi-retarded. i don't understand how ppl are able to keep up, when someone gives me an instruction, i have to ask 3-4 times just to understand it. i can't even put a coherent sentence together. the most basic skills, communication. i have hard time figuring it out. 

i don't understand how, someone retarded like myself could ever learn, accounting, math, programming, science, etc. am i retarded or everyone else so freaking intelligent now days. so only jobs left for me are labor jobs, which is hell no. i'm not doing that again. i think the world is too advance now, retards like myself are here to suffer",False,d2kqqn,oranranpea,https://www.reddit.com/r/antiwork/comments/d2kqqn/most_of_white_collar_jobs_requires_a_college/,30,36
553,Sad but true,"rocket

 

@tweetsbyrocket

society: work hard and you'll get rich
real=a he) a <morel cell

lokexstowm (e[-Neck sofa]
",True,d4asmw,lrlOurPresident,https://i.redd.it/24yp0adcpim31.jpg,10,252
554,My transformation after months of reading this sub,"Hey all,

So I've always had a hard time holding down jobs. I've always thought I was, well, a workshy loser who can't copy with the modern world. It only takes me so long before I stop working at the pace required by management, or answer back to a manager and piss them off.

So I stumbled across this sub and found people who are like me. Honestly it's been fucking amazing. 

So I started reading the sidebar texts and find myself agreeing with most of what I'm reading. And now I'm starting to wonder - holy fuck am I an anarchist? Have I been one for years and not realized it?

Is this why I can't thrive in the corporate system? I know there is something deep inside me that reacts immediately and sometimes intensely to tyranny. 

Now I'm starting to think that maybe I'm just suffering the bad luck of being born into the wrong system at the wrong time..

Anyway, thanks guys for this. It's an amazing place on the internet.",False,d3y3aw,tomsmith856,https://www.reddit.com/r/antiwork/comments/d3y3aw/my_transformation_after_months_of_reading_this_sub/,38,30
555,Elon musk is an asshole,He says he works 100 hours a week and that he suffers more than his workers. He says if you can't put 100 hours a week into work you don't deserve to be successful.,False,d4isfd,BabylonianSorcerer,https://www.reddit.com/r/antiwork/comments/d4isfd/elon_musk_is_an_asshole/,65,144
556,Haha such banter!,,False,d4qtu5,tomsmith856,https://www.reddit.com/r/AskReddit/comments/d4kj3a/if_naming_your_child_after_a_company_came_with/,3,7
557,"Traffic wise, who thought having most of the population going to and leaving work at the same time was a good idea?",,False,d3nvpn,notrox,https://www.reddit.com/r/antiwork/comments/d3nvpn/traffic_wise_who_thought_having_most_of_the/,31,89
558,pretend v2.0 - corrected - now with properties &amp; interest rates!,,False,d4phnk,prometheussf,https://www.youtube.com/watch?v=_3E-653YzVo,0,10
559,"There will come a day where all the people involved in creating and maintaining this rat race will be dead. Shortly after, there will come another day where all the rats wonder why the hell they’re racing.",,False,d3xvxz,MetalNickA,https://www.reddit.com/r/antiwork/comments/d3xvxz/there_will_come_a_day_where_all_the_people/,7,43
560,Post here today if you’re at work AND on the clock!,Don’t post if on break or lunch. Wasup dudes!,False,d29hw2,etoxQ,https://www.reddit.com/r/antiwork/comments/d29hw2/post_here_today_if_youre_at_work_and_on_the_clock/,12,13
561,Your thoughts on this situation,"An illegal immigrant i work with is getting paid 20$/hr for doing less work than me should i report her, confront my boss who is very aware of her immigration status, or leave it alone and be happy with my shittier pay?. 5 years ago i started work for a construction company that gets goverment contracts to work on huge building (cant be too specific in case someone i know gets on this sub) anyway when i got the job the boss liked me and decided to pay me 15 instead of 10 and put me in charge of 6 other workers the work was a piece of cake nothing but easy work, im not a lazy person and im not proud to say this but i took hella advantage of my place, i would tell each person what they needed to do for the day and after getting everyone settled i would tell them i needed to do ""paper work"" go find an empty room turn off the lights and chill or sleep till lunch. Then after lunch do sum work and just supervise and make sure the work was getting done. Fast foward to last year my boss hires this lady in her 30s not knowing the kind of person she is i offer her sum pot im also a fucken cannabis user anyway this rat tells on me and also along the way finds every error and exaggerates it to my boss in order to make herself look better well it worked for her because know i have to work 55+ hours a week while she only work 40 but still gets paid more than me, im just not in a good mood because of this and needed to tell somone thanks for reading i would appreciate to read your thoughts on this",False,d1tq4o,mangomandingotu,https://www.reddit.com/r/antiwork/comments/d1tq4o/your_thoughts_on_this_situation/,7,0
562,Is there a job you'd want if you could mostly just do the fun pat of it?,What would that job be?,False,d4gqhl,yadayadawhatnow,https://www.reddit.com/r/antiwork/comments/d4gqhl/is_there_a_job_youd_want_if_you_could_mostly_just/,10,1
563,Why are so many people content with the 40 hour work week?,"I just found this subreddit and I'm so happy to have come across a place that shares my feelings about work. Since graduating High School I've worked minimum wage jobs because I had no interest in spending any more time in school. Even with a degree I would still end up being somewhere I don't want to be for 40hrs a week so what's the point? Just to make more money? There's no guarantee even if I do go back to school. 

I've left multiple jobs because I couldn't handle the full time schedule of 5/8's (five eight hour days). I live at home and my parents expect me to either work or be in school full time and either way I suffer. Along with not having enough free time when I'm working I also can't get over the feeling of my life vanishing in front of me as I work my ass off. It's like I'm trapped with no option but to tread water and try not to drown in my own thoughts.

What's even more baffling is it seems like everyone is completely fine with how things are. Almost no one is proposing a shorter work week or even talking about the value of time outside work. Everyone I know criticizes me for my issues with the standard work week.  It's like capitalism has created a society that believes work comes above all else. In the end what's the point?",False,d1zx3f,FallOutFighter,https://www.reddit.com/r/antiwork/comments/d1zx3f/why_are_so_many_people_content_with_the_40_hour/,49,89
564,We’re literally being scammed out of living.,"*Rant*

Imagine having to go to school (a full time job) and do what a bunch of people tell you while simultaneously hushing you. Then go to college (a full time job, that you pay for and if you miss too many days you get dropped.) To MAYBE get a job that MAY pay you a living wage let alone a fair one with the ability pay off your debt from the aforementioned college.

About 90% of the people that are telling you what to do and how to do it are incompetent and stuck in traditionalist ways because it’s “easier that way.”

We’re being indoctrinated, literally being turned into GDP and for what? A chance to make someone else successful and hope they treat us like we’re at least human?

Everyday I feel like living is a mistake.

*End Rant*",False,d1q0fx,MittenstheGlove,https://www.reddit.com/r/antiwork/comments/d1q0fx/were_literally_being_scammed_out_of_living/,250,959
565,Free Talk Friday [2019-09-13],"Stickied 'Open mic' thread.

Do us all a thought. Post anything that doesn't quite deserve its own thread. Rant and vent, or ask questions.

&amp;#x200B;
 
Also, we are looking for moderators. No prior mod experience required, no CSS knowledge needed. What's important is that you're respectful to sub members, that you're not new to the subreddit, and that you're willing to use reddit chat to communicate mod-stuff.
 
Sounds good? [Message the mod team](https://reddit.com/message/compose?to=/r/antiwork), or contact me or u/AbolishWork or any other active mod.",False,d3kjl6,onedayitwillbedaisy,https://www.reddit.com/r/antiwork/comments/d3kjl6/free_talk_friday_20190913/,46,8
566,Gut-Wrenching Anxiety Before Work,"Anyone else get  this debilitating anxiety before you go into work?

Like, my stomach feels like it’s eating itself. Frankly; my dietary habits have been awful forever but since starting work again I don’t even take lunch, but I’m not hungry when I wake up.

Like... I wake up and just wonder what the fuck am I even doing? I think about why on Earth I am letting some fucking company dictate when I go to sleep and need to wake up in order to remain “productive,” when they can’t even fucking make a coherent schedule. Which I can’t completely blame them for, they’re human too.

All the same though, I’m sitting here providing PC’s for a Shipyard to fuel the military industrial complex so they can build “100,000 tons of diplomacy.” God, those posters annoy me. So I don’t even feel good about what I’m doing.",False,d3nup7,MittenstheGlove,https://www.reddit.com/r/antiwork/comments/d3nup7/gutwrenching_anxiety_before_work/,8,31
567,"This world is a joke, a bad bad joke"," 
 

one BigKidProblems
BED) @BigKidProblems

=>

Have fun at work today and remember
there are 7 year old playing with toys
on YouTube and making double your
annual income in one month
",True,d1u5vb,foljack,https://i.redd.it/k0tscufaull31.jpg,65,1549
568,An inspiration to us all,,False,d3cdc0,tomsmith856,https://youtu.be/R7OAmrQis0M,4,9
569,"A Positive, Uplifting Story About My Antiwork Hero Housemate","I thought I'd share a positive, uplifting story about a guy I used to live with.

The guy works in an Amazon Warehouse. He was a quiet Romanian lad who played computer games and liked smoking weed. Nice guy who enjoyed making music.

One day, he comes back home, knocks on my door, and enters my room to see me playing on my PS4. So he asks me what games I want to play next. I told him that I am looking to buy the new Assassin's Creed.

He comes back the next day with a copy of Assassin's Creed, and gives it to me. I ask him where he got it from and he tells me not to worry. I then offer him money and he refuses it. I don't ask anymore questions and put the game on.


He knocks on my door again a few days later, and asks me if he can test a game on my PS4. I say fine, and he continues to test random games on my PS4 for about a week.


I've realised that he is obviously stealing games from work, and ask him wtf is going on. 


He says he is stealing, because 'if they won't give me a payrise I'll just give myself one. He then shows me the ten PS4 games in his backpack that he had stole from work that day. He was selling them online, I think. 


The guy was an absolute hero. A gentleman and a scholar. ",False,cyfvm6,tomsmith856,https://www.reddit.com/r/antiwork/comments/cyfvm6/a_positive_uplifting_story_about_my_antiwork_hero/,9,74
570,HaPpY LaBoR DaY!!,,False,cyqh4v,ptfsaurusrex,https://i.imgur.com/L31WSeq.jpg,0,7
571,Working for peanuts,,False,d1brh3,kyabupaks,https://imgur.com/HmtoH1v,23,1242
572,About to lose a job offer because previous employers aren’t responding to reference requests...,"I’m not even trying to gain personal references here! All they need are standard references to confirm what I’ve been doing for the past three years. After dropping out of uni, all I’ve done is short-term work, so trying to gain references from the university itself, along with the employers I had afterwards is proving to be very difficult. 

It’s honestly ridiculous, and the first time I’ve been asked to do this. Usually they just want one academic/employment reference, and a personal one. 

I requested a proof of student status from the university which was meant to arrive via email within 5 working days. It’s been well over a week now. I’ve now requested it via post. 

I called HR for one of retailers I worked for (three different stores over the past 3 years) but was unable to request a generic reference for 2 out of the 3 times due to not knowing the previous employee numbers.

Previous boss for another employer no longer works at the company anymore, and I’ve been unsuccessful in contacting HR to gain a reference. 

The only reference I’ve been able to gain so far is for another retailer that has an automated online system which generates a generic reference once you provide your name and national insurance number. Didn’t even need an employee number!! 

I don’t even think I want this fucking job anymore. It’s for a stupid, low-paying apprenticeship which probably isn’t even worth all this stress. I rejected an offer for a higher paying retail job for this! I would’ve been working there for the past two weeks had I accepted. And I really need the money...

I thought the apprenticeship would be a good opportunity to do some academic work again whilst earning money, and would look great on my personal statement when I go back to university in the future. It’s in business administration, which sounds about as stimulating as watching paint dry...plus I hate office work and how stagnant it can feel...but it involves liaising with hospital workers, occupational therapists and nurses which, I guess, loosely relates to my future plans to work in healthcare. 

I’m broke AF and have debts to pay, so I applied for a couple retailers last week (two I previously worked for) and have have managed to secure an interview for both. Again, both of which pay much more than the apprenticeship. 

I know the apprenticeship is a decent opportunity... but fuck, I’m tired of struggling. I need money for an ADHD assessment, after which I’d like to have driving lessons again, pay off my debts, raise my first year tuition fee for uni, save for a future holiday, etc. I’m kinda tired of retail, but the department stores I’ve applied for do pay more, and I’d have the option to do overtime to make more money in a shorter amount of time. 

They ideally want me to start the apprenticeship on 16th but I highly doubt I’m gonna gain any more references than what I have right now. They won’t take me on unless they gain all my employment history from the past three years, so looks like that offer’s down the drain!!!

Sorry for the rant guys, just needed to blow some steam",False,d1a9k7,glowmilk,https://www.reddit.com/r/antiwork/comments/d1a9k7/about_to_lose_a_job_offer_because_previous/,4,12
573,Thursday is the best day of the week,"Just one day left, I can do this. Friday is ok, but two days rest are not enough. There is no way to enjoy a glass that is half full when it's 5/7ths, 71% empy from the start. Spend Saturday and especially Sunday sitting around depressed, with the occasional escape fantasy. Monday through Wednesday just infernal internal screaming. Repeat.",False,d1c8ze,Kivijakotakou,https://www.reddit.com/r/antiwork/comments/d1c8ze/thursday_is_the_best_day_of_the_week/,2,12
574,What the fuck? Like... What????,,False,cyu39l,Amnoon,https://youtu.be/8DMc3UF9jw0,8,10
575,I'm sure this has been posted a million times. But..,,False,d153bi,Wutthefukevr,https://images.app.goo.gl/4sk41BwRBkdLofEL7,0,1
576,Stupid manager,"I've talked about my manager to my parents and they say she's a bad manager. She criticises me but it seems more like an attack on me personally. A month ago I had to tell her 4 times that I was going on holiday before she changed my shifts cause she kept forgetting. She puts me on at night on my own to close up the shop and it's my first job and I've been there a month! I'm worried that some man could attack or rape me cause I'm a young woman and I'd be alone and vulnerable. Also I could fall and become unconscious and no one would be able to help because they wouldn't know and customers wouldn't be able to get into the store to help cause there's a lock on the door. And I'm worried about someone robbing the place or trying to get in when we're closed because customers have got into the shop twice when we've been closed! I'm not allowed a friend or family member in the store to keep me company and help me feel safe cause they have rules against it. She could easily put me on during the day or on days when there's two people on but she gives the shit shifts to the new trainees. She's also got my coworkers to soy on me which I think creates a very bad environment and I know I can't trust them. I only like two of the people I work with and one of them is leaving soon.

Then today my manager was telling me to pack out the fridge and she gave me the heavy stuff to do when I told her a few weeks ago I find it difficult to lift. I've been at work 3 nights in a row and today I had an 8 hour shift on my feet nearly the whole time. She asked what my plans for the weekend are and I was thinking you actual bitch! You took up my weekend with work! I'm too exhausted to even do anything on Sunday and my whole Saturday was taken up by work. I really hate my manager and I can't wait to get another job.",False,d13axz,Honestopinions5,https://www.reddit.com/r/antiwork/comments/d13axz/stupid_manager/,7,4
577,I really chuckle when I see crappy ex-employers getting publicly dragged on Glassdoor,"Like, you know it was a shit place to work. But when you see dozens of similar reviews from other employees and ex-employees all saying the same thing as you, you feel kinda validated.

I like to hope it's making it harder for that employer to hire people lol",False,d0z00x,Dan_85,https://www.reddit.com/r/antiwork/comments/d0z00x/i_really_chuckle_when_i_see_crappy_exemployers/,2,48
578,"No, THIS is the real Antiwork Anthem",,False,d15uw2,RetardedGirlPussy,https://youtu.be/eeea43Q2Wss,0,7
579,[RANT/PSA] A message to managers...,"I know you have goals and our performance determines your reputation in the eyes of your boss/corporate. 

That doesn't mean you have to be on their side.  If you scratch our back, we will scratch yours. It's really that simple. We're both stuck here working our miserable insignificant lives away so that we can afford to live. Why not make it easier for the both of us.

I was manager for a small computer repair business for about 3 years. I treated my employees like one of the guys and they did the same for me. I got their back when they made a mistake. They get mine when I have performance goals for them. It was simple. Easy. And we understood that we are all human, and all want to go home. I just don't understand manager culture.",False,d0mw9u,kennyFACE117,https://www.reddit.com/r/antiwork/comments/d0mw9u/rantpsa_a_message_to_managers/,2,18
580,Oh fuuuuuuuuck where are the 1.5m?,"honey, tell me what's wrong

  

By workers and | produce
$3,000,000 worth of goods
every year, the materials and
utilities cost $800,000, the
tools cost $200,000, and all
of us combined get paid
$500,000, which means that
there's $1,500,000 being
paid to someone who didn't
contribute to the work at all.

 
",True,d01emy,Bobz666,https://i.redd.it/9i0b8w605rk31.jpg,14,213
581,Google contract workers vote to form a union amid employee discord over treatment,,False,d04bzg,WinterTrabex,https://www.washingtonpost.com/technology/2019/08/30/google-contract-workers-vote-form-union-amid-employee-discord-over-treatment/,3,48
582,"Got a job at a place I thought I'd love, but nothing changed.","I'm 22M and haven't gone to college yet, so I've been working minimum wage jobs on and off. Always part-time because I know full-time makes me burnout and fall into a depressive hole. 

I recently got hired on at a local family-owned adult/smoke shop. We sell bongs, pipes, smokes, dildos, all that fun stuff. 

I thought this job would be great for me because I love the store, and it would be more bareable knowing that I'm not helping a CEO make millions.

It's only been two weeks and I already hate it. I'm still getting that dreadful feeling the night before I have a shift. My social anxiety keeps me from having fun with coworkers. On top of all that we're having huge money issues and the little I do make has to all go towards bills. I have no spending money for myself and it's bringing me down hardcore. 

If this job that I thought I'd love is still shit, who's to say the job I get after college won't be shit too? I don't think it ever gets better.",False,d0kkxm,WinterSkyWolf,https://www.reddit.com/r/antiwork/comments/d0kkxm/got_a_job_at_a_place_i_thought_id_love_but/,8,13
583,Workers are investing their lives in a game of start-ups.,,False,czygp2,Aqua_lung,https://www.reddit.com/r/fatFIRE/comments/czq39y/angel_investing_is_rationalized_gambling_that/,2,8
584,Idle Theory,,False,d0ezpf,MakeTotalDestr0i,http://endgame.co.uk/idletheory/,0,4
585,"Working is turning me into someone I hate, and I don’t know what to do anymore.","I used to be a very kind and empathetic person and now I’m so bitter and feel myself becoming misanthropic. I’m only 24. I have cptsd as well as adhd and navigating the work world with that in top of no college education is a nightmare.

  I work a lot of customer service and food service jobs, right now I’m a barista. The sad part is that I work for a small business that makes good money but the owner is constantly fucking us over. No health insurance, minimum wage and he actually got into trouble for paying people under the legal minimum wage. 

  I just can’t do it. Like I don’t want my life being like this",False,czcsqr,takethepiss95,https://www.reddit.com/r/antiwork/comments/czcsqr/working_is_turning_me_into_someone_i_hate_and_i/,10,65
586,Correct answer to this interview questionV,"I interviewed at some agency and one of the questions they asked me was “if you were asked to do something outside your job description, how would you go about it?” In my head of course im saying well fuck off cause im not getting paid enough for what im actually assigned anyways. Instead I say, well if its something small then I guess I just do it, but if it is something major we will have to talk about it... I wonder if they wanted a total slave answer.",False,czs88j,commandolandorooster,https://www.reddit.com/r/antiwork/comments/czs88j/correct_answer_to_this_interview_questionv/,2,6
