,title,body,is_image,id,author,url,num_comments,num_upvotes
353,Get a 2nd shift job if you can.,"Everyone is different, but let me tell you this experience, I’m working 8 to 4 30 right now and previously I was in a warehouse working 2 30 to 10 30. I miss those hours dearly. 

The free time works out the same, but here are the major positives imo.

Depending on your commute, there is no traffic.
You can run errands in the morning instead of places closing in the afternoon.
But here is my favorite reason, even though the free time works out the same, when you wake up, you aren’t immediately thrown into jump up and get ready for work.

There’s something about your free time being before work that feels amazing. Whether it’s because you technically get to sleep in and can mentally prepare yourself, Idk.

My friend wants and is getting to 1st shift which is 6 30 to 3 30. I don’t think he realizes just how tired he is going to be after work. The main reason why he is switching is because he doesn’t like that is whole day is gone. I’ve tried to explain to him that his day is over no matter what when he goes to work. But who knows, maybe it works out better for him.

For me. Being able to stay up to 5 am and then wake up and still not need to rush to work, or going to bed naturally and waking up with a time to do things before, was a blessing.

Fuck 9 to 5.",False,d8976a,PussyLunch,https://www.reddit.com/r/antiwork/comments/d8976a/get_a_2nd_shift_job_if_you_can/,9,46
354,Is death a reasonable alternative to a workless life?,"Now I’m not entirely sure if this is what this subreddit is about, but I’ve seen the different lifestyles people have.  I’ve seen the cog-in-the-machine slaves, I’ve seen homeless people, and I’ve seen people who freelance, and I’ve watched their freelance jobs destroy them, just like the cog-in-the-machine jobs.  All of those lifestyles are hell.  Here’s the thing; I’ve been contacted by what I believe to be inter dimensional beings separate from the demiurge slaver god.  They’ve told me that if I destroy my physical body on November seventh (commit suicide), I’ll be able to escape this hellhole that is planet earth and go to a relative paradise, without the sadist demiurge or the slaver pseudo-humans.  I just wanted to get your opinions on this, maybe some alternatives, because I am a pussy and killing oneself is hard.

And just so you know, the suicide hotline only exists to allow the rich to keep their wageslaves and taxslaves alive as long as possible.  Don’t try to report me or anything like that, that’d just make you a hypocrite.",False,d7zi9j,ICFAOUNSFI,https://www.reddit.com/r/antiwork/comments/d7zi9j/is_death_a_reasonable_alternative_to_a_workless/,26,21
355,"Worker: Commits Suicide on the Job. Facebook: ""Passed Away at Menlo Park HQ""","Facebook Worker Lies After Jumping
From Headquarters Building

enter Hurt Manner and Sarah Order
Bloomberg September 18, 2019

(Bloomberg) — A Facebook And. employee has died after jumping
from the fourth floor of one of the company's buildings at its Teno
Dark, California, headquarters.

‘A Facebook spokesperson confirmed the incident, and said the
company plans to contact the worker's family. A press release from
the City of Teno Dark said there was “no foul play involved
involved in this apparent suicide.” The employee was pronounced
dead at the scene, according to the city’s police department.

‘He were saddened to learn that one of our employees passed
away at our Teno Dark headquarters earlier today,” a company
spokesman said in a statement. “He're cooperating with police in
their investigation and providing support to employees. While the
",True,d75l2p,YuriRedFox6969,https://i.redd.it/yivzdueccvn31.jpg,7,64
356,Wasn't sure where else to post this,"32
Meritistittttiststitit
-apobacsssssccosssssnsoessssaas:

secnssescescsanoscsosses!

etsrrirstistirtistiett

o Doessessasesssccaes:

Saaeesenss!
peSSSceescescnscsccacossocs:
Seesscesessessnes:
Siteeccoccsesacs:
eSieieraccessnes:
aopenspneceseosesscscooscncooes!

_

:

 
",True,d8ca1u,xSKOOBSx,https://i.redd.it/4loc4s4wjeo31.jpg,29,893
357,My therapist thinks a job would be good for me. Uh...,"Oh boy, here we go.

My therapist thinks that a job would be good for me. As in, good for me mentally. That is just so crazy to me that a therapist would think that. And she talks about it like jobs are a great thing that everyone should have.

Of course working 40 hours a week for the ruling class is good for me mentally /s",False,d7xkkz,saturdaynew,https://www.reddit.com/r/antiwork/comments/d7xkkz/my_therapist_thinks_a_job_would_be_good_for_me_uh/,2,2
358,"""We provide Snacks and COFFEE""","Another one of these startup job ads that seems like satire, but is actually real.

&gt;Culture Fit

&gt;We have a small team and we LOVE working with each other. We want someone who wants to fit and grow with our culture.

&gt;This includes working hard, not being afraid of trying anything, helping each other out when needed, and being POSITIVE. Positive energy is big here!

&gt;Salary: Commensurate with experience

&gt;Here's what we provide

    &gt;An office conveniently located downtown
    &gt;Snacks and COFFEE
    &gt;The opportunity to work with a team of amazing people in an entrepreneurial, forward thinking environment
    &gt;A dog friendly office
    &gt;Incredible social events

Oh they provide **COFFEE**.  How generous of them.  Wouldn't want employees ducking out for 15 minutes for a bit of air and a break while they get their coffee from an outside place.

""Dog friendly"" but is there actually a dog?  Are you actually allowed to pet it?  I'll bet someone in that office needs the emotional support of a dog.

The whole thing is here:


https://www.lucova.com/careers/listings/6J1E8M",False,d6v6el,candleflame3,https://www.reddit.com/r/antiwork/comments/d6v6el/we_provide_snacks_and_coffee/,19,29
359,We’re a society full of workaholics living in denial of widespread misery,,False,d7tkv2,JustWantsHappiness,https://www.reddit.com/r/Showerthoughts/comments/d7ol8f/our_world_may_be_much_worse_than_we_realize_since/,4,53
360,At every job I’ve had...,,False,d6e1go,BadWordBadWord,https://i.imgur.com/XTWhix3.jpg,13,101
361,What’s a good job for drifters?,,False,d7kzd5,Keyboardtyper57,https://www.reddit.com/r/antiwork/comments/d7kzd5/whats_a_good_job_for_drifters/,5,6
362,I started a work from home position,And now I just don’t want to work! Lol like what the fuck guys.,False,d87xut,atticus_finch25,https://www.reddit.com/r/antiwork/comments/d87xut/i_started_a_work_from_home_position/,12,11
363,Are we supposed to just kill ourselves if we find the idea of working 8 hours a day 5x a week unacceptable?,"Because I am sitting here just relaxing and enjoying myself but, I know eventually I'll have to go back to work. But, here's the thing. I never see myself being truly happy if I'm chained to the same monotonous routine for 8 hours a day? Because to me that seems like a fate worse than death.  To live in a world where you can be stimulated constantly easily and then being forced to do something that is so completely boring,repetitive,and slowly watch your life flash before your eyes seems worse than eternal nothingness to me and it pisses me off that's what's expected of me. So what am I supposed to do? Keep on grinding and eating myself to death so that I don't need to wait as long for it to be over?",False,d7w8om,ODoyle_Rules88,https://www.reddit.com/r/antiwork/comments/d7w8om/are_we_supposed_to_just_kill_ourselves_if_we_find/,58,193
364,GM Retaliates Against Striking Workers' Kids,,False,d8845d,YuriRedFox6969,https://www.youtube.com/watch?v=E0HWFNcvViA,1,18
365,If he gonna spend money while at work wtf is he there for... ugh this is big cringe. Fake or not.,"karl Iv
OEM real-rule]

B(S(ce l= \val@n A ellarclamualcne| in
Slave-(omoymanlowlanlialenecl men <-ole
(o{=Roi[saline melon sal-her-\seal(=merit=)¢-(e He)
pay for it. The told him “I HaVE A
BOyfRIEnd”.....and the cashier left
told her “I'm trying hurry home and
the]To aesvelant=mieleltey=]| A malelmer=i()
your broke ass. ® @®

11:16 of - 9/20/19 - Twitter for shone
",True,d88eru,firefly6345,https://i.redd.it/lqdwteue8do31.jpg,8,70
366,"Join Childcare, they said. It'll be fun, they said.","Incoming rant, but I feel like I'm losing my sanity here.

Since the start of this school year, the business I work for has been turned upside down due to building work in the place that we rent. We've been squashed into a room which is half the size of our previous room, and our previous room wasn't big enough to begin with. The children hate it, the staff hate it, we all bloody hate it.

In particular, the children who already work hard to control their emotions are struggling more now than ever. Every day now, we have one child *at least* having a meltdown. The inspiration for this post, in fact, was that today, a child retaliated to me asking him to sit with the other children by throwing a plate at my head and calling me a twat. 

I've come home crying more days than not this month, purely from either stress or fatigue. My body aches all the time, and all I ever do now is work, eat and sleep. The worst part is that I understand their frustration but there's nothing that I can do to help. This is our situation for the next 6-12 months.

Anyway, I've been flicking through this subreddit today and I've related to a lot of the things you guys have to say. So I want to say thanks, because it means I'm not alone in what I'm feeling right now. Which is 'work fucking sucks'.",False,d89dse,vario_,https://www.reddit.com/r/antiwork/comments/d89dse/join_childcare_they_said_itll_be_fun_they_said/,6,8
367,Quit my job this weekend,"I quit my job this weekend. I'm a student, so it was more possible than it might be for most. The only reason I quit is because they lied about the responsibilities and underpaid me.

It was a remote transcription job where productivity was clocked. It was so monotonous. I had to buy wrist braces and blue light filter glasses too because of the wrist pain and eye strain. And I had to take at least a five minute break every 20 minutes, unpaid so as not to affect productivity. And the breaks literally consisted of staring at the ceiling to try and avoid too much eye strain.

An 8 hour task took at least 10 hours if you accounted for breaks. After taxes, I was making like $6 an hour, so I quit with no notice. It felt great to quit but now I have to find another job and I don't know where to work. I cannot wait until I graduate so I don't have to do minimum wage jobs, hopefully.",False,d8a46o,MartyMartinMartini,https://www.reddit.com/r/antiwork/comments/d8a46o/quit_my_job_this_weekend/,2,12
368,I’m sick tomorrow.,"Fuck it. I’m calling out tomorrow and taking a 3 day weekend(off sundays and tuesdays). I just started 2 1/2 months ago and have consistently been short staffed due to the two experienced people who are supposed to be training me going out on vacations a total of three times now for a week or more at a time, and this week, one was sent to a convention and one took a week off for her birthday. I spent all week playing catch up and fixing mistakes I haven’t been trained on well enough. I’m mentally exhausted. They don’t pay me enough and don’t offer health benefits. I’m spending my “sick” day applying for new jobs. And also fuck working on Saturday.",False,d7wj7v,floatingdandelion,https://www.reddit.com/r/antiwork/comments/d7wj7v/im_sick_tomorrow/,14,70
369,Give me a 4 day week already.,"Working 40 hours to far to much, should be maxed out at about 25 hours a week and then I could make more time for reading and exercise. 

If I'm selfish for wanting to enrich my own life and mind then so be it.",False,d84e6p,SearchLightsInc,https://www.reddit.com/r/antiwork/comments/d84e6p/give_me_a_4_day_week_already/,30,167
370,Redditor dismantles the establishment using the Flintstones,,False,d77xi3,orqa,https://i.imgur.com/k1nTA1Z.png,19,833
371,Satire isn't too far from the types of speeches I've heard across my various jobs.,,False,d61xms,azulhombre,https://i.imgur.com/i5jqNhd.jpg,31,1478
372,"My employer considers using most of your sick leave ""abuse""","Examples of sick leave abuse may include, but are not limited to,  the following: 

1. Any pattern of sick leave usage, such as the use of six days in a six month period, one or two  days at a time. 

2. Habitual sick leave absences on Mondays, Fridays, and/or the days immediately before and after  holidays. 

3. **Any employee who has no significant accumulation of sick leave after at least three to five years  of service, without sustaining a major illness during that time period.**",False,d61psu,harmreductionista,https://www.reddit.com/r/antiwork/comments/d61psu/my_employer_considers_using_most_of_your_sick/,18,52
373,Jobs that don't suck the life out of you,"As much as I hate to say it, some of us just can't afford to quit our jobs and enjoy life. Do you guys have any jobs that are less soul-sucking?",False,d8fw7f,I_am_catcus,https://www.reddit.com/r/antiwork/comments/d8fw7f/jobs_that_dont_suck_the_life_out_of_you/,16,11
374,"""I hate work. I hate this entire system.""",,False,d57z61,Sorroow,https://www.reddit.com/r/depression/comments/d509d2/i_hate_work_i_hate_this_entire_system/,21,66
375,"One of the greatest scams capital ever pulled was convincing us that the time we spend commuting, cleaning, cooking, doing laundry etc. is not ""work"" but ""free time""",,False,d5e53c,Regicollis,https://www.reddit.com/r/antiwork/comments/d5e53c/one_of_the_greatest_scams_capital_ever_pulled_was/,52,405
376,"AI Is Coming For Your Favorite Menial Tasks - As AI gets better at performing routine tasks traditionally done by humans, only stressful ones will be left. The work experience could suffer.",,False,d1p0u3,BlackHorse2019,https://www.theatlantic.com/ideas/archive/2019/09/artificial-intelligence-will-make-your-job-even-harder/597625/,1,17
377,Saving up for a down payment on a house so I can mostly leave the system,"Looking at cheap mobile homes and small houses in my area. I turn 19 next month, no credit and still living at home with parents. Found a decent mobile home with a small plot of land for $67,500. A couple cheap condos for $65,000, and a couple cheap houses in the $75-$90k range. With a 20% down payment I'd need between $13,000 and $18,000 for the prices I mentioned.      
  
I currently have $7,250 in the bank due to my saving habits and no current bills except for gas and car insurance. I have a shit job that I've been at for 2 months with a 53 minute commute one-way but it pays $12/hr vs. $7.25 being legal minimum wage, $9.50/hr being local economy. I figure I can probably save up for the $67,500 down payment in roughly 5-6 months  + whatever closing costs. I'd want to save up for a little bit after too to have more of a cushion. After that, my mortgage payment, property taxes, and home insurance would be roughly $304 (according to Zillow). Add electricity, water, sewage, garbage, food, internet, etc., and maybe it'll be an extra $500-$600 a month. After I pay the mobile home off, all I have is $19/month ($228/year) for property taxes. As long as I pay that, I have a house. + The other bills that if I get fired or take some financial hit, I could hold off on a bit.      
  
I think it's a decent plan. Once it's paid off, I'd only need a minimum amount of money and could live somewhat free. I can tell you I'm serious when I say I don't wanna work the rest of my life or work to live paycheck to paycheck. Work will just subsidize my bills and I'll hopefully be much more free.    
Of course all financials are speculative, could be more, could be less. I'd hope I could get a nice first time buyers loan or some help from USDA (though I heard they don't do mobile homes). This is my dream to not have to work myself to death. There's not a big point to this post but I wanted to share my steps I'm taking to leave the work life.",False,d231rv,IhateJobsAlot,https://www.reddit.com/r/antiwork/comments/d231rv/saving_up_for_a_down_payment_on_a_house_so_i_can/,0,1
378,The Beach Bum: All Play and No Work,,False,d24j7g,iron_dwarf,http://frame.land/the-beach-bum-all-play-and-no-work/,3,6
379,"You all hate being hired and working for someone, so what if you guys try to make your own business? Just a idea for you guys",,False,d26z7b,brageevjen,https://www.reddit.com/r/antiwork/comments/d26z7b/you_all_hate_being_hired_and_working_for_someone/,12,0
380,How do you guys expect the world to function if you could chose right now how everything would work?,"If feels like you guys think the world and job part is wrong, so how could it be right i your opinion. And if nothing can be done, then why do you guys just adapt instead of complain, maybe start your own business or something. I don’t understand the goal you guys have.",False,d273ni,brageevjen,https://www.reddit.com/r/antiwork/comments/d273ni/how_do_you_guys_expect_the_world_to_function_if/,2,0
381,We lost to our own hubris,"© David Stains @

4 @DavidOAtkins

Of you told a person in the 1950s
that in 2020 housing would cost
(o)V{=1 to) b e) in large la al=mere) (=e [-mele|(e
take a lifetime to repay, families
could barely make do even with
mon working, we were locked

in endless wars, & got was
paralyzed by crisis?

They'd assume we lost the Old
War.
6:22 of - 05 Rep 19 - Twitter for Android
",True,d21awk,JeffreyDhmer,https://i.redd.it/5c94q6d91ml31.png,10,106
382,Using money to determine human value is wrong,,False,d2zewk,nbatman,https://www.reddit.com/r/unpopularopinion/comments/d2zeu6/using_money_to_determine_human_value_is_wrong/,2,20
383,Fuck recruiting agencies,"Lying recruiting bitch told me I was gonna be making $50,000 as an accountant. Turns out I'm actually making $39,000. I hate this bullshit. I have no idea who lied but I want to get back at them. Should I just quit without prior warning? Can't even make a decent living with these boomer scumbags lying through their teeth and making living near damn impossible!",False,d301p4,Usual_Passion,https://www.reddit.com/r/antiwork/comments/d301p4/fuck_recruiting_agencies/,2,20
384,I've only worked one day at my new job and I'm already miserable (vent/seeking advice),"I was fired from my last job at a jewelry store about 3 months ago (the week of my birthday) for being ""too awkward,"" and I was honestly quite devastated as I really liked working there. I thought I'd get really depressed and suicidal after a couple of weeks of job hunting/unemployment like I usually do, but these past few months have turned out to be some of the best in my life. I've been learning about homesteading and gardening, and making plans with my boyfriend to get a small house and large plot of land so that we can eventually live off the land. We've managed to grow cucumbers, green onions, potatoes, garlic, and even an eggplant on our apartments like porch, and that filled me with a different kind of joy and hope, like maybe I could really get this going and spend the rest of my life gardening for a living. I was the happiest I've ever been in my life, I think.

I finally managed to find a job, which I was somewhat excited about because we could finally start saving money for a home. My first day was yesterday, and even though it went smoothly and I like my coworkers, I cant help but feel nauseated at what I'm doing. I'm working for a business founded by a certain Uncle Sam, and I hate myself for it. I cried for the first time in a long time yesterday night, and today I feel like I cant bring myself to even get out of bed. Its like several years of progress with my depression were reversed in an instant. 

I suppose what I want to know is if anyone has any tips for staying positive/not horribly depressed while working so that my boyfriend and I can actually achieve something that we want in life.",False,d393sd,MorriganSavage,https://www.reddit.com/r/antiwork/comments/d393sd/ive_only_worked_one_day_at_my_new_job_and_im/,5,3
385,What’s a really horrible job that pays a lot so you can work less hours?,"I’m talking about graveyard work or things people don’t want to do so the pay may be better, so I can work less. 

All work is intolerable to me so might as well just go “high risk” to get paid more and work less. 

Any ideas?",False,d3aevs,Addomit,https://www.reddit.com/r/antiwork/comments/d3aevs/whats_a_really_horrible_job_that_pays_a_lot_so/,15,11
386,Got sent home earlier today after a 3 and 1/2 hour shift because the store was slow today.,"That seemed like a reasonable work day. About a half hour more would’ve been a reasonable work day, but that’s about all I can stand without it seeming extremely excessive.",False,d3g4yd,RetardedGirlPussy,https://www.reddit.com/r/antiwork/comments/d3g4yd/got_sent_home_earlier_today_after_a_3_and_12_hour/,1,16
387,"My position is replaceable, my dogs are not.","I recently moved into a new house with my two senior dogs after I had just lost a dog at my last house due to a tragic accident. I moved over my weekend and only been here for less than than 24hrs with my dogs. My dogs are used to free roaming a house, whereas this one I have to keep them in my room while I’m away, which makes sense as there’s about 4 other dogs that live here. One of my dogs is blind, the other is developing cataracts and is hard of hearing, therefore they take a little more time to adjust and get used to a new place. They’re whining even when I’m in the room, and pawing at the door, which only gets substantially worse when I leave my room. I’m trying to get a day off so I can spend the day with my dogs, helping them adjust, however my employer is trying to tell me that I need to come in. It’s not a busy night, I’ve worked a shift very short staffed on a busier evening, so I know it’s doable. What’s the difference between me calling in to take care of my dogs - my family, vs me calling in sick with the flu? At the end of the day, my position is replaceable. They can manage without me for one evening. My dogs, however, are irreplaceable and I don’t want them stressed, screaming (one whines/howls very loudly when he’s locked in a room and doesn’t have me around (PTSD from previous owners) and the blind one follows along with it)  and pissing off my new roommates and getting off on the wrong foot. 

I’m stressed out and I’m losing sleep over a job, which is fucking ridiculous because it’s such a small request. I’m gonna get into shit if I no-show, and I’m gonna get into shit if my dogs are howling for 7 hours.",False,d2pt3y,avoqueen,https://www.reddit.com/r/antiwork/comments/d2pt3y/my_position_is_replaceable_my_dogs_are_not/,5,27
388,I think this song will be appreciated here.,,False,d2p6fo,Runningoutofideas_81,https://m.youtube.com/watch?v=WdXsrrxymT8,2,3
389,it's a hyperproblem,"at

#2 m GLOBALER KLIMASTREIK ™ GREVE MONDIALE &

™ MOVILIZACION MUNDIAL POR of CLIMA m 2ER@(R2E

) 4 { he 4 a
GLOBAL CLIMATE\ STRIKE W 2380/4282 = MOVILIZACION MUNDIAL POR of

WORK
SUCKS

VOUT)
i I Of 00 TORNADOES

of i

GLOBAL

CLIMATE

 

-IIIGOW # WITH! ANLNN VGSF # LVWITD 371 YNOd AIVIGNOW JARY9 # HISYLSVWITN YA1VEO19 & VWIT9D

SyINLS SLVWI19 1vg019 # £—of Saw -oe = VWI19 013d SIVa019 oySvz
",True,d2lt86,Hightowerin,https://i.redd.it/b8junkrr3rl31.jpg,1,1
390,Commuting is cruel and employers should pay for it,"Employers should pay commuting time. This would encourage more employers to offer work from home options especially in the knowledge economy.

** I spend 5 hours a week commuting X 52 weeks a year = 260 hours Per year commuting.**

**That is 10.8 straight days a year spent commuting to and from a job that I could entirely do from home!**",False,d2csjn,etoxQ,https://www.reddit.com/r/antiwork/comments/d2csjn/commuting_is_cruel_and_employers_should_pay_for_it/,50,132
391,This parent gets it!,,False,d2zq0m,strawberry_apple,https://www.reddit.com/r/Parenting/comments/d2viyd/i_tried_using_a_school_fundraiser_to_teach_my/,1,29
392,A billionaire lecturing a peasant on the virtues of 'zero-hour' contracts (when a person is employed but guaranteed zero working hours and often forbidden from holding any other job),"Word Sugar @ v
@lLord_Sugar

Correct me if |am wrong you chose to work zero hours
and you knew the rules. of you try hard enough and
perhaps reduce your self importance expectations you
might accept a Full time job .

@ UnionBrews @UnionBrews - For 19

Replying to @Lord_Sugar and @jeremycorbyn

I've worked zero hours. I've been called as | was leaving the house for work and
told that I'm not required on that day. It’s worse now than ever. Cry engaging

with people and listening to their stories. You will learn a lot when you stop
seeing them as “jealous loses”...

12:41 of - For 19, 2019 - Twitter for had

295 Retweets 2.Of Likes
",True,d2yh0x,YuriRedFox6969,https://i.redd.it/f7zn9es7n1m31.png,4,30
393,Early mornings were designed to crush creativity,"Seriously, have a new song but can't finish it now due to early rise. I'm already up way too late and will be wrecked either way tomorrow, the muse will be lost in any case. Haven't written anything in a year. Early mornings are intended to prevent dreaming and coming up with stuff late at night. There is no virtue in the early rise, quite the opposite.",False,d2gt6v,TheCassiniProjekt,https://www.reddit.com/r/antiwork/comments/d2gt6v/early_mornings_were_designed_to_crush_creativity/,12,45
394,20 hour shifts when you have 2 kids in diapers? That's what confidence feels like. ™," 

 

 

Ready

of Health for you

  
     
   

VACh lee signs
2 kiss in
else} else

01010) 4
late)athlete|=

 
 

'D.com/Healthcare of

 
",True,d2c7d8,themistocles16,https://i.redd.it/gnngzsizatl31.jpg,18,45
