,title,body,is_image,id,author,url,num_comments,num_upvotes
173,"I'm giving up, don't know what to do.","Hi, I'm a 21 years old developer.  
Unfortunately I had to quit school when I was 15, and I started working for many companies as a web developer.  


I rarely got a job for more than 1 years, just because I used to get bored very quickly and got to change job (and sometimes even technology/skills).  


On February of this year I became a freelance, and luckily I found one big company that sometimes assigns me tasks, bug fix etc. to do, so I can earn some money, but it's not enough for me.  


I lived my whole life with a dream: building something mine online, no matter what it is: a casino, a game, a popular software, I just wanted to start earning passive income this way, and I kinda did it when I launched a BTC faucet back in 2017 that got 67k users (unfortunately I realized that's not a sustainable business and I had to close the website after a year).  


I feel like I'm walking in circles, and now I'm back to that point where I need a job and money, but at the same time I don't want to say bye bye to my free time, to my daily not-stressing routine.   


Everytime I think about working in a company I get anxiety. I'm just starting hating everything about IT.  
I don't know what to do next. Every developer I see has a full time job and he's ok with that, but I'm not. Last night I googled everywhere to find a community of developers who don't have a job (lol, I don't know why, I kinda what to see people without a job earning money by projects etc) and I failed to find it (maybe because everything I want is fucking utopia).  


I'm sorry for the outburst, also this is my first post in this reddit community, hope you will enjoy my company here.  
(also sorry for the english, I'm not very good at writing, I'm uneducated).",False,day2zg,MrAntipathique,https://www.reddit.com/r/antiwork/comments/day2zg/im_giving_up_dont_know_what_to_do/,7,17
174,Arrested for Being Poor,"America is trash. Must look at this |
headline. His man has a wife with stage
4 cancer, left his kiss with the neighbor
babysitting (who has babysat before),
neighbor left the kiss unattended, and
they are trying to charge him with child
abuse. Luck this headline & picture!

of {U of m (else- He) ak - MGielelen el alelelsicelal

D¥-To r-Exert\-X-10 To) ma (-t-\VA1 ale of d(of-M-]1 of] all-mr-le[-ms}
late)and=u=](e)al=icon al-merely](e Felo meme) s mr-] ones To More)
VAIN WATS)

 
",True,db3rus,hibiscus38,https://i.redd.it/ylydmrzu97c21.jpg,14,148
175,Being a bro in a dystopian capitalist nightmare,"   

» Did Northern Ireland see
Tuesday at 23:48 -@

  

a
—

Today | watched one of your till staff pay for an elderly
man's shopping from his own wallet. | don't think the man
was aware that his card kept declining and didn't seem to
understand that the staff member had paid for it as he didn't
say thank you, he just walked on with not a word. But | saw
it. | saw him discreet pay and sat back down at his till like it
never happened. | wanted to let you know that this is one of
the kindest acts I've seen from a staff member ever. It was
in your Connswater branch just after am. It would be nice
for him to hear a thank you that he didn't get from the
customer he helped.

of® 2.k 286 comments k shares
",True,dad45a,speakinginparticles,https://i.redd.it/neck0dwl68p31.jpg,17,215
176,"(NOT SO DYSTOPIAN) Working Futures, An Anthology Of Speculative Fiction About The Future Of Work",,False,dbj611,commiejehu,https://www.techdirt.com/articles/20190925/16122343069/working-futures-anthology-speculative-fiction-about-future-work.shtml,2,2
177,Applied for disability the other day,"So the long and the short of it is I was in the workforce for about 10 years, during that time I managed to develop an issue with drink, severe anxiety, and major depression. I kept telling myself to man up and keep pushing on despite the abusive shitty work environment and I kept going back to due to golden handcuffs(Good pay, free benefits). I kept telling myself I was the problem and I just needed to get better, constantly pushing while society and everything around me kept pushing the idea of ""harder, faster, better, stronger"".

When I moved out of my parents house I used to be able to talk to anyone, had hundreds of aquaintances, many friends, many ambitions, the whole lot. By the time I realized I had developed all these problems I had lost all the friends I made by my own doing thanks to putting work and advancement first and this idea I had in my mind about being better thanks largely in part to my parents and upbringing. 

A few years ago I decided to move back to my parents but by that point I was completely far gone. I was struggling with total sobriety, replaced alcohol with weed, the anti depressants I was taking in my opinion made me worse, and overall completely lost my control over life. I sold my condo, my cars, and just about everything I had and was still left over with about 20k in debt. At this point the stress was crushing, my parents and brother kept telling me the only way to get better is to get a job and I was coming completely undone because I had been ran so ragged trying to ""make it"" and ""get better"". 

That's when I had a total mental break, I was smoking weed daily at that point, cut my anti depressant cold Turkey, and out of the blue one day I started believing and doing some crazy shit. Without getting into too much detail, I ended up arrested for felony trespassing because I went into someone's truck thinking it was my own. After being released from jail I had a couple of nice stays in the mental hospital which only made things worse and that's when I got diagnosed as bipolar. 

It wasn't until this point that my parents realized I needed help and were finally willing to somewhat let me back in. Nowadays I'm almost 30, on probation to get the felony off my record, back on anti depressants, and now have a mood stabilizer added to the mix. I have no more emotion other than the occasional anger, no more ambition to do anything, no more willingness to find a partner, and after lurking reddit and seeing the state of the working world it's clear things are only getting worse.

My family and my psychiatrist are convinced I'm bipolar and the only treatment is these meds, after my history there's no way in hell I think I'd be able to find another conventional career, and I have no where else to go. So I'm claiming bankruptcy for the 20k, I'm already on medicaid, and now hopefully I will be granted disability. I don't have the power to stand up for myself anymore and I've completely been backed into a corner. 

Nowadays life ain't so bad, I've got a roof, bed, and food. I play video games, drink coffee,  enjoy my last vice(cigarettes), and ride my motorcycle daily as my therapy. I still have dark thoughts most days and what I see online mostly just reinforces them but I get by. I stay sober(2years now) and don't fear any of the stuff I used to that gave me anxiety. Bad credit? Dont care, can't afford a house on a single income anyway. Dont care about cars anymore like I used to. Health insurance? Dont care, hoping to get cancer by 40. Work history and how good I look on paper? I blew that up, with any digging into my medical history I will never get a job. Partner? Had plenty of those, never panned out, wont get one with my current status and the one good/bad thing the meds do is kill my sex drive. 

So I guess the point of this post is this, if you feel you need to keep pushing, deep down you can't stand life the way you're living it, don't do what I did and damage yourself beyond repair. Get out while you can, if you can and don't ignore your inner voice. Had I done that I don't think I would be where I am today. They sell you this idea that something is wrong with you and you are imbalanced when in reality if there truly is an imbalance its because of the way we are living not because there is something physically/mentally wrong with us. Also be careful who you talk to and what you say, in my desperation I tried to look to doctors and police for help and that only sunk me deeper both spiritually and financially. Be careful who you trust. 

Also I felt like putting these thoughts out there just for someone else to see as I spend most days in solitude and I am not in a position to speak to my family without them jamming their opinions and advice down my throat. Right now I am just doing what I need to in order to have my basic needs met because that's all I CAN do. 

I know I'll never be who I used to be thanks to the wonderful experiences I had, and there's tons more I could go on about, but I'm hoping someone out there can read this and it will be a catalyst for some self preserving action. Don't let your the mold they want you to fill destroy you like it did me. Thanks for reading!",False,dbksea,TheDoctorN74,https://www.reddit.com/r/antiwork/comments/dbksea/applied_for_disability_the_other_day/,5,8
178,Employers ask about references to make sure you remain a slave,"Sorry for my poor English, I'm French. One of my friends lives in the US and  basically he told me that when you're looking for a job, your future employer usually asks for 2-3 references from past employment. I was shocked! Is it the Gestapo?! What if your manager hated you? I guess you guys need to be very submissive to make sure that you get good references in case you want to quit. What a joke of a system! Past employers can say whatever the hell they want! 

We don't have that requirement in the French system, employers don't ask any references. They just ask for a copy of your diplomas to make sure that you're qualified.
Although we're still wage slaves with a high unemployment rate, at least we can tell our employers to go f*** themselves when we quit.
That's what I did 3 years ago, it was so funny! I also locked up my manager in her office at lunch time and threw the keys in the garbage bin. She was so abusive with her staff, she got what she deserved. She tried to involve the police, they couldn't care less since there was no physical damages lol! 
My current employer doesn't know about it and will never know.",False,dbj4y9,DSibling,https://www.reddit.com/r/antiwork/comments/dbj4y9/employers_ask_about_references_to_make_sure_you/,33,118
179,This is GHETTO!,,False,daq215,RoyalWeirdo,https://v.redd.it/kbqnurv1dgp31,99,228
180,What is a good way to mess up workplace without getting in trouble?,"I hate my job and the people I've worked with and I want to give them inconveniences, so fat I've spat on the toilet paper, put a fee things in the wrong place and turned some bottles the wrong way. Is there anything else I can do that's legal to make inconveniences for the manager tomorrow?",False,day04s,Honestopinions5,https://www.reddit.com/r/antiwork/comments/day04s/what_is_a_good_way_to_mess_up_workplace_without/,10,0
181,I just had a revelation,"Employer: You are paid what you’re worth.

Me: Okay, I want these days off.

Employer: No, you have to work those days.

Me: But you just said I'm being paid what I'm wor—

Employer: You’re fired.",False,dazj5q,TheBountyHunterIX,https://www.reddit.com/r/antiwork/comments/dazj5q/i_just_had_a_revelation/,2,22
182,My work just announced mental health sickdays must be signed off by a mental health professional..,"In my country it is workers rights to be able to use sick days for mental health reasons if you need to. 

Now my workplace has said ""because it takes its employees mental health seriously, we will request a signed document from a mental health professional that we have sought consultation""

Well two issues

#1 most mental health people are booked out days in advance

#2 it costs at least $75 for one hour.

Well my workplace has offered kindly to help with #2 by way of a loan which you can pay back from your wages over a few weeks

How kind",False,db5mtj,Alexasissy,https://www.reddit.com/r/antiwork/comments/db5mtj/my_work_just_announced_mental_health_sickdays/,10,54
183,How the fuck do I deal with this working depression?,"I already have enough on my plate with school, and I have to now get a job. I will occasionally breakdown from time to time just because of school, let alone work. How do I get rid of this depression?",False,daqu2c,Phantomblujay,https://www.reddit.com/r/antiwork/comments/daqu2c/how_the_fuck_do_i_deal_with_this_working/,24,16
184,Calvin knows,"CALNIN DOESNT
WANT To LABOR

 

 

 

 

 

 

 

 

of'S SICK of WORKING
ALIWE TIME! of MATES,
COCRERATING WITH ALL,
THE OTWER ANTS!

THE GENEF\T of THE
SOLON / HES of

« S
WONDUAL “WITH
WIS. of of

'AND DESIRES!

 

 

CALVIN THE FLEA SUCKS THE BLOOD of HIS
ANGRY HOST of, PARASITIC. CONTENTMENT?

 
",True,d9ut2r,mcrp1234,https://i.redd.it/leabqvjx42p31.jpg,1,6
185,Job is a vacation from poverty.,"HEY, BOSS,
of of GET VACATION DAYS?

    

YOUR JOB ISA VACATION --
FROM POVERTY.
",True,dba0f7,mynamenotavailable,https://i.redd.it/kz3gx8f3tpp31.jpg,139,1527
186,The Caste System,"What do y’all think about the caste system?

The idea is most well-known from its Indian variation, but it is attested to in the following sources:

• Hinduism (mentioned above)
• Iran (Zoroastrian myths about Jamšid, the Avesta, and it is an idea attributed to some Sasanian kings)
• Plato
• Medieval Arab–Jewish Philosophy (Alfarabi, Avicenna, and Maimonides, but particularly Alfarabi and Maimonides)
• Islam (see _Hierarchy and Egalitarianism in Islamic Thought_ by Louise Marlow)
• Traditionalism (particularly Evola, but Guénon, Schuon, and Coomaraswamy, all paid lip-service to it)

It seems pretty universal. One striking thing about medieval mythology, particularly its European variant, is the consistency of ideas across cultures; for example, the French, the English, and the Irish all possess similar themes when it comes to their knightly or aristocratic mythologies.

Good resources on Indian caste system: _Śūdras in Ancient India_, by Ram Sharan Sharma, and _Caste and Religion in Ancient India_, by Jayantanuja Bandyopadhyaya.

It seems like there was a natural tension between those predisposed to, and capable of nothing more than, productive labor, often called _śūdras_, and the “ruling class,” characterized by chivalry on the one hand (the “warrior”), or ascetic knowledge (the “priest”), or sometimes both, combined.

Our modern labor system is tellingly not the product of any one individual or group of people engineering it. It seems like the world at large simply lazily allowed the situation to progress this far, without anyone trying to exercise any agency to stop it. If you think about it, a large group of people letting whatever happens, happen, is actually the very definition of chaos.

I guess my question is: how do we reinstate the caste system? A system characterized by such a hierarchical dimension, and subsequent confinement of individuals to their natures and roles, is what Alfarabi called the Virtuous City (see Antony Black’s _The History of Islamic Political Thought_).

Without controlling the masses; by arbitrarily allowing people to accumulate wealth and start businesses (especially people who are not qualified for leadership or commerce, i.e. the _vaiśya_); without controlling women (separate topic, but somewhat related); by letting who Myatt called the Magian and Homo Hubris, or who some people call “normies,” completely dominate the cultural sphere, and its accompanying confused philosophy; by allowing democracy to exist as a form of government; by relegating all questions to indeterminacy via postmodernism, all we do is allow chaos to rule.

Certain people have certain natures and temperaments, other people have certain exaltations, and still others have deficiencies. These realities cannot be erased, as their variancy is natural and therefore part of nature. To ignore them is to abolish what is natural, and to usher in what is unnatural. Not everyone is an “employee” and(_śūdra_) by nature, but our society force-fits people into that role.

Religion should inform public life, people should not drink or have extramarital sex. But secularism and scientism undermine the ability of religion to control people. The very fact that people vocally disagree about so many cultural and social issues, already means that _someone_, _somewhere_, is wrong. People are not unified in their beliefs and aims, there is therefore conflict.

How do we once again institute these traditional laws into society, in a practical and forceful manner?

How do we arrest the creeping tide of time, and prevent impersonal slavery, wanton lust, shallow philosophy, pseudo -“spirituality” (characterized, perforce, by Western Buddhism), abject lust,  and general ignorance, from wreaking havoc on the world?

Corrupt regimes in Africa commit genocide and starve people. Young men in America voluntarily shoot strangers and casual acquaintances, and then themselves. Women, as a political and cultural monolith, have more power than ever before, and contraception, normalized extramarital sex (dating, hookups, Instagram, and so on), and the push for abortion, only seek to enforce this. Men are now more variegated, more atheistic, humanistic, skeptical, and intellectually lazy, than ever before. People crave wealth, or they crave power, or they crave fame, and subject to rulership by their desires, the whole of society is then ruled by people, ruled by impersonal forces. This manifests as an impersonal sense of slavery, subjecting everyone unnecessarily to its non-discriminative tide.

How do we stop this?

Armed rebellion?

Quitting work en masse?

Rhetoric?

Thinking through history, I am reminded that there are very few cases of things changing for the better, without forceful and sudden revolution. In fact, history is very bloody. The world, at the moment “incomplete,” cannot be without conflict. Therefore the apparent lack of conflict in certain sectors of the world, is just that: an appearance.

Wasn’t the U.S.A. founded on a revolution? When has anything ever changed for the better without forceful and sudden revolution?

Or is there another way?

I feel that rhetoric will only be “Judo-ed” by the collective ego of most people. Changing the status quo is difficult... without changing the status quo.

Let me know your thoughts.

I know, and care very little, about any kind of political philosophy from the time of the Renaissance, or the Enlightenment. My concern is mainly reinstating the caste system, from the first principles put forth by thinkers like Alfarabi and Maimonides, and secondarily, Plato. I do recognize that the entire system was encapsulated and manifested within the summary Epic, the _Mahābhārata_, and subsequently elucidated in the Purāṇas.

Let us turn back time!",False,d8y11i,avengerofhusayn,https://www.reddit.com/r/antiwork/comments/d8y11i/the_caste_system/,44,0
187,Anyone else find it crazy how many people commit suicide over financial troubles/stress?,My parents friend hung himself a few years ago because he was in serious debt from his business not doing well. He left behind a young child and a wife. I did some research and this isnt uncommon.. fucking crazy what world we live in where money literally rules our lives,False,d8qc9u,ZadarskiDrake,https://www.reddit.com/r/antiwork/comments/d8qc9u/anyone_else_find_it_crazy_how_many_people_commit/,40,120
188,Manager just asked someone if they could delay their retirement,"This happened a few hours. So the VP, frenetic, work-obsessed, type-A personality walks in to Jim’s office. Some background: Jim is 72, had cancer a while back, is suppose to retire in a month and has been planning a move with his wife.

So the VP walks in and asks Jim if he can postpone his retirement until February 2020. I looked out the side of my cubicle for a second and expected an argument of epic proportions! If I was that close to retiring after 40 years of working I’d have some choice words. Not just an extra day or week but to wait three more months. 

But he casually just says “sure.” 

What the fuck?!?! 

Even if it was the best fucking job on the planet, I’d still say no. 

Can anyone explain this behavior because defies logic? 

The only thing I’m thinking is he afraid of losing the retirement if he doesn’t say yes. He just postponed all the plans he and his wife had been planning without even taking a day to think about it.",False,d54feu,Wantsahusky,https://www.reddit.com/r/antiwork/comments/d54feu/manager_just_asked_someone_if_they_could_delay/,18,60
189,Kickstarter is union busting,"  

Not the Same v
taylordotbiz

His morning, after six years of pouring my life into the
mission, the staff, and the creator of @kickstarter, |
was fired for organizing a union. They offered me no
real reasons, but one month's severance for signing an
NDA.

| will not be signing it.

4:17 of - Rep 12, 2019 - Twitter Web Pp

792 Retweets Of Likes

 

(9) of 9 nay
Not the Same @taylordotbiz him v
Replying to @taylordotbiz and @kickstarter

Last week another member of the organizing committee, @ClarissaRedwine
was also fired, and today a third prominent member of the union was told
there is no place for him at the company. | stand firm in solidarity with my
friends and colleagues.

Of to 75

 

B

  

Not the Same @taylordotbiz
The union bursting campaign that Kickstarter management is engaging in is
illegal and wrong. It is an unforgivable abandonment of the values of an
organization that | have loved and served with my whole heart.

Of to 88

him v

 

 

Not the Same @taylordotbiz- him v

large the Kickstarter staff to unionism, sign that petition and exercise your

right to a more fair and equitable workplace. On't let what happened to me
happen to you, You deserve better. UNIONIZE!

2 1 96 of.

 

a
",True,d57lhn,tomsmith856,https://i.redd.it/7ifonj6byzm31.jpg,0,191
190,Steve is right though," 
 

WooolITS FRIDAY!
You EXCITED?!

 
   
 
 
  

  
    
    
   
    
     
      
        
    
   
 
   
 

ANN ExciTEMENT FOR
“ERIDAY’ ONLY PROVES THAT
You'He of UNWITTING SLAVE
To THIS SOCIAL CONSTRUCT
of CALL ‘THE week.
FRIDAY Of NOTHING BUT A
FALSE HOPE, DESIGNED of
distract You from NOTIGNS
THE MACHINE SILENTLY

OPPRESSIN G YOU:
You'He Must A HAMSTER

of A WHEEL LINDA, TOO
EXCITED of “eriDaY of
NOTICE YOU'of of A CAGE,

   

his Of WHY NOBODY
LIKEs You STEVE.

ce °
",True,d5b9jw,roidsnveg,https://i.redd.it/6s5phmfm51n31.jpg,12,126
191,why work so hard just to make some rich idiot richer,"[{ WAY WORK of HARD JUS
of MAKE SOME RICH IDIOT RICHER,

at = He, —
went a

x)

 
",True,d5cmad,Copasetic64,https://i.redd.it/4bcj2901d3n31.jpg,4,49
192,"Would you still be ""anti-work"" under my buddy's circumstances?","Just had a good discussion with one of my friends from college about working. We were college roommates which we would consider some of the best years of life, mostly because of the FREE time. We both became significantly better at guitar and all of other hobbies, time with friends and family, etc. 

I asked him about his current situation and he expressed his distaste with work because his free time is still limited, but I feel like I wouldn't mind working 40hrs in his current position. 

He is a coder and works completely from home, so right there he is already saving a ton of time that would otherwise be wasted on commuting. He actually doesn't even have a car so he saves a lot on gas, insurance, car payment etc. He also is allowed to work his hours whenever he wants, as long as his tasks get one. And the kicker is since he works from home and has that freedom, he constantly travels and is currently living 10 minutes from a beach in Hawaii making 65k from his computer.

Still, he insists 40hrs/week is too much and despite his blessings feels like a slave and not living a true life. I personally would kill to be in his position, I am curious of everyone else's thoughts here?",False,d5onzl,throw-away-ac-slater,https://www.reddit.com/r/antiwork/comments/d5onzl/would_you_still_be_antiwork_under_my_buddys/,13,8
193,St. Luke’s nurses file notice to strike,,False,d5o0w4,WinterTrabex,http://cbs3duluth.com/top-stories/2019/09/16/st-lukes-nurses-file-notice-to-strike/,2,15
194,"80,000 Kaiser workers plan 7-day strike that will affect California, 5 other states",,False,d5lmg9,workplace_democracy,https://www.sacbee.com/news/local/health-and-medicine/article235160682.html,0,30
195,Just feeling exhausted by the culture,"I just feel so exhausted from all the constant consumer culture. Like you go on social media, and it’s all about “buy buy buy”, endless product after product. Especially on Instagram.. Then you have to sell yourself to your employer, seem attractive and interesting and capable. And if you don’t want to employer and you want to start your own business, then you become the person who produces all of the stupid garbage and annoys the rest of the society. It feels like the space is really free of this. You are always selling or buying something. And it just gets so exhausting, I wish I could find a void and just curl up in it. 
 
For those of you that are working, does it ever strike you that every single day of your life you are just producing a product or service. At least most of you. And that is your greatest contribution to this reality...",False,d65glb,triptifan,https://www.reddit.com/r/antiwork/comments/d65glb/just_feeling_exhausted_by_the_culture/,21,34
196,College is just a cover to hide connected peoples nepotism.,,False,d65cw5,HierEncore,https://www.reddit.com/r/conspiracy/comments/d63n8l/college_is_just_a_cover_to_hide_connected_peoples/,0,0
