,title,body,id
0,"Well, I think I’m ready to say fuck it", call center job though i am privileged to work from home as the last month with quotas that put your job performance in the hands of others depending on if they comply with scheduling workers comp appointments if i dont schedule x amount of people and work y cases i am penalized for lack of performance kicker is that you can work a significant amount of cases and schedule less that a half of them its dependent of if you can reach the patient if they are willing to schedule and a bunch of other factors like state laws not to mention the network loses connection so that interferes with performance its just shitty in regards to my job i feel like that guy from office space ive been working there as my first full time job for the last year and i feel like im just dead inside because of it i thought that it was the long commute wearing me down it is actually fact that the job is a boring day after fucking day same pile of shitty work so i think im just done its boring not intellectually stimulating at all i am stuck at a desk for 8hrs a day the security i have is a regular and decent paycheck and health insurance i am young smart and wellappearing human i feel that i am resourceful enough to make money in other ways my boyfriend advised i can always hop on his health insurance weve been together 6 years now and im pretty sure the only reason we arent engaged is due to that we have been getting out of debt for the last 2 years while also spending more than we should on little things here and there  anyway i believe my bills are minimal enough that i could make due until november all of my october bills are paid  i know i could call my creditors and let them know if i needed extension days for later in november for bills at the beginning of the month i live in a nice middleupper middle class area where being a nanny and grocery delivery service person is possible ive applied back w my old part time position as well due to that the work i had there was at least bearable though low wage idk standby ill let you folks know how it goes,d97c4v
1,I cover so many shifts a week I'm well into over-time but God forbid I ask for time off. WEEKS IN ADVANCE.,heres advice do no favors for your place of work when they find out you cant work like a mule or come in whenever they want you to youre replaceable,d93w1i
2,What are your guys opinions on manual labor vs office jobs?,i worked retail paving driveways in a family friends small company and now i work a 8430 office job tbh i miss working outside and always being at a new house doing work everyday working with my 2 close friends i make about 12 more per hour in the office job but im so miserable its becoming hard for me to even find motivation for the gym i still go to the gym everyday though because of the physique ive built i cant stand fake laughing at everyones stupid jokes and acting like i care about this job im in it for the money and thats it also whats with office jobs acting like middle school team bonding games and what not i might just work here for another 7 months get my 1 year experience then quit and go back to paving driveways,d93n2c
3,Nobody should have to come to work sick.,im sick like real sick theres been a flu going around the farm for a week or so and it finally got me im not upset with my coworkers they need money too im angry that only a few higher ups have pto im also angry that the farm owner is also landlord to most of us i work ten hour days just to give a significant portion of my paycheck back to this guy every month   im also upset scratch that im pissed off at the level of guilt tripping that happens any time someone cant be at work its an established fact that i go above and beyond to pick up other folks slack my bosses joke about it all the time that sucks watching people who make more money than me slack off and bask in the bounty of my labor is bad for me in every way i havent been sleeping or eating well for months and i weigh significantly less than i usually do my body isnt healthy and this illness is kicking my ass in spite of all of this one of the guys who does have pto made me feel like absolute shit for leaving this morning he knows how hard i work he knows my body isnt healthy because of the job still he had to make me feel like shit after our boss told me to go home im still working from home spreadsheets for seeding cultivation and harvest im working from home while sick already not getting paid for two days this week and on top of it all i feel like im about to have a panic attack because i dont want my team to think that im lazy or wimpy  i am amazing at my job i dont deserve to be put in this situation i dont deserve to feel this way about myself   this has been a rant thank you for coming to my rant,d92yqo
4,Completely Original Solution,bryan schwellinger   love how people think their completely original solution that they thought of in under am hasnt occurred to you at all since you started working  justnow like reply o ,d9oh9a
5,I skipped two of my three classes today to combat stress yet I still feel extremely guilty,i have an especially brutal schedule on thursdays two classes in the morning one from 9001015am and the other from 10301145am next i have a gap from 1145am130pm last class is out at 245pm knowing that i couldnt cope with the first two i made i deal with myself that i would wake up later and then go to the library and chill out then only go to the last one since i like it   i told my buddy i wouldnt be in class number two today and his response was lol does it even matter you dont ever pay attention anyway like yeah dude i dont because i dont know what the hell is going on in the class it goes all right over my head i think this exchange ruined the rest of my day he just said the root cause of the problem is my not paying attention it fucking isnt im tired exhausted and dead  im tired of these schedules im tired of the homework im mad at the job i had to get to afford nice things id like for myself   why cant we ever rest why cant i ever have peace this is not a kind of life i can keep on living without losing my mind i feel sorry for those of you forced to work full time because thats ten times worse than my predicament,d9stcs
6,Does anyone on social media have a job?,it seems to be full of people born to rich parents who dont seem to have jobs at all i check fb and insta on my lunch break and nobody bitches about work all i see are pics and videos of everyone unchained from labor pisses me right off,d9xzo9
7,Am I missing something in this Labour proposal for a 4 day work week? Throwing this out there.,crosspost in this forbes article a labour guy drops some interesting fine print in the labour party proposal for a 4 day work week businesses are expected to increase productivity of labor first   as the article puts it  gtthe implementation of mcdonnells plan will depend on companies successfully automating processes and improving worker productivity  in other words the labour party is promising that after workers have been rendered redundant by improvements in the productivity of labor the party will allow a modest reduction of hours to four days   but no promise appears forthcoming on converting the increased productivity of the last 90 years into free time  do i have this right  read this is what uk business owners think of a fourday workweek httpswwwforbescomsitesbarnabylashbrooke20190927thisiswhatukbusinessownersthinkoffourdayworkweeks,da1vzm
8,The process of calling in sick at my workplace,you need to go to the doctor the first day of being sick to get a sickness certificate so if you are so sick that you cant leave the house its an unexcused absence at the doctors office you have to wait 2 hours till you can see a doctor and while youre waiting youre catching all the germs from other sick people in the waiting room that also want their sickness certificate sometimes i think if youre healthy enough to go through that ordeal you might as well show up to work and make everyone sick out of spite because ive been at my workplace for less than three months all sick days are unpaid   i am thankful that healthcare is free in my country but because going to the doctor is free all the boss scumbags are paranoid that someone might take a sick day without being sick,d9if06
9,"Friday, day 5/5 , slow business and Bored",sitting here at my corporate sales job  watching my boss play on his phone while i take the most bullshit calls in existence just no motivation dont give a fuck about this shit anymore  if i didnt have bills i would be bouncing so fast   freest country in the world my ass,da1nuh
10,I had to leave work 2 hours early because my chest was starting to hurt badly,when i told my boss all he said was are you here tomorrow  i said yes  and then he said let us know well ahead of time if you wont be able to make it dont go bailing out 2 hours before your shift starts  i know employers and companies dont care about your health or wellbeing but he didnt have to make it so obvious lmao what a great work culture weve created where health problems are just an inconvenience i dont get it i havent had to leave early until now and ive always given notice way ahead of time for any shifts i wont be able to cover  just ranting laying on my bed now and hoping that this pain goes away on its own because i cant afford to go to the hospital,dal3lu
11,Thought I'd finally found good work,but that really doesnt exist anymore huh been at a new job for roughly 3 months it paid well for what it was and i felt like i was getting paid fairly enough for what i was doing and i was actually satisfied about it which i thought was surprising  of course management changes just ruined all of that for me they cut my wages but claimed i would get roughly the same amount due to tips i definitely did not new manager got mad at me for not coming in this friday when i said beforehand i was never available on fridays and even emailed her when the shift came up she never answered me they ended up cutting my days too now i barely work whenever i try to talk to the manager i just get brushed off i think its time to take my leave,dagibo
12,My boss says mental breakdowns help you grow,theyre a normal part of a job so you just cry and move on   killmenow,d8pxbt
13,My boss thinks it's normal and expected to work +12 hours a day and I'm pissed,i am an hourly teacher and i have already told my boss if she schedules me to teach it needs to be only two shifts a day not the whole because its too fucking tiring and im not a morning person so basically everyday i work from 130pm to 9pm and now she wants me to cover for another coworker in the mornings too  when i told her when am i gonna sleep and rest she laughed and said i teach everyday from 7 am till 9pm why cant you im so fucking pissed if i had another job lined up i wouldnt even bother going back,d8p0w4
14,Can I Convince HR to Just Freaking Lay Me Off?,i honestly dont see how anyone unless they are just a social mega star could thrive in the rotten work situation that im in   i am in a small agency and our it department is just me and two other guys  the it director and the network admin  two years ago they changed my job role and expected me to just know this network shit when my background is data analytics and software support  the admin began my new boss and this guy went to town uses his new found powers against me  he would get pissed if i asked him for help on what felt like a very simple thing to him and take it out on me by writing me up if i made one small mistake  even worse  i now have to submit an hour by hour log report showing that i am constantly busy  problem is the role has 90 downtime and they are like thats not our problem figure out on your own how to contribute  im a very shy person so getting out among the people and forging my own path is terrifying  i feel i only have one card to play  convince hr that my job isnt needed and lay me off  the anxiety over not having a clear job role plus working under this asshole boss has me constantly having panic attacks at work and calling in sick more and more  the advice to just get another job doesnt cut it  ive tried for years to switch jobs  its hard as hell to beat competition on a job interview these days,d8wo6f
15,I am becoming increasingly depressed,last time i held a long term job 1 year i felt what most everyone did i was afraid of starting somewhere new and disappointed that id lose my free time and i wasnt exactly happy but my displeasure plateaued after about three weeks however 90 days into this new job and i feel as if im slipping deeper and deeper every single day and i cant stop it every night becomes a little bit more excruciating and every morning i have to ask myself why im still bothering to wake up   im honestly not sure what to do im at a loss unfortunately i need to leave the state asap for numerous personal reasons as well as a strong dislike for it in general so i need at least another four months of steady income to make it to the marker where i can leave finally while there is a definite end goal february of 2020 im becoming increasingly concerned that im not going to make it there the ultimate idea is to hop to alaska for a year or two then finally leave the country but alaska needs to be the first step and im at the earliest of steps with barely anything in my savings im not sure i can endure another five months of this if the downward trend keeps going  i suppose this is just a rantvent post but this community is the one that dragged me from the right to the left and i feel like you all understand very well,d8ggy0
16,having a tough day. wrote this up on company time.,slices    the world is filled with beautiful things why am i here at work  there are books to read food to eat places to explore why am i here at work  there are people that need help i need help work doesnt help why am i here  why  to get money money i like nice food and cool things but i am chained to it i cant escape it  cant i just care for my plants read about cool things and be with my wife and daughter  i want to study about plants about fungi about weather about computers about statistics  i want to ride my bicycle and learn and cook and help  and yet i am here working working for a machine that will spit me out when i am no longer considered useful  working in order to enjoy a small amount of time away from work  working in the hope that one day i wont need to work that i can pursue my interests solely under time constraints and not financial ones  when will that day come will it ever come when will i be finished exchanging my life for money  this exchange is leeching strength from my body mind and soul when will it end  im a coward because five days a week i wake up and willingly trade away another slice of my life,d8n989
17,Fuck this system: The Manga,sweetie babe ofs  somebody something  productivity  wages  percent change since 1948     2000    ,d8i1wx
18,I have hope, i have hope in the young generation my generation that they will get fed up and do something about it or maybe do nothing about it  the bullshit education systems  bankers  politicians  housing crisis  minimum wages that can barely support one child you get the point they dont really have much to lose  if they can barely make ends meet do you really think they will care that much about modern conveniences like being able to stream 4k video i hope they will be able to see the vastness of the planet earth and its natural resources that can be harnessed to meet the needs of everyone in their lifetime   when will enough ever be enough  isnt it time that humanity sat back and enjoyed the fruits of their labor   does the world truly need more engineers  the major reason there was  a lot of progress in technology during the world wars is that before that  most people were happy with having a roof over their head  food to eat and lots of free time and new technology wouldnt affect their day to day lives    if the young decided not to do the grunt work of society it would simply collapse without firing a single bullet  there is no other way see hong kong protests police would refuse to fight people seeking their freedom from bullshit laws etc,d99hnn
19,The need to get a job both infuriates me and terrifies me.,maybe this post will be too venty if so it can be deleted   i recently dropped out of college after a few talks with my dad and he told me it would be better if i came home and that college wasnt doing any good for me im incredibly grateful that my dad is so kind but on the day i came back he told me about a job prospect he heard about i just brushed it off at the time but internally i felt terrified and almost shut down ive had 3 jobs before all of which were in fast food so obviously they were awful but thats given me a lasting impression and has made me absolutely terrified of any sort of job i tell him that i feel this way and he just doesnt get it he tells me that he found having a job at my age was liberating that it gave him purpose i tell him i feel the opposite way and he tries to argue with me trying to convince me i somehow dont know what im feeling i think hes doing his best but its like theres a barrier that prevents him from considering that i have a different opinion i feel trapped and scared because i have to get a job in order to achieve my dreams but i dont want to     i guess theres no real end message with this post just me getting my thoughts out there,d9aowh
20,Fuck this lib shit.,why crying employees can sometimes be a sign of a healthy workplace  last company  by dizzy will  oh     occasionally crying at work is normal and can sometimes indicate an honest work culture but there are some best practices to follow when dealing with a workers tears ,d9fruz
21,"updating resume, cover letter",it makes me sick figuratively speaking also my lower eyelid is literally twitching right now as im writing this it all feels so fake i hate it technically i have zero work experience bc im finishing university right now and i didnt need to work until recently so beside my studies and 1 summer job and 1 internship i can only list my abilities which is not much honestly just the usual bullshit bc i had been educated in art and art history i know i know and now im just trying to get a shitty office job btw these jobs usually list no experience is required so that shouldnt be a problem   but gosh i hate this i looked up resume examples keywords and only picked out the ones that are mostly true about me but it still feels fake   bc it is fake honestly yes im genuinely caring and empathetic person but thats when i see someone cry or theres someone that needs some support they could be strangers and i would still care hell i have approached a crying girl before asking her if she is alright even though i didnt know her but im not caring or empathetic when its an entitled customer who gets off on verbally abusing employees,d9ke4a
22,"If working wasn’t mandatory just for you, how would you spend all your days?",i like to fantasize about a world where im not forced to work but everyone else is so id be the freest man in america    im curious how everyone would spend their days of freedom would it lead to madness would it lead to enlightenment discuss,d99jup
23,A 21 year old is now my boss...,well to exact hes my bosses boss   he somehow bought the business that i work at and the store next to us he was only here 2 hours to meet the manager and never said a word to any other employees treated us like slaves and ignored us was late to pay and changed our hours to be open longer   our manager is so pathetic hes a 40 year old man sucking up to a 21 year old because hes afraid of being replaced  its been a month now and the owner stopped by to let the manager know hes going on vacation for the next 2 weeks seriously pissed me off how is this fair,dawpoy
24,"KE KE KE, ZERG RUSH ^_^_^_^_^_^_^ ^^",es like inn   shutupmikeginn  of someone tried to make me dig my own grave  would say no theyre going to kill me anyway and id love to die the way  lived avoiding manual labor ,db580s
25,The biggest lie ever told is that Slavery ended. It never did.,we are forced to work for most of our woken hours of our lives  we get paid a check which gets divided up to rent food transportation clothing and health expenses all things that slaves used to get for free  the only thing different is that cash or digital funds get transferred  we still have to give up most of our daily lives to our masters companiesownersinvestors  we are therefore still slaves slavery never ended,d9tezu
26,How do I live without working? Does anyone here live without working or work very little?,i dont want to work is there any way to not work and live comfortably  are there rich people out there who will give a stranger around 25k or less a month for free so they dont have to work  do any of you not work or hardly work if so how  existence is dumb nature is silly no one should have to work no one should have to do anything they dont want to do,d9vdcm
27,When i was in Europe every cashier i saw in grocery stores or department stores sat in a comfy looking office chair,but here in the states you cannot sit because it is not a good look like fucking hell i bet if cashiers could sit in the states the turnover rates wouldnt be nearly as high my cousin was a cashier at bestbuy and he said 8 hour shifts were brutal because his legs and back would hurt so bad i bet ceos are just itching for automation of everything,d9t5s1
28,"I was asked to cover another shift, can you guess my answer?",friday september 27 2019  a key whats up its now you doing man he were just wondering if you wanted the of tremaelelecmceale mimi jmexelelomze0 help cover a shift tonight until am  its up am     in  of so its an easy property justo youknow   ,dadaaa
29,Life should come first. Let's never again call it work-life balance., worklife  balance  lifework  balance    ,daymqr
30,Another Monday - how the fuck do people do this for 40 years?,another monday another week of work we were forced into this world without our consent then forced to play this shitty game that we had absolutely no say in creating and follow rules that we dont even agree with i want to switch to parttime work and actually have time and energy to do other things but since im in the us they weaponize things like health insurance to keep us in line the game is rigged and theres nothing we can do,dbaz34
31,My options at this point,ll y of  pre i tut of  to dumb k steal    ,d8mma9
32,people dying of starvation should learn2code, q runpopularopinion  ulivesinvan  him  millennials shouldnt complain about job opportunities if they havent considered learning to code  going resources are completely free on the internet any jobs now only require 2week bootcamp or some open source  experience of you just cant teach yourself with the tons of free resources consider software testing as an entry point   note j u it share ,d9ge50
33,"Can we get a 'Things I do at work out of spite, because fuck this shit' thread?",for example if you just take shit from your job or you have a hideout spot where you can get away from it all for a bit etc also id recommend posting from a throwaway just in case  ampx200b  some things i do  ampx200b  1 my boss leaves  earlier than i do i still sign out at 5 but from 4 to 5 i dont work why would work a full day when he doesnt  ampx200b  2 i always sign in 1015 mins earlier than i actually got there which adds up at the end of the week  ampx200b  3 i steal reappropriate merch and give it to my weed dealer or cute girls if im talking to any at that point in time  ampx200b  4 since my boss always leaves early my friday ritual is to smoke a joint behind the building in the last hour of work eand then just hang out listening to music,db3dnm
