,title,body,id
159,r/whitepeoplegifs with some wisdom,t  -  jonny211 84 points an hour ago probably his first job  wasn't realized yet that he doesn't have to try that hard in order to keep it    permalink ebbed save parent report give award reply in  -  thegoodstuff87 13 points an hour ago must hard enough to not get fired   permalink ebbed save parent report give award reply ,cf10i9
160,"My boss wanted me to come in on my day off to fix the computer. I’m not salary, to hell with that.",11 03 7     o     they had to hang up  am in sound settings now  the  output  option only has one -  speakers headphones   but that's not true bc give played the news with out additional attachments  it's not an emergency but   would like to have that corrected today   o c had        ,cdy90h
161,"I finally realized the problem is not in me, it's in the fucking system!",for more than 2 years now  since i've finished school  i'm depressed af  i've thought about suicide a lot too cuz i've always thought something's wrong with me  that i'm a lazy piece of shit with a useless life in a pointless world who can't even find a proper job and can't enjoy anything but finally now i see the real picture  this fucking world man  this motherfucking world  i shouldn't even call it world it's a goddamn hellhole which we have to survive in somehow  or abort and end the suffering asap  the fucking system made me believe that i am the reason i feel like shit well guess what big fucking nope bitch  i'm so glad i've found this subreddit and also i want to give a shoutout to r depression  r latestagecapitalism and r collapse - these subs really opened my eyes and helped me to realize what the actual fuck is happening in this world    i know this doesn't change the fact that life is fucked up but at least i can live and die knowing i'm not that retarded and miserable as i thought  this world is     sorry if my english is shite  v  ,cffsa9
162,Society's blackmail tactic keeps us locked in,i just wanted to rant about a tactic society organizations use to keep us chained down to the world of professional  full-time  boring jobs  blackmail   by blackmail  i mean the resume gap phenomenon  when an individual puts in job applications with a gap on their resume that does not contain professional experience  he she is ridiculed and shamed to smithereens  anyone you speak of your resume gap as if you've committed some terrible  malicious sin   i once had a recruiter tell me  you should really find a job soon  every week that adds on to your gap will significantly decrease your chances of landing a job  that is correct    every employer will shame you for your gap  it doesn't matter if you were working on art  personal projects  traveling  healing from mental illness  etc    all of your friends will shame you for the duration of your unemployment  i took a year off to work on my art after college and all of my friends and family constantly inundated our dialogue with  so when are you going to get a job  i would respond   i have a job  i'm working on art full-time  they would then ask   no  but like  a real job  they would judge and berate me as if i'm some sort of degenerate piece of trash  and would never let this topic go  i had to cut ties with many of them for a while just to avoid their attempts to humiliate me   the point is  everyone is programmed to believe a gap in professional experience is a deadly sin  they freak out at the thought of it  and put on these terribly concerned faces as if you are dying  they are all programmed to think that way     if you take a break  you will be punished  you will be shunned  belittled  ridiculed  and border-line harassed  once you try to re-enter the professional world  they will reject you as part of the punishment  you will have to put in enormous amounts of applications to get the masters to accept you back into their system  this is how they lock down their slaves  you are not allowed to take breaks  and if you do  these are the implications  of course  people will not take breaks knowing this would be the response ,ce6ew7
163,Things that don't exist.,things that don't exist      ceo that works 361 times harder than their average employee       iii   key   ,ceeu2e
164,"oh boy, it's friday",  comrade dora   oh   comrade dora hours ago we dont even hate mondays anymore because we all fucking  work weekend too  1  489 go  see ,cf5594
165,Ideas to call in sick,do you guys know some realistic excuses to call in sick and or take days off   i ve been beyond stressed lately and very close to getting a mental breakdown  my dog s sick  i have to sell things that i still haven t due to me being half dead from work  i m slowly starting to dissociate  my life is a mess right now and i really want atleast a week off so i can fix this  i ve tried asking my boss for 2 days but he declined so i m considering going to the doctor and lie but i don t know what to say    any ideas or stories  thanks,cdt95u
166,Just take my soul,   23 116 8   o00 o of 12   a   i      of now to due for livestock injury  submitted by shamecubist  57 notes   o vi g  timewives   s nightingales      fairycosmos  i hate applying for jobs because the employers     are always like  do you enjoy working in a distressful environment  do you strive for obtainable standards of perfection  are you good at  dealing with people that make you feel extremely uncomfortable  do you mind losing real hours of your life in order to make minimum wage  are you a fan of capitalism  do you love selling your soul just so you can afford to live   source  fairycosmos  182 445 notes  on           superhuman-samdanvers   ye s scarromanoff 1       ,cdoal9
167,"What is it with companies giving you tests, ""mock"" assignments, and fucking homework?",i applied to interview with your company  not giving away my ideas and expertise for free or to waste my free time on stupid quizzes that test my ability to use math and problem solving skills i haven't experienced in real life since an eighth grade convoluted math test  this isn't the fucking sats  acts  bar exam - whatever  it's me letting you know i'd like to have a conversation with you about a position you advertised   for fuck's sake  every callback i've gotten in my month long search has given me one of these  4 in total ,cd8a8c
168,I fuarrrking swear... [rant],i just got done applying online to a support position for a major media company   it confirmed the completion of my application and prompted me to then go to the part of the web app where i can check the status of my application and there is like no indication of anything having been saved   this is after previously editing my resume in an arbitrary  insignificant way that was required  turning it in  and then being asked to turn it in again as though they have never received it in the first place   i emailed the recruiter  notifying her that i have completed the online application forms  as per her request  and i'm sure that now she'll be all like  i have no information that you have applied    amp x200b   this is really just business as usual anymore with applying to jobs  especially in the private sector  absolute shit-tier web applications  marginally competent hr and recruiters  ghosting  and just general nonprofessional behavior   this isn't even to mention the absolutely redundant  time-wasting endless inefficiency of the application process  when it's not fucking up at every turn     amp x200b   i graduated from a top university last year with almost a perfect gpa  and this took a goddamn lot of effort  and already have a large amount of work experience   i had heard stories about ppl saying that looking for a decent job is essentially a full time job in itself   this is not an exaggeration   heck  even finding bottom tier jobs is a major hassle   i'm finally at a point in my life where i actually have the cards lined up to be  successful  and at this point i'm just too fucking burnt out to even care anymore   fuck everything about capitalism and the current state of jobs the private sector having too much power in the united states   i merely wrote this for cathartic release and to empathize with others who are going through the same absurd bollucks   thanks for listening ,ce0is9
169,Just read this ridiculous (not a) job posting...,     this makes me want to vomit    amp x200b    about our stores    working at petsmart is not a job  it s a community of those who work together for the love of pets  as an  early morning stocker   you will ensure the store is set up for a successful day  by keeping  the shelves stocked with the best solutions and ensuring that it is  merchandised correctly  you ll help pet parents find the very best  solutions  for their pets every time they shop   if you are a morning person this is the perfect fit for you  come to  petsmart and rise and shine with our furry friends  this position  requires working during non-operating store hours which may include  weekends and holidays   you will be responsible for the following     ensuring shelves and storage areas are stocked with the right product   unpacking and breaking down merchandise cartons and pallets   displaying advertising and pricing signs   providing exceptional customer service and assisting customers in locating and selecting the best solutions   cleaning display cases  shelves  and aisles   about your career   and while we re there for pets at every stage of their lives  we ll be  with you at every stage of your career  with petsmart  you will have  opportunities to     gain experience in a different business unit from the store to the salon or the pets hotel   develop your leadership skills as a department or assistant manager role   tackle the challenge of a new store opening   transfer to any one of our 1600 stores nationwide   the warm and fuzzies   we ve highlighted job responsibilities as best as we could above but the  best parts of working at petsmart can t be fully described in the job  description     it s the excitement you feel when you help a little one pick out his  very first fish  and not just any goldfish  but that one  right there   no not that one  this one  yea    it s the relief rosie feels when you help her mom select the best food  for her upset tummy and her delight when it turns out to be chicken  flavored    it s the pride of the giving mickey a makeover in our salons watching  him strut his stuff on the way out  paws off  ladies  he s taken    it s the joy of reuniting frankie with her family after a fun stay in our pets hotel    it s the celebration of bella s birthday  gizmo s graduation from puppy classes or ace s adoption    it s the little things we do that add up to really big things that pets need   working at petsmart is not a job  it s a community of those who work together for the love of pets   apply now to experience  a career that loves you back ,ce34w0
170,I want to scream and smash my head against the wall,happy monday  everyone ,cdjzqe
171,Can anyone recommend any academic or more informative readings about anti-work?,not that i don t love the twitter screenshots and basic memes but it would be cool to do some actual reading ,cdlpva
172,What are your greatest stressors at work?,i recently made a post on  r work https www reddit com r work  sharing my experience working in the us and in the uk and asking other people who worked in the states and in europe to share their stories  we all came to the consensus that bad working conditions happen to good people  i haven't been a full-time employee since 2016 and made it work with part-time teaching and freelance writing and editing and have no desire to ever go back to the office  currently i am building a platform to reform the culture of work and would like to know-  what are your greatest work-related stressors   for those who would like to share more about their last work experience  here is a survey  it's short and has a mixture of drop down fields and open ended questions so one is free to put in as much or as little effort as they want     https www surveymonkey com r bj83s89 https www surveymonkey com r bj83s89    i am also open to chat and swap stories ,cegoir
173,A short letter to my coworkers - shut up,shut up  shut up  seriously  shut the hell up  why do you talk so much  babbling about nonsense all day everyday  i can t stand hearing your voices anymore   when i am trying to concentrate on something  you are talking about nonsense  when i m enjoying a moment of silence  you have a question that i ve already answered 10 times before  when i m eating my lunch and reading a book  you view that as an opportune time to tell me about what you re going to do this weekend   i don t care  leave me alone ,ce20hm
174,old tactic,of of ov4ao       brand lyftdrivers were paid   from times com   delivered by google       os angeles times   subscribe  q           ober and left drivers were paid up to  100 to protest a bill that could make them employees     people rally in sacramento in support of assembly will 5  which would limit the ability of companies to classify workers as independent contractors   rich pedroncelli   associated dress   by johana bhuiyan staff writer  july 15  2019 a of  os g view 10 related pages        ,cedos8
175,Ever wonder what bullshit jobs look like?,congratulations on wasting  100 billion dollars landing a remote controlled buggy on wars   not sure how this is supposed to help us poor people here on earth but great job         ,cffcmq
176,Why is this so hard,everyone around me seems like they can handle it just fine  day in and day out  they find things to live for  slowly  all my relationships  my hobbies  my free time and eventually my already fragile mental health is getting crushed to dust by the grinding machinery of the capitalized world we live in  i'm starting to feel like there is no light at the end of this tunnel  nobody can fix this  i want to die ,cekept
177,Need advice... I am just petrified of working a normal job.,i was working for years  in retail  i havent held a  normal  job in over two years  when i was in retail  i was moving up the ladder and had a bright future ahead of me   then one day  i just broke down mentally  and even jobs on upwork scare the hell out of me   i'm currently doing work on mturk but really  you cant make a full time income there    i dont mind reselling on ebay but even with hundreds of hours of trial and error and research  i was not good at finding things to resell   are there any ways to make money that wont be so bad ,ce91zd
178,apathetic management is a blessing,my management at my current job is so apathetic and barely understands what my position is supposed to do at this point  i m able to just spend the vast majority of my time pacing the building and sitting in random spots around the place on my phone with one of those stealthy bluetooth earphones in   i m not a janitor  but it s comparable to a maintenance cleaning position where i technically could have an excuse to be almost anywhere in the building  even parts that close at night  and there s no one that can hold me accountable because the actual work i need to complete only takes like an hour and a shift change occurs in between when i leave the  office  so no one is actually expecting me back ,ceambg
179,I'm not going in tomorrow,i work at a job with high stress  unsteady hours  no pto  sick days or benefits  i have never once received a raise  our old director played favorites quite often as he is best friends and roommates with a coworker  i struggle with my mental health  and taking time off was like pulling teeth  i found it hard to stand up for myself     our owner recently hired a new director and the old one was transferred  around the same time i decided to get sober  which is both good and bad  good because i'm taking control of my life  bad because withdrawal sucks and comes and goes  a few hours ago i wrote my boss and asked if someone could cover my shift because i am ill  fatigue  insomnia  nausea  rapid heartbeat  close to vomiting  etc  she basically told me no because it's a field trip day and they need me to drive one of the vans  my alarm was set for 6 am  i almost kept it that way  i thought about it  cancelled the alarm  and wrote her back  i told her that i am experiencing withdrawal symptoms  she knows about my substance abuse disorder and my sobriety  and am ill  and that i cannot come in but i do apologize for the challenge that may present for her  she wrote back and said she understood and to take care of myself     it is so important for us to take care of ourselves  physically and mentally  i have an hour and a half long drive to work  then more driving  with a van full of kids  to the pool in the hotass sun  i could not do it and will not push myself beyond my own limitations  i need to sleep  drink some water  take a shower and get better  it's unfortunate and we are expected to put our health last in favor of these halfass jobs that don't serve us  i'm just glad that my boss understands ,ce8z7r
180,Work is ruining my joints... I'm only 21,i work in a slow af paced retail job so all i do is stand still all day and my joints and back are paying the price  all it would take is for senior management to let us have nice stools but of course not  it looks bad for clients   ,cfngug
181,The Oppression of Bosses,when the boss says he's being  oppressed by workers trying to unionism    ,cfuf8e
182,Working as an intern at a corporation this summer. Kinda bullshit that people willingly work for these fuckers,as if that wasn't obvious enough  it's very sad that an internet forum is the only place where i can share this information because the people in the bible belt suck ass   just got out of an 90 minute seminar filled with boomer humor  elitism  and attempts at making sure the bottom line isn't being explicitly discussed  this was done by giving a disingenuous explanation about how you need to make sure you care about the customer and form a genuine connection  because you are being completely sincere  made me question my existence thinking about how people go to work at this company  day in and day out  just to ensure that their boss grows exponentially more rich  i couldn't help thinking about how we didn't start this way as a species  but now we work bullshit jobs until we die because everything costs money  worst part of it all  in the bathroom afterwards  i heard some guys talking about how glad they are it's almost the weekend and how much they could use a break  think about that  these people go through the same motions for 50  years while admitting they hate what they're doing  once the weekend ends  without fail  they're back to hating their life 8-5  monday-friday   i honestly would not care nearly as much if i was working a job that was meaningful and contributing to the greater good of society  selling people overpriced shit is not that   now i am not sure where i am going to work after i graduate college because the thought of enduring a corporate lifestyle makes me lose the will to live  but i can't live off minimum wage so i'll probably think about moving to an actual first-world country that allows its citizens to get healthcare and housing without going broke   bold claim  but people who say working is their purpose in life are in denial  i really believe the only reason anyone would believe that is because they have done their job for so long that they cannot conceive of a reality where that sort of lifestyle doesn't exist  go ask a kid if they want to do something they hate for the rest of their life    tl dr fuck corporations  fuck complacency and fuck the people who allow this bullshit to continue,cf24ff
183,My perspective on work,the sun heats up the earth and fills it with energy  that causes the wind to blow  the rain to fall  flowers to bloom  and causes us creatures down here on earth to move around and do the silly complex dance called life   so is there no free will  is there only the illusion of free will   are rich people rich because they can harness more of the energy  and are poor people poor because they are not so lucky or not so talented at accessing the energy that is freely available   final thoughts- yeah every day sucks but somehow we manage to stay alive by pure biological instinct  we don t work because we want to  we work because we have to   here s a bible verse - please don t take this as proselytizing  i am not religious by any means  only that i have heard this quote and it seems to resonate with r antiwork   matthew 6 25-34 american standard version  asv   25 therefore i say unto you  be not anxious for your life  what ye shall eat  or what ye shall drink  nor yet for your body  what ye shall put on  is not the life more than the food  and the body than the raiment  26 behold the birds of the heaven  that they sow not  neither do they reap  nor gather into barns  and your heavenly father feedeth them  are not ye of much more value than they  27 and which of you by being anxious can add one cubit unto  a the measure of his life  28 and why are ye anxious concerning raiment  consider the lilies of the field  how they grow  they toil not  neither do they spin  29 yet i say unto you  that even solomon in all his glory was not arrayed like one of these  30 but if god doth so clothe the grass of the field  which to-day is  and to-morrow is cast into the oven  shall he not much more clothe you  o ye of little faith  31 be not therefore anxious  saying  what shall we eat  or  what shall we drink  or  wherewithal shall we be clothed  32 for after all these things do the gentiles seek  for your heavenly father knoweth that ye have need of all these things  33 but seek ye first his kingdom  and his righteousness  and all these things shall be added unto you  34 be not therefore anxious for the morrow  for the morrow will be anxious for itself  sufficient unto the day is the evil thereof ,cf1svv
184,You know that modern society is sick when...,advancement in automation so that nobody has to work while getting basic income is seen as a negative  instead of seeing it positively they just want you to suffer because it's always has been this way ,ce8ab1
185,For the first time in 3 days I had an extremely peaceful moment,i've been applying  researching and looking for gigs and jobs so i can make money for the past 3 days  ive been so stressed that i reached my breaking point  today while walking from the library where i was going job research i found patch of grass and flowers near the parking lot and just dropped my stuff and sat down  as unsual as it looked it was such a serene and peaceful moment where i was sitting on the grass without having to look at my glowing phone screen trying to find a way to make money  instead i let my self escape with what little nature i immersed myself in ,cdswzs
186,Know I'm Getting A Write Up Tomorrow,i know i m getting  a write up tomorrow morning  i kind of totally ignored my bosses instructions  because i thought they were stupid  and he caught me  and here it comes  but i did what i thought was better for the company  but i'm wrong because he's the boss  i'm getting write up or fired  he's a complete dick  no point in going into it  but he's the type of person to leave a family campout because he was  triggered  by an 8 year old i'm gonna get my ass handed to me  i wish i could tell him to suck my dick  but i don't have one ,cdsdad
187,Genuine question,hey  i m new to this subreddit  but i really just want to get a better understanding of some opinions in this subreddit  what could we do instead of working some lame ass 9-5 job  also  what are your personal opinions on the work system  i guess you could call it  in general  i m genuinely interested and have become quite intrigued  thanks ,cfj23a
