,title,body,id
42,Seems legit.,patrick     have every company  he'd like to promote mental health in the workplace   employees  now about hiring more people so we feel less pressure   increase our pay so we can keep up with the sparkling cost of living so we're not so stressed out   every company  to not like that  cry sofa   3 43 of - 20 war 2019  fo   of 9 in ,bs5i44
43,What about an Anti-work Union?,this might be a dumb idea and i am still fleshing it out  what about an anti-work union that focuses on issues related to precarious work and the gig-economy that rejects state intervention to create full employment  it could have as its explicit goal the freeing of people from work as necessary to their survival  something like what iww once was but with more explicit focus on abolishing wage labor   it could have as one of its tenants something like capitalism is in a moving condradiction in that it presses to reduce labor employed to a minimum and yet posits waged labor as the only way for 99  of people to make a living   does anything like this exist  it is a stupid idea  how could it function ,brhvya
44,If you didnt have to work what would you do?,at times when i didn't work i stayed very busy  i've got a million things i could engage in other than selling my time  if you didn't have to work  what would you do  not assuming you have unlimited money  but you've got enough for necessities and some extras ,brxkzw
45,Inane conversation,do you find your co-workers irritating in the respect that they converse about topics that are about nothing at all  i find i can't relate to most of the people where i work because they talk about things that i find incredibly mundane  i listen in but have no words to say  i'm at a loss and can't relate  of course i am viewed as the weirdo outsider or just arrogant and aloof  i can't really focus on or find things to say about washing machines  nutrition and the like  i do find conversations about films  music  politics etc deeply engaging but they seldom happen where i work  even the films i like would be ones they would either not know or wouldn't be into  preferring lighter stuff instead  it makes socialising impossible so i don't really bother with it  i usually try to get out of the workplace anyway so i can sit and read with a coffee  it helps to break up the grind  don't really know how they can stick that aspect either ,brutvh
46,Unemployment does not mean you are worthless,there is a capitalist cultural stigma that surrounds unemployment to mean you are undesirable  undeserving  and unqualified  this stigma is strong enough to take a toll on mental health  depression  anxiety  and sometimes even suicide    we live in a unjust system that can never define our humanity  don't let it define you  unfortunately  our material conditions may decline due to our lack of income  but we cannot make this a reflection of our value  as difficult as it may be    but this is somewhat impossible  there is a reason why classes remain in the same class for generation and does seep into individuals mentalities to some degree  this is a fight that really seems hopeless    but don't lose faith in what we are all fighting against  as r antiwork as shown  work can alienate us to mundane machines that go against our humanity as well  we are forced into activities we do not want to do  but commit a portion of our lives to    we are entrapped in a system that does not reflect who we are  and whether you are unemployed or working  you are human that has value  cherish it ,brz2lp
47,How shorter hours with no loss in pay was won,https thesocialist org au 8-hour-day ,brn682
48,Fucm work, the ecological limits of work http autonomy w ,bt3de7
49,Little rant I needed to get off my chest.,yesterday in the us it was memorial day  97  of employees get this day off  this year  it also happened to be my birthday  which i don't normally care about  but ya know  it would have been nice to have my birthday off  last week i asked my boss if we had monday off for the holiday and she just laughed at me and said our business doesn't take days off  so literally everyone i know is off and enjoying the beautiful weather  all my friends are hanging out without me on my birthday since i'm stuck at work  my boss doesn't even come in  i don't get any emails or phone calls from her  in-fact i didn't get any emails or phone calls the entire day since everyone assumed we were closed  needless to say  i was fuming and still pretty salty about it ,bu4gbj
50,Most video game characters have better lives than the average person in this society...,think about it  i will give you some examples    amp x200b   doomguy   doom slayer  well guess what  depending on the version we re talking about  he had his civilization destroyed  had his pet bunny killed  got earth argent d nur destroyed  but he doesn t care  he  wants  to avenge them  but unlike  us   he has fun while doing this task  he kills demons and take names every day of his life  and he enjoys it  he sees his slaughter of hell as a arcadey game  and he loves what he s doing  he finds new weapons  he kills  with it  he has a good time  he even put his grappling hook on a super shotgun  jesus christ    amp x200b   sackboy  he is a good old doll of sack in a big world full of possiblities  he spends most of his time having fun playing levels across the ether of little big planet  he s entire life consists of literal fun and games and there s always something new to do     amp x200b    amp x200b    amp x200b   meanwhile we are all here preparing for the next week of work thinking about how we will kill ourselves someday    amp x200b    amp x200b   need i say somethng more ,bu40ng
51,This place pisses me off,end rant,bu1s3f
52,Which state so you think better to live with the antwork mind set?,for example i live on nyc and everything is consumption to the highest degree  everyone i know works 50hr weeks and barely have any time to themselves  what state or region do you recommend  thanks ,bu4t2u
53,"I endeavor to answer the question ""what do you do?"" with something, anything, but my job.",my job doesn't define me or what's important to me  it is  at best  a casual thing i do once in a while because i have to - like cleaning the bathroom   i think it's very important that we live in accordance with our beliefs and what we value  even if you work 40 or more hours a week  i welcome you to give some thought about how you would answer this question in a way that doesn't reference your work but maybe references a hobby or interest of yours   let's work on re-defining our relationship to work so that we no longer over-value its place in our lives and in our minds ,bu977y
54,Anyone else feeling more and more numb each day?,i've had existential depression since i was a child  and life has made it so much worse  i've been through so much my entire life  i don't feel like going into detail   i care less and less about life everyday  i feel like i'm in a dream  or a nightmare rather    instead of going to sleep and having a nightmare  i wake up into one ,btfimm
55,It’s possible to enjoy your work,this is a fact  i enjoy my work and i know many others that do  i work in software development  i m incredibly grateful for my career  just remember that although a hatred of work may seem to exist everywhere  it doesn t  nothing is certain  but i feel confident that a more likely path to self respect is to focus on working hard on something which means something to you  rather than taking advice such as  fap in work to save time ,btj0vb
56,"""I wish I had spent more time in the office,"" said not one single person on their deathbed in the history of the world",cnbc   cnbc  cnbc  despite work life balance buzz  disconcerting to spend time with your kiss could severely impact your future wages     disconnecting to spend time with your kiss could sabotage your career cab com  10 32 - 11 may 19 - socialflow ,bsh11e
57,My boss is refusing to pay 21 days of the new minimum wage,i thought you d share my frustration upon discovering that the bastard my boss is  is not paying the first 21 days    so here in the uk the minimum wage went up in april  i asked  -hey boss  when do you start paying the new wage  - on the 21st -okay  however i must ve been drunk  it was the end of the shift and i work in a bar  and didnt realise once the bloody wage goes into effect  it goes into effect    not up to the employer to decide when to raise the wage  even if  convenience  is a good excuse to him  his calendar may go from 21st to 21st but he is avoiding a 32 pence raise,bshs1p
58,"""if you're so burned out why don't you just quit?""",uh because i've always been passionate about not starving to death ,bt5lx6
59,I did nothing productive this week at work,that is all,bvg9l1
60,Unemployment Does Not Mean You Are Worthless,there is a capitalist cultural stigma that surrounds unemployment to mean you are undesirable  undeserving  and unqualified  this stigma is strong enough to take a toll on mental health  depression  anxiety  and sometimes even suicide    we live in a unjust system that can never define our humanity  don't let it define you  unfortunately  our material conditions may decline due to our lack of income  but we cannot make this a reflection of our value  as difficult as it may be    but this is somewhat impossible  there is a reason why classes remain in the same class for generation and does seep into individuals mentalities to some degree  this is a fight that really seems hopeless    but don't lose faith in what we are all fighting against  as r antiwork as shown  work can alienate us to mundane machines that go against our humanity as well  we are forced into activities we do not want to do  but commit a portion of our lives to    we are entrapped in a system that does not reflect who we are  and whether you are unemployed or working  you are human that has value  cherish it ,bs2z4b
61,I didn't go to work today...,    to  p       didnt to to work today   lied sa            feel    se       2 of   iv ' et a am c      of run  -  i   is dont thin ill of tomorrow  lets take control of our lives and live for pleasure not pain     ,brvtd9
62,"I have a good-paying, (relatively)low-stress job and it still feels like bullshit.",i waste 10 hours a day commuting working  that's 10 hours a day i'm not watching my daughter grow up - i see her for 3 5 hours before i have to put her to bed  10 hours a day i could be with my wife doing anything else  10 hours a day i'm not able to prep food or clean up or read a book or fucking anything   i felt good about working enough to pay off two student loans  why the fuck do i have those in the first place  now i need to save up to put a downpayment on a house to put me in debt for 30 more years  a house i'll spend at most 55  of my waking time in   this is bullshit  there has to be a better way ,buuwjk
63,"New job already pressuring me to cover shifts with zero warning, even on days I already worked. Need advice",ive recently begun working as a cashier for a major chain pharmacy  name rhymes with night shade  i have essentially full availability  but i need at least 2-3days notice due to child care planning  esp now that schools almost done   however  my manager has been consistently texting calling me off her personal phone to ask me to cover shifts for people who call off  this makes me very uncomfortable  as i don't think she should be calling me personally like that  and the time frame is way too short  i worked 7 30-2 30 today  and she asked if i could come back in at 5 to close  i'm not crazy for finding this a bit unreasonable  am i ,bv362y
64,Imagine telling on yourself like this.,  each's ch s was thursday at 8 26 of    na   farmers don't get retirement plans  k by jeanette  support small  sick purple   a each's  jeanette nichols   has never had a day off     ,bu89th
65,I’m happy I found this sub and VERY excited to post here while on the job getting paid!,i have a good office job that pays really well and provides excellent benefits  however  i feel very angry and bitter that i have to go to an office to do my work   everything i do  along with everyone else in my department  could easily be done from home  there is zero reason to be forced to come into a place where nobody wants to be   most days i have 4-5 hours of work a day  sometimes even less  sometimes the full 8 hours  but based on my phone that tracks screen time  i average 15 hours a week on my phone during work hours  it would be better for me if i could just go home after my work was done   so  i am happy i found this sub  i m very much looking forward to reading and posting during work hours ,bu869v
66,Andrew Yang on Joe Rogan, andrew yang on joe rogan https www youtube com watch v r6ibeb3t9fe    https www yang2020 com policies https www yang2020 com policies    https www mixcloud com thejoeroganexperience 1245-andrew-yang https www mixcloud com thejoeroganexperience 1245-andrew-yang ,bv6ab5
67,2 hours playing games at work -- Phone almost dead! :(,and i forgot to bring my charger  less than 23  battery  ,bvcbea
68,Dizziness?,have been feeling dizzy for the past week  all day long  it feels like everything around me is spining  gone to the hospital and they didn't found anything wrong  but also didn't tried very hard  to be honest  could this be anxiety ,bveoft
69,Framing UBI to a conservative,basically just ask them if they would be ok with getting a free  1500 a month from the government with guaranteed housing  and they don t need to give up their jobs  no change to their lives otherwise ,buhik1
70,Working is involuntary.,hampton institute 7  hamptonthink     when people claim that the fulfillment of basic needs for all would destroy the incentive to work  they are admitting the entire capitalist system is based in coercion  that it is a form of slavery  work for us or starve  labor can never be  voluntary  in such a system   4 19 of- 11 act 18 ,bujj4h
71,I have only one year of relative freedom left for possibly the rest of my life and it scares me,i've not exactly been dealt a good hand in life  especially regarding a plethora of mental illnesses  but on benefit from it  and living in a rich country with a strong welfare state  is that it has been a great thing to convince the government to give me free money for a period  so i don't have to work  but i started figuring shit out  finally getting the right diagnoses  getting the right medication  apart from still struggling to find the right antidepressants  and as i do the expectations rise  i went back to school to finally get my high school diploma  and opted for a 2 year track instead of 1 year so i have more free time to easy myself in and not get totally stuck again if something goes wrong  convinced the government to keep giving me free money because with part time school i'm not eligible for any kind of education money   so  i just finished my first year  another year left  1 year  in which i don't have to work for my money and have a super light course load and tons of free time to enjoy myself  but after i graduate the money stops  and i can either continue to higher education and get a loan or work  i'll probably go into teaching  which is initially a 4 year study and possibly more for a master degree  and the course load won't be 10 hours a week  and then  then i'm really done  then i'll have to work to earn money and i will have to do that for the rest of my life  i'll probably never get free semi-disability money again with a good degree like that   i really hope i'll like my job and get satisfaction out of it  as teaching is very necessary  but damn if i'm not scared and not looking forward to living life like i'm doing right now ,bush96
72,Work is making me loathe myself and just loathe everything in general tbh,not sure if this is the proper place to post this  i ll start by saying i m still pretty young  younger than 24  and i work full time in the fast food industry  a snobby salad bar    i ve been here for about 2 years and i absolutely hate it  my manager is an asshole the customers are assholes and the work albeit easy is made much more difficult based on the lack of competence or general laziness from the rest of the staff  i ve found myself drinking more often  like nearly every day  and just coming home wildly irritable anxious and most of all depressed   i m soooooo fucking sad   i ve always struggled with depression dating back to my last couple of years in highschool  but this job has made it so much worse  waking up is a struggle and i often come late because of how long it takes me to just get out of bed im less excited to do most of my normal hobbies  write read watch my fave tv shows etc    i feel trapped because i need money i can t depend on anyone else for it   life is so unpredictable for me and even a week jobless could determine how many meals i miss   i know the obvious solution is to  find another job  but i just posted this here because i haven t really shared these thoughts with anyone i know personally they all just chalk it up to me  overreacting    this job is just killing my motivation to do much else and i know thats a brittle spirit   but if this is life to come i m not all too sure i wanna continue living it    rant,buqxjr
73,What are your thoughts on this ?,   of company switches to 4-day work week after giving everyone raise portcullis legal  a law firm in of's plymouth  has switched its entire workforce to a four-day work week after giving the entire staff a pay raise   the initial results have been hastening   our team is happier and our customers are receiving better service  the company's canal- ing director said  the four-day work week was introduced permanently after a five-month trial     ,btae0b
74,Don't like open office? Have the exact opposite!,sponsored      room too many distractions in the open office  increase employee productivity with these soundproof phone booths by room      soundproof office shone booths by room create a moment of peace in the open office with sounder   bedroom com ,buwbag
75,DAE secretly feel bad sometimes when they don't go to work?,tomorrow is a bank holiday and i had planned not to go into work because the schedule was already sorted out and i wasn't on it  a short while ago another supervisor calls me to say she thinks shes coming down with the flu and she cant come in for her 6-2 shift  i tell her to feel better but i cant cover because my family is taking my car  let's be honest  its a damn lie  this is the second time she has called me with short notice to cover her 6-2 shift and i've said no  i do feel sort of bad because isn't it my duty as a supervisor to be flexible or whatever  on the other hand i dont want to be spending the  pto   i get in a call center ,brxplf
76,At what point should companies start giving you a raise?,like what constitutes a raise to you  length of time spent there  change in job title  i want to know what you guys think    someone in my department just quit stating that the vp wouldn t give her a raise and  doesn t care  so if my wage will never increase i don t see the point in staying either,brstfl
77,I can't go tomorrow,i can't  i can't do it anymore  only 5 hours to wake up and i'm still dreaming about leaving   today is my final day of vacation and the fucking dread is killing me  my soul is being drained  why do i have to wake up at 6 am to do that shit every single day whywhywhy,brw3lq
78,[Thursday Rant] Maybe seeing a light at the end of the tunnel,well the last few weeks were brutal  i'm for a long time in the same job  i don't know how i could put up with so much bullshit  but maybe it's because i bullshited myself that my side passion which i put in all my money and effort in would blow up in the meantime  guess what  it didn't and it's gone now as every other person who was involved finally resigned    amp x200b   maybe it's because i had the illusion that i actually can gain financial independence with saving a lot  investing and crypto and stuff  guess what  yes since i focused on it i came a long way  but realistically speaking with the annual wage i earn  it still would take at least 20-25 years and then i would be anyway near retirement age  so it's more like fuck you money for a short amount of time when i'm out of a job   most people on financialindependence and personalfinance are already privileged people with master phd degrees and cushy jobs in big companies where they belong to the top earners  or doctors  like mrmoneymustache  lawyers from wealthy families  also a near illusion that it is possible for everyone to quit their job at age 35-40    amp x200b   so after that realization and instant feeling of being trapped set in  i've never experienced so much existential crisis like this year  it's agonizing   on top of that my boss made it pretty clear that i simply can't stand working for him anymore    amp x200b   so what did i do  i looked for another prison  employer  who maybe has some better slave  work  conditions although it's the same shitty job in a part-time way  i actually had an interview and it look promising  soon i will know if they accept   what did i do  i just asked for so much that i would earn the same amount for only 4 days instead of having to work for 5 days  can't believe that they would even consider that   that would mean 52 days more  almost 2 months more life time in a year    amp x200b   wish me luck and don't give up   - gt  don't kill yourself  don't let the system win,bs0w9i
79,What's your plan?,curiously asking  to see how much our answers relate    amp x200b    if you dont have a plan  you become part of somebody's elses plan  - terence mckenna   amp x200b   i dont want to be part of someone elses plan unless it's to abolish work   ,bs3yhx
80,How shorter hours with no loss in pay was won,https thesocialist org au 8-hour-day ,brn3ph
81,A controversial opinion,feminists have tricked women into thinking that a  career  is more meaningful than raising children  now  married couples with two full time jobs can barely make ends meet because they pay other people thousands of dollars to raise their children  this isn't a liberal vs  conservative issue  elizabeth warren lays it out in the two income trap    suffice to say  2nd and 3rd wave feminism play right into the global corporate-capitalist agenda  convince women that careers provide meaning  flood the workforce with women  drive down wages while simultaneously drive up the cost of childcare and higher education  put money in the pockets of corporate moguls while attempting to convince underlings that middle management and 50 hour work weeks give your life value ,brg4m3
82,"Your free time, devour it.", now my life is in complete disorder  it is true  i have a job with a tiny salary of 80 crowns and 8-9 interminable hours of work  but i devour the hours outside the office like a fierce beast  franz kafka  1907  letter to a friend  don t squander your personal time by ruminating on your distaste for your work time ,brqvmc
83,"If nobody had to work anymore, the global population would explode.",i don't want to work as much as anyone on here  but it occurs to me if people didn't have to spend a huge part of their lives chasing money  then they would be having a lot more sex  resulting in a lot more babies being born and there's already a lot of talk about overpopulation as it is now  so imagine what it would be like if nobody had to work anymore ,bs5w9u
84,"Anyone else a musician/artist, but have to waste 80% of your life in an office doing nothing instead of working on your craft?",i m at work and a wave of inspiration is hitting me now but i can t do anything about it  it s not like i m getting any work done  so why can t i just go home ,brdrvi
85,Best jobs for intellectual introverts,what are the best jobs for intellectual introverts  in my specific case intj    i am a female mid20s living in italy with a bachelor's degree in foreign languages  i've tried to work as a freelance translator or teaching italian but they say i need a master's  while in the past even someone with just a high school diploma could do that  lol  so i am gonna go back to graduate school   but i'd like to see general advises for introverts who want to work alone in small groups at worst  and mostly from home small office  not small cubicle in a giant firm  and not slave away in menial manual jobs   accountant jobs which requires talking all the time with colleagues and supervivors  thank you  ,budafh
86,What should I do with myself?,i'm a guy under 30 who has been dabbling with starting an ecommerce or amazon fba business but like usual  fear holds me back  a friend suggested i become a tradesman like an electrician but i feel like that wouldn't fulfill me  i don't work or study much and i live with my mom and siblings  i saw the guide but it's a little vague  i  like others here  don't want to be a cog in a machine that dehumanizes them ,btam3u
