,title,body,id
67,Ok so I thought I liked our VP at first but he’s watching us like a hawk,he was really cool and laid back it seemed he didnt want us staying late or doing too much when we didnt need to   but today i found out that he got onto a coworker for coming in late which makes no sense because she has been coming in between 89 for the entire year that ive been here and now suddenly its a problem i usually leave early on fridays when no one is here but my coworker warned me that the vp is watching us so i guess if he leaves ill sneak out and get back online from my laptop before he gets home so he thinks im still there lol   he also told us we have to take our laptops home every single night this pisses me off because not only is it just an annoyance to have to pack it all up and lug it to and from my work to my car then my car to my apartment but it makes me accessible at all times which they can always reach me by phone except now they can reach me by phone to tell me to do something after hours it moves all my icons to my laptop screen which i literally dont use bc its too small and then when i hook it back up to all my main monitors the icons are all fucked up and i have them in a specific spot and order for easy navigation so its a waste of time because i have to sit there and move it all back i understand having us take the computers home when theres a big storm or something but every night just in case thats ridiculous   my manager has also been snooping through all the emails yesterday she was like so i saw in the email that you have no more stuff to upload im like whyyyy are you going through my regions email when im the one who handles that region you legit have no reason to be looking through it   pro tip if your company has a skype for business im system change your settings to wear it doesnt save any of your conversations one time after a girl was fired i saw them going through all her emails and saved im convos idk about anyone else but ive talked some major shit over im   another pro tip on skype for business you can change the settings to where it doesnt go inactive for hours at a time i have mine set to indefinite so i can be working from home and just leave and my computer will show that im online also works when you wanna take a long lunch leave shortly after everyone near youyour manager leaves set computer to go to sleep in 45 mins so you have an extra 45 on your break since it will show your boss that you left 15 mins before they got back ,bhe8kc
68,Shareholders believe all labor is theft., him from kansas 2   i kimfromkansas  when we talk about tends in underemployment and people sobbing together four parttime jobs to make ends meet its important to understand that this is the will of the shareholder not the workers  and as far as shareholder are concerned all labor is theft  1253 of  11819 ,bg8g9t
69,How to convince freind to be work free,my freind usubterrainio works 9 to 5 week by week to pay the bills hes misrable how can i convince him to quite his job and ask his dad for a credit card like i did think of the posibilitys hes a smart guy he could go to college hes also a libertarian if that makes any difference in convincing him,bgy02w
70,When coworkers act like they're your supervisor,yeah i always hated that shit im not sure why but the worst of it happened when i worked at a warehouse it was probably because i was the youngest employee there,bg9amr
71,I guess I’m looking for a new job,i brought some of my concerns to the vp my concerns were  1why is one of our deadlines being set to monday by the manager when its not really due until end of day tuesday  2 the goal for finishing our work on mo days is 630 pm and we are supposed to get off by 5 im not a fan of having to stay late every week that shouldnt be part of the job i mentioned that i usually feed my dog by 530 and that i have her on a schedule   3i dont like that im being forced to move regions  his answers were mildly infuriating and not what i expected to say the least   to concern 1 he said that i should ask the manager go figure you bafoon thats what im basically asking you to do he said maybe theres a reason she set it so early that you dont know about ok but then why is my region doing it on tuesdays then  to concern 2 he said the goal is to finish as early as possible but then basically said that theres nothing he can do then insinuated letting the temp employee go i said uhhhh having only 2 employees in that region wont work he sort of back tracked by saying yeah i know but and then made excuses instead of offering solutions then said well if one region isnt finished there shouldnt be one person staying late every day so if they dont finish their job i have to do it for them and stay late do i need to reiterate again how much i dont plan on staying late every week   to concern 3 he said i need to learn the other region which like i get but i dont need to do it every week permanently to learn it the manager is taking my region and giving me hers because mine is more manageable   time to hit up some new job prospects lol,biriv7
72,It's 3pm on Sunday and I'm crying because tomorrow is Monday,sigh  im 20 im a chemical engineering student i did really well in my classes in school and got hired for a coop position at a nearby chemical plant these positions are very highly regarded and competitive everyone in school my school and the employer told me it was such a great opportunity basically its like a longterm internship that you take time off of school to do because working hard in school does pay off right right  its been 4 months now and im quitting prematurely i was initially signed on for 12 months my supervisor changed roles a month into me being there and essentially stopping providing any help or mentorship from that point onwards i had a coworker who was sexually harassing me and trashtalking me to others i did my best to separate myself from her and move offices away from her but i still see her every week day she has been incredibly cruel towards me   my hours are 730am4pm but factoring in commute im pretty much busy from 630am5pm each day because of my job because i need to get up so early i need to be asleep by about 10pm so thats a daily 5 hours of sentient freetime on this planet when usually a person has 16 hours with 8 for sleep thats fucking thievery  i see my coworkers more than i do my boyfriend who basically is my family isnt that messed up   i really just dont give a fuck about my job management and people issues aside why the fuck would i care about making more plastic our main product faster and cheaper in fact i realized that in order to add value to our planet i should actually sabotage any efforts of this very chemical plant to provide any value in the situation i should do the absolute bare minimum and get paid to fuck around and make things more complicated and more costly for others maybe donate a good chunk to some environmental groups what a crazy situation  because the coops here dont have degrees yet theyve also classified us weirdly were salaried workers to prevent us from unionizing like the bluecollar workers here do but with no health insurance vision dental pto or vacation i make good money 50kyear but what is that worth without healthcare without any time off with a pushed back graduation date and basically no freetime in my life anymore the past two weeks ive just been laying in bed whenever im not at work ive lost a lot of weight ive felt really trapped i do not feel valued at all additionally im doing what i could get paid 70kyear to do with a degree i dont care about the money primarily but i should get a fair wage   in school i was living on about 22kyear i was happy even with the crazy difficulty of my courses i had time to see my friends my boyfriend and be amongst likeminded and caring people i wasnt tired i wasnt depressed i did things that mattered     i did psychedelics for the first time a little before i started my job which is perhaps how this whole thing started i know it sounds really crazy but it was probably the most meaningful thing ive encountered in my life it showed me all of the connection that i had to myself to others to every living creature and the planet it helped me heal so many wounds   however i honestly want to bawl thinking of the billions of pounds of plastic that i have helped produce while working here i am so sorry to the earth and the plants and the animals please forgive me please i am lucky to be gifted with a schoolminded brain but i feel as though i have used my power for evil and for destruction i cannot believe how much i have helped to destroy our planet   wednesday is my last day at this job in a couple weeks ill continue my schoolwork   its at the point where honestly when i get up tomorrow morning its going to take everything in me to not keep driving past the plant and into the nearby woods and lay down amongst nature and do something actually meaningful and exist there instead all just to keep a stupid bullet point on a stupid resume to get another stupid job like this to looks good and smart and to make good money thatll again get in the way of doing something meaningful   it would take some maneuvering but perhaps postundergrad i could do something useful id love to become an academic researcher with more of a medicinalchemistry bent id love to help the legalization and propagation of psychedelic medicines i know it sounds a little nutty   but is it more nutty than selling away my life to be a humancog in a slowburning machine built to destroy our planet and sell it out for human greed thatll sell me out as well when it gets too greedy   i am destroying our planet,bif204
73,Chip in your sick leaves.., d mm cnn   key can a teacher ran out of sick days to stay with his cancerstricken daughter so fellow educators whipped in with their sick days  adding up to a a  s like horsey 2 dorseyfilm tales from the working class  dystopia repacked as feel good stories are getting old    ,biefyy
74,So.. have any of you broken free from this hellish cycle we're stuck in? How?,give us some success stories a light at the end of this tunnel,bifg0s
75,"The pressures of becoming an ""adulting""",i just had my 25th bday a couple of months ago the quarter life crisis and ever since i was 19 i have trying to figure out this whole work thing i have tried multiple job industries and even tryied being self sufficient by having my own online drop shipping business after years of trying both i have come to the conclusion that 99 of jobs are unfulfilling and boring as fk going down the entrepreneural path doesnt seem that flash ethier 6080 hour weeks constantly working having no time for other things in life the only way i can see this working is having your own business but actually being passionate about and not just in it for the money since no amount of money can compensate for the unfulfilling ratchet exsistence you feel with being at work i honestly dont know what to do also i have these annoying high school friends that are echo chambers constantly saying nonsense such as got to get off the mums tit someday  gotta grow up and get your own place one day when are you going to finally become an adult etc etc this annoys the shit out of me as they are trying to convince themselves by thinking that there is a rational way of living like a fking robot for 50 years but im not getting any younger and the pressures is getting to me anyone else feel this way have any advice   bluepillergonerogue over and out face maskhttpsiimgurcomcwugvtkjpg,bivwzt
76,Probation,anybody here on probation i just started my first month and not really sure what to make of it its for a dwi and is 3 years but one of the requirements is to be working or in school i quit my job last june just 3 months after i got it irrelevantly but also terrible timingand have a had a hell of a time finding work ever since in part due to transportation and in part due to my ever growing negative attitude on the whole system why im on this sub and general displeasure with the type of work i do having my first meeting with probation today was a reminder that im stuck in this system and i literally cant opt out right now i almost wonder if jail would just be better,biydsv
77,amirite?,build mea thousand ships    ,biuw96
78,Feeling so beat down,i feel like no matter how much i work i cant get ahead everytime i come into some money from busting it some big dumb ass expense comes up im tired of the rat race i dont buy anything anymore pretty much just food everytime i spend money on something non essential hell even food sometomes i feel like its being taken from me i dont know if any of this makes sense im just so tired demotivated and lethargic i hardly even want to do the things in passionate about because of how beat i feel about having to work so much,biximk
79,"Let's talk about this ""impostor"" syndrome",i have been struggling at my current job and have been hunting for a new less stressful job on the side i finally landed a promising interview this week and i am nervous as fuck  specifically i am nervous about having to answer the inevitable question of why i am jumping ship the truth is that i am bailing because i am simply not good at it and i want a job that i am better at and that will stress me out a lot less thats really all there is to it but i cant really say that right nobody ever wants to admit their faults especially in an interview we are supposed to inspire confidence in our abilities make ourselves seem like the perfect gear to be slotted into the machine so i will pretend to be that fully functional gear  is it any wonder that so many people suffer from this socalled impostor syndrome i think that even if you arent in a particular situation like mine ie struggling to come to terms with personal limitations which are disrupting your life in a very real way chances are you still have to make some sort of alteration to your individuality in order to work even the people who are good at their jobs face the pressure to continue to perform to hide their fatigue or moments of discouragement work always posits a productive reality against an immanent reality a hierarchy of uses and values against a chaos which can only be described as inherently human we are forced to hold out our association with the former as the true core of our identity while obscuring our relationship to the latter  can we imagine a work culture in which i could show up to an interview put my personal flaws on the table alongside my strengths and not feel like i have put my neck on a chopping block can we imagine an employer telling us we are totally okay with your flaws because work isnt actually that important  whats important is that your existence isnt a total fucking nightmare so just do your best and well stick with you a guy can dream right  ,bivy5q
80,At my whit's end. How do you guys handle it?,i work a very demanding it support job im required to be available 24x7 on salary night or day i get phone calls and im required to drop whatever im up to and fix various issues i commute 45 minutes daily and whatever i do it seems to never be enough i have lost all motivation so my work is just piling up   then when i am home i dont want to do anything i usually end up scrolling through netflix for 3 hours then go to bed im gaining tons of weight since i dont want to cook so i usually just order out im no longer interested in hobbies and i never want to spend time with my friends or family anymore i got sucked up in the american dream so just leaving it all really is no longer an option since i have a mortgage to pay and i gotta eat   ampx200b  how does the like minded antiwork community deal with it im feeling a bit of the existential crisis coming on where i think im just going to be like this till the day i die,bj8zn0
81,"So here's an idea to reduce government, bullshit jobs, climate change and work all in one proposal",say we get a referendum on the ballot in a state that allows referendums next year  the referendum states that anyone in public employment who believes they can do their 40 hours job in 21 hours can opt to work only 21 hours per week 3 days times 7 hours for a full forty hours pay if the employee chooses this option they can no longer qualify for overtime and their department or unit cannot hire additional staff to cover the hours lost due to the employee working less   more work has to be done to flesh this idea out  but could it work,biwzja
82,I just handed in my 2 weeks notice,i cant take it anymore its got to the point where i was seriously considering driving head on into a tree or something on the way in so i could deliberately put myself in the hospital rather than go to work it was a college job to begin with and then i just got really sidetracked and ive been there for 2 and a half years now it was stacking shelves overnight at a large retail store   i havent got a plan or anything and i know its stupid to quit without having anything lined up but thats the least of my concerns right now i had to do it for my mental health ive got a fair bit of cash saved up because im in the fortunate position of still living at home so money wont be a problem for a while   i already feel a huge weight taken off my shoulders and i have an application currently being processed for a job thats tied into one of my hobbies im a big motorcycle guy and its a tech apprenticeship the pay isnt great for qualified motorcycle techs but that doesnt bother me its got to be better than being stuck in a cubicle all day doing bullshit tasks that ultimately dont mean anything so hopefully i hear back soon  in the meantime though im going to use this period of not being in work to focus on my fitness mental health and general wellbeing,bj49ru
83,middle management and HR are fake professions,ever notice companies who employ these parasites both suck to work for and do business with,bj9dkj
84,Who gets high at work to pass the time?,i do maybe 23 times a week it helps that i work from home helps get me through the day sometimes when i can plug in my headphones and just cruise through some boring work shit while catching a little buzz,bj4pj6
85,Future Corpse - Monitor Faced. An antiwork song.,buried alive from 9 to 5 or worse for some poor folk,bjam1v
86,I felt free for seven months and now I feel like I want to die everyday.,i dont know what i expect to get out of this post but after lurking for so long i feel like i could at least feel some kind of better after saying it out loud   i worked for a retail chain for a little over seven years during that time i slowly climbed the ladder from a cashier up to an assistant store manager it was a long and arduous process but it was also my first and only job during that time i started off at minimum wage of 735 and made it to 12 during my time there the way our stores were oriented only allowed two and on rare occasions three employees in a store on a day to day basis my days were a constant waiting and worrying that the next employee would even show up to work everyone wanted a pay check and not a job a concept i didnt understand until nowbut at the time it helped add to the pile of mental anguish i had to endure  towards the end of my work life i was working 6070 hours a week paid overtime is a perk but it wasnt worth my mental health anymore so i finally decided to quit   i enjoyed seven months of a job free life i had a nest egg that helped supplement my life with my girlfriend but it only lasted so long until i needed to get back into the market   so i started a job at another retail chain they started me out at the same twelve an hour i was making before doing twenty times less work   but the problem now is that im having panic attacks everyday i feel forced to do this just to be able to live my life i feel forced to do this to provide for the woman i love and all of these things combined drive me insane everyday and i dont know what to do with myself to cope with it   i want to quit but i feel so stuck  i have dreams of maybe making video games someday maybe try twitch streaming i just want to do something with my life that i enjoy and can sustain me at the same time and i feel like ill never get to that point   rant over thank you for hearing me out,bixn6f
87,"So I have 1 month working at a new job, and I’m already ready to quit.",so last month i got a new job as a bank teller compared to my old job working in the medical fieldi ended up figuring out the medical field wasnt for me   well being a bank teller is less stressful than working for doctors so thats a plus but as my time at the bank continues im realizing im done with working for people i honestly hate it dont get me wrong i love talking i love conversations but damn are all these peoplespatientscustomers attitudes very entitledso now im wonderingis there any legitimate good work from home jobsus tx i understand that this might not be antiwork but its still kinda antiwork in the sense that i dont like working in public anymore any help would be very appreciated,bgk0uu
88,[x-post] The average life of a Japanese 20-year-old,posted by usyflan 1 hour ago  in my early was working in japan all  see are old worn out faces of  workers both men and women who are stuck in a culture of overcome and hard work every day  still only work 40 hours at most a week some days  more like 6 or 7 but im done with it  ve lost all the time  had to focus on  my own life instead its all for the sake of my job and obligations to many things get pushed to the side since  dont have time to sort any of it out  once my contract is up or  get fired  m just moving back home and not  working ill either make money for myself or just not spend hardly any  ive thought about it a lot as ive been working the past several months its     in no way worth it to sacrifice most o of work and money  your day almost everyday for the sake   dont care if im poor or seen as lazy to others im donna spend the short  life  have rousing on my mental and  physical health and welling work is  something ill do for my own sake by my own accord ,bhq9wz
89,Me (the horse) trying to get through the workday,the swamp of sadness  never ending storyhttpswwwyoutubecomwatchvy688upqmrxo,bfqjfr
90,You can pretty much get people to protest anything except the one thing that underlies all social ills: wage slavery,the independent when the government says nah to everything taking direct action on climate change is the only option httpwwwindependentcoukvoicesextinctionrebellionclimatechangeprotestsdirectactionpetitionadamboultona8878006html,bfj9zu
91,The True Meaning of Easter.,an thatconnartist  and of easter sunday jesus did rise decreeing that the big tesco must close of his honour but the express store can stay open for essentials  16042017 1005 am ,bfssbc
92,"""Since VICE management has yet to explicitly say so, we will: VICE LIVE has been cancelled, and our union is working hard to ensure members losing their jobs get fair severance packages. Media unions cannot prevent layoffs, but they can soften the blow. Organize your newsroom."" - VICE Union",1208 he b  old one   sweet     vice vice union union viceunion  since vice management has yet to explicitly say so we will vice live has been canceled and our union is working hard to ensure members losing their jobs get  fair severance packages media unions cannot prevent layoffs but they can soften the blow organize your newsroom  1213 of 17 for 19 twitter web client     sweet your reply    a ,bfsq51
93,Bullshit Jobs (book) by David Graeber,my first post here i just discovered this sub   i recently read this book bullshit jobs has anyone else read it i highly recommend it to everyone in this sub it goes really in depht to pointless jobs and why they exists   personally the book just blew my mind im kind of perfectionist who would probably keep myself busy even without job and i have been so frustrated with every single job i had   im studying programming because i think it as best way to make ends meet and have possibility to change jobs and spend longer periods of time unemployed and work at home and im actually interested in it   i feel like all my previous jobs have just drained my energy and creativity to make something actually meaningful now i have been unemployed for 9 months thanks to social security system in my country and some money i inherited and never before have i been so focused on my personal goals and needs so much in my life   i believe this kind of chance to explore one self with enough time should be possible for everyone i understand it wouldnt work if everyone just stopped working but everyone should have a year in their life when they can focus on themselves and figure out a plan for their future that they dont hate  i would love to hear your thoughts about the book or your relationship with this world where everyone is expected to grind all their life,bhnp7n
94,Mandatory 1 hour unpaid breaks should be illegal.,youre extending the time a worker has to be at their company for a whole hour    yes you can leave the premises but that just involves you taking off your uniform and commute time by the time you get home you have to head straight back to work  1 hour unpaid breaks are degrading and pointless you have no time to do anything and spend more time waiting for the break to end than anything  its a huge waste of time and takes out any meaningful hours you couldve spent at home  great now instead of 3 hours of free time you will have 2 hours,bhkoto
