,title,body,id
243,What boomers really mean when they say do what you love.,i have considered leaving my job for something more related to my hobbies  it's entirely possible  but really there's a reason most don't talk about it though it's been mentioned here a few times  1  it has to be something you're practically in love with  not just a pass time  because spending eight hours a day several days a week doing anything becomes your whole life  even when not physically there  people ask about work  most of the people you talk too come from work  sometimes you even dream about work  if it's something you like doing  you better really like doing it  alternatively you could hate what you do but just get paid really well or do practically nothing  but for the first world those are options anyway  really the only difference between us and a peasant is while the third world farmer has to choose total poverty of commitment  while we often lack commitment  gee what a shocker  we do have the option of just not doing anything for the most part and living off the scraps  some of us more than others ofcourse as all things considered  america is basically a third world country larping as a first world when you look at say sweden or norway    2  as said if you don't absolutely love this thing there's no way dealing with shit head bosses  being tired all the time  and doing the same routine every day forever is going to make you wanna kill yourself any less  the only thing that will happen is eventually you'll feel bad because not only was this not quite the passion you thought it was  but people will criticize you for somehow being ungrateful that you're living out  your dream job  and you're in the same predicament you were before  as so many in game design experience  because when people think game design they think inventing the new super mario world  not writing seven hundred lines of code for the next fortnite update on a deadline which amounts to little more than some money in your name and being able to say on your resume you worked on fortnite  maybe you can do a floss dance for big money gaming tech and then get treated like shit at blizzard or something   look at the way they treat their consumers  that's only a fraction of how they're obviously going to treat you working for them  if the customer is just a clown to be parted with their money then banned or ignored  you're outright a slave to be abused and tormented to extract as much benefit as possible  i don't give a fuck how many monsters you drink  you're not gamer enough to love that life    3  the same issues will happen no matter where you work because it's not a personal problem it's a systemic one  the same way i say all mods are evil  all mods should be shot  isn't a testament to reddit itself but mods in general and despite their pissing and moaning about mu'h violent content moderators aren't a protected class but i am and they still harass me  you will experience the same sorts of evil working for the 4chan or twitter equivalent in wagie cagie   sure there might be some variety here and there of how you're mistreated  and certainly they'll draw from different pages of their big book of bullshit reasons  but ultimately it amounts to pretty much the same thing  boss is a twat  doesn't pay attention to the real problems making these projects and expectations implode  co-workers are all either completely numb and just don't do their job right on purpose  or are so impassioned with making a name for themselves will act like they're in a fucking gangster movie just to be supervisor  you get all sorts  but really does it matter if there's cultural  racial  and gender diversity when it all amounts too  i really don't wanna see or interact with any of these people   you'll probably need to find one you like though  you don't wanna be the 40 something single guy or girl whose entire life revolves around cats and this shit job  because as much as employers say they don't wanna drama in the work place  unless they're gonna arrange you a marriage like some arab prince  giving the vast majority of your life is spent at this specific location with these specific people  you better find someone to breed with or you won't be breeding at all  thus only making the experience more unbearable and grueling  cause i dont know about you  but i wasn't born on this earth just to die alone     so what im trying to get at is don't expect  doing what you love  to change anything if that work is tied in any way to capitalism  which it will be  we live in a society ,cgncep
244,What a wretched state of things,i'm currently at  the lobby area of my dispensary and two of the regulars who work at nearby burger king are complaining  quite rightfully from the sounds of it  about having to panhandle just to afford work clothes since even working 80  hrs a week they don't have enough to cover basic necessities  as well as the fact that their boss is evidently stealing from their paychecks and not giving them their earned overtime  i'm infuriated for them at the inhumanity of such a situation and knowing it isn't even uncommon in the richest country on earth is a fucking travesty  i'm not doing great myself and i can't offer much help other than condolences but godsdamnit if it doesn't make me sick with fury ,cg4u6x
245,No water? No problem.,due to a water main break  human stupidity  yesterday my office went a few hours unable to flush toilets  wash our hands  or get water to drink    finally  we were sent home to work  we were told to work from home today as well   early this am we got an email  facilities is bringing in porta potties  it s only 90 outside  and bottled water     first world problem  but ugh  maybe just give us this one ,cf5jsl
246,"""Go spy on other stores that sell our products see how we can be better than them...what do you mean you want paid to do it?""",an a few staff members go round and look at the competition near your store rebecca sent out something last wednesday to be filled in please go through it look at the questions      would like at least one sent in fro  very store   from every store let me know if you are going to do this and what day  i'll go have a look at the other shop in the town tomorrow 16 23 w  1 unread message  an you go on day your not working so your not in uniform ll ,cgfhy8
247,"My boss is the epitome of the ""bad boss""",i'm currently the only person working in my department because my boss doesn't want to hire anyone else  so i'm left dealing with the workload of three people  in spite of this  i complete my work well before the end of the day and do so accurately    this  however  does not seem to be enough for him  if i tell him this  he will either make me work in the hot  deep south humidity and heat for the remaining 3-4 hours  or send me home with no pay and no consideration for the fact that i need to eat and pay rent  similarly  if i take only a  second  to myself to make a note on one of the lectures i listen to during work hours  criminal psychology  he'll get onto me for wasting company time    despite paying me and the others less than  12 hr  he buys lunch for the supervisory staff and himself on fridays to  celebrate their hard work  despite the fact that 90  of their day is simply ordering others to do things and then sitting around disciplining workers for too-long bathroom breaks    meanwhile  i take on the work load of 3 people and everyone working outside is made to do 8 hours of grueling work for less money than i'm paid to sit at a computer  and we're not allowed to check our phones or send messages for even a moment because it's considered a waste of company time    until a month ago when i started this job  i still believed the modern workplace was a cakewalk and everyone complaining was an entitled child  but this has opened my eyes to the things going on around me  and the many abuses of employers ,cg332n
248,What is the point of staff events? Specifically parties.,parties are meant for fun but staff parties carry this weight that i think nothing else has  they aren't mandatory but there is this pressure to attend or else you are labeled as not being a team player  you can't get too drunk or roudy because it's still a work environment  you can't be yourself and you cant have too much fun or too little fun    sometimes i'd rather have my head in a vice than navigate the work environment of backstabbing colleges  lame parties and snide but polite comments ,cffiqm
249,Suggestions for revenge on ex-employer,hello all  so my asshole ex-employer has basically exploited a loophole in the law to scam the equivelance of 1400 usd  a large amount of money in my country  out of me  i am so furious right now and i want to do something back to feel good about it  suggestions  ,cgsn89
250,ALL BOSSES ARE SCUM.,z  most by mob to sobriety  to   got let go tonight from my job  by boss said that   had been rousing a lot on my society and working my recovery - which was good and healthy - but ultimately that   had been too focused on it and not indicating enough of myself to my job   it s small business and he s looking to expand into a second location  and lately  his words   he doesn t need good work  he needs great work  and my eight years  while previously great  have slipped  he s seen my progress since coming to grip with addition and working the program  but it s not what he wants or needs right now   to   got a month s severance and that s that     put eight years into this  it s a small game and toy store in new jersey    built a community here and made it a place for people to play  right  years  and   got let go   because i've begun to come to grip with personal problems and taken the steps to better myself before anyone got hurt   la     31 it  share he  add a comment    ,cfz3kv
251,The economy is booming. Jobs everywhere!,ion jobs have been created since  plump took office   rottetprepublicans  eerie   have three  of them and  still can't pay  my rent        ,c84psr
252,I earn money doing nothing,i have a job where my boss is constantly fixing stuff i am supposed to do  he is not angry about that  the crazy part is that he is control freak and changes that stuff with passion  he can not help it because it has to be always his way  i dont know what to make out of that  firstly i was mad because it hurt my ego  now i start to realize this is actualy good thing  i am working completely remotely and nobody knows what i do whole day  today i was in the gym and shop and did fucking nothing and nobody gave a shit  i am pulling 100k  per year for this  i think i will find another job and i will be fucking rich   i know it had nothing to do with antiwork but this is crazy  i have never experienced this  i do not know how to behave here ,c8lkxk
253,Swimming to work is a perk baby,security footmen burnside venice war   drill  burnside war   drill venice each of   looking for a active and attentive security for venice beach restaurant  work one block from the beach  must have valid guard card  must be able to lift 50 of   move tables stick chairs and stand for long periods of time  must have full availability  flexibility to work weekend  holidays  must have reliable transportation  good communication skill and be self motivate  marking is not provided but working by the beach has its peaks   shifts varies from pm-pm   5 pm to am   pm to a   resumes are welcomed but not mandatory  ,ca1sel
254,It's funny how even your very own mother won't acknowledge and validate your exsitence until you start ''working'' and accumilating useless commodities.,gotta love that utilitarian approach ,c91dm1
255,I could build my own house for less than what the market is asking for one,seriously  if i put in some serious effort to build my own damn house  it would take me what  maybe a year  a couple years  as opposed to being house poor for decades in the current system   but obviously that is too easy  and the system doesn t get anything for my hard work  so instead i m expected to work a career for decades  and then maybe a house in my price range will be available for me once i get there  who knows  maybe houses will be  13 000 000 for a 2 bedroom by then    people talk about land taxes but it s all phoney bullshit  where i am from  you could travel north for days and not see another human  you could lay claim to a piece of land that would not be touched for another 500 years  yet  as soon as you do  the government wants money for it  yep  this once useless  uninhabited land is now suddenly very important to them  and as such you must pay  xxxx every year  forever  for the privilege of living    it s bullshit  houses are not priced based on what their value is  they are priced based on how much they can suck out of you  there s always some dim witted asshole with more money than brains willing to fork over 25 years of their  50k year life to live there    but ofcourse  if shelter is free and your food is grown yourself  how are the capitalists supposed to siphon money from you ,c98ahm
256,The system can be exploited,https youtu be 4az2rxtqaz8,cal29d
257,1st day at work. “What do you mean you can’t find the cable?”,i    7     he    x          ame a oe   he engage oo s       a a he e- a es    jaqadudtonuaddgaaneddvetes e    ,camww8
258,Feeling bamboozled by company,on their website  they posted that it's 40  days of paid leave  but come to find out that contractually i have to work 6 days a week 12h a day and sometimes 7 days a week during peak season   and i can't take leave whenever i want  i can't leave during their  locked  season,c9dciw
259,Four-day work week: Australian company triples profits after cutting out Wednesdays,https www news com au finance work at-work productivity-soars-after-aussie-company-introduces-fourday-work-week news-story 37aecacac1e1d4f7120fb704a67e90de,c9l58r
260,We are such an entitled generation...!,2 life-worth    ,c8kybd
261,My neighbour shamed me for being unemployed,i posted about it on another sub last week   https old reddit com r narcsinthewild comments c5jfej ive got a new neighbour story     gt update on the neighbour i described here    gt https old reddit com r narcsinthewild comments c3w638 im not sure if my neighbour is a narc or what but    gt earlier tonight we had another balcony chat    gt unusually for him  he asked how things are going with me  particularly my job search  i'm currently unemployed and having a tough time finding something in my field  i told him about a couple prospects and then we moved on to other topics    gt then he comes back to it  and starts by saying sort of laughingly  it's funny  since i've known you i've had so many jobs  i keep getting hired   he's a part-time dishwasher in a restaurant  i didn't like the direction it was taking so i started asking him about his current job    gt he circled back and said  i just worry about you  i worry that you'll run out of money and get evicted  not what we'd be able to help you with money    gt i said  i'm tired  so i'm going to bed  talk to you next time    gt he was absolutely having a go at me and he can fuck right off with that   it's still bothering me a bit   it's creepy when someone goes out of their way to hurt you   i haven't had any contact with him since   i'm posting here because another angle on it is our toxic culture of work   that's how you get people who believe even having one of the shittiest jobs around makes you superior to someone who has no job   it's also how you get people who are so insecure that they need to punch  down   this guy probably bullies the immigrant dishwashers at his job and similar   so in addition to the toxicity of having to do jobs that are largely pointless to begin with  we also have to contend with petty status games   no wonder so many of us have depression and anxiety and self-medicate with various substances ,c8oy9c
262,How come companies don't get fined for fucking things up for employees?,my company deducted hours from my paycheck for their mistake   now i have to wait weeks to get compensated after reporting them   i already live paycheck to paycheck  missing money hurts me severely   i'll get my money eventually but they get no fine or anything for fucking me over   if i do something that hurt the company they will make me pay for damages ,c9ticn
263,If people didn't have to live independently this wouldn't be too much of a problem.,there's a stigma for living with your parents  but if you were able to do it  you wouldn't feel obligated to slave away  another thing is  even a minimum wage job would give you enough to save up for a house if your parents aren't stupid enough to charge you   it's just a stigma that causes parents to kick their kids out and let them fend for their self   a 18 year old making minimum wage but not paying any bills  no car payments or anything is going to save more money than most people  and be able to get a house very early in their 20's     they can fuck off and travel the world and do whatever they want in life   it's just not normal for parents to let their kids do that ,c94z7s
264,Imagine living in the Shire,it honestly sounds like the perfect life  everyone just not concerned with the trouble of the wider world  sure  there's work to do  but you'd actually see the fruits of your labour and you wouldn't be slaving around constantly  there wouldn't be all this stress from management  take your time  live a good life  plenty of friends and likeminded people  what's not to love ,c8rovm
265,It saddens me to hear my coworkers talking about their weekend jobs.,it doesn't seem to bother them either  the fact that they don't have any free days at all ,c96y70
266,Letting paper determine a humans worth is morally depraved,i do not believe humans should have to prove they deserve life or person hood  which is why i would never take part in this system  i care for my own species and would like to see us succeed too much to take part in something so immoral and harmful    only feeding  sheltering and educating the humans with enough pieces of paper is clearly a detriment to the progression of our species intelligence and well being  i highly doubt a successful alien species in would ban their own race from education based on amount of paper  it's so clearly a horrendous idea   telling humans that they have no value by default is disgusting  people can try to make all the political economic arguments they want against this simple truth  but at the end of the day all they prove is that humans have yet to create a system that is worth defending    it's funny how people usually respond to these kinds of ideas with  have fun dying in the streets  not realizing that proves our entire point ,c8mg9o
267,Receptionist at new job told my boss I was rude because I was trying to explain something to her,anyone have problems with people at work being hostile and trying to force polite fakeness on others  i've noticed that i don't do anything that would be out of the ordinary  barely interact with a person and they derail quickly  this receptionist kept saying  we can't help you  and i was saying  i'm not asking for your help i'm asking for my boss to call me back  she talked the same way i did  if something needs to be communicated  why derail communication and understanding because it sounds  rude      i don't care about gossip  drama or people's opinions of me at all  what i am sick of is people actually trying to cause me harm and ruin my life over nothing  they also often create problems out of nothing i notice  polite manipulation is the worst at office jobs as well  now that i have worked both that and a variety of labor jobs  i can't do the hard labor and people think i'm lazy when i worked as hard as i possibly could to do it right  now this is the first job i've got in economic empowerment working with adults in transitional housing  dual-diagnosis       but if my job is gonna constantly be threatened and i can't communicate without hostility  i can't help the people i want to help  i attained my self-determination as a teenager from an abusive household  it was actually profound  i survived many toxic jobs because at least they paid me while my abusive family did not  and i got to leave  eventually i lifted myself beyond it  but it's clear there are people everywhere who take out their suffering on others and are too hooked by revenge  it is especially damaging at the workplace and it keeps us disempowered  i'm not going to be part of the problem  if they put me on the streets because of their toxicity  in the end they only hurt themselves     i speak from repeated precedent when i talk about this too ,casz8v
268,Job application pre-test... do I need to just lie about my actual personality to get the position?,   it a crowded event     stick closely to my friends  try to meet as many new people as possible       ,cb76vt
269,I really like learning weird things about other people’s jobs that are messed up. Share a few with me?,for example  i have a sensitive stomach  i am pretty good at dealing with it and it usually doesn t cause problems at work  however  one time  my  productivity  was off and they required me to make up 2 hours i had accumulated because i d had a terrible week with it  i had to come in on my day off just to work 2 hrs ,cbyl23
270,"""You have to be crazy to work here""",how much of a role do antidepressants and the like play in your workplace ,cb9zou
271,How can anyone think working full time is a good idea?,except the people that want to leave you with so little time you can't barely do anything   i work part-time  between being social  and i'm not very so  getting a good 8 hours  trying to exercise consistently  upkeep and maintenance of ourselves and things  cooking good healthy meals  where's the time for hobbies  no wonder everyone loads on the couch watching tv and movie or the internet  though i'm guilty of that one ,c8izlw
272,Any suggestions on getting through the day?,i can do four hours  five at most  then everything falls apart to the eight and a half before i leave   i feel like i'm in prison the remaining hours   i feel trapped  i would literally be okay with doing anything else  like going to church or waiting at the dmv   i literally watch the clock on the computer and watch each minute go by  and it seems to make it ten times slower   i'm allowed to listen to music but usually it doesn't even help   those last four hours or so go by sooooooo slow   should i just try to keep busy   any alternative suggestions ,cbvu0u
273,"Oh, your employee could have possibly died? I don’t care! You’ve inconvenienced me.",x david demerchant  4 reviews    9 months ago  on't bother calling for take out  they put you on hold and never come back   it  it  e ranks d's  owner    9y9months ago  sorry for your inconvenience  the server taking your order had a seizure while doing so and couldn't complete the process  when you showed up to retrieve your order and it was not ready  even though there was an ambulance in front of the restaurant and we were tending to the medical emergency at hand  we offered to complete your order at that time    am sorry that you declined and chose to complain in a public forum  ,cbiz9q
274,Company just fired a guy and now a guy is sick,i just worked my shifts for the week and i've been looking forward to my weekend  now i'm getting texts from my boss asking if i can come in on saturday morning or if not can i come in friday night etc  the answer is no  i have a life  do they think i just want to spend my existence sleeping and working  i don't want to spend every waking fucking moment of my life busting my ass for someone else's benefit  i would be there less then the standard work week if i could  they should at least offer to double my pay for that shift or give me some kind of incentive other than the standard rate  my time is valuable to me ,cc0qif
275,The Greatest Generation (from the comment section of an article on burnout),https imgur com a jtqvpmg,cbgohk
276,Works sucks. Bullshit is better.,stoned thought here   when someone asks me to bullshit something  to hide something from a landlord  or their boss  ect   i have 100  more gusto towards doing the task at hand  b c the task is honest with me  it is bullshit  that s all it is is bullshit and this bullshit allows me to help a friend and screw someone over messing with them   doing bullshit still sucks but compared to work   work is bullshit being forced to wear a disguise of actually having meaning  if you start calling work stupid  many people feel threatened  even though deep down they know what they are doing is bullshit   they will lash out  protect their bullshit  but it s all bullshit  let go on a work  identity  get the money and fuck off   i hope i made sense  i m too stoned to continued  the buttonsr hard ,cbml84
277,Why Do You Hate Work?,i'm a manager at a fairly large business  in the 7 to 8 figure range  i've got a few dozen employees  and i'm in charge of most of them     amp x200b   do you any of you tolerate your jobs  if not  why  what would make you like it more  i'm not sure if any of my employees hate their jobs  they don't seem to  but i'd like to get some perspective why they might  and if so what could be done to prevent it ,cbpsrn
