,title,body,id
0,Have to quit my bullshit job,i have posted about my job before i really dislike it im a glorified administrator working on a military base   before the base closed my line manager a military officer and all round dickhead said i am in stage one of the formal disciplinary process as he is concerned im not working my full time hours nor do i have the formal qualification for the job a boring health and safety certification so why hire me then idiots i never pretended to have the qualification but theyve decided i need it   as i dont want to be dismissed after their little kangaroo court i resigned and turned in my 4 weeks notice on the spot which he looked really surprised at   the kicker is he said my work is of very high quality i spend 90 of my time at work reading my kindle playing games on my ipad or browsing the internet sure i take long lunches and i dont have any timesheet or anything to track my hours   fuck it i hated that pointless job anyway the salary was pretty good though,bgg727
1,[Discussion] I quit my job after one day of work.,hey everyone i am really curious to know how many hours a week do you work  i accepted a job that was 1 hour away each way for pretty good money but id be working 5 10 hour days of physical manual labor and half saturdays a part of me feels guilty but it was so hard leaving at 6 am and coming home at 630pm still having to make dinner and prepare for the next day id never see my family as i would be in bed at 9  it was too much i was on my feet all day landscaping  my co workers were so happy to work 50 hr weeksits justso sad do you not have a family or hobbies others would call it lazinessbut i am too young to work my life away while my body and health are in good shape i want to walk in the parks garden do things for me  justwhat the hell happened to a 40 hr work week my spouse is also working just as much no wonder people get divorced,bghdib
2,Do you discuss work with with your significant other?,my wife and i usually talk about our days when we get back home from work we both think that its good to know how your partners day went over the years however we can go through periods of time where work was too much to bear and we tell each other to not even ask about it weve lived it and dont want to spend time talking about it   im conflicted on how to feel about this on the one hand when work has particularly sucked that day the last thing i want to do is talk about it but on the other if i cant talk about it have i given work too much power over me  anyone else go through this,bgfj5x
3,"As a dishwasher, fuck Easter.",faster day had to for 5 to 2 without breaks now i gotta work 9 to 7 probably wont get out for much later fuck my life just want to ctb ,bfoiwk
4,Moving to cheap countries with savings?,im becoming more and more drawn to the idea of moving to countries where one can live for around 250 a month all in ive got some savings which could last me at least a few years at that amount i like the idea of leaving the rat race and just moving around cheap countries for a month here few months thereetc and when my money runs out i could just move back home to save up and do it again  does anyone have any experience with this type of lifestyle,bfo2uc
5,That's about the size of it.,   kimzee lifeiscrazzy   could die and my job would get a ouija board and ask if  got someone to cover my shift ,biwxaa
6,Burn out is wild,burn out is so real and i didnt realize until it pushed me into a manic episode trying to get money in a way that makes sense,bj87d8
7,"Getting angrier over the years, because of work",ive had a series of jobs that had a strong confrontational element in them customer service tech support even if advanced level etc ive only recently realised the extent of the emotional it caused me   whenever a company searches someone with good people skills its because your real job is essentially to argue with others or convince them to do things they dont want to do  but you have to be polite and nice during the amount of repression positivity and fakesmiles and such is really really spirit crushing   i think i was a nice person once i aspired to be one at least now im just angry and bitter all the time the myth about bastardised operator from hell thats often used to described techies thats because their job made them this way   i cant show this true face at work so i end up taking it out on people in my personal life sadly they dont deserve this,bjbcm2
8,What have you internalized?,i am a hard worker  i was rummaging through some of my elementary school assignments and found this as a common theme in how i described myself and its very much true i always chuckle whenever i read a post about how much soandso hates the super productive worker the worker who goes above and beyond who voluntarily takes on extra work who sacrifices their selfinterest for the betterment of the group the company because i was that person  i started working once i was legally able to do so  at age 14 i worked a minimum of 31 hours weekly i was so loyal and productive for the company that id even voluntarily work through my break time years later when i landed a factory job i remember feeling very useless and irritated whenever there was nothing for me to do  this has all changed recently after a few life experiences and realizations  the psychological influences that shaped my behaviour are so complex that i cant possibly write it all out here but to put it simply  i feared alienation all the environments i grew up in the culture was your value is what you produce what your status is how useful you are and how closely you obtain what we deem valuable you needed these things to be accepted and humanized otherwise you were an outcast and that disconnect from community your peers hell  even from your parents and family leaves a deep psychological scar so i learnt and internalized to accept authority and to submit to its demands i learnt that everything that i was to be had to be aligned with others values i internalized that my worth and value as a human being was solely derived from my economic output my productive labour and attaining those things which others ascribed social value to  so yeah thats a very very simplified version of my experiences what have you internalized,bj1plq
9,sounds about right,                you have just won 2 million dollars you will be paid in hours installments of 8  you must be present to collect    ,bj5ubw
10,Someone took my computer off the docking station and went through my stuff,so the vp is making us take our laptops home and very single day after staying an hour and a half late yesterday i forgot to take my computer oh well no big deal right   well when i came into work this morning my computer was on and on my log in screen weird so i log in and my last file was moved from my laptop screen to the main monitor also weird so at this point i know someone went into my computer dont know why anyone would need to but whatever whats bothering me the most is that i also noticed all my icons were fucked up this is one of the reasons i hate taking my laptop home every time i disconnect it it moves all my organized icons over to a random jumble on the laptop i noticed that all my icons looked as if i had taken my computer home   it seriously looks like my manager took my computer home and went through it which cool theres nothing to hide but why why is she such a micromanager what was she trying to do,bj2u6v
11,Found this comment under an 80s Japanese funk song and it reminded me of this sub,charlie at 11 months ago  oh yes japan in before the bubble burst in the early 1990s it was the beginning of the end of japans infallible economy everybody including the japanese thought it would never end only a few short years later japans economic bubble would pop and lifetime employment as they knew it would be over suddenly we found that the japanese workers were not so much unlike american workers or british workers or other workers they didnt necessarily enjoy being owned by the company and giving all of their lives to the company either  most japanese men of that generation retired with few hobbies or interests beyond work yet they were forced to retire young they were like living ghosts the japanese workforce of today is not like this they are much more like their western counterpart  working to live instead of living to work  how less  i 168 9 reply ,biqw3l
12,Does anyone else feels this ?,does anyone else find questions like whats your passion whats your niche dont you wanna grow and become successful do you wanna die poor  very irritating and frustrating    and seriously this startup trend has ruined everything now everyone is working 12hrs a day because one asshole thinks he can be next jeff bezos or bill gates,bj0xv5
13,"""Our employees' wellbeing isn't in our budget.""",have been approached by a ftse kolo nexoynaterlananvitaneni1m01010h 0101 employees to talk about mental lielifeliable a oh oldeemon oannamanila a mental welling workshop company with one and half employees and  pay of  have no oo1 mo byam elhe o of arsenate business doing business  1029  29042019  tweetdeck  201 retweets 1673 likes ,biutc1
14,China's billionaires to workers: Work until you die working...,bloomberg next china so much for that worklife balance httpswwwbloombergcomnewsarticles20190419nextchinasomuchforthatworklifebalance,bfgo5u
15,"I don't consider America to be a ""free country""",alright i live in a free country sweet that means i should be able to stay home tomorrow anddd thats impossible because i have to work against my will to have the right to shelters that are already built food that human no longer struggle to find and my favorite water  might as well we charge each other for air   theres nothing free about this place physically or financially,bi9w3s
16,"that was honestly my first thought. ""so the others are gonna work the whole school year now?""", d mm cnn   key can a teacher ran out of sick days to stay with his cancerstricken daughter so fellow educators whipped in with their sick days  adding up to a a  s like horsey 2 dorseyfilm tales from the working class  dystopia repacked as feel good stories are getting old    ,bi9b3e
17,Anyone ever had a problem getting a job after a period of being able to not have to work?,so me and my wife both hate work  just the concept of how its structured is so terribly demoralizing that i wonder how im going to make it through the rest of my life  ive had several kinds of jobs and they are all terrible  the bosses corporate bootlicking employees etc  you guys know the drill    over the past 6 years me and my wife have taken turns at being the sole provider while the other takes some time off usually 5 months to a year to try to enjoy the better aspects of life  we have 6 animals but no kids so we are pretty good at budgeting to accomodate the sort of lifestyle we find worthwhile  i got laid off from my last job and got a pretty nice severance package plus unemployment  at the same time my wife got a decent paying job so ive lived without the burden of work for the past year and a few months the times coming up though i can tell my wife is really starting to hate her job so im on the depressing quest to pick it up from my end    im a little worried about how to get another job with a 14 month period on my resume where i cant account for  playing with and raising newborn kittens while exploring artistic endeavors unfortunately doesnt appeal to hr or hiring managers  do i lie on the resume and if so how  what do you guys do i didnt even get walmart to call me back about a position and a lot of my resume is filled with grocery and grocery vendor experience   anyways thanks for reading i wish all you the best comrades     and if you must go to work tomorrow  well if i were you i wouldnt bother  for there are brighter sides to life  and i should know because ive seen them but not very often  still ill by the smiths,bhnh10
18,New Sub r/LifeAfterSchool for Discussing Life Post-Graduation,hi everyone  i recently created a new sub rlifeafterschool for anyone who wants to talk in general about life after high schoolcollege whether you graduated or you didnt  thought some people here might be interested,bihkqy
19,"Has anyone here read ""Homo Ludens""? - a book on the profound use of play (opposite to work?)",what really is the root issue i take with work is how it claims to be meritocracy but actually perpetuates toxicity and misanthropy instead its a broken meritocracy that values how well you fit as a cog in the system how obedient you are even at the expense of skill quality or wisdom and how likely you are to willingly bully those under you if you move up in the chain to me being so antiautonomy in work culture is ultimately antiplay and destroys purpose if i discover enough workplaces are this way which appears true in the 7 years ive worked then my goal is to boycott and do something valuable based on true wisdom that actually is supportive to the lives of other people i wont go to work everyday ill go to play       in homo ludens johan huizinga defines play as the central activity in flourishing societies he identifies five characteristics of play it is free it is not ordinary or real life it is distinct from ordinary life both as to locality and duration it creates order it is connected with no material interest and from it no profit can be gained     httpswwwamazoncomhomoludensstudyplayelementculturedp1621389995httpswwwamazoncomhomoludensstudyplayelementculturedp1621389995,bikyht
20,"If there are any, what are some things that would make you like your work or a job?",i see a lot of posts here of people fed up with their work and i assume youre all familiar with david graebers bullshit jobs and it seems most of the work youre describing falls into the category of bullshit jobs so i totally get it   but i was just wondering if there were any circumstances where youd either like or could live with your current job or if theres any kind of work that would make you not feel that way  i know im rather privileged in a sense that ive never had to do work i hate to keep a roof over my head privileged in quotes because the reason for that is that im eligible for a bunch of financial support from the state for disabilities ive never had more than the absolute bare minimum either but that was tradeoff i was willing to make im opposed to the concept of work on an ideological intellectual and emphathetical basis not emotionally from personal experience i delivered mail for 4 years which i honestly loved pretty much total freedom but i do think the fact that it was only 10 hours a week contributed a great deal to me not getting fucking sick of it im back in school now getting my high school diploma because i never finished because of the aforementioned disability and im planning to go into teaching which if the disinterest for a subject i love from teenagers that dont want to be there doesnt make me want to kill myself in 3 months would seem like a pretty fulfilling job  would any of that apply to you would a substantial reduction in hours make it at least bareable would you hate your job and work in general as much if it was only 20 hours a week or 10 and youd still have enough to live do you think that theres any work that if in a magical perfect reality you could pick exactly what you wanted and make a living youd enjoy find meaningful if not these things are there any conditions which would make you like your work,bf3wah
21,Antiwork Japanese Culture,posted by usyflan 1 hour ago  in my early was working in japan all  see are old worn out faces of  workers both men and women who are stuck in a culture of overcome and hard work every day  still only work 40 hours at most a week some days  more like 6 or 7 but im done with it  ve lost all the time  had to focus on  my own life instead its all for the sake of my job and obligations to many things get pushed to the side since  dont have time to sort any of it out  once my contract is up or  get fired  m just moving back home and not  working ill either make money for myself or just not spend hardly any  ive thought about it a lot as ive been working the past several months its     in no way worth it to sacrifice most o of work and money  your day almost everyday for the sake   dont care if im poor or seen as lazy to others im donna spend the short  life  have rousing on my mental and  physical health and welling work is  something ill do for my own sake by my own accord ,bhpq64
22,“You should be grateful to have a job”,argh i hate hate hate this   httpswwwmumsnetcomtalkamibeingunreasonable3566531toskiveoffworktomorrowpg6amporder  why wouldnt you skive off work  im with hic  there is no hierarchy of who gets to skive and who doesnt if you are employed to do a job then you turn up and do it unless you are unwell  is nobody just really grateful to actually have a job i have crippling anxiety and some days i am in tears on the bus on the way to work but i still always turn up because that is my reasonable duty to my employer they are being kind in employing me im not being kind by turning up its their right to expect that of me  yes they employ me because they need me to do the work i do  but they dont need me specifically they could employ a million others to do the job  so it is a kindness on their part that they chose me rather than someone else  life and the universe dont owe you employment its not a difficult concept employers can always employ someone else instead of you therefore if you have a job you are in fact very lucky again not difficult  i just want to slap these docile little drones,bhkk35
23,It is crazy if you zoom out and look at our life,we get born we goto school to spend whole day there till our teenage and then college for another few years die hard to get a job that requires us to know everything on the universe then we use all those knowledge we learned for some fucking investors to steal money from people those bosses live a completely different life than us they dont need to work their children dont need to work we work fucking hard for them until we become old and out of energy we dont even have time to play with our children or spend time with family like other animals do besides that whatever we call knowledge or work is only destroying this planet most of the things we produce is just waste that benefits only the capitalists many animals are getting extinct because we invade nature like anything   ampx200b  so we are neither useful for the planet nor did we live a good life for ourself,bgwv16
24,I had the privilege of talking to a C-suite executive on the phone,like a lot of companies nowadays we have internal company social media which presents a fabulous opportunity for shitposting im quite proud to say ive had memes taken down for being too critical of the soul crushing corporation anyways a bit of sarcastic shitposting on a post by one of the many bland corporate white guys got a response which lead to a phone call i gladly took the opportunity to speak my mind  he tried to seem all personable asking me about my history with the company saying how he relates since he started at the bottom 25 years ago so he knows what its like whatever i got into my list of grievances like why is it that the store does tens of thousands of dollars in sales weekly but i dont even get 1000 on my biweekly paycheck how come a pregnant coworker had to cancel her company health insurance because it was far too expensive why do i have a full time coworker struggling to make ends meet between paychecks non answers all around well weve introduced paid maternalpaternal leave such great benefits if you work hard youll be able to move up in the company and make more money shit like that i straight up asked how much he and the other executives are making but he dodged that question at breakneck speed   i despise these corporate douchebags getting rich off the labor of store and warehouse employees while they sit in their cushy offices abd boardrooms all that conversation did was motivate me to slack off at work and unionize my coworkers get fucked corporate man,bhyffj
25,"Come Back Early From Absence, Almost Get Fired [vent]",hi yall wanted to share my tale of woe my work is backwards with sick days i had 7 days off for anxiety my doctor recommended that i have another week but i thought id be better off coming back before they start threatening me with dismissal i figure im doing them a favour  so i come back and i get reminded of the absences system 1 point for lateness 3 points for absence and at this stage noone has told me how many points im on or how many lead to a dismissal  over the next month i have four more sick days from adjusting to the medication which i think is fair since i was recommended a whole week off by my doctor so theyve actually earned days from me  without any warning i get called into the office ive racked up 19 points and thats more than enough to justify a dismissal im flabbergasted my week off only counted for one absence and if i had taken the next week off it would still have only counted as one absence by trying to be considerate ive actually managed to fuck myself over  i get away with a written warning gee thanks and told not to have any more absences so fun working under an anxiety attack ive learnt not to ever consider doing my company a favour cos they certainly wont reciprocate,bhnti4
26,"If Wikipedia were for-profit, Jimmy Wales would be a worshiped billionaire, writers would be celebrities, and Wikipedia wouldn't be a joke.",but instead they did the right thing and made it a nonprofit relying on the goodwill of anonymous contributors just an example of how were punished by society for doing something good and rewarded greatly by chasing profit and personal wealth,bf1wye
27,Leftist Anarchist Discord for fellow anarchists to come and enjoy!,hello rantiwork  come down to ancom official lt3  ampx200b  weve got   bread lots and lots of bread   revolutionary spirit   peter kropotkins spirit   a commune for people to create votes on things theyd like to change in the discord one person one vote   dedicated chat for posting your grand amazing antiwork memes   dedicated chat for organizing people world events ancom events meetups or etc   dedicated chat for ancom education with plenty of great videos against capitalism and explaining anarchism for both new and experienced peoples   ask other comrades about ancom and better learn about it educating oneself debating   a bookclub chat where comrades read political literature   the discord itself we try to keep as horizontally powerstructured as possible mod actions are very transparent and publicly logged   a place for comrades to be loved  seek out emotional andor practical support and advice similarly to rmutualsupport   httpsdiscordggwwpznsmhttpsdiscordggwwpznsm,bgls50
28,A quick shout out to those workers whose jobs aren't so easily ended.,i work as a substitute teacher and i am firmly antiwork i think most industries and positions within most industries are mindless rat mazes to ensnare working class people so that they are too tired to pose any threat to the leisure class however jobs like mine arent so easy to say lets reduce the hours to off set the increased production children deserve people who care watching over them my idea of a nonwork world is one where people have time to give attention to things like child care and personal growth i know teaching isnt the only profession like this so i want to give a shout out to all the people in jobs they know are a necessary good for their communities,bh93gu
29,Activision Blizzard pays employees for health tracking,the company cares about your health right oh wait  activision blizzard vp of global benefits milt ezzard said i want them to have a healthy baby because its great for our business experience ezzard said rather than having a baby whos in the neonatal icu where shes not able to focus much on work   article httpswwwgamesindustrybizarticles20190410activisionblizzardpaysemployeesforhealthtracking  wp article about health tracking in general httpswwwwashingtonpostcomtechnology20190410trackingyourpregnancyanappmaybemorepublicthanyouthinkutmterm97b84f327fcc,bgd8zi
30,How to unionize your workplace,being pro union online     getting coffee with a worker and asking them their thoughts on workplace issues     coordinating with a local union rep starting a spreadsheet to keep track of who at work is in support neutral or opposed     keeping this into secure during this underground phase of unionizing finding 1 or 2 workers willing to work over several months until you get a strong majority of workers in support then vote to go public then youre unionized irl    ,bgsj08
31,Working turns your hair grey.,i looked at myself in the mirror at the gym today and there are so many grey hairs just popping up  im only 32 and just 2 years ago i only had like 3 grey hairs  today i have like 8 or 9 or so  i got so many grey hairs because i work the front ticket taker at a movie theater the stress is what is turning my hair grey and giving me wrinkles   all this stress and i only made around 9600 last year from this job fuck working my hair and face are beautiful and im ruining it all for a pittance  i know one guy who worked at walmart and half his hair is grey from working there and hes the same age i am,bh1xcs
