,title,body,id
0,Complaints from a Walmart Cashier (rant),i m an 18 year old cashier who works at walmart  i m taking a year off between high school and college and was originally going to work this year  but after recently going full-time  i m having doubts  sorry if this comes off as entitled petty  but here are the things i m struggling with   1  walmart is a shit company  after learning more about their business practices  i m no longer naive to their horrible ideals and can t claim ignorance  working for this company makes me feel guilty as i am enabling and helping them   watch the documentary  the high cost of low price  on youtube   2  my fucking feet hurt  even with my  comfort mat  under my register it is painful  once i wore flat-soled shoes instead of tennis shoes and my feet hurt so bad that i had to buy a new pair of tennis shoes half way through my shift   3  baby boomers  i m tired of being screamed at over expired coupons  it shouldn t piss me off but when 5 customers in a row don t say  hello  or  thank you  back  i get a little irritable  it s like i m barely human   4  social anxiety  before i got this job  i rarely talked to anyone  i ve become more social and i m able to hold conversations now  so i m grateful i ve tried cashiering  but i m just an introverted person and it s exhausting to hold conversations all day   5  they won t let me take off the three days i want next week for a trip  this one is petty but it s inconvenient as i told them about it nearly two months ago and i spent money on my ticket  they usually let me have whatever day i want off but this time it s different  i guess   6  we re chronically understaffed  some days i m the only cashier with lines of 10  people while management dicks around and pretends not to see   7  i have to work holidays  maybe i m coming off as entitled but last year was the first year i ever had to miss thanksgiving with my family because of  brown thursday  we ate at 5  so i had 15 minutes to eat  and then went off for my shift at 5 30    8  stress  i know i have one of the easiest jobs out there  but i just can t take it  i m just bad at social interaction and i get stressed out by all the weird demands and complaints  especially after standing around for 8  hours   9  i miss being outside  my days off are spent recharging  i want to go on trips with my family  i will have to miss out on ours this year because they won t let me take it off  and i want to get back into the gym more often  i want some peace  and relaxation before i kick myself into college and a career   10  they re probably firing my favorite manager because  they can and it s convenient for them at this time  it s all bullshit  it s not my business to share so i won t give info   11  brian is a douchebag   reasons i want to keep my job   1  money  i want to be able to go to college  yesterday a very kind man came through my checkout and asked me what my plans were since i d just graduated  i told him i m taking the year off before school and he told me  the reason they pay you like this here is to encourage you to get a degree  and i just couldn t stop thinking about how ass-backwards and absolutely untrue that was  i am a human machine  i do nothing but monotonous  simple-minded scanning day in and day out  they pay me this way because i am the human version of a self-checkout machine   anyways  sorry for my rant  i m not having a good time ,chbws2
1,Boss: *addressing my grieving family and friends* can anyone work a double tomorrow?,admiral snaccbar of  simplysnaccbar  by funeral   loss   solemnly placing his hand on my casket and sobbing  how could you do this to me we are so understaffed today ,ch8ka1
2,"Boss cut my hours in half and made promises she couldn't keep, keeps pushing off talking to me about it",i'm at a loss for what to do  i started working in a pr position about 3 months ago and my i'm fed up with my boss  in my interview she hired me to work a minimum of 20 hours a week  and said i could work as many extra hours as i wanted up to 40 a week  i was very excited to work that many hours and had big plans for what i was going to do for the company   since then she's cut my hours to 30 a week and then 20  despite my putting in massive amounts of work during that time  she cited lack of funds to pay me and said that she hired me to work 20 hours initially  i lost almost all of my motivation after this  all that hard work was rewarded with my hours and pay being chopped in half  i am now back to living in poverty after a few short weeks of making a livable income for the first time in my life    she promised my coworker a comission for any investment money she earned  but didn't give me the same deal  when i asked her about it  she said that my coworker was not receiving any comission money  i asked her if my coworker knew that she wasn't receiving comission  and she wouldn't answer the question   i had to promote our company at an event and my coworker got there over an hour late  my boss told us she wasn't coming at the last minute  my boss didn't reserve a table and i had to borrow a table and chairs from the venue  it was lucky they had extra supplies for us or we would have been fucked  i carried several boxes of heavy supplies in the 100 degree heat as a 120lb girl  hunted for a table and chairs  set up the entire booth and deconstructed it solo  and carried the supplies back to the car in the rain at the end of the day  my boss asked me to drive to the office and return the supplies today--we are under a severe thunderstorm warning and i told her there was no way i'd carry the supplies by myself in the pouring rain  she was clearly unhappy with this    i am looking for a new job but i have a disability where i can't stand for long periods of time  which limits my options  i had a meeting to talk with my boss today  but she cancelled on me and is flying out of the state tomorrow for 2 weeks  i have no idea where to go from here and i dread working for a company that doesn't respect me or my time  any advice for this situation ,cgzd74
3,Work is amazing,   i  by  te west prize  0  west hope              that life for  0 utter 1   one crane  t want had ii but north doing         ,chb2wv
4,Gotta love the boss/employee relationship...,di  4 admiral snaccbar   v a  ustiaal el asiatclerel or a  by funeral   slokcispmumeye  anna  iv e e erases alicmarclarekolamaang casket and sobbing  how could you do this to me we are so understaffed today  9 27 of - 7 23 19 - twitter for android ,chc5vh
5,solemnly,admiral snaccbar  simplysnaccbar   by funeral   loss   solemnly placing his hand on my casket and sobbing  how could you do this to me we are so understaffed today ,che4ly
6,"We all, this sub and others related, need to start saying the words ""general strike"" until others start repeating it as well.",a   admiral snaccbar   iv is  simplysnaccbar of waivlaleree h   slokcispumubeye  anna  e erialep alicmarclacekolamaan'g casket and sobbing  how could you do this to me we are so understaffed today  9 27 of - 7 23 19 - twitter for android ,chi1e3
7,Forced Overtime (The joy of cutting labor),i already feel like i m always at work  i do seven 8 hour days in a row and then get a few days off   recently someone at my company has figured out they can make spreadsheets look good by not hiring people and cutting labor   so for a few weeks everyone was getting forced into 16 hour shifts randomly and hitting around 64-72 hours a week   now i walk in and find out we have been scheduled 7 days in a row with no off days for the indefinite future   what is the motherfucking point of even being alive on a schedule like this  i guess i don t have that  protestant work ethic  or i am a bad worker bee   so now i am on permanent night shift and will not see my wife except for maybe a few minutes if she stays up late or i get up super early    what kills me is half the employees just smile and take it like good little worker bees   bigger checks   i guess i m just a lazy piece of shit ,chxpko
8,Some food for thought.., of you don't find a way of make money while you sleep  you will work until you die  ,ci6sni
9,why only antiwork when you can antistudy?,shan  zeshan 97    had a dream last night that   forgot   had exam and   missed 3 exam and   woke up so shook and then realised   graduated nearly a year ago  how do i still have exam stress with no ,cihln5
10,I get blamed for the most random crap and have to apologize,i work at a call center and schedule health screening apts  so far this afternoon  started 3hrs ago  i ve apologized for  - our first apt time in the morning  we start doing the screenings at 9am  or the fact that the morning is full - this lady had terrible cell phone reception  - not being lifealert  - that our services cost money  -  having a refund policy - having a tv commercial - asking 10 basic questions about health history  they can decline and they re pretty general  not many people would consider them super personal and invasive  though  - and  my favorite  not giving away a  60 service for free   and i don t just apologize unless the person is really mad or yelling at me  besides it says directly on my instructions on how to proceed that i have to apologize for things   what s the dumbest thing you ve had to apologize for at work ,cjhe9i
11,Long post ahead. Need serious advice.,hopefully this post doesn t get too long  but here it goes  i ll be transparent as possible  for the past 3 years i have done absolutely nothing  i was in a masters program and things kind of fell threw right at the end  and now 3 years have past of me leeching off my aunt and mother playing video games  sleeping  and staying inside    i am 27 now and for the past 3 months i have been moving forward quite a bit  i ve lost a lot of weight  got back into my masters program and will be able to finish it within 4 months    here s the fun part and why i am on this sub  i m completing an internship to finish my degree and i hate this shit more than i should  my drive is long  the pay sucks  and the work is all bullshit  but all things are pointing positive and i ve  technically haven t been in a better spot  and yes i understand that my options will be better once this shit is over with  but knowing that doesn t help me get through the day  so why the fuck am i so miserable  that shit doesn t make sense  everyone is telling me to get on medication and frankly i m against it since i already was on two pills for 7 months  i dropped them cold turkey when i got off my ass 3 months ago  i never thought the medicine helped personally and neither did my family  which is funny since they think it s a good idea again    no matter what happens  i m finishing this internship  but the question i want answered is if you guys think i should go back to living with my mom and leeching off of her  i get it  i m a lazy piece of shit  i think about this everyday and honestly this might be my true nature  and not just the typical lazy bullshit like everyone thinks they have  like  this is the i sat around for 3 years and it didn t bother me lazy  the truth is when i sat around for so long  i probably wasn t  happy  but i know damn well i wasn t unhappy either  and now  now i know i am unhappy    so yeah  i m going to have a ms soon  and it doesn t excite me  i don t feel motivated and i really don t give a shit  i was so excited to put everything back into place and full of energy  but now that i m doing this shit  fuck all of it  so yeah  if i have the opportunity to leech off my mom should i just do it  give me any kind of advice  please  i don t think i m suicidal  but the thought of driving off the road one day and trying to cripple myself does put a smile on my face and brightens my day ,cjd9nj
12,Just thought back to an amusing experience I had in my first job review.,i was 22 years old  a new engineer who graduated into the recession   i knew i was underpaid   they knew i was underpaid   but i only ever heard good things about my  performance   ugh  hate that word     it was the end of the fiscal year  raise time  and they gave us a self evaluation   which is a dumb idea out the gate   one of the questions was  how would you like to be rewarded for good work   i kind of blinked at the page   what the fuck  other than not sucking up 8  hours of my day   i wrote down  other than the traditional form of higher pay  not much else comes to mind   a few weeks later i get called to the hr office  like i'm getting called to principal in school   she goes over my pitiful raise  um salary adjustment  and goes through my review   she asks  what do you mean by 'traditional form of higher pay'   i had to look blankly at her   i honestly didn't know if she was fucking with me or not    a higher raise   more money   she still stared at me   what was i gonna say    this shit is boring and the more money you give me the more i can enjoy my shrinking non-work hours and the faster i can finally leave this institution of wage labor   i just stared her down until she said  ok  and i went back to my desk   are these people for fucking real   later  when i left  she asked me why i was going to a new job   i said it was because it was more interesting to me  more in a field i wanted to work in   she asks me why i took this first job then   i couldn't believe it    because we were in a fucking recession  and i applied to 80 jobs and you were one of the only 3 that got back to me   being a new graduate i couldn't exactly be picky   hr has to be some of the most indoctrinated and clueless ,cjklhw
13,Have you ever had a workplace try to force beliefs onto people or intimidate you into pretending to agree with them? How have you dealt with it?,i had a mandatory training that amounted to requirement to abide by strict and narrow beliefs  and worse than that  wanted us to push it on our clients who are often really vulnerable and in need of help with basic life activities  they don't need this wish-wash religious stuff pushed on them  i don't mind if other people believe this  i'm often the philosophical minority and am used to it  but it's amazing to me there are widespread  discrimination laws  in the united states  and i'm presuming many other countries  yet something like this continues to march on  i don't like to involve the law at all  it's not my values  but it is really telling if a company can get away with this in a world where people usually sue or quit over this  at first i thought i was alone in diverging from the narrow beliefs  but having looked back on it repeatedly and gotten support from a friend in the same industry  i now question how many people were also silent dissenters  only 6 out of the 40 people actually spoke when it was supposed to be  an open discussion  which was blatantly a lie ,ck50j0
14,"!! CASHAPP TRANSFER, WESTERN UNION/MONEYGRAM , PAYPAL TRANSFER , US/CA BANK LOG-IN &amp; GIFT CARDS AVAILABLE",  cashapp transfer  western union moneygram   paypal transfer   us ca bank log-in  amp  gift cards available   we are verified hackers and sellers on alphabay market before closed down  if you are old time customer send pm or contact link below   you're welcome   fast trending money transfer platform   cashapp is known for instant and reliable transfers with basic two steps method of transferring balance to bank account or make an online purchase  only thing required to receive money is to provide  cashtag   cashapp transfer   240 for  2000   360 for  3500   450 for  4k - 5000   580 for  7000   hacked and verified western union moneygram transfers for sell you will get mtcn number to track the transfer  this number is also needed to pick up cash at the office  any document with the photo is required to pick up money  transfer available after 2hrs - max 4hrs     wu moneygram   150 for  1500   300 for  2500   550 for  5000   700 for  8000   900 for  10000   we offer paypal transfers  amp  hacked paypal accounts with old login date if you want account you will receive after payment  account login and password socks5 to safety access the account   full guide to authorize cleaning money guide 2019 you receive paypal transfers in less than 30min  email only required once funds has been sent  it is 100  clean and you get zero problems   paypal transfer   120 for  1000   240 for  2000   280 for  3000   340 for  4000   420 for  5000 -  6000   we also offer virtual gift cards  they are secure and untraceable  the codes of the gift card are delivered instantly by e-mail  which you specify when placing the order    visa gift cards   120 for  500   240 for  500 x3   380 for  500 x5   580 for  500 x9   us ca bank login are updated daily or often   td bank   acct balance  34k for  2600  rbc bank   acct balance  26k for  1700  chase bank   acct balance  19k for  1200   bank transfers are also available upon request you receive login credentials   socks5 to safety access the account   all payments by btc contact us with order choice -  wickr -  kingtevo  email -  kingtevo protonmail com,cjq831
15,The Orwellian Workplace,i've seen this complaint on here many times but i'm sure many people aren't aware to the extent that this tends to happen  i'd like to point out what exactly qualifies a workplace as  orwellian  and what you cab do about it    now  the actual practices of the orwellian workplace might seem  at first  like basic  integral parts of a safe work environment  but as with all things you experience in work  it's something that should be questioned   your general orwellian workplace involves a  lot  of monitoring  more than could ever be reasonably expected in your general workplace  while in retail your occasional camera may be used to record and retroactively watch employees in the case of a lawsuit or similar legal issue  an orwellian workplace  directly  and presently monitors your actions  ensuring you are not breaking any of the multitude rules of the workplace    i will give as an example two workplaces  one i previously experienced and another i am currently in    the first of these two was perhaps the greatest example of resource waste and complete employee mistrust  i worked for a security firm that had installed cameras across the facility for dual purposes  for the officers to monitor the site  and for headquarters to monitor the officers    you see  the company i worked for didn't trust the officers despite the fact that there had been no unattended or poorly-handled on-site incidents at that particular location  and when they learned officers were doing things other than staring at a monitor for 8 hours  they set up an out of state monitoring office with a second set of officers watching us for even the most minor infractions  and random inspections would see every aspect of our entire shift torn apart with a fine-tooth comb to catch us and write us up for something as sinful as taking a minute to respond to a text message  these offsite personnel were themselves monitored by a separate set of offsite personnel   you might be saying at this point that such a stringent oversight is necessary in the security industry and that so much shouldn't be classified as orwellian despite the obvious comparisons  and are simply safety measures    in which case  i offer you the second workplace    in this job i work for a junkyard  we have dozens of people scavenging up parts and it's my job to catalogue them and prepare them for sale  while we usually get in 10-20 of these parts a day  i have been able to finish my work within two or so hours  this leaves me with very very little to do and as a result  i find myself simply sitting there refreshing pages  recently  however  i was reprimanded for a  drop in work output  and after some poking around i learned how they believed this  they were not looking at the number of parts left to list  nor the number of parts listed  no  they were watching two factors  bathroom breaks and keystrokes   now  the issue of bathroom breaks is due to a medical problem  but the state of health in the workplace is another issue for another day  what i want to focus on is the keystrokes comment    this is a common tactic of companies  particularly in desk jobs  the question is not if the work is being done  or if it is being done well  the question is if we are  wasting their time  and breaking the unspoken law of workplaces  workers are assets  not people  and an asset not utilized to its full efficiency is useless  regardless of the health of the asset  and so they watch us  monitor us  and reprimand us on the basis that we are not to waste any of the time they they view as theirs  for this sin is cardinal amongst employers and bosses    so why am i telling all of this  just to complain about my own experiences  just to make a post begging for pity  no  my reasons are twofold    1  to help others understand what their bosses are no doubt doing to them at this very moment  no matter the industry and no matter the work   they are watching you  make no mistake  they may tell you this is because they are protecting themselves legally  but that is only what they say and they certainly believe you to be a danger to their fragile superiority  you may think u s law protects you  but you are wrong    2  to drive home the point that  this is not okay  it may not be illegal  but law is not the moral arbiter  to be treated like an automation  a robot at risk of going off programming at any time  is cruel and dehumanizing    so what can you do if this is happening to you   there are two things  but both are unfortunately long shots    1  join a union  especially if you're in retail  the iww can help you organize your workplace quickly and demand lighter monitoring before your employer can catch on  ultimately  all you'll need is for the rest of your coworkers to feel the same as you do  this is  however  dangerous  as many larger chains would rather close down than allow unionization  when doing so  use a fake name in correspondences  do not conduct business on company grounds  and make certain you choose your allies well  many other workers may be lying in wait to solidify a position by selling you out   2  stand firm  this works best if an employer relies on you or your position is difficult to fill  if they pull you aside to reprimand you for  wasting time  or for a low workload  be certain to remind them that they hired you to do a certain job  and that the job is getting done efficiently and effectively  most employers are well aware that workers are their base  and that important ones are vital  if you stand up to them  it's likely they won't push harder so long as everything they ask you to do is being done    remember  don't let the bosses win  workers are the backbone of their greed and they know it ,cjeal1
16,Need help.,i am from venezuela  i work for a group of web developers from china  they mostly get their jobs from websites such as upwork  but now upwork is banned from their country  now we are looking people from the us to rent their ips and work from their  we would send money for a computer we would use remotely and find jobs from upwork  we can pay monthly 150usd only for just having the pc on so we can use it when we need it,cke8vp
17,Work is a nightmare I'm dreading with every fiber of being,just automatically having 90  of your young and middle aged life mandatory being spent in prison  i'd rather be dead ,ck38w4
18,Is there a 'pro-' alternative to 'anti-work'?,first a disclaimer that seems to be mandatory on the internet nowadays to prevent people from commenting before reading  i'm not criticizing the idea of 'anti-work'  i share the sentiment  i'm just genuinely interested   that said  i was wondering  this subreddit is called 'antiwork' and i see a lot of 'anti-work' mentions  but it implies is criticism on something that already exists  and criticizing something is easy  'anti' generally also has a negative sound to it  i personally always prefer to present alternatives to something i'm criticizing   so my question is  is there a general consensus on what the alternative s  would be  is there a name for that  so i can read up on it and i could put in a more positive light by calling it 'pro-whatever' when talking to people that may be easily offended by opposing ideas ,cjf2tt
19,"Wait, that's illegal",me  boss can   get a raise  boss       he value you in ways that cannot be expressed in money  ,ckcgiu
20,Manager made me laugh today,joking about not giving us any overtime and saying because when we completed our work early sometimes we re allowed home early  15 mins usually  and still get paid full hours  i hope he was joking because i would hope my manager isn t that stupid  income for employees is obviously more important than money for the business  you would have thought he was talking about paying out of his back pocket though smh,ck9j2n
