,title,body,id
137,Politely tell my boss ‘as a cheap labour worker I don’t see a single benefit to working non-paid hours in research to be better at my paid hours’ ?,bartender been working with this guy for 12 weeks and i got an angry tone last week saying i must be better and show why i prefer working in the bar as opposed to waitressing or barback and learn all the 79 cocktails   i must know 20 and im quite the no complains always there worker definitely always 5 minutes late on the clock but never ask for a break regardless of working 57 or 10 hours and when asked to cover a shift at another establishment i do without asking questions would say im a pretty solid employee who also happens to work on a minimum wage also i dont owe you any hours scheme its cool i study during the week and i need the money but me being better at my job makes him the people above him and the owners happy they make more money i never do i like this job because its close to home but i really wont spend my non paid hours memorising drinks to be better at a job that makes me overworked stressed and caused a shoulder injury i still havent recovered from any tips,bbj88k
138,Job Interview (I made a weeird video),ampx200b  videoxelkkzpqoms21 job interview realistic  im not sure why but i created a very weird amp short video about the kafkaesque nature of job interviews heres the link to my new channelhttpswwwyoutubecomchanneluc8djxdxsny3sbipzateauw with more crazy stuff to come  ampx200b  cheers,bdtynk
139,Hitch Hiker's Guide to the Galaxy got it right,on earth man thought he was much smarter than dolphins because he had achieved so much  fire the wheel new york city wars and so on  while all the dolphins had done was muck about in the water having a good time conversely the dolphins believed that they were smarter for exactly the same reasons,bdjuk6
140,RIP,    whosoe ver believes that man should work and exhaust himself all day of prove his worth of a fool of fails of recognize that where there of  value of work there of also value of laziness through relaxation the working man may find peace and comfort and though this need not of eternal of sets the stage for him of  find something even greater himself of 0    on by ,bdzb49
141,My problem with work is not work itself but having to wake up early and commute in.,when i worked 117 i was very happy,bcqfrj
142,Films about work,i had the joy of watching look amp see last night a docufilm about author wendell berry and the industrialisation of farming in kentucky and the us as a whole a very interesting film which i can highly recommend people in america see netflix  the film scratches the surface of the joy of working for ones self of how industrialisation has made debtslaves of many people that once loved their work so much and how that has in turn crippled communities and destroyed lives in the mismanaged name of progress its also beautifully shot  now interestingly this doesnt really cover anti work and is kind of more prowork though more for loving the work you do which i feel is an important tangent to the discussion   do you have any films youve seen that have really influenced your philosophy on work,bco8zj
143,I'm tired of people being fed nonsense about college and the role that it has on their lives,society harasses people into going to college and honestly im sick of it  high school students always hear this nonsense from their guidance counselors and parents about how they need to go to college after they graduate  they just promote it like its the endall to all the troubles in life  these kids are being fed bs  when i was a freshman in high school instead of being mislead for 4 years by the assumption that i needed to go to college right away i much rather would have had someone telling me to take a gap year to figure out what i wanted to do with myself    as someone who has spent the past 5 and a half regretful years in college the best advice that i can give to anyone younger than me is to take a year off after high school and to do some serious introspection  figure out who you really are what you want your life to look like what youre good at and what going to college really means dont let society your friends or even your parents harass or guilt trip you into going to college  what nobody tells you is the following   1 nobody is going to be helping to pay off your student loans  and thanks to predatory practices youll be paying them off until you die     2 nobody tells you about how more than half of your college experience is a repeat of high school courses that you dont need     3 nobody tells you how it physically mentally and emotionally feels to be a holder of debt     4 nobody tells you how even after wasting your mind body and soul on degree that youre not entitled to any job opportunities or a sustainable living     i cannot stress enough if you have a skill that will allow you to operate outside the norms of this system please find it and hone it  this isnt a post telling people not to go to college this is a post telling people not to let society guide that decision for them without considering their options first  theres too many people who think they need degrees when all they really need is their individuality and creativity  you dont need a degree to highlight preexisting talents you just need to find them     ,bar12p
144,Who knew? Overwork is bad for the poor capitalist!,the guardian longer working hours do not mean higher profits say economists httpswwwtheguardiancommoney2019apr15longerworkinghoursdonotmeanhigherprofitssayeconomists,bdnlka
145,"I'm 47, been working since graduation at 22...still fucking hate work",yes after 25 years three career changes retraining up the wazoo and two masters i can still hand on heart say that working sucks donkey balls the earliest i can get out of this hell will be 60 if im luckyyou cant begin to imagine the resentment and anger i feel about how this damn system has eaten up the best years of my life,bdddh4
146,Free Talk Friday,rant and vent thread  discussion thread,bcdx30
147,Keynes biographer: Economists committed to scarcity and wage slavery,project syndicate the good life after work  by robert skidelsky httpswwwprojectsyndicateorgcommentarymanagingautomationintelligentdefinitionofwellbeingbyrobertskidelsky201904,bdx10t
148,*Sunday dread intensifies*,bizarrocom facebookcombizarrocomice list y mind fares  i got into the human world to find purpose but this whole thing i just an elaborate version of fetch          ,bczfqi
149,Im 17 and feel 40 because of work.,i have been balancing work amd highschool for the last year i dont mind my job at all i wash dishes at a restaurant and im being promoted to back up cheif next week and that means i have to wake up 2 hours earlier on weekends im excited for the training i guess but i have this sense of impending doom i have a decent gpa and my parents are pressuring me to do good at school and keep a job so i can pay for my gas amd car insurance i feel like im spread thin and i might be stuck flipping burgersnot that cookimg for a living is a bad thing instead getting to go to a good college im also worried that i might fail the sats because i have no time to study without giving up some hobbies also im feeling physically weaker with more aches and pain ive been having trouble sleeping for the last month and a half and i think my anxiety is getting worse i guess this was more of a rant than anything i was just wondering if any of you have been in or are currently in a similar situatuon,be140k
150,Fuck Jobs... I'm going to do my own thing,i allowed life to screw me over i bought into the whole going to college and accumulating degrees for promises of getting good jobs so far ive worked five jobs and they all sucked college was a scam  i quit my job back in february not sure where my life is going but i wont lose hope ill find a better way to make money for myself instead of working for someone else wish me luck,bbr9lm
151,"Choice, Consent &amp; Disappointment",first of all thank you for this sub  its been a relief to come here after a long day at work to find validation or blow off some steam watching other people blow off their steam  ive learned a lot and yall are the best    ampx200b  i find myself on rantiworkhttpswwwredditcomrantiwork due to three central themes in my life  choice consent and disappointment i came from an abusive family growing up so control is important to me choice is important to me  growing up my dads rule was once you started high school you get a job there was no explanation given as to why more importantly i wasnt given a choice my dad didnt ask i wanted a job he told me to get one i didnt know why i needed a job  my friends and i didnt need much money to have fun we went to each others houses or walked around the local walmart lol and as for college well i was just going to get scholarships and financial aid no the issues was choice was taken away from me in the process i might still have wanted a job if i had the option to but its not something i got to do its something i have to do thats still true today ive also realized that in public school at least i could get some of my socialemotional needs met from teachers my teachers loved how polite and hardworking i was and how well i paid attention in class i got some of what i didnt get at home at school i dont even get a fraction of that at work  as ive grown and matured into a healthier adult the issue of work has festered in my mind its plagued me ive beaten my head against the wall trying to solve this chinese finger puzzle why do i struggle so much with work why the harder i pull against this idea the more im snared in this trap  in maturing ive learned that choice is incredibly important n relationships ive learned that i dont have to be in any relationship i dont want to not only does that keep me safe it makes the good relationships that much better because they are a choice i get to be friends with nice people and have a nice partner because they make me feel good if someone treats me poorly when im honest and vulnerable with them  like my family  i owe it to myself to protect myself and walk away is it hard does it hurt yes because then i have to rebuild another area of my life and find another way to support myself but like removing a sliver from my finger its best in the long run im an active person and i love to be busy i very well might choose to have a job if it was a choice but i cant therefore until its a choice i believe i can never really know if i would actually want a job its an apparent paradox how can i ever really know if i want something if im not allowed to leave it whenever i want  this leads into my latest introspection as to why i struggle so much with work disappointment i went to college wanting to do well and setting high expectations for myself and i take some responsibility for not doing as well as i wanted i know i was capable of getting straight as but wasnt aware of the tools and support i needed until after college at age 29 i feel like im just gaining the awareness of what i need and skills to ask for those things now but even as ive grown into a healthier more mature person job after job continues to disappoint i trust myself more now  ive done the work  and im beginning to believe its not me  its the job system that continues to disappointment me time after time   i want to honor the belief i once had of what jobs career and life after college held they were the epitome of promise and hope but after five years in college and seven years of jobwork  not to mention time spent in high school even before that envisioning what this life would be likeim at a point in my life where it just cant be me anymore part of it is the unrealistic expectations i set for myself but i was also raised with the belief that if you do well in school go to college and get a degree youll easily get a job in your field  and then youll be happy this cant be it  this cant be what i was looking for and working toward for thousands of hours and years of my life  theres nothing here its justlife there is pot of gold or light at the end of the tunnel  and i absolutely refuse to believe its because of me  because after literally thousands of hours of work and effort ive been doing it wrong this whole time   jobs are disappointing me i loved going to school  friends learning whats better than that jobs have been so disappointing to me in what other relationships or experiences in my life do i get so few socialemotional needs met where else do i have to confront authority headon im not an authority in any other relationship in my life nor do i answer to one seriouslythis is it   ampx200b  these days im faced with the reality that i will need to adjust my expectations for what i job is and maybe what a job can be to survive and live a happy life it feels like my experiences at a job are more or less what they were in high school  a way to make money fun at times boring at others but not the main event of my life that was fine in high school but that still feels like how they are today that wouldnt be a problem but they were built up over the years as being this big colossal thing and compared to what they really are they feel like such a disappointment and letdown  i am very grateful to be among a community of people who get it so we can grieve this loss together  thanks everyone,bbsdic
152,Life after college starter pack,life after college started pack  ed to make new friends    too air     king 9 to enter  not entity on et the of met in     you tag were google  how to retire at age 25  google search tm seeing lucky       ,bbtxgk
153,Henry Miller was antiwork,while i was reading tropic of cancer i came across this interesting section and just wanted to share it with you guys  in everything i quickly saw the opposite the contradiction and between the real and unreal the irony the paradox even as a child when  i lacked for nothing i wanted to die i wanted to surrender because i saw no sense in struggling i felt that nothing would be proved substantiated added or substracted by continuing an existence which i had not asked for  everybody around me was a failure or if not a failure ridiculous  what was most annoying was that at first sight people took me to be good to be kind generous loyal faithful perhaps i did possess the virtues but if so it was because i was indifferent i could afford to be good kind generous loyal and so forthsince i was free of envy  from the very beginning i must have trained myself not to want anything too badly from the very beginning i was independent in a false way i had need of nobody because i wanted to be free free to do and to give only as my whims dictated  in my bitterness i often search for reasons to condemn them the better to condemn myself for i am like them too in many ways for a long while i thought i had escaped but as time goes on i see that i am no better that i am even a little worse because i saw more clearly than they ever did and yet remained powerless to alter my life  at a time when others were getting themselves comfortable berths i was taking one misarable job after another and never enough in it to keep body and soul together almost as quickly asi was hired i was fired i had plenty of intelligence but i inspired distrust whereever i went i fomented discord not because i was idealistic but because i was like a searchlight exposing the stupidty and futility of everything besides i wasnt a good ass licker people could tell at once when i asked for a job that i really didnt give a damn wheter i got it or not and of course i generally didnt get it but after a time the mere looking for a job became an activity a pastime so to speak it was a way of killing time no worse as far as i could see than work itself i was my own boss i had my own hours but unlike other bosses i entrained only my own ruin my own bankruptcy i was not a corporation or a trust or a state or a federation or a polity of nationsi was more like god if anything  this went on for a while welluntil one day i was trapped finally the day came when i did desperately want a job i needed it not having another minute to lose i decided that i would take the last job on earth  ,batp6y
154,Has anyone tried doing purely contract jobs ?,im an accountant and thinking about doing this  or starting my own shop ,batmbp
155,"Panpsycast Episode 56, ‘Utopia for Realists’ with Rutger Bregman (Part I)",why have we been working harder and harder since the 1980s despite being richer than ever why are millions of people still living in poverty when we are more than rich enough to put an end to it once and for all  and why is more than 60 of your income dependent on the country where you just so happen to have been born,bazbi2
156,How to deal with bossy supervisor?,i am working at a company which basically you have to serve people all good until you have to wait for the dishes to come  you wash the dishes put all the stuff away and then this bitchy supervisor an old witch and for sure a bitch too asks us to do her shit like wrapping silverware sweeping and mopping   what she does is just sit in a corner or walk without any direction and watch us how we struggle among hundreds of dishes that come she complains about everything and she refuses to do anything else i dont remind seeing her doing something because if she is a supervisor in her mind she thinks she is a goddess  if you are a supervisor it doesnt mean you have to do whatever you want treating us like slaves   i want to know how to deal with her bullshit because i am at the verge of quitting my job,bbfztg
157,Yang for President 2020!,sorry about the politics but seriously guys look into it he wants universal basic income  ryangforpresident ryanggang,bb59i9
158,Life is a series of distractions until you die,what can one even do after coming home from work  do chores watch netflix shower sleep repeat  ampx200b  and then on the weekends i just sleep i straight up just sleep because im so mentally tired  ampx200b  and then what out of 365 days you get maybe 3 weeks to go on vacation  ampx200b  i get vacation anxiety at the end of it because its a temporary relief and you still have to get back to the grind after almost like a worse sunday evening anxiety  ampx200b  im tired all the time because i dont sleep well i dont sleep well because i have end of day anxiety and pressure to fall asleep so i cant fall asleep because im too anxious about falling asleep so on the weekends i sleep all day because around 4am is when i get the most tired i have seen neurologists and sleep clinics and done all my due diligence and sleep hygiene i took prescription medication for sleep and depression  ampx200b  honestly the root cause of this is work but work is normalized so i guess im just a whiny bitch to society and my feelings are invalid,bb9q1m
159,I was so stressed my mind wouldn't stop racing at night,   8 mind before my alarm   by       ,basbal
160,The Commodification of Camaraderie,humans are social animals and generally enjoy working with others especially as a team we also inherently fear social rejection which in many ways is similar to physical pain capitalism and bosses exploit this spirit and fear of rejection to make us work unpaid overtime and more hours than we should since we dont to be seen as letting down our coworkers this is very clever on their part since it works on a deep psychological level and is extremely hard to fight against because you dont want to be seen as letting down the team,bc3l8x
161,My Boss Is Holding Me Hostage!,every day i fee like my boss is holding me hostage he knows i have a young family and he constantly is giving pretty explicit threats that if my performance doesnt improve he will fire me the result of this would be homelessness for my girlfriend and two kids i know there is nothing i can do about this regardless of the pathetic platitudes i get on here about direct action and workplace organizing the former of which i have tried to no result at all,behfat
162,Taking Your Boss Hostage?,i have been fantasizing about taking my boss hostage at work and livestreaming it and getting a kind of dogs day afternoon situation going has anyone else considered this it might be real good antiwork propaganda if a bunch of us did it in a coordinated way,be6ivn
163,Side gig to get money?,now that i lured you in with such a title i need your help haha  like all of you im sick of working and work absolutely destroys my mental health worklife balance and literally everything in my life and im also not a morning person so imagine going to work everyday not having enough sleep last month i called it quit and i have been unemployed since i really needed the break and decided that i should take at least one month off before going back to work i only have savings to survive two months comfortably four months uncomfortably unfortunately being normalized to capitalism ever since day 1 of being unemployed ive been so worried sick about not being able to secure my next employment and all the fears around not having money being homeless etc that i have not been enjoying life at all i literally am looking up online for job postings everyday and have been applying nonstop a friend told me that i should consider doing part time side gigs physical or online but i have no idea around how to do it or if its enough to support myself financially during this time for what its worth i really only need a side gig to delay my next employment because i really need this time off have any of you done this before if so does it help financially and how do you do it  honestly if i have the choice i would love to just not work but we all live under the supreme reign of capitalism so we have to work to me i dont mind working so much actually i do mind i really just hate the whole 95 thingy and i work best at my own pace and time at the same time i really dont have the business mind to start my own business or anything like that which gives me control of my own working conditions,be8o4m
164,I just quit my job,and although i agreed with my manager to stay throughout may because i didnt want to fuck her shit up by leaving right now as she was there for me many times   i feel somehow liberated  although i know i will have to be a wage slave once again its still satisfying   to all of you hating your job but irationally staying at them because of fear for the future just quit you will find something else it will hopefully be even better as i hope for myself  cheers,be7yvl
165,Wanna enjoy the holiday with your family? FUCK YOU! Get To Work!!,   he are no longer  taking requests off for memorial may     weekend may 2427 his is our business weekend of the year and we need  everyone here thanks            ,bcx608
166,Free Talk Friday,discussion rant and vent thread all in one,berwgv
167,I work janitorial for the college I attend. My boss is making working so much less worth it,i just need to vent ive worked this job for almost a year ive hauled ass done everything asked of me and more my boss was all for doing bare minimum coming in when hours suited us and reporting full shifts as long as we got our work done i cared about my boss then he left and his job was taken over by a total control freak bitch coworker  she started with making us clock in and out fair enough but that did mean i had to walk to the other end of campus four times a day and essentially cut my pay in half because i had to stay the whole time she then started coming up with ways to make more work and sent out worksheets to fill out every shift none of this has lead to increased productivity and reduced overall results she then decided people couldnt work on their own that they had to work in groups that they couldnt use their phones but still had to text her at least twice a shift so she could make sure people werent dawdling with clocking out today i was vacuuming the hallway and checking reddit its not hard kinda mind numbing and meaningless she caught me on my phone yelled at me not to do it again shes been awful in other ways imposing her religious codes on her workers essentially deporting a kid who ticked her off by making it so the school couldnt rehire him followed all her workers social media and once changed in the public area in front of me i am so done im going to halfass nitpicky stuff slow way down tell her im not using my personal phone for work and then sit in a bathroom stall for the rest of my shift i have a disability that would make 20 minute bathroom breaks reasonable and if she catches me doing that ill report her for sexual harassment and ada noncompliance i used to care about her and her kids but not anymore,bbtioi
168,"Anybody else feel ""ripped off"" after taxes slash your already meager paycheck?",imagine working so hard for two weeks eating shit finally getting your paycheck and then finding out that its even lower than you had anticipated and it was taken away by the government to use in some unexplained opaque process that you have no control or influence over   how would anyone possibly be happy with that,betcw6
169,Stop calling it 9-5,its 84 in most cases  both suck but with 84 cycle you get an extra experience of waking up at the same time as chickens be grateful  and better dont get too comfy beneath your blanket because sht is gonna hurt when the alarm goes off lol,bcq9bn
