,title,body,id
0,Does anyone else just feel like work is inconvenient?,for lack of a better phrase    i spend 40 hours a week doing things i don't care about  i spend most of that time thinking about things i could be doing at home from cleaning to watching netflix to going to the gym in the middle of the day  if i wasn't working  i would have more energy and maybe actually think about finding a passion hobby  but instead i'm so exhausted when i get home that i just veg out   yes  it sounds like making excuses  yes  maybe i could  change my mindset but i'm just so tired  and i think that's what  they  want     in the meantime  i've applied for several maybe less shitty jobs this week related to something i maybe care about ,brq7em
1,What about an Anti-Work Union,i am still fleshing this out but what about an anti-work union that focuses on issues related to precarious work and the gig-economy that rejects state intervention to create full employment  it could have as its explicit goal the freeing of people from work as necessary to their survival  something like what iww once was but with more explicit focus on abolishing wage labor   it could have as one of its tenants something like capitalism is in a moving condradiction in that it presses to reduce labor employed to a minimum and yet posits waged labor as the only way for 99  of people to make a living   does anything like this exist  it is a stupid idea  how could it function ,brhyrs
2,Attendance Is Mandatory (Rant),what the fuck  just what the actual fuck  i am just so annoyed right now  the management team at my office wants to schedule a 4 hour  gonna end up being maybe twice as fucking long  training on the day off that persons get and as they claim attendance is mandatory  that's such a fucking passive aggressive phrase    i'm just tired of this place  right now i'm just hiding in the  sick room  because everything here is shit  i'm trying to grade a 4 minute call and it's taking 15 minutes because word keeps crashing because their computers are from the dark ages based on today's standards    i'm just tired of work and these dumbasses thinking that this shit gives their life worth or some fuckery because all it truly does is stress me out and i can't sleep at night or enjoy anything because i'm stuck here having my life sucked from me  i just wanna go home man god damn ,brdymy
3,US Postal Service is seriously trying to abolish wage labor,reuters  self-driving trucks begin mail delivery test for u s  postal service  https www reuters com article us-tusimple-autonomous-usps self-driving-trucks-begin-mail-delivery-test-for-u-s-postal-service-iduskcn1sr0yb feedtype rss amp feedname technologynews,brhqd6
4,"""Adrenaline is better than coffee"" as if it's normal to need something to get through the day.",             start your day on sportbike and you'll be  wide awake for the worldly     ,brrfw5
5,"""Sure my life isn't perfect, but my job is!"" - job offer poster I walked past today",naturally i applied straight away  i've always wanted a terrible life with a perfect job     it was at a hairdresser  a twist on their slogan '  but my hair is ' ,brvmr2
6,retai/food service is first world hell.,remove this if it doesn't fit  but i felt like you all would be kinder to my ranting than the rest of reddit   im about to quit my job since i have the safety net of a slightly better job in a field that doesn't make me want to blow my brains out  so heres some things that made my job the piece of shit that it is    amp x200b     the phrase  work theft  i've been talked to twice since i started this job in this location less than a year ago  both times were about me taking too long breaks  the worst part of this was them not taking the blame  my two bosses told me my coworkers didn't trust me and were coming to them constantly  to complain about me taking a 20 minute break  instead of a 15 minute break    to reduce shoplifting in the store we have to walk the floor and greet customers and fix up messy areas  this walk should take 5-10 minutes   now you know why i took long breaks  our  shrink  walks never reduced theft  except for greeting known shoplifters  i was told that i wasn't dedicated enough to the job  and they could tell i didn't take pride in my shrink walks       they were fucking right    pizza parties arent a replacement for more money and respect   my store manager is a creepy fuck and has literally been caught punching walls in the back room and makes all of our  majority female  employees uncomfortable  i've personally complained to his boss but uh  he's allowed to be a dick because he makes the company     store credit cards are a scam    specifically the cards from my store are dumb  dont get them    also  this is probably true for the majority of big box stores  but employees  who do all of the work selling the cards  get little to no rewards  at my store we get  reach  cards that get drawn randomly every month and one person get either a  25 gift card to the store or a shit piece of store merch  my managers get bonuses and raises    now  if you catch and can help lp prove than an employee is stealing  product or   guess what  you can get up to  350 as a reward  cash  not gift card     because of this ive been snitched on for  shopping  our merchandise   i was fucking looking at the color of the lipstick  i wouldve bought it too if my discount was more than 10  at my old location we shopped during work all the time    not only do i have to be polite to everyone at work including employees and bosses  i need to be overtly friendly  i have coworkers that do this and its fucking unsettling  and customers that i speak to as a human being  appreciate the store much more than when i treat them as a thing to sell too  fake friendliness is not something people like   ceos    amp x200b   i think thats all i really wanted to say  fuck my job  i cannot wait to say goodbye  i just wish my coworkers didnt have to stay  no one deserves to get paid fuck nothing and treated like shit 40  hours a week,bsb8dj
7,"Today was another day in which I got paged for a potential server issue, but it turned out some manager’s email just landed in the spam folder.",i just read the thread here that tells the unemployed   you re not useless    i m the opposite  employed and useless ,bsdq25
8,Three incredible reads about work and what society expects from you,are we ok with book and article reccos here  these were amazing    amp x200b   1   convenience store woman   goodreads https www goodreads com book show 38357895-convenience-store-woman from search true    sayaka murata  ginny tapley takemori  translator   a short story about a possibly-autistic woman  and her menial service job  she's been at it for 18 years  and the strict rules and cult-like conformity are the only things that make her feel human  please look past the ghastly  quirky  marketing  there's a great story hiding here    2  secret life of an autistic stripper   narratively com https narratively com secret-life-of-an-autistic-stripper    reese piper    free longread  a very similar story  except it's a true-life account  and the storyteller is a stripper   3   apathy and other small victories  a novel   goodreads https www goodreads com book show 97084 apathy and other small victories from search true    paul neilan   a story about a guy surrounded by the kind of people who identify with their job too much  speaks to the frustrations frequently voiced on this sub    amp x200b   happy friday  friends  don't put in more effort than is healthy for you ,bsgu3u
9,Is there any hope for us?,i hear news about automation everywhere  but is it really gonna work out for us and we won't need to be wage slaves anymore  is it even going to happen in our lifetime   i work in customer service  and i'm getting to the point where i'm back to contemplating suicide to get out of a life where you're nothing but a pawn to make a man more money while he considers you less than the ground he walks on  i'm going to university and hopefully will come out with a degree that will help me get a job that i actually like  but i really don't know if i can do another 3-4 years of this shit ,bt2kc7
10,[VIDEO] Auto repair specialist talks about his daily work life problems.,if you watch this video   https www youtube com watch v hbj0trj8r7y https www youtube com watch v hbj0trj8r7y   whats your opinion on it   he basically talks about 'millenials' wanting everything made easy and won't shut up and do the work properly till they die   some insight of the mentality that my boss also subscribes to  i mean i hear what he says and all  but even doing what he talks in the video perfectly would leave me unfullfilled in life  like he probably is too but won't admit it  life doesn't always need to suck  its what you make of it     amp x200b   different people run different operating sistems in their minds so it's natural that they don't agree with what eachother thinks  mindset     amp x200b   the story hes talking about reminds me about the relationship with my boss  except i didn't quit after 2 days and i've been here a couple of months  but my boss is sometimes an idiot too  not that bright in some areas  but i also make stupid mistakes  my excuses is the work enviorment  i just run around too much and then i miss this or that or forgot to check something which may lead to disaster  i wasn't this forgettfull before i started working  but now  i feel like an old man  i keep forgetting things on cars  like i forgot to tighten something properly and shit goes bad  yet work is on my mind 24 7 sadly ,bsj05z
11,5 years experience to sell bread,offre d emploi       vendeur  of  confirm e  ba dynamique et souriant e  aime travailler of equipe  minimum 5 ans d experience   all  01 47 32 18 83 pour prepare render-vous    ,bsjhxg
12,Probing into my work/life balance, the most cringey thing about fridays at work especially before a long weekend is management asking if you have any plans    yeah  forgetting about this place for a couple days ,bsigrn
13,A more honest exchange,i have been really depressed about work lately  but i'm starting to come around  it's been a struggle to give myself the credit i deserve  i tend to lose motivation and let more routine organization and communication tasks slip by me  but i am still pretty good at getting our main tasks done  when there is urgency that calls for it  i work as hard as anyone else  it's actually when things slow down that i can be lazy  i have motivation issues that i need to work on  likely related to a deeper depression which has nothing to do with work  or maybe it's add  maybe laziness is just laziness  i don't know   but sometimes i just wish that people knew and accepted my work performance for what it is  because it's this unceasing imagination of people's judgments which really makes me anxious and depressed  can't this somehow be a part of the negotiation of labor  despite how often i slip up  i know i am not going to get fired because i have skills and experience which are hard to find  i would be difficult to replace   at the end of the day  i know that my presence is a net positive for them  losing me would make things more difficult  why does it seem impossible to be open about my flaws  to lay them on the table and say  take it or leave it  why should the burden be entirely on me to change for the better  or else feel ashamed by my repeated failures to improve  i do want to get better  but i also want this guilt and shame out of my life  i feel anxious for 8 hours a day at work  and then guilty or ashamed for another 8 when i leave  that's no way to live  it's an unfair exchange for my livelihood   for just the bare right to pay for an apartment  some food and other necessities  i just want to fucking  be  why does that have to come at the cost of so much mental or emotional strain   to me  the ideal situation would just involve some simple  but perhaps radical  honesty about the exchange of my labor  i would promise to put in my time and do my best to improve my performance  but in addition to my wage i would want some basic understanding and acceptance of my flaws  i would want to drop the fa ade i put up from day zero  when i first sit down to interview and only list my strengths  never my weaknesses  i don't want to feel like an impostor anymore  i don't want to feel like i have been trapped by the very perceptions of myself that i try to encourage  i don't want to feel like i need to escape before anyone finds out who i really am  i want my employers and my co-workers to say  we're at last glad that you're here to help  because having you is better than not having you  and that's good enough for us  is that such a big ask  am i being naive ,bv0ylw
14,If you..., eat eggs  or tuna  or really any kind of fish  in the break room at 7 in the fucking am  you deserve to get fired just on principal  keep your stinky meals at home  goddamn woman ,bv7dmw
15,Hired on the Spot and then Fired Immediately,so as the post title said  i went to an interview at a local branch of a company who's expanding their operation  and was hired on the spot  my work experience just prior to this was at a very successful company with a good reputation  and i had glowing recommendations coming from my previous bosses  i went into the interview knowing full well i was overqualified for the job  as my last job was doing basically the exact same thing  but i didn't expect to get hired on the spot       side note  in my experience  hiring on the spot is actually not a good sign  it means the company might be more desperate than they're willing to admit       but anyway  i tell her more prior work info and start filling out the legal hiring forms  but then the interviewer starts asking me weird or even possibly illegal-to-ask questions   so other than yourself  who requires you to be employed  even at the time i knew this was a red flag  so i know this interview  which again  was technically over  as i was filling out hiring information  is gonna get awkward real quick  for the sake of my own clarification sanity  i somehow worked up the nerve to ask her a few questions as well   so what's the next step from here  interviewer lady says she'll  submit my paperwork to my new boss  and he will contact me on wednesday about drug testing and a start date  this was also a red flag to me  why would my new boss need to see my resume and cover letter and prior experience  is he somehow involved in the hiring process  something about that just seemed real out of place to me  but i thought maybe it was just some weird  unorthodox hiring procedure     amp x200b   anyway  the interview ends  my paperwork is filled out and the interviewer tells me i'll hear back from them on wednesday  well wednesday comes around  and guess fucking what  they retracted their employment offer  not gonna lie  it was like a movie where i read the email like 3 times to actually comprehend it  my brain starts going a million miles an hour trying to figure out what went wrong       -failed background check  nope  never been arrested or in trouble  not even a traffic ticket     -bosses said something unbecoming of me  no  i worked with them a long time and they were also my friends  definitely wasn't that     -something wrong on my resume or cover letter  nope  double checked and it all looks good     -did i say something wrong  no  don't think so  i wouldn't say i aced the interview but it definitely didn't go badly      so then i start remembering the real minor details     amp x200b   interviewer was late to the interview  despite it being a time she told me and that we knew ahead of time for 2 weeks  security guard accidentally slipped that she was in a meeting   she was in a meeting at the same time she was supposed to interview me  on a time  she  set      employees seem to be coming in late as i was waiting for the interviewer to show up  and not like 1 or 2  but like 20 kept filing in and going through security  no idea why       when i first walked in  i had to correct her on some things she misunderstood about my previous employment  it seems like she did some research on my last job  but some of the things she  ass   u   me  d were objectively wrong  my last workplace manufactured things in a proprietary way and she just researched the industry standard way of doing things  i literally specifically mentioned that on my resume as well  so i don't know if where she went wrong there  again  looks like she was winging it       call me cocky  but i think i was fired out of their own incompetence  the being late to the interview and then not understanding the things i mentioned when contacting her earlier  i don't know what else to call it  i should have been an obvious hire for this company  and i guess i was at first  before whatever happened behind the scenes went down  anyway  i'm just kinda taken back but their lack of professionalism  i'd love to hear what you guys think about this or if something similar has ever happened to you      also  because they wasted a fuck ton of my time i don't mind dropping their name  the company was msc industrial ,buwxg1
16,Do you like being relied upon? Do you ser that as a benefit of work?,this is from an interview with sam harris  adam grant says that what makes me people feel as if they matter- at work or otherwise- is feeling noticed  cared for  and relied on   38 45   just thinking about how this is one of those benefits of work that i have a hard time finding elsewhere  i know that when i'm not working  i start feeling depressed and i think some part of that is the need to feel relied upon by others   when i think about being anti-work i can't seem to get over all these small intangible benefits beyond pay  the sort of baby-in-the-bathwater type benefits that i don't want to lose but can't seem to find elsewhere   i could be wrong  but it does seem that there is some psychological benefit to being relied upon  to being held accountable to complete tasks even if you don't wanna do them  i don't know how to square that with my sheet desire to not work  or my politic leanings towards ubi ,bvemce
17,"Don't you love it when as soon as somebody complains about wage slavery, a bunch of people have to come in and say 'wHy DoN'T yOu StArT yOuR oWn BuSiNeSs'",i see it quite a bit in a lot of threads in this subreddit    i'm sorry that i was born into the lower class  where i don't have a bunch of daddy's money hanging around so that i can start my own basket weaving business  if i even tried  i'd be bankrupt and starving to death in a refrigerator box ,bt6gna
18,Answering Your Phone on a Day Off - Nope,i've never understood people that answer a work-related phone call on a day off  they're not ringing up to shoot the breeze  you are  probably  not obligated to answer that phone  if you're in the emergency services on call  that's cool   i also had a friend that was  shocked  that i let a call from work ring out while we were having an early morning coffee  i said that it's so early in the morning they're probably ringing up to ask me to cover a shift  fuck no  it's my day off  i've planned to meet for coffee and then do fuck all because it's my time    i'd occasionally answer my phone and say i was two towns over or out hiking or something  sometimes i was  my boss was suspicious that i was always  doing something  when they rang to ask me to cover  pardon me for not wanting to spend every waking moment of my life behind that fucking counter ,bt9x57
19,Anyone here work in social services or the mental health field?,i work with seniors who are low income  have mental illnesses and other disabilities  i would like to find meaning in this work  but most of the time i feel like i'm a  duct taper  most people i work with are really isolated  some have no friends or family at all  so my interactions with that person might be important to them  but i really don't feel like i'm making a difference  even if someone tells me i helped them  i feel nothing  even though i do empathize and care    for me  i think years of suicidal ideation are also taking their toll  making me feel obligated to constantly be justifying my purpose to myself  but i think it also has to do with expectation vs  reality  and pretty much omnipresent burnout  i've done other types of jobs  like especially pointless data entry  and that was much worse  but i'm getting weary of my constant job-related dark night of the soul  i'm 34   i know most of us here want to limit do away with paid employment  but i'm interested in hearing from folks in my field  how are you coping  and do you think your job is sustainable for your own mental health  do you feel like you're succeeding in helping people or improving their lives  do you feel disconnected from the work ,bukj2d
20,31 year old female employee commits suicide after being pressured by her bosses to perform better.,to spend most of your waking hours satisfying corporations is not what any person wants  it is a life of quiet desperation ,bv2ovk
