,title,body,id
92,My employer is being acquired by a massive corporation. It's highly likely that I'm going to be let go once the deal is done. I have no idea what to do.,i'm new here  i'm gonna ramble a lil bit about what i'm going through - sorry if this isn't typical antiwork fare but i like the cut of y'alls jib   i've been working in the enterprise it field for the past 10 years  the last 3  years with a startup  as far as employers go  i have to admit this startup is pretty good  my director is very much a  life first  type of person and doesn't give folks a hard time for taking time off when they need it  late nights weekend work is usually made up for with time off  it's encouraged that folks seek out training opportunities and are given time for them  stuff like that  working for this startup has also presented me with travel opportunities and other perks that i ordinarily wouldn't have in my role  that said  if i've learned one thing in the past 10 years working in this field  it's that i am deeply unhappy and will not last doing this until retirement age  these feelings were exacerbated a couple of weeks ago when we arrived to work one morning to learn that the board had agreed to be acquired by one of the largest corporations in the industry  whom i have zero interest in working for  and of course now my work feels completely pointless because once the acquisition is done all the existing it systems are just going to be ripped out and replaced  which isn't very good for my day-to-day morale   these corporate acquisitions take a while to complete so i know things aren't going to change too drastically around here for at least a year  execs are saying the typical  we're going to try to find a place for everyone moving forward  bullshit  and that may be true for the engineers who design the products but it is a support group and it's very likely that most of our team will be let go  hr has already outlined how any current or future equity will be dealt with but that's all we have in writing so far  basically  on the date the acquisition is finalized  vested shares will be paid out for the agreed buyout price  and unvested shares will be paid out according to the employee's existing vesting schedule  meaning periodic payouts for the next x number of years  as for what kind of severance package  if any  could be expected beyond that  it's still entirely up in the air   i'm trying to look at this optimistically but there are so many variables  the way i see it  the best case scenario is that the severance package is good enough so i can use that   my equity to go back to school because i really need to change careers  i'm fortunate enough to have kept my debts under control and i'm still in my early 30s  not married no kids leaning on me  so this seems like it could be a real opportunity to find a new direction  at the same time  i really don't know what i would even study if i were to go back to school  since this announcement i just feel like i'm living on borrowed time  i'm resolved to save as much money as i can while it's still coming in  but everything after that is a giant question mark  i've never felt more expendable or uncertain about my future  has anyone else gone through this sort of thing or attempted a career change after working in one field for a decade  am i a spoiled d-bag who should check his privilege  any thoughts or advice would be very appreciated ,chraco
93,Living like a billionaire until you’re 50 or living with an “average” income until you’re 90-100?,my partner just asked me this question and got mad when i said i would pick the first one   i just don t see myself being happy at all working 7 30 am until 6 00 pm 5 days a week  50 weeks per year  after work getting into traffic  coming home to cook clean up do whatever that needs to be done  if i got energy left for it anyway  i only see myself existing rather than truely living if that s going to be the case   what would you pick  and why ,ci5os6
94,"Student loans payment just started today, my license got suspended, and they wonder why people are miserable",just paid  800 today  and will continue to do so each month  for many years  there's some things i can do to get my payment down to  400  then  it'll just take even longer  and i'll pay the government more interest so they can fund their wars and fund the rich fucks  and what gets me is that i got off 'easy' with the amount of student debt i have  i have less than many other people   as a bonus  i just found out my license was suspended  i had no idea for eight months  i never got mail  phone call  nothing  and yes  my info is updated  so now  i get to go through 8 layers of hell to fix it because it's a complicated situation due to involving two states  oh  and i also get to pay them lots of money for never telling me  so yay   the kicker is  i'm supposed to move back to my home state in two weeks  so if i can't get it handled through mail  then i get to pay thousands more for them to haul my car to my home state    and all this moving is for a new job  and thank god i will be making a livable wage and eventually able to pay all these things  but at my old current job  i would have been entirely fucked  i thank my lucky stars for this new job  and that's how they get you to be grateful of your new job and worship it  at my old job  my life would have taken an ugly turn  and it makes me think of all the people that didn't get that lucky job and ended up in similar situations  this life is just unnecessarily stressful  stupid  and at the end of the day  quite boring ,choipz
95,"I don't know what to put as a title, sorry.",hello  i'm new to this sub  been reading a lot about other people's hard times about working and receiving advice so i think i should do the same  just to seek some comfort from the stress i've been through recently  this is my first post being here   so if certain parts of my post are deemed immature  inconsiderate   offensive or just simply not suitable for this sub  please let me know and i will correct myself   i wanna ask you guys something  any of you who has experience of overthinking a lot  especially during work    i don't know whats gotten into me  but i keep having worries about things that i'm doing  worries like how will other coworkers look at me when i made a mistake  or how will the boss scold me for no doing things the way he does  no matter how much i try  i just can't shake away this fear of constant worry of judgement from others  now matter how confident i am in doing it  that had led me to quitting my second and last job  combine the fact that both of those jobs had me deal with shitty coworkers and bosses  it's just making me slowly losing my sanity   now i am currently unemployed  but my parents had been forcing me to go find a job  simply because i haven't finish my work study college  currently studying culinary arts  and those typical  this is how life works  you work or you die  reasons    it hurts to see all my interests are either useless or not profitable that i have to ditch them just to stay in this society  i wanted to write and animate  but years of studying other subjects and working had rendered my vocabulary and creativity deteriorating  i wanted find jobs related to the things i like such as light novel writer  or animator in the video game industry  but realized that they are all not that profitable  or just generally doesn't exist in my country  last time i know   japan publishers doesn't really accept light novel submissions from foreigners  let alone fan fictions from existing creations due to copyright  even if they do  considering my luck  i would rather use my scripts to set up a campfire to keep me warm if i ever get homeless    i regret for being smart when i was young  so smart that i actually though that i could be a good person with a bright future like all those adults told me  only to be trampled onto the ground by reality  i don't know what to do  spending every night thinking about what will i become if i continue this way  being myself instead of being a work slave like other people  i don't know where to seek advice until i stumble upon this sub  and now i'm typing this  so that i can at least make myself feel better from all these negative thoughts because i know that there are other people at the other side of the world like me  struggling   sorry about the long post  but thank you if you reached this far  to think that i am still be able to write a long paragraph like this after giving up on writing for so long really brings back the memories of young me dreaming about writing a novel and submitting it to be published  if only i can go back to that time when things are simpler  so i don't have to worry about everything from the present to the future ,ci1556
96,Medical field stories,i haven t personally worked in  but have heard the most horrific stories from the american  healthcare  field  doctors and nurses being forced to work 12-36 hour shifts on their feet  no breaks  have to go hundreds of thousands in debt and then work a multi year unpaid residency under abusive senior doctors or surgeons  then  when in practice  you basically have to pander to the pharmaceutical industry and over-prescribe and over-order testing because you get 15 mins with each patient    i ve heard countless terrible stories about gossip  workplace bullying and mobbing as well  it seems to be an industry that  particularly  caters to being an abusive workaholic sociopath  and has multiple types of hazing rituals for new professionals such as extreme work hours  near-slave labor during education  and more extreme workplace bullying  it seems worse than just the typical work culture issues we have here    and it seems even more scary that people s lives are literally in the hands of these workers  people s health is on the line  often urgently  concurrently as these workers are using work time to bully each other    has anyone else noticed this  i ve completely ruled out working in any kind of healthcare field because of how bad the stories i ve heard are  and it is just counter intuitive that society would allow such unhealthy conditions for our doctors  nurses and hospital workers ,ci1i6p
97,Vacations Don’t Fix the Problem,at my last job i met many people who worked the entire year for a 1-2 week vacation  they explained that it made it worth it and when they came back they felt refreshed and could continue on with the remainder of the year s work  i ve seen this type of thinking in a lot of jobs and it is so problematic    first  a vacation doesn t fix the system that is perpetually exploiting you and demanding more and more    second  this type of mentally is dangerous  for some it pacifies them  and they continue on for he one break they get a year    also  most people are checking e-mails and getting calls from their bosses while on vacation  i ve even seen some people who were just staying home get called in to work because the bosses knew they were still in town    i remember telling one coworker  who had been at the company for six years and had recently gotten her own office so she was extra pro company  about my dream of teaching english in thailand  and she said  why  you could just take a vacation there and still work here    and another reason it doesn t work is because most americans don t take their full vacations  i was withholding taking it cause i wanted to get the monetary equivalent when i left  and some bosses guilt their employees about leaving and it s never a good time    don t be pacified by 10 days off  can someone do the math and tell me what the percentage is for days off and worked  it can t even be more than 5 ,ch8fm7
98,Compare and Contrast,a amene rvantiw ork of   bigger paychec    ,cgw4dq
99,How could you?,admiral snaccbar iv  simplysnaccbar   by funeral   loss   solemnly placing his hand on my casket and sobbing  how could you do this to me we are so understaffed today  6 27 of - 7 23 19 - twitter for android ,cha83j
100,I could feel my soul dying looking at this,aunt  10  unseat sosyuadng of s04 j00   obey mvedwos    wopssod yes  to juoseud oh  bof lnidiw  loud tigvivay sunoh  ale wiivay  rol a jou of gong bao are   ensue by am feurules   to primed wag oaks boa bay   panama yea  not are      want now   copy 10 of to seal   not may   aye  sal   fuyaq s rugay of  an ak ok may  -4943060  49 q of y4om and 29   a you regatta  work m canada  availability  hours available mon from  recent job  company same your position  salary    declare that the information  omission of incorrect information  company's policy  of hired    understand standing requirements  company  or its agent 3  information may be obtained by telephone  financial institutions  personal information agents  of my application for employment  and if   am  to the applicant  your application will be considered  s and e nation application will be kept by the management          ,chpcll
101,I want a more simple life.,i m planning on starting a vegetable garden at some point when i have the free time but for now i just have a pretty low maintenance memorial flower garden for my past pets that i d also like to expand at some point  it s just hard because on top of work already being draining and awful for the average person i m also chronically ill and i have to spend so much time just doing nothing to feel well enough for stupid work the next day    i m also planning on throwing out most of my stuff here soon  i have a lot of useless stuff that i ve bought over the years to fill the empty void within me and to cope with all the shit that s happened in my life  i know that i don t need it and it s time to let go so i can move on  but it s difficult  especially when i feel like i just don t have the time and also feel like it could impact me negatively mentally  because most of it is spent at work  and it s really making healing and improvement and learning to cope seem really impossible    i just want a simple  quiet life  i don t want to have to care about having enough money and pushing my body way too hard so i can keep my job so i can have enough money ,cisewt
102,Fuck Mondays!,   he before the with century  it was tradition for many workers to observe  faint monday  where they would take monday off and instead of working  they would party  drink  or relax and recover from their hanover  ,cim7zh
103,Personality Test,i recently started as an intern for the i t  department of an adoption agency in my town  one of the first things they got me to do  after a grueling introduction filled with reading legal nonsense and company policies  was take one of those 16 personality types tests  after completing it i think i got enfp-t or  the campaigner  which is classically known for despising boring reparative tasks and thrives with social engagement and a spontaneous environment  my manager saw this result and promptly scoffed  calling  one of those 'feeling-types'  and then left  i know these personality tests aren't meant to be taken to heart  but it really got me thinking about my future and how dark it would be if i had to do this kind of work for the rest of my life  even the next 10-20 years ,ci62zf
104,What possibilities do we have for a passive income?,i get that most of us hate work and it's especially worse when you get paid next to nothing for it  but what can we do to make a bit of passive income besides the job ,cjznu7
105,So who's idea was it to claim that employment gap is a bad thing?,for some reason it's a crime in the work world to take a break and just relax and enjoy what life has to offer   you have to work nonstop till you retire    if you go a month or so without a job  employers will think something is wrong with you  and throw your resume in the trash   i just can't believe society has accepted this as normal ,cjle5m
106,How do y’all feel about Ted Kaczynski?, you can be a kantian if you want  i  for one  remain a rousseauian  -immanuel kant,ck4r7q
107,I have a great opportunity and want to throw it the hell away.,bloody hell this got long quick  i spent a while writing it  i don't know if this is where it belongs  but it seemed the right place at the time  tldr  i have an interview coming up for a  good job  and i fucking hate myself for considering showing up for it  mostly because of the fact that the interview process reveals a lot about how the company doesn't genuinely value the time or talents of their applicants   i dropped out of graduate school recently  with six figures in debt  there just aren't any jobs that require a phd in my field that i would ever last in  my  work ethic   a phrase i've always found off-putting  fluctuates too much over the course of a year for me to credibly promise 30  years of loyal service without reverting back to the pathological lying i engaged in as a small child as as a desperate  failing  attempt to gain peer respect in a world i found  and still find  incomprehensible   i've applied to exactly one job so far  as i currently live in a city that doesn't have the size to maintain a huge corporate economy with jobs whose hr managers wouldn't be former business students who barely passed courses i once taught for a stipend roughly 70  below the median salary for someone my age  and who by that fact alone know that i don't have many talents that are really necessary in said jobs  i clicked  submit   how apropos  over a month ago  i aced the phone screening over two weeks ago and have an interview coming up this friday  i'm certain that i gained this interview thanks to the extraordinarily ambitious cover letter i included with my resume  my energetic go-getter demeanor during the phone screening  and the friendly  reminder  i sent the monday following the phone screen  featuring a reiteration of what i think i can contribute to the company   the in-person interview is a typical panel interview for an analyst position in middle management for a techy company with a few hundred employees  the first half will feature a presentation i'd put together over the next couple days  in which i'd outline my responses to a few questions they gave me regarding a data set of their customers and the services they've contracted from the company  the second half will feature  behavioral questions   describe a specific  actual situation at your past job where  lt lt challenging scenario gt gt  occurred  describe in detail how you responded to it  and describe what you learned   despite my graduate training in an academic field that is naturally cynical about agents' motivations  i totally overlooked the fact that i basically agreed to complete a spec assignment for the right to have them consider hiring me for pay  this is  in and of itself  not remarkable  as anybody who can read nonfiction and chooses to exercise that ability knows that the  unpaid internship   working for free for months  is becoming so normalized that it's no longer unheard of to hear of people paying for said unpaid internships  i've gone from feeling somewhat hopeful that i won't be homeless a month from now to feeling angry and bitter that i've agreed to a glorified american idol audition in which i'll be desperately attempting to impress strangers for really nothing more than a chance to not be homeless  i actually think i'd get the job if i put the requisite effort into it  i'm just sick of working for free just for a chance to not be garbage   i discovered this sub after seeing it linked in a post elsewhere  it's where i've belonged since my first day of working for free at the age of 6  don't give me any shit about how school isn't  working for free  but rather an  investment in one's self  -- i did just fine learning new skills before attending school  and beginning school was far more akin to driving a ferrari into a tar pit than the  journey of self-improvement  school is aggressively advertised as  looking back  even when i aspired to be rich  it was only insofar as i'd never have to do the song and dance again  and had nothing to do with a chance to own cool toys or live in a ridiculously large house or cover myself in finely woven  meticulously cut cloth   while the company i'll be interviewing at does something of value  at least if their backend infrastructure is as well-designed and maintained as their shiny client interfaces  which i'm sure it isn't  i can't help but feel like i'm  selling out  what's worse is that i can't complain about it to anyone i actually know  family and former classmates are either apathetic or downright antipathetic toward the disposable poor  and my low-income friends resent me for not being grateful for the opportunity  would i be good at it  yeah  i bet i'd be better at it than the hundred other applicants this company must have lined up to be taking so long and raising so many barriers  i'm just better trained than almost anybody else who would consider applying for it  and the phone screener implied as much with some of the questions  i asked for enough money to live well in this town  even after loan payments  so i'd be throwing away a lot of potential security if i canceled   yet my top  ambition   if you can call it that  in life has nothing to do with spending 9 hours a day in a building across town  analyzing the rate of return on sales agent expenditures  i'd much rather get on a bus down to mexico and get to a low-cost town where i could live cheaply enough not to worry about money  write niche rants like this  and in the meantime teach those who i rely on a few things about computer programming and applied statistics  or maybe teach their kids  i believe that the beauty of computers is that  employed in the right way  they could make work as we know it obsolete  or at least something that takes up little enough time that few resent it as i do now  instead they've somehow made opportunity even more scarce for those who can't keep up with them and increased the workload for those who can  it's perverse  and people like you called it years ago   i spent many a year of my adult life as a  libertarian  i still think i am one  but it doesn't mean to me what it did once  and certainly doesn't mean to me anymore what it means to other self-styled  libertarians  if there's anything november 2016 taught me  it's that a libertarian is more often than not somebody who wants the government to leave him alone but still wants the option to call the cops when someone inconveniences him  it's someone who spews bullshit about the  non-aggression principle  but will vote for the first pussy-grabbing sociopath who promises him a tax break that amounts to his cable bill  it's someone who talks trash about government public works projects and a bloated military-industrial complex  but still wants a 1000  mile scar to be built across the sonoran and chihuahuan deserts to protect us from people who probably wouldn't want to come here if the past century of foreign political intervention and domestic drug policy hadn't made a bad situation worse where they came from   i hate working  even for wealth  unless i can see the benefits accrue to those whose quality of life meaningfully depends on it  i hate myself for even considering another three days of working for free  even if it's for a chance to not be tossed in the garbage with 6 billion other people who would probably take my opportunity if they could  i hate myself for vocally supporting the amoral value system that makes irresponsible opportunism the only option for so many  i kinda hate my cat for being the one reason i don't want to be homeless  even if he's got kidney failure and will probably die if i'm gone for 10 hours a day since he'll only drink water when i'm home  i want to fucking die  and r depression is only going to put up with my shit for so much longer   i secretly hope that someone in hr or on the panel sees this and sends me an email saying i shouldn't bother showing up on friday  i want to send an email saying i won't  i've already written and proofread it  it's in my drafts folder   welp  that was quite a rambling rant  i've either found kindred spirits who will identify with it  or found a place where these thoughts will be downvoted into oblivion  but i had to post it somewhere or i'd never get any sleep  i probably won't anyway  but perhaps i'll get a few new friends out of it  good night  and good luck  i'm exhausted ,ck5gcn
