,title,body,id
256,If he gonna spend money while at work wtf is he there for... ugh this is big cringe. Fake or not.,karl iv oem realrule  bsce l valn a ellarclamualcne in slaveomoymanlowlanlialenecl men ole oroisaline melon salhersealmerite he pay for it the told him i have a boyfriendand the cashier left told her im trying hurry home and theto aesvelantmieleltey a malelmeri your broke ass    1116 of  92019  twitter for shone ,d88eru
257,"Join Childcare, they said. It'll be fun, they said.",incoming rant but i feel like im losing my sanity here  since the start of this school year the business i work for has been turned upside down due to building work in the place that we rent weve been squashed into a room which is half the size of our previous room and our previous room wasnt big enough to begin with the children hate it the staff hate it we all bloody hate it  in particular the children who already work hard to control their emotions are struggling more now than ever every day now we have one child at least having a meltdown the inspiration for this post in fact was that today a child retaliated to me asking him to sit with the other children by throwing a plate at my head and calling me a twat   ive come home crying more days than not this month purely from either stress or fatigue my body aches all the time and all i ever do now is work eat and sleep the worst part is that i understand their frustration but theres nothing that i can do to help this is our situation for the next 612 months  anyway ive been flicking through this subreddit today and ive related to a lot of the things you guys have to say so i want to say thanks because it means im not alone in what im feeling right now which is work fucking sucks,d89dse
258,Quit my job this weekend,i quit my job this weekend im a student so it was more possible than it might be for most the only reason i quit is because they lied about the responsibilities and underpaid me  it was a remote transcription job where productivity was clocked it was so monotonous i had to buy wrist braces and blue light filter glasses too because of the wrist pain and eye strain and i had to take at least a five minute break every 20 minutes unpaid so as not to affect productivity and the breaks literally consisted of staring at the ceiling to try and avoid too much eye strain  an 8 hour task took at least 10 hours if you accounted for breaks after taxes i was making like 6 an hour so i quit with no notice it felt great to quit but now i have to find another job and i dont know where to work i cannot wait until i graduate so i dont have to do minimum wage jobs hopefully,d8a46o
259,I’m sick tomorrow.,fuck it im calling out tomorrow and taking a 3 day weekendoff sundays and tuesdays i just started 2 12 months ago and have consistently been short staffed due to the two experienced people who are supposed to be training me going out on vacations a total of three times now for a week or more at a time and this week one was sent to a convention and one took a week off for her birthday i spent all week playing catch up and fixing mistakes i havent been trained on well enough im mentally exhausted they dont pay me enough and dont offer health benefits im spending my sick day applying for new jobs and also fuck working on saturday,d7wj7v
260,Give me a 4 day week already.,working 40 hours to far to much should be maxed out at about 25 hours a week and then i could make more time for reading and exercise   if im selfish for wanting to enrich my own life and mind then so be it,d84e6p
261,"My employer considers using most of your sick leave ""abuse""",examples of sick leave abuse may include but are not limited to  the following   1 any pattern of sick leave usage such as the use of six days in a six month period one or two  days at a time   2 habitual sick leave absences on mondays fridays andor the days immediately before and after  holidays   3 any employee who has no significant accumulation of sick leave after at least three to five years  of service without sustaining a major illness during that time period,d61psu
262,Jobs that don't suck the life out of you,as much as i hate to say it some of us just cant afford to quit our jobs and enjoy life do you guys have any jobs that are less soulsucking,d8fw7f
263,Saving up for a down payment on a house so I can mostly leave the system,looking at cheap mobile homes and small houses in my area i turn 19 next month no credit and still living at home with parents found a decent mobile home with a small plot of land for 67500 a couple cheap condos for 65000 and a couple cheap houses in the 7590k range with a 20 down payment id need between 13000 and 18000 for the prices i mentioned          i currently have 7250 in the bank due to my saving habits and no current bills except for gas and car insurance i have a shit job that ive been at for 2 months with a 53 minute commute oneway but it pays 12hr vs 725 being legal minimum wage 950hr being local economy i figure i can probably save up for the 67500 down payment in roughly 56 months   whatever closing costs id want to save up for a little bit after too to have more of a cushion after that my mortgage payment property taxes and home insurance would be roughly 304 according to zillow add electricity water sewage garbage food internet etc and maybe itll be an extra 500600 a month after i pay the mobile home off all i have is 19month 228year for property taxes as long as i pay that i have a house  the other bills that if i get fired or take some financial hit i could hold off on a bit          i think its a decent plan once its paid off id only need a minimum amount of money and could live somewhat free i can tell you im serious when i say i dont wanna work the rest of my life or work to live paycheck to paycheck work will just subsidize my bills and ill hopefully be much more free     of course all financials are speculative could be more could be less id hope i could get a nice first time buyers loan or some help from usda though i heard they dont do mobile homes this is my dream to not have to work myself to death theres not a big point to this post but i wanted to share my steps im taking to leave the work life,d231rv
264,How do you guys expect the world to function if you could chose right now how everything would work?,if feels like you guys think the world and job part is wrong so how could it be right i your opinion and if nothing can be done then why do you guys just adapt instead of complain maybe start your own business or something i dont understand the goal you guys have,d273ni
265,We lost to our own hubris, david stains   4 davidoatkins  of you told a person in the 1950s that in 2020 housing would cost ov1 to b e in large la almere e melee take a lifetime to repay families could barely make do even with mon working we were locked  in endless wars  got was paralyzed by crisis  theyd assume we lost the old war 622 of  05 rep 19  twitter for android ,d21awk
266,Fuck recruiting agencies,lying recruiting bitch told me i was gonna be making 50000 as an accountant turns out im actually making 39000 i hate this bullshit i have no idea who lied but i want to get back at them should i just quit without prior warning cant even make a decent living with these boomer scumbags lying through their teeth and making living near damn impossible,d301p4
267,I've only worked one day at my new job and I'm already miserable (vent/seeking advice),i was fired from my last job at a jewelry store about 3 months ago the week of my birthday for being too awkward and i was honestly quite devastated as i really liked working there i thought id get really depressed and suicidal after a couple of weeks of job huntingunemployment like i usually do but these past few months have turned out to be some of the best in my life ive been learning about homesteading and gardening and making plans with my boyfriend to get a small house and large plot of land so that we can eventually live off the land weve managed to grow cucumbers green onions potatoes garlic and even an eggplant on our apartments like porch and that filled me with a different kind of joy and hope like maybe i could really get this going and spend the rest of my life gardening for a living i was the happiest ive ever been in my life i think  i finally managed to find a job which i was somewhat excited about because we could finally start saving money for a home my first day was yesterday and even though it went smoothly and i like my coworkers i cant help but feel nauseated at what im doing im working for a business founded by a certain uncle sam and i hate myself for it i cried for the first time in a long time yesterday night and today i feel like i cant bring myself to even get out of bed its like several years of progress with my depression were reversed in an instant   i suppose what i want to know is if anyone has any tips for staying positivenot horribly depressed while working so that my boyfriend and i can actually achieve something that we want in life,d393sd
268,What’s a really horrible job that pays a lot so you can work less hours?,im talking about graveyard work or things people dont want to do so the pay may be better so i can work less   all work is intolerable to me so might as well just go high risk to get paid more and work less   any ideas,d3aevs
269,Got sent home earlier today after a 3 and 1/2 hour shift because the store was slow today.,that seemed like a reasonable work day about a half hour more wouldve been a reasonable work day but thats about all i can stand without it seeming extremely excessive,d3g4yd
270,"My position is replaceable, my dogs are not.",i recently moved into a new house with my two senior dogs after i had just lost a dog at my last house due to a tragic accident i moved over my weekend and only been here for less than than 24hrs with my dogs my dogs are used to free roaming a house whereas this one i have to keep them in my room while im away which makes sense as theres about 4 other dogs that live here one of my dogs is blind the other is developing cataracts and is hard of hearing therefore they take a little more time to adjust and get used to a new place theyre whining even when im in the room and pawing at the door which only gets substantially worse when i leave my room im trying to get a day off so i can spend the day with my dogs helping them adjust however my employer is trying to tell me that i need to come in its not a busy night ive worked a shift very short staffed on a busier evening so i know its doable whats the difference between me calling in to take care of my dogs  my family vs me calling in sick with the flu at the end of the day my position is replaceable they can manage without me for one evening my dogs however are irreplaceable and i dont want them stressed screaming one whineshowls very loudly when hes locked in a room and doesnt have me around ptsd from previous owners and the blind one follows along with it  and pissing off my new roommates and getting off on the wrong foot   im stressed out and im losing sleep over a job which is fucking ridiculous because its such a small request im gonna get into shit if i noshow and im gonna get into shit if my dogs are howling for 7 hours,d2pt3y
271,it's a hyperproblem,at  2 m globaler klimastreik  greve mondiale    movilizacion mundial por of clima m 2err2e   4  he 4 a global climate strike w 23804282  movilizacion mundial por of  work sucks  vout i i of 00 tornadoes  of i  global  climate     iiigow  with anlnn vgsf  lvwitd 371 ynod aivignow jary9  hisylsvwitn ya1veo19  vwit9d  syinls slvwi19 1vg019  of saw oe  vwi19 013d siva019 oysvz ,d2lt86
272,Commuting is cruel and employers should pay for it,employers should pay commuting time this would encourage more employers to offer work from home options especially in the knowledge economy   i spend 5 hours a week commuting x 52 weeks a year  260 hours per year commuting  that is 108 straight days a year spent commuting to and from a job that i could entirely do from home,d2csjn
273,A billionaire lecturing a peasant on the virtues of 'zero-hour' contracts (when a person is employed but guaranteed zero working hours and often forbidden from holding any other job),word sugar  v llordsugar  correct me if am wrong you chose to work zero hours and you knew the rules of you try hard enough and perhaps reduce your self importance expectations you might accept a full time job    unionbrews unionbrews  for 19  replying to lordsugar and jeremycorbyn  ive worked zero hours ive been called as  was leaving the house for work and told that im not required on that day its worse now than ever cry engaging  with people and listening to their stories you will learn a lot when you stop seeing them as jealous loses  1241 of  for 19 2019  twitter for had  295 retweets 2of likes ,d2yh0x
274,Early mornings were designed to crush creativity,seriously have a new song but cant finish it now due to early rise im already up way too late and will be wrecked either way tomorrow the muse will be lost in any case havent written anything in a year early mornings are intended to prevent dreaming and coming up with stuff late at night there is no virtue in the early rise quite the opposite,d2gt6v
275,20 hour shifts when you have 2 kids in diapers? That's what confidence feels like. ™,         ready  of health for you                vach lee signs 2 kiss in else else  01010 4 lateathlete       dcomhealthcare of    ,d2c7d8
276,I’m in my senior of college and joining work full time seems crazy.,i just interviewed for a marketing internship last week and i didnt get it however i need experience in marketing to even get a full time job i have work experience but not marketing experience so its pointless   yet ive done another internship for marketing and i learned absolutely nothing it was also unpaid and i was required to be there 20 hours a week as well as doing my regular job where i make money and i was taking a summer class at the same time internships dont even give you real world experience at all and i even heard from someone in the company at the internship i just interviewed for that their position doesnt teach you anything either  if internships dont give you experience at all then what is the point im not going to go get coffee and write your company blog for 0 for a whole summer but you apparently have to just to get a job fuck that college is a scam and so are half the jobs out there id rather stay at the job i have now part time and get paid more money an hour than have to try to work 40hrs a week for next to nothing,d2wx0t
277,labor struggle sessions,next monday in our local bar were going to try a new program dubbed labor struggle sessions where we are inviting people to talk about their work and general conditions  the idea came about because theres two distinct social grouppings that develop around adulthood  1 standard friendships where work is mentioned mostly in passing  2 work relationships where most of socializing is centered around the subject of work or how the collage or boss is an asshole etc  so by taking some ideas from we are plan c c is for consciousness raising httpswwwweareplancorgblogcisforconsciousnessraising  were trying to mix this together to kind of get people to reflect on the conditions in a more critical and hopefully more productive way  now of course theres a standard set of questions that come up such as is there a union and is it doing anything and i think theres a lot of stuff to be uncovered in peoples conscious and unconscious coping activities  but if anybody of you has experience in doing things like this please share were welcoming all input and ideas and my biggest fear in the midlong term is that consciousness raising can simply end up being a hugbox rather than the basis of any meaningful organization  also will report in later if anybodys curious or would want to start their own version at home we in mainland eu,d3ofvl
278,One of my supervisors basically admitted to me that most of our work is pointless.,i work retail at a large department store my supervisor and i were making small talk about how little there is to do sometimes and he said that when that happens there is always something to do   i asked like what and he said sizing and folding tshirts and then we both laughed and i said you and i both know thats just bullshit busy work and he agreed   i dont know how im going to get through working thanksgiving and black friday this year guys all of this stuff we sell people dont even need god forbid you dont get a new pair of shoes for every single outfit you own sarcasm,d3i67j
279,should i call out tomorrow?,i work at an extremely highstress highvolume understaffed campus starbucks licensed store fulltime and make 10hr no tips no nothing i have been there parttime for two years and recently switched to fulltime i am not kidding when i say my suicidal ideation has reached its peak in the last month mostly due to exhaustion and being treated like a dog by management and customers i have done the math and can swing a day off financially and i feel that i need it  i am a hairsbreadth from a very public breakdown  but i cant shake this weird brainwashed sense of fear about calling out should i take the long weekend,d3k1lh
280,Doing errands during work hours,i started a new job a while back they have seemed wholly unprepared to train me and ive probably done 1 hour of work since i started despite asking for more  its been a few weeks now and today the only person in charge of me is out  im sick of sitting in my chair staring into space  so i just took my car to get a needed oil change when im on the clock im feeling guilty now and worried about being caught  but then again  all the executives never come in on friday anyway anybody else feel like this,d3u3m1
281,Incels are basically the proletariat in the sexual hierarchy,if we abolish work it only makes sense for us to abolish polygamy and give everyone state mandated girlfriends,d41oef
282,Is there an antiwork discord?,if not i was thinking about making one,d3zvs5
283,...how is it that you waste the best years of your life doing something else?, hes retired hes just turned sixty you know and on the actual day of his retirement it turned out he wasnt a radiologist at heart at all he didnt want to spend another day of his life on medicine hed always wanted to be a beekeeper and now bees are the only thing hell take an interest in how do these things happen do you think if youre really a beekeeper how is it that you waste the best years of your life doing something else  aleksandr solzhenitsyn cancer ward,d2jrdg
284,loser,if you dont work you are considered a loser if you live with ur parents you are considered a loser if you collect welfare you are considered a loser and no women would ever marry you  there is no point you are not free day in and day out you are living inside a cage inside ur buildings and jobs you stay in the same spot working for 40years till ur old enough to retired by the time ur old enough to retired life isnt enjoyable at that age anyway   im done parents are kicking me out i cant imagine working again there is no freedom only rich people are free rest of us are slaves serving the rich sleep work sleep work sleep work yeah im done ill go homeless and enjoy my last moment im in mid 30s now with no skills no accomplishment ignorant brain terrible health for my age ill just rot in a beach somewhere till i die it was cool being part of this community but at some point u gotta go see u in the next life,d3wrrv
285,Antischool,how many people here were or are antischool i remember feeling this sense of imprisonment at school but was too young to really explain it now i see school for what it was a way of getting people used to monotony and boredom and obeying authority and breaking you dont do you dont question the 40 hour week,d3p92h
286,Work Sets You Free,how many people do you think would agree with that statement without knowing its origin i imagine a lot  its no coincidence to me though that this phrase was the mantra presented at the entrance of nazi concentration camps while what we go through day to day are in no way on the same level as the horrors faced in those camps i think the connection is pretty evident  slaves toiling away for their masters in a desperate bid for survival all while arbeit macht frei hangs over their head   just like in our society where we are expected to dedicate our lives to labor and careers we live in a culture that clearly believes in that phrase with leaders and masters who would pretentiously spout it every time one of their slaves complain  i dont know what to completely make of it but its  always been ironic to me that this phrase was at the entrance of many concentration camps and it is one that many people would buy into its a sick allegory come to life,d1v7mj
287,I quit my job without anything lined up and I feel a crazy mixture of feelings,i put in my two weeks recently and this week is my last week the job i quit recently isnt the only job i have but it makes most of my income because my other jobs are on call im feeling relief because the job wasnt for me but also so scared ive been going to interviews for better jobs but been turned down and i respect their decisions jobs are very competitive im unsure of whats gonna happen but maybe i can take a short break before working again,d1xv4b
288,Eye-opening experience at work today: some suffer in silence.,i quit my job recently im on my resignation notice period today i said my farewell to a very kindpolite woman i never directly worked with in my division all i knew was that she seemed cool and something told me she was suffering there too the expressions on her face when id run into her occasionally led me to suspect that  everyone i said my goodbyes to before her pretty much had the same robotic reaction everyone in this office acts like cultrobots except for her   but boy was i surprised today this woman suggested i have a seat and closed the door i was very curious as to why she specifically closed the door she asked me why i quit  i told her hate the field making a career shift nothing lined up but ill figure it out she goes im leaving soon too  same situation nothing lined up next thing you know were having a fullblown conversation about soulcrushing office jobs and how nearly all jobs are boring as fuck these days she was very open and honest and even shared that the job has been taking a toll on her mental health   she said she doubts shell find a job she truly likes but wants something at least a little better than her current role she complained about micromanagement and pointless inefficient processes i agreed we were so in sync honestly i was astonished by this exchange  we both congratulated each other for building up the courage to get the hell out of there and move on she was so genuine she didnt judge me for taking an intentional employment gap to recoup at all i didnt judge her either of course   she said the discussion was extremely comforting and reassuring for her i said the same as simple of an interaction this was with a woman i barely know it felt amazing finally i see some humanity in the office   this taught me that though we are a scarce breed the few of us who are against workism suffer in silence its a very comforting reminder to break that silence with a coworker every now and again for me it was literally a beautiful moment every damn day i thought i was the only one there going crazy she said she felt the same way  that is all,d1y7fk
289,daily grind,so this is what life is wake up five days a week and go to work its like every day is groundhog day except the weekend this shit sucks,d27uah
290,"There was someone that posted here two weeks ago. The title was, how are you guys supporting yourself. That person recently deleted their account.",i didnt know where else to post this so since i found that person on this sub id figured it would be appropriate to post here anyways i was following this person seeing what they were posting and commenting on that person had it rough they talked about going downstairs at night to eat to avoid the parents and the dad would say mean things if they didnt go down at night i wish i could remember the name of the account they had it rough and was in a bad spot mentally and physically   whoever you are and for whatever reason you deleted your account i hope you see this i think of you and you mattered to me,d4r55j
291,I just applied for Dish,i just applied for dish and the assessment was really hardcore like it dug to get personal stuff yet it was only one answer or the other so either way it would make you seem bad out of context a few that stuck out to me were i make new friends all the time or whenever something good happens i wonder what will go wrong like that kind of stuff bothers me regularly let alone for a job application then they ask me to define words such as anxious i know its all psychological but its ridiculous the kind of stuff they go to lengths to ask you,d4tc9l
292,Why do people have to pay for uniforms?,why would we pay money that we had to work for just so we can keep working  if wearing uniforms is compulsory why should people have to pay for it why are workers paying for it and not the companies  i mean you literally work to be able to pay to keep working  and people are okay with this,d4jh0c
293,anti-work songs?,i have a few no surprises  radiohead imo by far the best slave to the wage  placebo every day is exactly the same  nin  giv more pls,d4j6zq
