,title,body,id
393,"A Positive, Uplifting Story About My Antiwork Hero Housemate",i thought id share a positive uplifting story about a guy i used to live with  the guy works in an amazon warehouse he was a quiet romanian lad who played computer games and liked smoking weed nice guy who enjoyed making music  one day he comes back home knocks on my door and enters my room to see me playing on my ps4 so he asks me what games i want to play next i told him that i am looking to buy the new assassins creed  he comes back the next day with a copy of assassins creed and gives it to me i ask him where he got it from and he tells me not to worry i then offer him money and he refuses it i dont ask anymore questions and put the game on   he knocks on my door again a few days later and asks me if he can test a game on my ps4 i say fine and he continues to test random games on my ps4 for about a week   ive realised that he is obviously stealing games from work and ask him wtf is going on   he says he is stealing because if they wont give me a payrise ill just give myself one he then shows me the ten ps4 games in his backpack that he had stole from work that day he was selling them online i think   the guy was an absolute hero a gentleman and a scholar,cyfvm6
394,About to lose a job offer because previous employers aren’t responding to reference requests...,im not even trying to gain personal references here all they need are standard references to confirm what ive been doing for the past three years after dropping out of uni all ive done is shortterm work so trying to gain references from the university itself along with the employers i had afterwards is proving to be very difficult   its honestly ridiculous and the first time ive been asked to do this usually they just want one academicemployment reference and a personal one   i requested a proof of student status from the university which was meant to arrive via email within 5 working days its been well over a week now ive now requested it via post   i called hr for one of retailers i worked for three different stores over the past 3 years but was unable to request a generic reference for 2 out of the 3 times due to not knowing the previous employee numbers  previous boss for another employer no longer works at the company anymore and ive been unsuccessful in contacting hr to gain a reference   the only reference ive been able to gain so far is for another retailer that has an automated online system which generates a generic reference once you provide your name and national insurance number didnt even need an employee number   i dont even think i want this fucking job anymore its for a stupid lowpaying apprenticeship which probably isnt even worth all this stress i rejected an offer for a higher paying retail job for this i wouldve been working there for the past two weeks had i accepted and i really need the money  i thought the apprenticeship would be a good opportunity to do some academic work again whilst earning money and would look great on my personal statement when i go back to university in the future its in business administration which sounds about as stimulating as watching paint dryplus i hate office work and how stagnant it can feelbut it involves liaising with hospital workers occupational therapists and nurses which i guess loosely relates to my future plans to work in healthcare   im broke af and have debts to pay so i applied for a couple retailers last week two i previously worked for and have have managed to secure an interview for both again both of which pay much more than the apprenticeship   i know the apprenticeship is a decent opportunity but fuck im tired of struggling i need money for an adhd assessment after which id like to have driving lessons again pay off my debts raise my first year tuition fee for uni save for a future holiday etc im kinda tired of retail but the department stores ive applied for do pay more and id have the option to do overtime to make more money in a shorter amount of time   they ideally want me to start the apprenticeship on 16th but i highly doubt im gonna gain any more references than what i have right now they wont take me on unless they gain all my employment history from the past three years so looks like that offers down the drain  sorry for the rant guys just needed to blow some steam,d1a9k7
395,Thursday is the best day of the week,just one day left i can do this friday is ok but two days rest are not enough there is no way to enjoy a glass that is half full when its 57ths 71 empy from the start spend saturday and especially sunday sitting around depressed with the occasional escape fantasy monday through wednesday just infernal internal screaming repeat,d1c8ze
396,Stupid manager,ive talked about my manager to my parents and they say shes a bad manager she criticises me but it seems more like an attack on me personally a month ago i had to tell her 4 times that i was going on holiday before she changed my shifts cause she kept forgetting she puts me on at night on my own to close up the shop and its my first job and ive been there a month im worried that some man could attack or rape me cause im a young woman and id be alone and vulnerable also i could fall and become unconscious and no one would be able to help because they wouldnt know and customers wouldnt be able to get into the store to help cause theres a lock on the door and im worried about someone robbing the place or trying to get in when were closed because customers have got into the shop twice when weve been closed im not allowed a friend or family member in the store to keep me company and help me feel safe cause they have rules against it she could easily put me on during the day or on days when theres two people on but she gives the shit shifts to the new trainees shes also got my coworkers to soy on me which i think creates a very bad environment and i know i cant trust them i only like two of the people i work with and one of them is leaving soon  then today my manager was telling me to pack out the fridge and she gave me the heavy stuff to do when i told her a few weeks ago i find it difficult to lift ive been at work 3 nights in a row and today i had an 8 hour shift on my feet nearly the whole time she asked what my plans for the weekend are and i was thinking you actual bitch you took up my weekend with work im too exhausted to even do anything on sunday and my whole saturday was taken up by work i really hate my manager and i cant wait to get another job,d13axz
397,I really chuckle when I see crappy ex-employers getting publicly dragged on Glassdoor,like you know it was a shit place to work but when you see dozens of similar reviews from other employees and exemployees all saying the same thing as you you feel kinda validated  i like to hope its making it harder for that employer to hire people lol,d0z00x
398,[RANT/PSA] A message to managers...,i know you have goals and our performance determines your reputation in the eyes of your bosscorporate   that doesnt mean you have to be on their side  if you scratch our back we will scratch yours its really that simple were both stuck here working our miserable insignificant lives away so that we can afford to live why not make it easier for the both of us  i was manager for a small computer repair business for about 3 years i treated my employees like one of the guys and they did the same for me i got their back when they made a mistake they get mine when i have performance goals for them it was simple easy and we understood that we are all human and all want to go home i just dont understand manager culture,d0mw9u
399,Oh fuuuuuuuuck where are the 1.5m?,honey tell me whats wrong      by workers and  produce 3000000 worth of goods every year the materials and utilities cost 800000 the tools cost 200000 and all of us combined get paid 500000 which means that theres 1500000 being paid to someone who didnt contribute to the work at all    ,d01emy
400,"Got a job at a place I thought I'd love, but nothing changed.",im 22m and havent gone to college yet so ive been working minimum wage jobs on and off always parttime because i know fulltime makes me burnout and fall into a depressive hole   i recently got hired on at a local familyowned adultsmoke shop we sell bongs pipes smokes dildos all that fun stuff   i thought this job would be great for me because i love the store and it would be more bareable knowing that im not helping a ceo make millions  its only been two weeks and i already hate it im still getting that dreadful feeling the night before i have a shift my social anxiety keeps me from having fun with coworkers on top of all that were having huge money issues and the little i do make has to all go towards bills i have no spending money for myself and its bringing me down hardcore   if this job that i thought id love is still shit whos to say the job i get after college wont be shit too i dont think it ever gets better,d0kkxm
401,"Working is turning me into someone I hate, and I don’t know what to do anymore.",i used to be a very kind and empathetic person and now im so bitter and feel myself becoming misanthropic im only 24 i have cptsd as well as adhd and navigating the work world with that in top of no college education is a nightmare    i work a lot of customer service and food service jobs right now im a barista the sad part is that i work for a small business that makes good money but the owner is constantly fucking us over no health insurance minimum wage and he actually got into trouble for paying people under the legal minimum wage     i just cant do it like i dont want my life being like this,czcsqr
402,Correct answer to this interview questionV,i interviewed at some agency and one of the questions they asked me was if you were asked to do something outside your job description how would you go about it in my head of course im saying well fuck off cause im not getting paid enough for what im actually assigned anyways instead i say well if its something small then i guess i just do it but if it is something major we will have to talk about it i wonder if they wanted a total slave answer,czs88j
403,"The Age of Technology, All Manner of ""Useless"" Work",i was listening to alan watts yesterday at work and i had this idea  just like the matrix we have been reduced to a battery through tecchnology  what if we are not using machines but machines are using us  what if we are just the means to the end for technology to surpass us and become autonomous and conscious in itself we are literally the tools and the servants of machines  we are helping them grow and we are feeding them with our time until the point where they are inescapable and occupy our entire lives  we are in a symbiosis with machines in this age  we create these abstractions and they become more and more abstract as technology grows  right now machines need us i guess equally as we need them  machines like advertisements for example both create a need possibly needless that we didnt know we had and fulfill that need  we need but dont really need facebook or reddit for example  time labor energy is used for so many things that we could otherwise live peacefully and simply without we are literally giving our lives away to machines  what about universal basic income barely any internet except what is needed google maps books answers to questions what we already have no more bullshit really needed and sitting home all day enjoying our time a trimming of the fat of technology getting rid of all useless advertisements etc things not really needed  i need to think about this more its a difficult concept to grasp these are just a few quick thoughts on the subject,d028no
404,"The ""gig economy"" does not treat people like human beings",the gig economy is working exactly feismimshsio 0 ofs10 of  os angeles  ober cofounder busy  recordbreaking of the ober drivers forced to mansion for 72am as sleep in parking lots to drivers fight for wages make a decent living  ke in the for    ,d04nli
405,Capitalism in a nutshell,the gig economy is working exactly feismimshsio 0 ofs10 of  os angeles  ober cofounder busy  recordbreaking of the ober drivers forced to mansion for 72am as sleep in parking lots to drivers fight for wages make a decent living  ke in the for    ,d0b7pz
406,Does it annoy the crap out of anyone else when employees/bosses brag about how few days off they take?,my job is open 6 days a week and i heard my boss bragging about only having taken 1 sick day in 30 years what kind of life is that it shouldnt be considered a virtue or standard of how good a worker you are,czjbi8
407,I'm so sick of companies running my life and breaking me down,im so tired of the way this system works my boss gets to talk down to me and break me down every day my boss gets to tell me when i am allowed to come and go gets to tell me when im allowed to have a personality gets to tell me when im allowed to live and how well im able to do it   the answer is find a better job do you know how long it took me to find this one do you know how much i suffered and sacrificed just to be stuck in this shithole   its not fair its not right there should be laws against this shit but thats communism right thats the evil my grandfather fought in vietnam isnt it kinda funny how instead of letting the government tell us what to do we willingly let companies do it to us all the while waving the star spangled banner and shouting freedom  be grateful no one deserves a job you have to earn it  youre lucky you even have a job you spoiled shit  america was built on hard work and sacrifice do your damn part  if you cant handle the hardships of jobs that makes you a lazy loser  i just want to earn enough to survive and have fun once in a fucking while why do i need to give 100 of myself when i dont need that much oh because the culture in this fucked up place says i have to do my 40 stay late and show up early eat the shit my boss gives me with a smile and the whole time somehow tell myself its a good thing  accept your lot and work or die so no one has to pick up your slack im feeling the latter is a better option at this point,d0hv3h
408,"The Dread of the ""Work Day""",is my third favorite dread behind existential and judge,d19ngx
409,I'm so fucking jealous of the people who get to decide to just fuck off and do what I'm desperate to do,i know we all kind of resent people who a could be retired or have enough wealth to live on and still waste their time withering away behind a desk or b dont have the money to do that but bootlick like they think they do i feel thats pretty reasonable to feel angry or at least annoyed by however i carry the burden of resentment for another group of people who definitely dont deserve it and theres a number of them in this sub  i am so so jealous of people who are able to scrape by on minimum work or lowpaying work they really love im so jealous of people who decide fuck it and move to another country or another city with no plans i am so so fucking jealous  my boyfriend is chronically ill and relies on my health insurance we have 5 pets that i could never consider giving up animals are probably my greatest passion in life and i wish i could be working with them every day instead of doing data engineering to figure out what kind of products our players we make games buy the most while all those surveys of them telling us what they want are ignored i know exactly what i would do if we had a windfall large enough buy a ranch in montana join a farm collectiveland trust and rescue animals from abuse and factory farms i would give fucking anything to do that hell theres a ton of things i would be happy doing id live in a fucking rv i dont care but im not even able to work from home without easing into it over the course of a year or so   i make great money i support a 2 person 5 pet household as the sole income earner at 24 years old in a very high cost of living city we have a good life my workplace is as ideal as it could be and yet at least once a month i break down in tears and make my boyfriend promise on his life that i wont have to do this forever  so to the people who risked it all who have the freedom to say youre heading out into the world and see what happens i hate you and im proud of you live your best life for both of us because as much as i hate working in this soul sucking job that even has interesting work to do good people great benefits good pay etc really the perfect job on paper for the most part i would hate to see my boyfriend sick or give away our pets more   and to the people who have the ability but choose to wither away at a desk or grind to the bone when they could be living their life on their terms is it your work ethic that will hold your hand as you pass away will your passion for the grind hold you when you find out you have cancer no if youre going to throw away such a fantastic opportunity at least let me pick it up   the hellish part is i know someone a friends boyfriend whose family is legitimately rich like be private islandprivate jet rich you know what he does works retail part time plays video games all day and doesnt even fucking pick up after himself while his girlfriend works full time you piece of shit you could change my whole entire life the lives of so many people what the fuck is wrong with you how do you sleep at night   we leave for a vacation tomorrow 2 weeks at a national park 4 days completely off the grid im of course so excited but im so scared im afraid i wont be able to come back im afraid well return ill sit down at my desk and realize i cant do this anymore all this stress all that school all the crying and anxiety that i wouldnt get a good job only to realize this wont make me happy anyway i put my expiration date at about 5 years before i completely lose my shit 5 more years and i have to stop maybe well get some universal healthcare dare to dream so we dont need to worry about my boyfriends illness but im not counting on it   i hate feeling like a coward when i sit down to work each day i hate feeling like im wasting my time and being an idiot its not my fault the man i love was born with a defect its not his fault but were both punished all the same and im shackled to this desk i fucking hate it im so angry all the time i cry a lot i lash out my days slip by so fast and im so so tired all the time i hate sprint planning i hate being the only woman in a room full of men i hate work being the only place i can make friends i hate happy hour i hate bars i hate being inside i hate sitting my body is decaying from the inside out i used to be an athlete what the fuck happened i hate this i hate it so much  sorry i really need to vent and i dont really have anywhere to turn other than my boyfriend who has heard it all i could go on and on i think i just need a hug,czc6qa
410,Employment processes are fucked,you know employment processes are fucked when the only way to get a job is if you have a close family member or friend working at that company worst part about it is the companies that are considered good only look at applicants who are referred might as well sign me up for disability and welfare if this is how you move up in the world,czb2js
411,Why people don't complain about work,   ba      p about spendingallof their time and energy of work ,czdg7q
412,2meirl4meirl,he during my current phase he during my where im 1000x  em phase  more sad but dress normal for work          ,czo7m0
413,I am not who my parents want me to be.,my parents want me to be like everyone else they want to spend most of my time at work they want to me to get married and have kids and i have no interest in all those things i work just enough to take care of my immediate needs sometimes i go weeks without going to work and i love every minute of it but this disappoints them i think im a disappointment to them because money doesnt motivate me and im not like everyone else who they constantly compare me to   they dont seem to realise that i have my own dreamshttpssoundcloudcomremedy97outsider and my own path to walk which isnt predetermined i make it as im walking  im the most antiwork person i know and its challenging to be that but its worth it if you can live your life according to how you envision it,cz4bgv
414,How are your finances?,i am only really working this job so i can have health insurance but if i end up needing anything major done i am pretty much fucked anyway and i dont particularly care if i drop dead tommorow so kinda hard to save money or say fuck it ill put it on the card i know that it will keep me working forever but i really dont have much intention of sticking around to pay it off anyone else just slowly circling the drain to complete brokeness i probably have 2000 in the bank and 3000 in debt  obviously thats a doable thing i just dont care if im forced to live this way my home life is going to be comfortable,cz3ybo
415,Going back to school to avoid wage slaving,i am actually considering enrolling in a research masters degree its free in my country just so that i dont have to work these terrible jobs   should i do it i have no passion in the field but atleast ill be less of a slave but the downside is that i will be doing some work with no money in return,cyfk5t
416,17 help before it’s too late,soooo ive had chronic depression for as long as i rememberi have a therapist and it doesnt help that in two yearsentering junior year11th grade very soon i will be leaving the comfort of free expenses and into the reality of debts minimum wage and shitty workplace conditionshonestly i think if i have to take place in that 95 system theres a good 90 chance i will kill myself my true aspirations and the things that keep me going is exercise and sports music and spreading knowledge and happiness to all those that i cananother reason i enjoy musicnot to sound like a weird flex but damn near all my teachers say  he is probably the smartest kid if he actually tried ie lazy and talks a lot in class but somehow gets ridiculously high test grades and thats about the only reason ive made it this far i am full and willing to completely dedicate myself to something i enjoy doing and school is just not one of them but its practically the only safe route its got my anxiety and depression up and im scared for after high school any tips on where i should start from today,cz19hz
417,The fuck is up with all these questions on a PART TIME job application?,i recently quit my full time job that i hated to go to college full time and have been looking for a part time job almost everyday for the last month currently filling out an application to work at a convincedrug store and i have answered the same 5 questions more than 3 times each literally and now they want to know the address of where my highest education received was at and all my previous jobs which all of these are answered on my resume that i uploaded at the very beginning of the application now im finally about to finish the damn thing and now i have to have a mandatory phone number and name of a previous supervisor does this shit sound absolutely insane to anyone else not to mention the job is calling for 1020 hours a week,czccmm
418,R&amp;D paranoia, i work in tech rampd yesterday was the first day at a new project as my old one was over two coworkers have warned me about the bullshit factor in this one the first meeting was awkward as fuck the project is a 3 year one and our job tech wise is to integrate the work of our partners and generally to manage them the project is running for 6 months now and the first review is coming       so the project manager want us to do a demo for the review he also said that our demo has to be the best because we are the coordinator and continued probably the director himself will do the demo so it has to be good since i was the new guy i raised my arm and i asked since we are the integrators we have to wait for our partners to finish and it is too soon also our work and demo is gonna be combining the work of our partners so how exactly can we differentiate from them  actually if we did a demo it is like completing 50 of the project and its the fucking first 6 months out of  3 years   ampx200b  so the project manager had the brilliant idea to not wait for the actual project components from the partners but ask from them some previous iterations of their work that are suboptimal for our project and initial design in order to integrate them and make a demo and for some components that there are no previous iterations we would just go and buy off the shelf components that are similar and integrate them so we are gonna make something that is not even close to the goals of the project just to showcase something  this is literally a whole new project which has to be done in 2 months of course its gonna be a sloppy prototype that just has to survive the demo but i see no point at all at any of this   managers are terrorizing everyone here about the reviews but my experience from the reviews is totally different if you talk sense to the reviewers they are cool in my second review i was told off for revealing some vulnerabilities of my designs every design has them however the reviewers were happy to discuss them and that didnt even hurt our rating why so much bullshiting isnt everyone sick of themselves,czi2bi
419,Having an extra rough day having to work today? Let's motivate eachother today.,we probably all want to die a little inside from working but i hope you have a decent or quick day today amp actually enjoy your time off,cz90lh
