,title,body,id
155,Sometimes I just want to leave it all behind,i live with my parents in slovenia but sometimes  everyday  i dream about leaving my current lifestyle and living more simply  like selling all my stuff and moving to russia's far east or something  i know i'd be hard  i might not survive and stuff  but i would be a 'free man'  i just want my soul to rest  this is all too much     amp x200b   i know i'll do something eventually  i know i will 'find my place'  because there is no other way  nothing else is sustainable  live free or die  i just want to be free again  i haven't felt that feeling of being totally free in like 10 years and im only 21     amp x200b   i just feel i have grown so weak from society  i could almost not survive without it  our old survival skills are being forgotten  everything you own comes with its own bill  nothings free  our modern commodities have made us comfortable  lazy and weak  imprisoned people  i want to once more become strong  independent and free  it's hard to even do this in certain places  you are surrounded by all sides from your parents  friends  government and society in general  cornered and forced to submit and suffer    amp x200b   what happened to the old way of life  why did the people all move to the cities  its horrible there  i guess once you've been there awhile you dont even remember the feeling how it feels to be free  how to breath fresh air  how to feel blessed for just being alive    amp x200b   im done with this  just picking my choices now  planning my escape  which route will i go  will i stay in my country but live in a small house  could i even do it without the government cracking me down about not having xy service and paying a bill  or will i move to russia's far east and drink vodka with the babushkas  will i just go live in the woods somewhere and not make fires so i wont be found  like i dreamed to as a kid  will i leave my family  my heritage behind  will i be missed  will they be pissed  will they remember me ,bqknjl
156,One of my major life goals is just to work less.,this is the first time in months i've had two consecutive weekends off  and have only worked 40ish hours per week   i can feel myself slowly adjusting to it  i'm slowing down  taking my time to smell the roses a bit  engaging in my hobbies more  thinking about big picture stuff   this isn't possible when you're working 50  hours a week  it's just not  now maybe there is diminishing returns there  maybe after 6 months of working only forty hours a week  maybe i would cease to enjoy these weekends and start to be more concerned with my bank account   and certainly i wanna do some work  even if it is a job i dislike  there is some value for me in being forced to leave the house to meet obligations  to accomplishing tasks etc    but any more i think  i wanna minimize my expenses and maximize my pay so that i can get by working 30-40 hours a week  one of the major ways i'm going to do that is having a vascetomy  it's a decision i've been thinking about for years  and i finally had the consultation and scheduled the operation   and i feel great about it for a lot of reasons  but one of the big ones is that raising a kid costs 200k and i don't wanna have to dedicate 10k hours of work to that   think about that  at 20 hr  that's 10k hours that i no longer have to work  i'm investing  800 to save potentially  200k  i can't believe anyone would go to their job and think  'boy i'd really to spend more time here  how can i make that happen '   not me  friend-o  not me ,bqggnt
157,How to Drop Out - A guide that really helped me guide my life with an antiwork attitude,please read this    http ranprieur com essays dropout html htdo http ranprieur com essays dropout html htdo    i've always resented work  absolutely loathed it  daily i call myself a wage slave and a fool  i spend 100  of my life doing things i don't want to do  for now    but this article helped me to navigate a bit  i chose not to drop out  but to find a cheap house and aim for an early retirement    may it serve you as well as it has served me  in the age before r antiwork,bqb23p
158,I hate the bullshit culture of hardworking in low paying jobs.,if you pay peanuts  expect monkeys  fuck all the  come early  back late  culture without any compensation  and what's worst is the workers themselves look down on people that are  punctual  if employers want workers to come early  please pay extra  back late  also please pay extra ,br5csl
159,Anxiety is GONE when i don't have heavy shift work,i got fired from a shitty gas station job a while ago  they fired the whole store  someone was stealing idk  something like that  i don't really care  i still have a night time janitorial gig i do that i love  cuz i'm alone and its quiet  no other people at all  that's enough to pay all my bills other than rent  for rent ive gotten pretty thrifty lol    amp x200b   anyways barely working has had incredible effects on my mental state  i feel so good every day  so calm  no worrying no anxiety etc  it's incredible  i'm looking hard right now for another night janitor type job or working from home in any capacity    amp x200b   what are some ways i can make money from home  does anyone transcribe  selling on amazon ebay  mturk  give me some ideas  id rather max out a credit card before being a wageslave again ,bpl45r
160,Company manipulates us to think holidays are just inconveniences.,memorial day is coming up and you know what that means  monday off  right  well  not for our company   i was hired under the promise of 3 5-day weeks  3x12hr   1x4hr  we have been working 'voluntary' overtime  56hrs per week  since christmas   every time there is a holiday  the company just shifts our weeks forward by a day  so  instead of mon-thur  because of memorial day we will now work tue-fri  effectively counteracting the point of the holiday and making the following weekend one day shorter   i even heard a coworker say that they wish memorial day  and all other holidays  didn't have to be there just to fuck up our schedule  what a terrible culture we have  to have encouraged this kind of thought   no  my friend  we must hate the company,bquyca
161,Looking For a Job Between Semesters Starterpack (my favorite time of the year),looking for a mob between semesters starterpack  judgmental father  x 10000       now's the job hunt going   remained you some job listing    enthusiastic  dedicated  team  family   thank you for applying with   gradually become radicalized against the idea of work and society altogether      ,brboy3
162,This is my supervisor. About 2 weeks ago I quit my manager asked me to stay on and work 6 hours a week on small tasks. Guess who has two thumbs and already worked 6 hours this week? This guy!,hi jacob can you cover today please  am just by myself  is 2        ice o     ,bn3gu1
163,My desk phone likes to remind me where I could be if I wasn't at work 🙄,  polycom     voice ,bmyhm0
164,"All work, all work",union dues cost around  700 a year          think vous bias and of s your money  don't you ,bmpvoq
165,Such a long week!,it's thursday  or as   like to call it   may 4 of the later-ye-le -m-aet-a slam ,bmzgm2
166,"So, I’ve decided that, if I’m going to be broke, I’m doing something I hate less",i ve joined r freelancewriters and i m brainstorming ideas to build my portfolio and figuring out how to build a website  maybe in a few months or a year i can tell these capitalist pigs to kiss my butt  i made a promise to myself when my sent me my 2yr anniversary thing that i would not get a 4yr certificate  i plan to find a way to keep that promise to myself ,bmc6lo
167,"Ever just drive home from work, stay in the car, and just sit there?",or cry  or scream  depends on the day  just gonna keep doing this til i die  i guess,bmcvqr
168,Reasons for off days,i dislike the norm on my workplace that you need to be doing something of importance to get a day off  some event or plans that you couldn't attend to if you were at work  if someone has no relatives or friends it's as if they're not allowed to take days off  what you do on your day off should not be of importance to the employer  at all ,bmh3nc
169,We're all going to die one day.,i think a lot of people either forget or try to ignore the fact that they are going to die one day  this becomes more evident when it comes to having a job  or when someone brings up the idea of how fucked up it is that generally you have to do something you dislike for most of your life  so you can keep living  which is mostly doing something you dislike  most people have been so conditioned to the idea that you have to  work hard  to earn the right to live  which is ridiculous  we're all going to die one day so why do we  as a society  make the time we spend alive unnecessarily unenjoyable  we have the resources to take care of all of our basic needs without too much strain and yet  people frown at the idea of universal basic income  it's so sad that most people have been conditioned to love their slavery so much so that when they come across someone who doesn't want to be a slave they call them lazy and a leech  but why  we're all going to die  what's the point of spending our time alive chasing money  which is really only paper we choose to give value collectively  i honestly would rather die than live my life this way  because what would be the point    amp x200b   everyday i remind myself that i'm going to die one day  and when i face this fact  it becomes hard for me to waste my time doing something i hate for money  which has no ability to make me truly happy  in a better society  from a young age children will be given the space to explore their talents and what they're passionate about so that when they grow up  that will be their vocation  one person who seemed to really understand this idea was  alan watts https youtu be vcfb4jsgtmw  and he inspired me to spend my time doing  what i enjoy https soundcloud com remedy97 van-gogh  instead of chasing paper ,bno8i1
170,First day at work.,fuck you guys are damn right about everything  here some people are doing their jobs since last 25 years  i wish i don't live that long enough to work   just one question how can someone spend 20-25years doing what they hate  ,bo0ww6
171,Join me if ya like,fairbanks ak  going through a lot of hurt  i lost my baby boy  tula  may not be human  but he was a giant part of my life   been subscribed to r antiwork for quite a while  it used to help me feel not alone despite the majority of everyone here being somewhere on the opposite end of the political spectrum   i've always held to the belief that the giant sociological clash between the two prevalent political parties is a massive waste of time  and frankly pathetic  we as a species are not as intelligent  and heroic as we make ourselves out to be  tired of living in a world admired by the artists that crafted this falsehood of freedom  i hate that i couldn't save my baby boy  and that it's my fault   i'm going out to the wilderness  this is the only place i've ever lived where despite the bleakness it's actually possible  i can't be around this worldwide dominant civilization that has flexed itself into the absurd borderline worship of the false value that is currency   it's a controlling mechanism that is unfortunately required  because honestly the mentality widely required for utopia is blatantly vacant in our social strictures  we're not responsible enough  and this irresponsibility  as well as misplaced value in authority protocol has harmed me for the last time   i want to bite back  and i see now that the only feasible way to do this is to create your own path rather than explore the  freedoms  laid out to the  united  people ,bmugrs
172,Today my manager chewed us out for having the audacity to ask for tampons in our bathroom.,my coworker brought it up today because she has been having customers ask her for one and giving them from her personal supply  plus most of us are women  including the manager  so it makes sense  manager chewed us out for that   saying  oh  so now you want the company to pay for your personal supply of tampons then  huh  like  how dare we have bodily functions  we're all rolling around in piles of our luxurious feminine products laughing at how we scammed the company    side note  the highest paid employee here makes  13 an hour - and that's after a  1 raise that was only implemented last week ,bmu705
173,I need to rant but it’s 5am and everyone I know is asleep.,what the fuck is wrong with everyone  why the fuck is everyone okay with this system that s rendered our lives totally meaningless  is everyone secretly suicidal   i d literally rather kill myself than work 40 hours a week and with my shitty minimum-wage career prospects just 40 hours isn t even close to enough to support myself  i won t kill myself  though  i m afraid of dying so i m just gonna live in a forest or do some  r vagabond shit    i just don t understand how people can see how much of their life is being stolen by capitalism and be completely complaisant or even give it their enthusiastic approval  eight hours a day  five days a week  forever  it s so bleak  math has never been so depressing   i m overwhelmed by the absolute hopelessness these numbers give me ,bmhigk
174,"By being forced to work more to receive health coverage, workers have the amazing opportunity to ""earn extra money for such things as school tuition""! 👏",senator odd young 19 his -   any hemp in indiana faced reduced hours and earning ability as a result of obamacare s 30-hour threshold    just introduced a partisan bill   ensure that hoosier can support their families and  e  oung senate gov senators introduce partisan will to restore 40-your workweek   u s  senator odd young of indiana  is 2 270 comments  shares    ,bptet4
175,Letter to my coworkers,to my coworkers and management   work is making my life miserable  you don't have to make it even worse   i don't give a damn about productivity  i don't care how many phones i test and or repair in an hour  i dread the working day and i just want to go home or throw myself out of the window  i'm about to snap at any second   i hate being at the office early even if there's nothing to do for an entire hour  and then you put the blame on me if i  slack off  and i don't get on  doing something useful  fuck off  will you  this is not my house  i don't care about this place  i don't care about profits  i don't care that the  machine  works  i work tirelessly to do everything in half  i  work like a cat  in that i will undoubtedly take longer breaks  poop on company time and  play  as much as i can with clocking in and out  for example  only doing it after i begin to microwave food  prepare my lunch  and never going to the bathroom when i'm clocked out  i only work at a good pace if i have my zionist boss watching me as a prison guard watches over his her inmates  and even then i mostly simulate doing anything or lie about my productivity rates   there are weeks where there's no work at all  and others where we can't keep on  flexibility  you call it  adaptation  we have to learn to  do other things  so when there's nothing to do we can just sweep the floor  organize our desks a thousand times  and take on others' jobs  or we just have to become automata  seeking only to produce more and more to the point of exhaustion   but why  have you ever wondered about the why of it all  ignorance truly is bliss  that's the lesson i'm getting  you are working hard  putting the blame on others  and complying to every order  and even so  guess what  all of that is meaningless and only serves the purpose of making a disgusting man richer than he is  the planet more polluted  people becoming more stressed out  that's your daily life  fellow workers  i don't get how you can live with that  orwellian doublethink  like when one of you tries to teach me ways to be more productive  i just want him to fuck off and ask him  are you seriously trying to make me work even harder for nothing but a shitty pay  in this anxiety-filled environment  for a man that supports an apartheid state  but you wouldn't compute that  you just go on with your lives  like nothing's going on  gym this  party that  holidays  netflix and bs  i envy you  i really do  i also consume media and have hobbies  but damned be me if i ever alienate myself like that  they say people are anxious  but what i constantly see is people that can miraculously detach themselves from any kind of structural-level of questioning  focus on the individual level and be filled with energy and motivation  hell  some of you are even friendly to the boss  zen buddhists to the core   what strikes me the most about doublethink is that you  management  while being a worker like the rest of us  still comply to every order and have no problem kicking your coworkers' asses around and treating them badly to be in good terms with the boss  bootlicker pragmatism  you should encourage us to live  slack off  but instead  you are totally fine being the front face of exploitation and anxiety  i get it  the boss is a piece of shit that can fire you at any moment  you were just following orders and getting paid  right  how can you be happy with that   oh  and this is the best part  bosses and management are like bff  referring to themselves as  we  and to the rest of us as  them  there's also a subtle condescending attitude  where they  jokingly  call us ableist terms  or things like  dogs   human trash   bags of shit  homophobic and racist comments passing by like  jokes  hatred toward muslim and black people  i can't stand it  even more knowing that the boss is a zionist  you  my coworkers  go on with that  congratulations  however  this is better than thinking you are friends with your boss  at least i notice the distance   indifference  ignorance  lack of critical thinking  ableism  racism  shitty attitudes  heck  i constantly get to receive  advice  and rebukes from a coworker  in a condescending manner  of course  because people love those 5 minutes of power to vent off  doing the same task as i am because  i'm not doing it right  hell no i'm not  i'm trying to sabotage as much as i can while not putting my survival at risk  can't you notice  i skip testing stuff or i do it without paying attention  i steal supplies  accessories  i slack off  i browse reddit  the news  i try to recover the time and energy this asshole is stealing from me  and i try to cheat society as much as i know how  the same society that would let you rot in the streets  you idiots  i don't owe anyone of you anything  but i still am not a piece of shit and i understand the stresses of work  i never complain about your work and i treat you with patience and respect  why can't you do the same  your lack of solidarity amazes me  you are quick to throw others under a bus whenever the opportunity arises  most of you are quicker even trying to shift the blame to others if it's not clear who fucked up in something  egoists to the brink  still  i respect you  i'm the stupid here  i should just become an apathetic narcissist and focus on my own life  that seems to be the key to happiness in this wrecked world    ----  this is going to be my letter of resigning to my coworkers when i'm done with the bullshit ,bq2xot
176,Do any of you have a job that's bearable?,i've worked in most of the main industries and each one was its own hell in both the same and very different ways  but mostly just the whole day being wasted  do any of you do anything that doesn't feel tedious and mind numbing that you actually want to put effort into ,bo4i2f
177,Bagels aren’t very nutritious.,by boss arrived at work in a brand-new lamborghini    said   now  that s an amazing car   he replied       of you work hard  put all your hours in  and strive for excellence  i'll get another one next year  ,bo61zj
178,My boss is offering me overtime like it’s a present, we know we re giving you a ton of work but you can clock in those overtime hours to catch up   so you d like for me to do more than 8 hours of soul draining work in my day  as if i had nothing else to do with my life after work than hmm idk  tend to my personal life ,bopve2
179,Interesting fact about the minimum wage since 1970,a few weeks back i created a bit of controversy by suggesting the minimum wage should be set at  45 not  7 25 as it is now  or even  15 as some union activists are demanding  a few folks thought this idea was outrageous  so i have been doing some more research and guess what i discovered  basically  that is what took place in the stock market    my suggestion was that the minimum wage needed to go up by 35 times from  1 45 to make up for the depreciation of the dollar since 1970  guess whose price actually did go up -- an astonishing by 34 times since 1970     the dow jones industrial average    amp x200b    change in the price of the dow jones industrial average since 1970  source  macrotrends https i redd it vgsqrtmyzsy21 png   that's right  although people think it is absurd to suggest the minimum wage should rise to reflect the loss of purchasing power of the dollar  almost no one seems to notice that the djia has risen almost exactly as much as it would have taken to offset the depreciation of the purchasing power of the dollar since 1970   wage slavery doesn't work for wage slaves  that's why they call it slavery ,bptx79
180,RANT,my house is just like a waiting room to prepare for my nxt day of work fuck this shit ,bnfwb7
181,People are only made at Lauren for reminding them of their wage slave reality,they have the nerve to call what she did harassing and emotionally distressing threatening to sue  they won't  if these pussies don't she their own employers for firing them  how are they gonna sue some girl pretending to   literally the only reason people are so upset is they know this is entirely plausible someone could just waltz in and fire them  and they wouldn't do shit about it  that's not lauren's problem   america is known for posturing too  walmart could not legally ban her as a person  only the act thereof of meanie pranks  i know reddit does it  but reddit is also a publisher and if i post bomb instructions  reddit posted bomb instructions  not me as my legally named license and registration  something reddit mods dont like talking about  i mean why would they  top ten life hacks   if you don't know what the hell i'm talking about with this whole lauren thing   https youtu be l4hlyhy1b7i  it's just a prank bro,boh29g
182,I’m making a 4 figure passive income in my sleep 😴,thanks to crypto investing trading   risk level  high,bokbxh
183,Corporate work is little different from farming commodity goods,i've come to regard the farming of goods that sell on commodities markets as absurd   it takes away your control over prices and forces you into the  get big or get out  mentality of agri-bussiness con-men   it leaves you relying on insurance and subsidies to weather bad price years  not to mention the insecurity costs of herbicides  pesticides  and fertilizers that come with monocropping  when you could instead be growing and selling a diverse range of produce and fruit to your regional buyers   so how is pursuing training and work experience in a specialty for improved corporate  or even government for that matter  employability any different   i've considering this as i look forward  to developing yet another tech or adding another degree to my cv in order to get work   the wages of employment are almost always just another form of commodity pricing   you're time and life are the commodity of course   the opportunity cost is what you could be doing instead to both enrich yourself and your community   unfortunately  too few communities offer the structure and maturity to support this kind of life approach   access to workshops  to land  to raw materials  or to experts and apprenticeships is a rare privilege when you look at the vast number of people in the world who inhabit disrupted and disfunctional communities   that's just the world we've inherited   i think about this and wonder if maybe i should just skip the crap and spend some years doing a trade like musical instrument repair which can reliably become an independent income   there are a number of trades that i've pursued but simply lack the money to turn into anything more than hobbies ,bp8lkn
184,I detest human beings. How can a misanthrope survive without having to work with others?,as a misanthrope  i can't fucking think of a job in which i could work alone  i'm terrified of having to  one day  have coworkers  most of them uneducated people  less intelligent  less productive  less polite than me  with huge moral flaws    i don't want contact with them  i don't want contact with the filth   but fuck  the majority of people are extroverts  and the world was built by extroverts,boxdlx
185,How do you make income unemployed?,young adult here  and realized of what comes after high school  either college or the work force  my major career dream in my life is to be a freelance filmmaker  but it may take a while to get to that and i was thinking ways to make money while being unemployed  is thier an escape to the mundane 9-5 lifestyle ,bouojr
