,title,body,id
219,No privacy in our personal lives. None. At all. Job interviewers don’t even consider people who don’t offer their entire life to the job.,its honestly ridiculous that you cant even mark your availability to your own needs you have to match your availability to what the company wants or else they will not even look at you   i remember when applying for a fast food job i had marked saturday off of my available days they were closed on sundays im sure you can guess what this place is lol so i was trying to get you know a weekend i already wasnt keen to working another fast food job but i needed to pay my car note at the time during the interview the manager said well i noticed here that you said you arent available on saturdays why like what am i supposed to say if i tell you that i just want that day off youll look at me like im lazy and entitled for wanting a weekend i cant lie and say i have another job or they wouldve probed me for details about that job thinking back it is a christian company so i shouldve come up with a lie that i do some sort of church volunteer work on saturdays and that probably wouldve gotten them off my ass didnt think about it at the time because i wasnt expecting them to be so invasive about why i wanted saturdays off   like and the worst part of it is that day you wanted off ends up being on your schedule every week they scheduled me almost every saturday   the complete disregard for our schedule preferences is disrespectful as hell if you ask me to me it just says we know you are full grown adults who would like to have some control over your own schedule but we dont care because we need everyone here to be our personal lackey who we can call in whenever we want also if you tell them hey please stop scheduling me at 5 am i dont like it they will probably schedule you more at 5 am this also happened to me at this same company i asked to switch to more afternoon shifts because i think its absolutely ridiculous to get up at 4 am to be at a fucking fast food job at 5 am i gave a different excuse and they kept scheduling me at 5 am then got mad when i called in constantly lol like sorry dude i told you already i dont like going in at 5   like find someone who wants to go in at 5 am and if no one wants to go in at 5 am why are we opening so early so people can come get their precious breakfast sandwich at the asscrack of dawn every morning,bcdyyu
220,Quit my labor job for some R&amp;R,ive been working at this warehouse doing physical labor work for 9 an hour for almost 3 years now unfortunately ive never gotten a raise because i go to school during the week and miss 23 days a week i finally had enough of the back and knee pain that ive endured on top of that my boss informed me i wasnt making enough hours and hed have to fire me soon so i quit im tired of seeing people who work the same hours as me and make twice as much money unfortunately my family and my girlfriend are pissed at me my friends on the other hand are on my side so thats something im never doing any physical labor work again unless theres a fat fucking paycheck any suggestions on places thatll be high paying but low physical work im fine with mental work that doesnt bother me as much,bckpm2
221,Need advice hoping to get some feedback,i am writing this as i am mere minutes from going to bed to wake up for work in the morning yes i work on weekends only and though it might be only 2 days of the week i work at a factory job doing the same monotonous task for 11 hours with only two 30 minute breaks which i have no control of when to take  i am currently a fulltime student 23 male living in toronto in computer science and i work full time to help pay for my expenses which is mostly for my car for those wondering why i have a car as a student let me explain i originally went to college for two years to become an electronics technician i landed a full time job after graduating which i didnt mind just the manager sucked after working there for a year and a half i paid my student loans and had enough money to pay for a car i paid for a car from my dad however i currently pay an outrageous insurance despite never being in an accident   after some time i was hoping to go back to school to advance my knowledge to get a degree in computer science i asked my current employer if i could work part time with them while i was in school and they originally said yes but than changed their mind and said no as a result i need to find a job fast to help pay for my car insurance which made up 50 of my monthly expenses alone so i took a job at a warehouse   again although i only work two days a week i dread this job so much i wish to do some about it but i dont know what  side note let me also say that i throughly enjoy university and dont regret going back i love what im doing my grades are great and everyday i enjoy coding doing mathematics and photoshop i hope to get a selfmade career doing these things that i love i also volunteer when i can i give food to the elderly and use my coding skills for good to help charities design their websites  thank you all for reading sorry if the grammar or spelling is broken i am writing this quickly before bed,bcywxc
222,If I was a boss I’d give myself more than 17$ an hour...,he your own boss  getting paid by the hour       own boss barn up to  17he  ,bba5rc
223,Emotionally clingly fucking co workers,no i dont want to go to the casino with you  no i dont care that your white boyfriends mom and sister hate you theyre racist  no i dont want your number im married and  i dont shit where i eat  no i dont have extra moneyheadphonessnacks plan ahead like any other adult  no i cant calculate your hours worked they have apps for that   ampx200b  the list goes on and on i hate that i work in a male dominated industry but since its im a woman im expected to be free therapy lunchesetc to top it off most of the people that i work with are homeless temp workers and therefore are easy to ignore in most places i just look forward to getting into my new apartment getting my car and savings padded and get the hell away from these needy ass men  ampx200b  ughh,bdnsw3
224,Max Stirner - All Things Are Nothing To Me - Todas las cosas son nada para mí,ampx200b  httpsiredditrfzqdurslir21png,bbslqu
225,“Uplifting” Snapchat story I recently saw.,when you just gave birth but you have an exam tomorrow          ,bbh003
226,Stop and Shop Strike,key acts for stop  shop customers  aholddelhaize success  top operating supermarket in new england 8 billion share buybacks since 2010 over 2 billion in profit last year           134 increase in operating income last quarter  putting workers takehome pay        huge reductions in retirement benefits     drastic cuts to healthcare     elimination of holidays and personal days  increase in poverty in your communities longer lines at checkout           less customer service     higher employee turnover    ,bccp05
227,Purpose of life,do you even feel like you are stuck in this job schedule and this is not your true calling you want to take 2 3 months complete off from this schedule of mf  waking up early  commute and think about next step in life but you cannot do that as you cannot afford it so thinking about it just makes you depress what do you do in those situation  how do you snap out of it ,bcvqrb
228,Need life advice,with the help of the government i found a new depressing office job they saw that i dont have a degree and said i need to do one or else ill get fired degree 45h per week working incl 2 days school for 3 years straight i dont have any other options since a degree in my country is everything if you dont have one you can only find a humane job with rare luck or work in badly paid places since theyre paying for the costs i agreed i will quit as soon as it gets too much  ampx200b  but now im not sure if i did the right thing i already signed all the documents and i dont have any other plans for life i thought maybe with time ill get an idea that i can earn money with live a good life in another country or find a partner who wouldnt have a problem with me not working but i kinda doubt it now i really dont want to spend the best years of my life early 20 wasting 3 entire years in a delusional capitalist place they tell me oh its just 8h a day of course forgetting the 1h way to work  the 1h unpaid lunch break the studying and the workinduced depressions my parents are kinda forcing me too to get this degree everyone here has done their degree at 16yr olds but my lazy ass tried to avoid it at all costs i dont know what to do i saw so many posts here of older people regretting how they wasted their best years with 40h jobs  ampx200b  what would you do in my situations and if youre comfortable to share what are your plans or projects to avoid the 98 bullshit im sadly bad with arts music or programming,bddos7
229,Stop and Shop Strike,for those who want to support the workers of stop and shop who are being shafted by corporate nonsense here is a list of american companies owned by international conglomerate aholddelhaize     bfresh   food lion   hannaford  giant food  giant food stores  peapod  stop and shop  ampx200b  the full list of companies can be found at the link below   httpsenwikipediaorgwikiaholddelhaizehttpsenwikipediaorgwikiaholddelhaize  ampx200b  please do not give any of these companies your business while the strike is ongoing,bd4rxf
230,Capitalism's Death Toll,anyone consider the amount of people who have graduallyor not drank or drugged themselves to death because of being forced waste their entire lives in pointless work,bbsmyy
231,British Propaganda ad,when you work your pension workshttpswwwredditcomrunitedkingdomcommentsbdxii4dwppaid315000forthisgoggleboxadvert,be1rd6
232,You can do it,just a few more hours then you can chill and play some video games  i believe in you dude hang in there,be1x4y
233,Layoffs are Coming...,my job has been struggling to find more projects and its pretty clear layoffs are coming this would be the third place ive worked in 5 years where that has happened   im so sick of the we are family we need you talk right until the money stops coming in im sick of being at a job i hate work makes me miserable i dont know what to do,be1bch
234,The concept of modern work is the dumbest fucking thing I could possibly imagine.,i know im not the first nor the last to feel this way and this isnt a unique or profound idea for this sub   i just cant fucking take it anymore   i left my corporate 95 job to work part time in retail i physically and mentally could not take it anymore im only in my mid20s but my soul literally felt black i wasnt sleeping enough i was sitting 1012 hours a day i was doing pointless work that automation was advanced enough 10 years ago to do management was incompetent i would have panic attacks if i made a simple error because they could fire me for any reason and at any moment   now for 13 of the pay i still spend 40 of my life either working or worrying about work because of course i have to answer emails and texts even when im not clocked in   i can barely afford what little bills i do have  my manager nearpassively nets 800k a year while myself and my 3 coworkers operate her company for 12 an hour   customers scream at me for issues outside of my control when i put on my best customer service face and try to handle issues with understanding and tact i am threatened with losing my job because i should have been able to prevent a rich housewife from getting angry about a shirt being 30 when the last time she bought a completely different item it was only 10 or some other bullshit thing   i left work uncontrollably shaking today because an item was sold out and a customer wrote a scathing review about our interaction after storming out and yelling about how i was retarded and incompetent i handled the situation as best as i could i was polite apologetic and offered an alternate solution but because i caused my manager bad publicity i am currently awaiting to hear if i will be required to come in to work tomorrow might i note that in the several months ive worked here this is the only time anything even remotely negative has happened during my shift   i know there are many people in similar situations it breaks my heart that there are millions of people whose entire lives including mine will be spent working some meaningless bullshit job until they die   i took this job after i left my corporate 95 thinking it would be less stressful boy was i wrong   thanks for letting me rant here,beef1s
235,Night watchman is a good job if you don't like work.,i used to work as a night watchman for about 5 years and even though the hours were unsociable and it was zero hour contract through a shady company i can honestly say its the best job i ever had   you dont really have to do anything or put up with shitty coworkersetc you just have to be willing to go to various sites at short notice and be able to handle being alone for 12 hours i would typically spend the shift watching films and tv shows playing video games and vaping weed also some sites i could bring my dog with me which was cool  eventually i was fired after i got caught sleeping but at that point id had enough of the job and the company anyway so didnt really care but i would definitely recommend this line of work if you dont like work and it helps if you dont like other people too ,bebdc5
236,Waking up in the morning is the worst fucking thing in the world,you never get used to it getting enough sleep is a constant struggle,bdu84y
237,I think i'm just gonna quit Tomorrow,im 31 and did what everyone else told me to do     go to post secondary   get a degree    work        this is a fantastically shitty life no one and i mean no one cares 1 iota about quality of life work life balance add to the fact my girlfirend wants to buy a new house for a debt free prision sentance of 25 years all i did was get a degree i swear     im reading kierkgaards eitheror right now i like his view that as we suffer more we learn more about ourselves wellwhy not high tale it to another city and start over work part time and if i make it great and if i dontwell i died on my own terms     i feel for most people in fact i dont resent my boss or my bosses boss they are all in the matrix and dont even realize it i love humanity because the potential is there you see glimers of it in disaster  life and death scenarios but other then that you really dont     anyway play last of the mochasions and go balls to wall,befmcz
238,"My first two weeks at my new job. Apparently, I have a new father guys! I really hope passive aggressive texting doesnt become a habit. Unbelievable.", was notified that you have been tardy multiple times the last two weeks  of avail late ke ai male exomualiswelolsea i become a habit  the  think  was only tardy once   think the second time  just blocked in late     4 min  sms ,beelst
239,Once you've built a buffer it's possible to work without participating in the bullshit,warning dont behave like this until you actually have financial security  i spent part of my 20s building a significant fuck youbuffer in order to feel more liberated and now that the immediate fear of losing my job is gone ive realized that its possible to work without participating in the bullshit  what i mean by this is whenever a sociopathic manager tries to guilt me into sacrificing more of myself i can now respond with a well i think that a worklife balance is important for ones health or respond to the classic why should we hire you with a well i think that my profile fits the description but ultimately thats your call and so on  i realize that not everyone has the opportunity to build a buffer but for those who are working white collar jobs and feeling like theyre not gonna be able to make it to retirement focusing on building a fuck youbuffer might be enough to offer some happiness and peace of mind until retirement,bal9a4
240,My thoughts on work while being laid off,simultaneously terrified for my future and more excited than ive been in months  my first job technically second but with the same company is ending very quickly i was told the position is being shut down 2 days ago and my last day is this upcoming saturday i need a new job asap because i dont have the spare funds to keep myself going for long periods of time especially with my current goal of going to college for the sake of learning or using the money if i have to to go to a trade school to make more money im also still living with my parents for the purpose of saving money but i dont want to be a burden on them forever  despite all of the things im stressing over at a time like this theres a part of me that cant wait to be unemployed in the whole year ive worked here i have not had a single full nights rest very few days where ive turned off my alarms a couple sick days gone through about 2 bottles of sleeping pills missed dozens of times to be with the people who keep me going and my aging pets and parents  in my head i know i need to get a new job fast and i will be sending some applications later today but im really at the point where im willing to give up on my future for a few weeks of rest it makes anything seem worth it to turn off my several alarms and get a full nights rest for the first time in months my family moved to a more rural area last summer but ive been so busy and when not busy exhausted that i havent had time to do yardwork or take my dog on daily walks or clean the house for my mom who works so hard already  that classic pie chart where 8 hours goes to sleep 8 to work and 8 to playpersonal is unfair when so much common work could be automated some human input is necessary of course but wasting away at unnecessary jobs because your life has no value without money is bs not only is it unfair but its a lie those 8 hours of work a day arent 8 hours when i live 30 miles from my work its not 8 hours when the thought of work not only keeps me up at night but keeps me from sleeping as heavily as i need to  ended up more ranty than intended but the relief i am feeling by being laid off even if a bit misguided i feel is pretty indicative of the pressure i was being put under by even the simplest of jobs but day after day ,bat3an
241,Quitting job I’ve hated for three years tomorrow.,got new job lined up with no benefits and a slight pay cut i couldnt stand the bullshit of office life management lied to my face one too many times ,bapwr8
242,Limited notice,whats with these jobs that want you to start the same day with little to no notice love how its accepted that they do such things but how dare it ever be the other way around i have been offered a job by an agency twice now on short notice the first time they wanted me to start i forgot i had a dentist appointment for a tooth that needed to be pulled immediately almost had to go to emergency and mind you was my first dentist appointment in 15 years so it was kind of important and yet this agency still asked me to start a job with 12 hour shifts factorymachine operation as if thats not dreadful even for 4 hours the same day with a few hours notice i wasnt sure how long the appointment was going to take or what shape id even be in having a tooth pulled so i said no fast forward to today and i am emailed and asked to start at 7 im now full blown into a random cold and would literally rather do anything else but im not sure what im supposed to say in response like honestly i just want to send back an angry message about the short notice i need a day or 2 to organize a ride home anyways they know i have limited transportation and still want me to do jobs with 12 hour shifts on 23 hours notice fuck out of here,bbbxsr
243,"A thought exercise: video games are popular because they present an idealized version of work (seriously, hear me out)",so a few days ago someone posted one of those what would you do if you didnt have to work threads many people said art volunteer work part time work etc but the most repetitive answer was video games  a few days ago a colleague of mine has left the company there were talks that hes under performance review which is corporate code for youre probably getting fired soon lets call him jack   jack has been working at hooli a major it company for about 5 years and had the reputation of someone who isnt exactly a hard worker he enjoyed performing simpler tasks  ones that teammates described as press a single button to fix something   jack and i often talked about video games ive been playing the same massivelymultiplayer game for 12 years on and off and so did he the day before he resigned he told me of a new game hes into which involved a lot of manual tasks   you have to craft your arrows and fletch them on your own one by one for example in order to fill your quiver and go hunting this is interesting coming from someone who wasnt considered the most studious staff in the company us engineers are always encouraged to automate everything because manual tasks are considered uninteresting prone to error and inefficient it made me wonder why would people enjoy that level of detail in a game and it got me thinking  i would posit that ltdrumrollgt video games are actually an idealized version of what we want work to be like we play video games because they fill the hole that modern labor created this is of course a makebelief system and im not saying video games are productive  but theyre designed to make you feel like they are whereas 95 office roles do not  the following arguments to support my claim are  1 better reward systems no person character is underpaid in video games if the quest doesnt give you enough gold armor reputation or the mere sense of satisfaction that you progress in the story etc you dump it you might even ditch the game altogether for a more rewarding one  theres no harm in changing games you wont lose the roof over your head reading the wow subreddit after realizing this has been an eyeopener all the rants there about the current reward system can be read from a marxistlike pov  2 no faceless corporations  the quest giver is a person you interact with directly not a huge bureaucratic machine that views you as a cog its strange to think about it but in a good immersive game  even an npc has more heart than the it giant that pays my salary the quest giver or their faction have a story you can relate to   3 no meaningless pointless tasks  if you get told to kill 12 wolves for their pelts then that pelt is later used to craft armor for your character or whatnot if you get told to pick 8 herbs its because theyd be used to craft a potion to heal an orcs sick daughter or something you actually feel like you help someone no huge excel spreadsheets no powerpoint presentations that dont interest anyone heck even most raid guilds dont hold team meetings over videoconferencing   4 your gamework has actual results  if you kill an evil demon boss they die and you saved a village if you gather 20 pieces of silk and nylon threads you craft a cloak that your character can wear the difference is visible who knows what the hell the paperwork i generate is for other than checking a box for the sake of saying we did it this relates to what marx described as alienation from your work too perhaps in games if you work hard towards something you produce a meaningful item of some kind you can often look back at something you achieved in the game with pride  5 you can walk away whenever you want to youre a mercenary in most cases you can pause and continue later if youre tired bored or have something else to do you can play solo or in a group you are your own master and dont need to ask for approval to log off i have to create 2x calendar events fill out a web form to hr and send a massdistribution email to the entire team whenever i take sick leave    6 you get out and see the world this too is ironic because in reality you sit on a chair for hours but the ingame system sends you across different scenic fantasy lands most workplaces are rows of gray openspace desks in busy urban areas with shops and tall buildings some games take place in urban environments too but they launch new maps so you wont get bored my game launches new maps with new regions every few months or overhauls the existing ones dramatically so the world wont get repetitive and boring  to summarize i dont think people are inherently lazy they just want to do tasks that are rewarding interesting and serve some purpose which is very often different than what office jobs are like,bdbui7
244,How many of you would be disciplined/fired if you spoke to your boss in the same way that they spoke to you?,im sick of being talked down to and not being able to speak my mind because of the consequences ,bak30z
245,I can’t go sober,i just cant do it i have to go out to the car and have a drink every couple hours or i have to pop a bunch of pills i work a lifeless souls job and ive never been able to get myself together toward something better im just pissed off i wake up every morning,bdx86r
246,A young man in his 30’s at my job just had a heart attack,he had to have surgery and is in the icu his wife also works here and hasnt been in since last thursday when it happened   i just cant help but feel its connected to stress and work hes not fat he seems like hes active he goes back and forth from the office to a job site a lot i dont know his job so idk how stressful his job is but its just unsettling to me,bdx1v5
247,How would you protest labour laws and trying to change them?,sometimes i got nothing to do on weekends might as well go be a thorn in someones side,beo0u5
248,Capitalism,up or a he tnponcun ing outs     a of vi he replied of you work hard i all  and  hours of and strive for excellence i get another one next year he he    ,bdu1od
