,title,body,id
119,Employers ask about references to make sure you remain a slave,sorry for my poor english im french one of my friends lives in the us and  basically he told me that when youre looking for a job your future employer usually asks for 23 references from past employment i was shocked is it the gestapo what if your manager hated you i guess you guys need to be very submissive to make sure that you get good references in case you want to quit what a joke of a system past employers can say whatever the hell they want   we dont have that requirement in the french system employers dont ask any references they just ask for a copy of your diplomas to make sure that youre qualified although were still wage slaves with a high unemployment rate at least we can tell our employers to go f themselves when we quit thats what i did 3 years ago it was so funny i also locked up my manager in her office at lunch time and threw the keys in the garbage bin she was so abusive with her staff she got what she deserved she tried to involve the police they couldnt care less since there was no physical damages lol  my current employer doesnt know about it and will never know,dbj4y9
120,What is a good way to mess up workplace without getting in trouble?,i hate my job and the people ive worked with and i want to give them inconveniences so fat ive spat on the toilet paper put a fee things in the wrong place and turned some bottles the wrong way is there anything else i can do thats legal to make inconveniences for the manager tomorrow,day04s
121,I just had a revelation,employer you are paid what youre worth  me okay i want these days off  employer no you have to work those days  me but you just said im being paid what im wor  employer youre fired,dazj5q
122,My work just announced mental health sickdays must be signed off by a mental health professional..,in my country it is workers rights to be able to use sick days for mental health reasons if you need to   now my workplace has said because it takes its employees mental health seriously we will request a signed document from a mental health professional that we have sought consultation  well two issues  1 most mental health people are booked out days in advance  2 it costs at least 75 for one hour  well my workplace has offered kindly to help with 2 by way of a loan which you can pay back from your wages over a few weeks  how kind,db5mtj
123,How the fuck do I deal with this working depression?,i already have enough on my plate with school and i have to now get a job i will occasionally breakdown from time to time just because of school let alone work how do i get rid of this depression,daqu2c
124,Calvin knows,calnin doesnt want to labor                          ofs sick of working aliwe time of mates cocrerating with all the otwer ants  the geneft of the solon  hes of   s wondual with wis of of  and desires        calvin the flea sucks the blood of his angry host of parasitic contentment    ,d9ut2r
125,Job is a vacation from poverty.,hey boss of of get vacation days        your job isa vacation  from poverty ,dba0f7
126,The Caste System,what do yall think about the caste system  the idea is most wellknown from its indian variation but it is attested to in the following sources   hinduism mentioned above  iran zoroastrian myths about jamid the avesta and it is an idea attributed to some sasanian kings  plato  medieval arabjewish philosophy alfarabi avicenna and maimonides but particularly alfarabi and maimonides  islam see hierarchy and egalitarianism in islamic thought by louise marlow  traditionalism particularly evola but gunon schuon and coomaraswamy all paid lipservice to it  it seems pretty universal one striking thing about medieval mythology particularly its european variant is the consistency of ideas across cultures for example the french the english and the irish all possess similar themes when it comes to their knightly or aristocratic mythologies  good resources on indian caste system dras in ancient india by ram sharan sharma and caste and religion in ancient india by jayantanuja bandyopadhyaya  it seems like there was a natural tension between those predisposed to and capable of nothing more than productive labor often called dras and the ruling class characterized by chivalry on the one hand the warrior or ascetic knowledge the priest or sometimes both combined  our modern labor system is tellingly not the product of any one individual or group of people engineering it it seems like the world at large simply lazily allowed the situation to progress this far without anyone trying to exercise any agency to stop it if you think about it a large group of people letting whatever happens happen is actually the very definition of chaos  i guess my question is how do we reinstate the caste system a system characterized by such a hierarchical dimension and subsequent confinement of individuals to their natures and roles is what alfarabi called the virtuous city see antony blacks the history of islamic political thought  without controlling the masses by arbitrarily allowing people to accumulate wealth and start businesses especially people who are not qualified for leadership or commerce ie the vaiya without controlling women separate topic but somewhat related by letting who myatt called the magian and homo hubris or who some people call normies completely dominate the cultural sphere and its accompanying confused philosophy by allowing democracy to exist as a form of government by relegating all questions to indeterminacy via postmodernism all we do is allow chaos to rule  certain people have certain natures and temperaments other people have certain exaltations and still others have deficiencies these realities cannot be erased as their variancy is natural and therefore part of nature to ignore them is to abolish what is natural and to usher in what is unnatural not everyone is an employee anddra by nature but our society forcefits people into that role  religion should inform public life people should not drink or have extramarital sex but secularism and scientism undermine the ability of religion to control people the very fact that people vocally disagree about so many cultural and social issues already means that someone somewhere is wrong people are not unified in their beliefs and aims there is therefore conflict  how do we once again institute these traditional laws into society in a practical and forceful manner  how do we arrest the creeping tide of time and prevent impersonal slavery wanton lust shallow philosophy pseudo spirituality characterized perforce by western buddhism abject lust  and general ignorance from wreaking havoc on the world  corrupt regimes in africa commit genocide and starve people young men in america voluntarily shoot strangers and casual acquaintances and then themselves women as a political and cultural monolith have more power than ever before and contraception normalized extramarital sex dating hookups instagram and so on and the push for abortion only seek to enforce this men are now more variegated more atheistic humanistic skeptical and intellectually lazy than ever before people crave wealth or they crave power or they crave fame and subject to rulership by their desires the whole of society is then ruled by people ruled by impersonal forces this manifests as an impersonal sense of slavery subjecting everyone unnecessarily to its nondiscriminative tide  how do we stop this  armed rebellion  quitting work en masse  rhetoric  thinking through history i am reminded that there are very few cases of things changing for the better without forceful and sudden revolution in fact history is very bloody the world at the moment incomplete cannot be without conflict therefore the apparent lack of conflict in certain sectors of the world is just that an appearance  wasnt the usa founded on a revolution when has anything ever changed for the better without forceful and sudden revolution  or is there another way  i feel that rhetoric will only be judoed by the collective ego of most people changing the status quo is difficult without changing the status quo  let me know your thoughts  i know and care very little about any kind of political philosophy from the time of the renaissance or the enlightenment my concern is mainly reinstating the caste system from the first principles put forth by thinkers like alfarabi and maimonides and secondarily plato i do recognize that the entire system was encapsulated and manifested within the summary epic the mahbhrata and subsequently elucidated in the puras  let us turn back time,d8y11i
127,Anyone else find it crazy how many people commit suicide over financial troubles/stress?,my parents friend hung himself a few years ago because he was in serious debt from his business not doing well he left behind a young child and a wife i did some research and this isnt uncommon fucking crazy what world we live in where money literally rules our lives,d8qc9u
128,Manager just asked someone if they could delay their retirement,this happened a few hours so the vp frenetic workobsessed typea personality walks in to jims office some background jim is 72 had cancer a while back is suppose to retire in a month and has been planning a move with his wife  so the vp walks in and asks jim if he can postpone his retirement until february 2020 i looked out the side of my cubicle for a second and expected an argument of epic proportions if i was that close to retiring after 40 years of working id have some choice words not just an extra day or week but to wait three more months   but he casually just says sure   what the fuck   even if it was the best fucking job on the planet id still say no   can anyone explain this behavior because defies logic   the only thing im thinking is he afraid of losing the retirement if he doesnt say yes he just postponed all the plans he and his wife had been planning without even taking a day to think about it,d54feu
129,Kickstarter is union busting,    not the same v taylordotbiz  his morning after six years of pouring my life into the mission the staff and the creator of kickstarter  was fired for organizing a union they offered me no real reasons but one months severance for signing an nda   will not be signing it  417 of  rep 12 2019  twitter web pp  792 retweets of likes     9 of 9 nay not the same taylordotbiz him v replying to taylordotbiz and kickstarter  last week another member of the organizing committee clarissaredwine was also fired and today a third prominent member of the union was told there is no place for him at the company  stand firm in solidarity with my friends and colleagues  of to 75     b      not the same taylordotbiz the union bursting campaign that kickstarter management is engaging in is illegal and wrong it is an unforgivable abandonment of the values of an organization that  have loved and served with my whole heart  of to 88  him v        not the same taylordotbiz him v  large the kickstarter staff to unionism sign that petition and exercise your  right to a more fair and equitable workplace ont let what happened to me happen to you you deserve better unionize  2 1 96 of     a ,d57lhn
130,Steve is right though,     wooolits friday you excited                                                                              ann excitement for eriday only proves that youhe of unwitting slave to this social construct of call the week friday of nothing but a false hope designed of distract you from notigns the machine silently  oppressin g you youhe must a hamster  of a wheel linda too excited of eriday of notice youof of a cage       his of why nobody likes you steve  ce  ,d5b9jw
131,why work so hard just to make some rich idiot richer, way work of hard jus of make some rich idiot richer  at  he  went a  x    ,d5cmad
132,"Would you still be ""anti-work"" under my buddy's circumstances?",just had a good discussion with one of my friends from college about working we were college roommates which we would consider some of the best years of life mostly because of the free time we both became significantly better at guitar and all of other hobbies time with friends and family etc   i asked him about his current situation and he expressed his distaste with work because his free time is still limited but i feel like i wouldnt mind working 40hrs in his current position   he is a coder and works completely from home so right there he is already saving a ton of time that would otherwise be wasted on commuting he actually doesnt even have a car so he saves a lot on gas insurance car payment etc he also is allowed to work his hours whenever he wants as long as his tasks get one and the kicker is since he works from home and has that freedom he constantly travels and is currently living 10 minutes from a beach in hawaii making 65k from his computer  still he insists 40hrsweek is too much and despite his blessings feels like a slave and not living a true life i personally would kill to be in his position i am curious of everyone elses thoughts here,d5onzl
133,Just feeling exhausted by the culture,i just feel so exhausted from all the constant consumer culture like you go on social media and its all about buy buy buy endless product after product especially on instagram then you have to sell yourself to your employer seem attractive and interesting and capable and if you dont want to employer and you want to start your own business then you become the person who produces all of the stupid garbage and annoys the rest of the society it feels like the space is really free of this you are always selling or buying something and it just gets so exhausting i wish i could find a void and just curl up in it    for those of you that are working does it ever strike you that every single day of your life you are just producing a product or service at least most of you and that is your greatest contribution to this reality,d65glb
134,"Citizens of this subreddit, when you are a manager, will you be the antithesis of everything you hate?",citizens of this subreddit i fucking hear you sick of wage slavery sick of not having the emotional or mental capacity to enjoy my hobbies after a 40 hour work week sick of increase of responsibilities but no increase in pay sick of loyalty not being rewarded sick of meaningless work sick of stagnant wages sick of being at the mercy of a multibillion dollar corporation that controls the fate of myself my spouse and my kids  when you are in a position of power or influence at work what will you do to right the wrongs that youve experienced,d6atuz
135,Has the veil been lifted? Or am I just paranoid?,after working in retail it seems like ive seen the behind the scenes whats behind the curtain and how workers feel i almost feel like everyone i see in any store is faking their enthusiasm which is horrible to think about and is why companies ask people to act cheery but if its not real then it breaks the illusion i dont like thinking that people are acting just for my sake i see youtube videos on the homepage about people going and doing crazy stuff and in concept it sounds fun but from a workers point of view it sounds really annoying but theyre probably thinking this dude is making a big deal out of this i know there are people out there who really do enjoy their jobs but regular stuff especially retail and probably the food industry just seems to suck as a whole   its not like i think people need to be genuinely happy at work quite the opposite they should be able to show their real emotions,d6m02w
136,Is anyone else really sad they wasted their teenage years working?,if i could go back i would not work from the age of 1418 the most carefree time of my life spent slaving away in a store for pennies now im on the brink of graduating univeristy and the monotony of schoolwork life already has me depressed  im 21 and already crushed by the system my mental health is deteriorating and i have no social life if i could have forseen my future back when i was 14 i would have spent time actually enjoying life  this is a cautionary tale to teens who read this do not work unless it is an absolute necessity life gets real real soon,d5bk6i
137,when your alarm goes off,         he ill scream fee constantly  each day is a new nightmare in this hellworld called earth ,d5sdbq
138,I’m quitting my office job tomorrow to go and work in a warehouse,cannot stand office culture just hope i dont regret this decision,d55p57
139,Hopefully This Will Be a Start To Work-Free Society, httpswwwtheguardiancomcommentisfree2019sep12fourdayworkingweekreporthttpswwwtheguardiancomcommentisfree2019sep12fourdayworkingweekreport,d5zaca
140,LOL. It's sad really.,4  news  posted by ulazeruscheetah 16 hours ago of of rise navy confirms ufo sides posted by link 182 pocket are real and should not have been released ce  nbesandiegocomenter 2 i m 60kcomments  give ward a share i save q side of report 89 devoted  comment as mrcookies1234  that are your thoughts      ettoniicn z  sort of best v   dogsand 29kepoints  10 hoursago     honestly i just wish aliens would hurry up and do what theyre going to do so i dont have to go to work anymore reply giveaward share report have ,d6bwka
141,"Got completely financially screwed by work, my boss couldn’t care less. Putting my notice in within the next few days with no backup.",so i work two jobs but my main job is working oneonone as a school aide with a special needs little boy all day every school day im employed by a company who sends us to individual clients so while im technically employed by an agency its really the families who personally hire me  ive been working with this little boy since the beginning of this year i care about him but hes very tough and this particular rich family is very neurotic bordering on abusive they like me but its a miracle they do they freak out constantly about very minor things and they dont follow any of the advice thats given to them by my supervisors mostly things to the tune of have you considered trying methoditem here to make your son less unhappy they basically dont think he really needs additional help but the school wont allow him to attend without me and his challenges will just disappear with age also its not really good to have a single aide on a fulltime case like this mostly concerning burnout for the aide which i absolutely have at this point im miserable with anxiety at work every day and adjustment issues for the child   but because this case is so big  for my boss and the family has hated every other aide before me and wont tolerate trying new ones my boss has accommodated their request that i be the only one to work with their son this wouldnt be so bad if not for the fact i have no other clients before this case i used to have several i saw on alternating days this basically means if this family cancels for whatever reason i get nothing usually however the damage is minor ill lose a day 8 hours of work if the kid is sick i can usually just scrape by but what happened last week was something else  so basically the family decides out of fucking nowhere to take a vacation for a fucking month taking my client with them zero warning whatsoever the mom actually lied to me and said theyd be back this past monday they didnt even tell my office this by the way so for the past week and a half ive had no hours and until they return in early october ill be getting about 9 hours a week if im lucky my office is currently trying to find me some hours with other clients my boss doesnt care at all how much this has screwed me financially 40 hours of weekly work down the drainfor a month note i only work my other job for 4 hours a week so that wont help me much  ive put up with so much bullshit at this jobon this case because i really cared about my client but this is the final straw im planning to put in my two weeks within the next few days with no new offer before the family gets back because i just cant take this anymore the pay at this job is terrible as it is but in situations like this im up the river without a paddle whats worse is ive really bent over backwards for this family even changing my availability to accommodate them and their son taking their callscomplaints well after work hours etc  im just looking for advice at this point on how to draft my two weeks effectively i put in my two weeks once before about a year ago and my boss begged me 4 yes 4 times not to go offering the raise she denied me for a year and a half and even had my supervisors emotionally guilt trip me into staying the kids love you and need you naturalrattle please try to find a way to stay with us they know i have a soft spot for the kids but i cant do it anymore im trying to avoid all that noise and just have a clean break while i still can and gtfo for good this time thanks guys,d6kvxg
142,Looks like Lowe's is into a Little S&amp;M Play,    candidate sub x     c   silverpeopleanswerscompastaticwebcandidatehubquestionnaire170875283 or x in employee who fears being fired will work hard  o o of o o of   complete        neutral completely agree  door performance indicates that an employee needs to be disciplined  o o of o o of   completely disagree           neutral completely agree  good managers discipline employees who do poor work  o o of o of o  completely disag       neutral  om  p type here to search        850pm w 3 0 of go  in ,d5r3ny
143,forcing fake happiness on employees (especially in non client/customer oriented jobs),why cant employers be normal be realistic why dont they understand that most people wont love their jobs that most people work in these jobs to pay bills why cant they accept that   why do they have to force you to be fake happy all the damn time why do i have to pretend that yes i love to be treated like shit by customers or that yes i love to slave away in whatever jobs   they must know we are all lying through our teeth during interviews or during work is this about if we can convince them with this fake happiness then we will also convince clients and customers but what about jobs that dont require direct contact with clientscustomers not even on the phone   even though i can see why one reason for forcing fake happiness on employees could work in a customer client oriented job there are other jobs that are not like that and therefore this forced happiness is nonsense,d5y78s
144,Is it just me or is it corporations that are tearing the fabric of human life and causing the depression of a lot of people?,getting up everyday to the same soulless routine and slaving away to barely make a living while a few top executives make a majority of the wealth leads to severe depression and this is not just happening to people in their 20s many older people are also describing how much they hate life the amount of meds people have to take the make it through the day is staggering,d671g3
145,"*quits* Manager: what you’re doing is really irresponsible, you basically screwed us over, Me: I understand..",is someone able to take my 445 shift tonight  will not be able to come in  1018 of  an someone please cover my 930  jathimicolaaros boy ivan ne li morela      1007 of ,d7ldly
146,microsoft planner sends me notifications every saturday morning about tasks that are due.,of all the things this one gets me the most software specifically designed to hassle workers on their day off over tasks that werent completed during the week is fucking bullshit,d7ao32
147,From r/funny. #1 on r/all. How the fuck is this funny,      i completely kill p 99 of bacteria lilac lowest price                                                                                                                                     ,d7d4by
148,Quick question,is this sub really dedicated to not working how do you get money for food and other essentials,d7al7b
149,I'm an unemployed 30 year old who lives with his parents,and i absolutely love my free life i dont need much money im interviewing for junior software developer jobs and am back at university studying a part time bsc in computer science so it probably wont be long before im working again  i need money and employment in general but im really enjoying not answering to a boss and sometimes i get the feeling that my working friends just dont understand that im actually winning in life at the moment   im a free man in a world of wage slaves    it fucking rocks,d7fs9p
150,Existential Crisis,i feel like this slavewage rat race is killin my soul does anyone have any advice for escaping to a healthier happier life closer to nature,d7bxhs
