,title,body,id
245,I stopped going to work so I can do what I enjoy.,i've always been of the opinion that it's better to live a short life full of what i enjoy doing  than live a long life full of things i don't like doing  work  so i stopped going to work so i can focus on studying counselling and also mainly make music  the past few months i've been writing a lot of songs and i've really enjoyed it  i managed to put a few songs together with a main theme through out and now i have a complete album i created  it's called  'going nowhere' https soundcloud com remedy97 lost in remedy97 sets going-nowhere  and it's basically about a character who starts of very depressed about his life and the fact that he has to work a shitty job and through out the album his perspective changes and he becomes free  so at the beginning he feels that he has no purpose or direction  he is going nowhere  but at the end he realises that there is no destination in life  there is just  this moment  now-here    amp x200b   it'd be cool if you  listened to it https soundcloud com remedy97 lost in remedy97 sets going-nowhere  it would also be cool if you didn't   i just wanted to share something i enjoyed creating  ,bqheww
246,This T shirt design is now on Threadless, amp x200b    img jojbau6z0fz21 ,bqzvj3
247,Hopefully more and more people will start realising this,d  7 if you find a job   you love  you never work a day in your life         there is no perfect job for me  you romanticize a career to feel better about selling or best years to wage slavery  to not indoctrinate me into your cut of  complacency old man  ,bowek2
248,White collar work is useless,so i m a recent college grad  first generation  low income  relatively good grades  three year grad  etc  i just landed a salaried career in a nonprofit that s been in the news lately for some truly shady shit    my pay is garbage for all the responsibilities of course  and i was supposed to be paid yesterday but nobody gives a shit and apparently the boss doesn t care unless you pester him  it s not like i have student loan payments due tomorrow   point is i feel useless and helpless every day i m here  my talents aren t being utilized  i d kill to be a writer or an academic someday  but if you have a skill that can t be sold to shareholders in some way in this capitalist hell s ape you basically don t matter  white collar jobs are the ultimate manifestation of the machine that is our hypercapitalist society and being in the  middle class  is one gigantic joke myth    sorry if this doesn t make sense  i m just pissed bc i want my fucking money ,bjhnq3
249,What about financial independence and early retirement?,much of work nowadays is glorified slavery  but there is an escape and i think it is found in frugal living and investing   i am a childfree antinatalist so i don't have any children and don't follow the traditional life script of marriage  have children  get a mortgage  and become a wage slave    having children in a capitalist society is economic suicide   it is possible to live a frugal and environmentally friendly childfree lifestyle and save enough to retire early ,bjh3p7
250,Update,i am 30 and work in healthcare  it is high stress and non competitive pay   i broke down about three weeks ago and left my job  only to come back due to some sense of duty to the people i serve   the three days i was free i felt such an immense relief and was genuinely happy  all i keep thinking about is leaving again  i want to be free ,bjkduv
251,i guess i finally got diagnosed with something that might be worthy of getting disability,i m not sure  hopefully this isn t an offensive post for anyone but i got diagnosed with bipolar  last time i tried to go for disability i put down major depressive disorder and that didn t work  but i m sure there s still a great chance that this won t either    don t really know about getting an attorney either  isn t it expensive  and you have to stop working to apply for disability  what kind of fucking sense does that make lol  where are you supposed to live and what are you supposed to eat  and even with an attorney i m sure you can get turned down too  after all that money spent  you ve still gotten no where    i m so confused and so tired and honestly trying to keep my mind busy so i don t do anything drastic to myself  i cannot handle a full time job  it s killing me  how am i supposed to pay for my psych appointments  i m so tired you guys,bjfyzy
252,Living in an apartment complex is torture for those who work overnight,imagine working 10pm-6am and being woken up at 8 30am by the sound of lawnmowers  weed-whackers  and leaf-blowers that literally don't stop until well into the afternoon   there's nothing i hate more than the incessant monotonous tone of these machines  well  except having to work ,blrx7n
253,Why do some people think we'd be useless if we didn't have to work because of automation?,i'd rather feel useless if i did something a machine could do ,bl1z4b
254,I just busted my ass on the most difficult serving shift in my life and I walked home with $0 in tips despite getting an average of 20% on each table.,work is a fuck ,bl4a9n
255,Shut up. Fuck you.,cities deane ad fe  seatiedelaney   hate kiss  their idea of playing is to pretend they're doing jobs and errands that adults have to do for real  and then they complain about getting to take 3-hour caps every day  hut up  luck you  0 58 - 04 may 19 - twitter for shone  215 retweets 1 836 likes ,bkjfm1
256,72 hour tech work week in British Columbia?,   john fanning  fodalatelaaretaraliare   mule   slim  van couver    3 of hour work of  alfbaba rou semdaib big on the benefits of working 9 am  six days a week  cutis b c  re  he act soctoel about friend  state     11 44 of - 02 may 19 - twitter for shone ,bkkx8l
257,There's Hope,this is a rant i've had on my mind for a few weeks now as i've been lurking in this sub  and i apologize if its semantics aren't fully on point  i haven't spent a lot of time hashing this out  i'm just kind of hoping you all can see what i mean  this is not an attack on anything or anyone nor is there any anger or frustration behind it  only the desire for us all to lead happier lives   i first want to say that i empathize with all of you  i am anti-work in the sense that i don't believe in forced wage slavery and i think people's avocations should be their vocations if they so choose  i think the current quasi-capitalist system is a biased sham  however  there's a lot of really  really negative stuff in this feed  it's as if most of you are just waiting to retire or die  being miserable for every second of your workday and spending every free moment dreading the next workday  to reiterate i totally empathize  and i'm not here to tell you that it's all sunshine and rainbows  in fact i'm here to tell you that a lot of aspects of your job  or most jobs  are kind of shit  but you don't have to completely give in to that   i work a minimum-wage job where i put in between ten and twenty-five hours a week as a pizza chef and occasionally an arcade game attendant  and a second job where i drive for a notoriously shitty food delivery service  both jobs have abysmal aspects to them that i dread  however  i've learned to find joy and purpose for both jobs  getting people their food  helping them out with games  seeing people's reactions when i fix something for them  even just helping my co-workers with their tasks is rewarding  is it rewarding because the company cares about me at all  no  i'm just a cog in their machine  easily replaceable  i don't believe in the current capitalist system  and i don't believe in a minimum wage that isn't a living wage  etc  etc   howevrr  my job is rewarding because i found a company that has a bottom line i can support  delivering and or producing quality products for customers  to me  it's a matter of personal vindication - i succeed at my job because i've decided i am providing for myself and providing a necessary srtvice  and sometimes that's enough to excuse the pain  it can be for you  too  if you choose  the power of positive thinking and all that jazz  you may not want to work at all and that's fine  we're all here wanting to make that happen  but having a grudge against your job isn't gonna make your bad job disappear  what can disappear is your negativity  you have that power  if you don't  see a shaman or a therapist or a pastor or a friend or whatever    you only live once  my friends  stick to your ideals  but do not let them cloud your skies too darkly  we can't choose to opt out of the system  but we can choose not to let the system affect  or infect  our bodies with negativity    that's all  i hope you have a pleasant evening ,bkfe4m
258,"""Automation does not need to be our enemy. I think machines can make life easier for men, if men do not let the machines dominate them."" - John F. Kennedy",hey ervin  guess what  paying a geezer to wave of people isn't most effective           a robot's  gonna to  your joy  bye                                 every life is a unique aoventure 1 hope you ano of'of glao have a that part of pleasant yours i with us                                                      why hasn't that robot gone full freakout mode ano starteo karate chopping custumers yet                                 please    was  programmed to love   why are you 50 boring  worst 500k 1 ever spent          after a life of                                 wealth ano ny excess  nothing 7 else can get of a thrill anymore  love on't of imme a boner  roryblank   qpoopisustle b  roryplank kingofbloo0 co  ,bkfwbb
259,"Too poor to go anywhere, too tired to do anything.",                                    been it's because  indies now a day of boring  and every- demand   want thing  want to to rest  use this day off  to sleep     ,bkbukj
260,9-5 words that describe yourself,here is a list of 9-5 words i have heard of the years    feel free to comment your favourite words or terms   wage slave  wage cuck office jockey  cube cuck  clown world  9-5er 1x1m cubical  ball and chain  cube dweller  ldr  neet wage cage  worker bee  slavery  debt slave  prison slave  wage slave pepe,bk6stn
261,Every goddamn day,the ultimate game of waking of every  goddamn day and   doing the same shit over and over and over fuck of    wake of    ,blyphv
262,Any 9-5 veterans here?,what i mean by that is anyone here work in the 9-5 for 20-40 years    does it get any better  what i mean by that does it get more bareable  or do you find it gets worse over the years   i'm 5 years in on and off as a 9-5 and i'm struggling to hold on ,bkw7rg
263,Thinking about quitting my stable full time office job to start serving,my boyfriend is a server  and our soon to be roommate is also a server  they make pretty decent money  they don t ever have work before 11 am  they get off at 10 or 11 sometimes but who cares when you don t have work till noon the next day  they only work 5 hour shifts  they have so much free time and i feel like i m in jail or something with my stupid ass full time job    idk  should i quit so i can just serve tables and live a life free of 10 hour shifts  unnecessary stress  and drug tests  this full time job  has taken away my identity and i don t feel like myself  i feel like the mundane aspect of it all is suppressing me  i can t be real with one single coworker because they re all very conservative  all against weed  all pro capitalist  i m just not like them and i don t fit in  i can t fit in with my boyfriend or his friends because i m all  i have work at 7 am i can t stay  or  i m tired from being at work all day  always something holding me back    i miss the days of leaving work at the door  with my current job i have to worry about things when i m at home  projects from last week carry over into the next week  the only nice thing about this job is when that direct deposit hits  still not even the best pay  i thought  17 an hour would be a life changer  which  it has helped  but it s only a couple hundred more that i made in fast food lol  i d honestly rather get my life back than keep the stability of full time work  i can make plenty to cover bills  i m planning on getting a townhouse to rent with my boyfriend and our mutual friend who is also a server  i m thinking that i ll use this job to fund the move essentially and then transfer to a serving job as soon as i get to the new area i ll be living in    thinking of the 3 of us having that nice ass place with all part time serving jobs seems like the shit  i would kill to wake up with my dog and boyfriend and have time to enjoy the morning  then go to work at 11am or 5 pm  making the leap just scares me    any servers on here  how do you like it  did you quit your full time job to serve part time ,blbv19
264,Why and how is “mandatory overtime” legal?,seriously  you take a enough of my time ,bm7q4c
265,"In your office, is toilet paper placed in one of those locked toilet-paper dispensers? I find these devices absurd",i just had a look  these devices cost anywhere between  44 to  200   a single roll of toilet paper is what  50 cents   so in order for a mechanism to lock the toilet paper to be worth the investment  you have to have a pretty serious problem of tp-theft in your office  imho  people would bother to pilfer something as cheap as tp regularly if they're that poor and underpaid  it's absurd  the lengths they which companies would go to maintain these small-yet-efficient oppression mechanisms    amp x200b       amp x200b   last week  my workplace had some protests arranged by staff  the company is huge and it reached the news too  everyone got an email to come over to a dedicated room on their lunch break  to support coworkers who suffered retaliation for raising various complaints against the company    not a lot of people showed up  i think they were scared of retaliation too  besides  people really need their lunch break -it's the 1 hour a day in which they can step away from the mid-century modern pastel furniture and fake smiles    i've had this idea of arranging an alternative protest through social media  in which everyone secretly steals 1 toilet paper roll from their office bathroom and uploads a picture on twitter reddit etc  perhaps with some added anti-work text on it  they can't retaliate if they can't catch you    but as i ran it through friends  i realized in most of their offices  tp is behind lock and key  i'm kind of bummed out  it would have been a fun new antiwork holiday ,bki6tn
266,Finally with people who think the same!,i am just here to acknowledge this wonderful occasion where we vent off  because we are not able to stop this shitty system in which every human being is merely seen as a work force than a living creature  but hey  money will save the day right  well  what will you breathe when no rainforest provides free oxygen  '   amp x200b   ok so i just wanted to thank you  really  it is an honor to find people who also dislike the idea of working and working as well  but because i am still new to this subredit  could you send me some helpful posts for a beginner  just a guideline how to fucking survive without work  would be fine   ,bm66xg
267,Platimotivational about embracing the gig economy given to a homeless person living in a car. Makes me sick,interesting want  but like an says  the world will not bend to your will  fact of the matter is  simply  you took a dead-end path in this made we call life  now you can stay at the dead end  screaming out your anger to the world and refuse to budge - or eat some humble pie  backtrack to a place you've already gotten thou once already  and fight your way thou the masses to find a new nice in the world   i fix computers for a living - that career is coming to an end  with the advent of smartphones and tablets  throwaway devices  i'm also in a dead-end path  i got downsized a decade ago  been scraping by surviving ever since - but i know its just a matter of time until i'm in the same boat you are   doesn't matter that it isn t fair  such is life  i went from making a decent wage in my little hometown to a federal poverty-level existence  real eye-opened  gutta admit   thankful  i had a girlfriend that could survive on under k a year  half the federal poverty level  and she taught me how to stretch a dollar   and about eating humble pie  and raven nodules   so my choice are move to a big city and be miserable in a metropolis  or restrain to a different career  and in the same age you are  which is why i'm studying the  homeless boards in case things don't work out  and taking free online courses to educate myself on a different career path   the world will not change back into my favor  but with the advent of the digital world  new opportunities abound  i have friends that survive by grinding thou endless online surveys and doing grudge work for amazon's mechanical turk  another one hunts garage sales every weekend and spends his weekdays posting his finds on various auction sites  a gal-pal with fashion sense does the same thing with outfits avenged from garage sales and thrifty shops  one couple works with me to recycle old electronics and clean banks in the evenings to pay their mortgage      so it boils down to this   are you willing to give up your pity party and start over from scratch   or would you rather admit defeat at the hands of life and your assist family and just cash out your existence   your journey only has to end if you refuse to move forward - even if you don't like the direction its heading at the moment  pick your path  and roll the dice up   best of luck to a   like red green says  i'm pulling for a - we're all in this together   ,bm58sm
268,The only way,          now to avoid stress at work   1  on't go to work                    ,blevt7
269,"For some reason, I thought this should be here. That’s the taste of freedom I want to feel again someday.",james y  caucasianjames  not having to bring my backpack to the last day of elementary school was the last time i truly felt free  9 07 of - 5 5 19 - twitter for shone ,blllv1
270,Am I in the wrong for having this plan in life?,to sum it up  i'm currently attending college but i do not go to any classes  i am spending as much time as possible playing a game in hopes that i can make a career off going professional in it   if this doesn't work out  i'm killing myself   i do not want to deal with life at all  there is no work i can find feasible and the thought of even just a part time job makes me want to die  i don't want to do this shit for 50 years ,bm2kd3
271,Anyone here has easy jobs but reasonable pay like Homer Simpsons?,would you still be anti work  if company pays you for doing nothing and doesn't care if you just sleep  eat  playing around  etc during office hours ,bm2bub
272,Tattoos,i don't have any myself  but i feel like  the man  probably tells a lot of people not to show their tattoos at work   anyone have problems with this ,blzi21
273,"I really didn’t expect anything different when we took our surveys at work weeks ago.... but, you’re being told your pay is crap 💩 and your answer is that we must not understand the career ladder, we just need more training. 🖕 not an idiot.",il te ret  is to  age and career oath th  can a i il   by        did          in 2 el in ll in 5 1 2019            ,bjria4
274,Unrealistic target goals,you will have work more than 8 hours a day    ,bjprpc
275,Just had my dreams pissed all over.,granted though my mother did have some valid points   she can't support me forever   told her i wanted to quit my job  got told off and that i needed to get a full time job or at least more hours   told her i wanted to live in a van  that i didn't agree with the full time working philosphy  that i didn't think i would ever own a house  could she see me having  350k  spare with any job i worked  think is you don't even get to keep your house to give to your kids in this system  it's counted as an asset against you so you get less government support  plus you have a house  you're stuck  want to leave  you need a house pet sitter  plus still got a mortgage and some utilities    amp x200b   sure  she probably see's this as a pipe dream from her lazy 29 year old  and granted i am 'lazy'  she thinks it ridiculous that a 29 year old would live in a van  i get this sentiment  i'd want a nice van i could cart myself and my cat in around  don't want to abandon him  he's my responsibility and i love him lt 3    and it would at least have to be paid off  i'd probably need odd jobs until i win the lottery  how desolate is the alternative though  get a house  date  have kids  granted they're adorable  dress like other people  act like other people  smile and be happy that you're employed  being super friendly with the boss so you're in their good books  oh yeah  i like them  let's let them keep their job  even in doing this  or attempting it  it's not cheap in australia  you'd want like  30k for a van  easily  80k  new  and still not 4x4   10k to get it 'off grid' and fitted out  then you still have to pay to run it  which would probably chew out the max  300 a week we'd get in welfare  which is often your weekly rent around here    amp x200b   realistically it's probably a pipe dream  i'd need the money  then i'd need upkeep petrol  i like how bob wells  of cheaprvliving  put's it though  you get a big house  all the utilities  you're trading freedom for comfort   granted i might like these some day   only way i could see doing it is having the money first somehow  then just doing it and saying see-ya  but by then somebody will be saying don't be stupid get a deposit on a house  then get the house and keep a job and pay  300  a week so you'll have it outright in 30 years  then you can sell it for a caravan and travel if you're still alive at likely 70 years so you can then get your full measly pension from the government  though i can see the point in a house  it's really just a way to park your money and have 'security' as well as a place to fill up with stuff  though i want a farm    amp x200b   seems whatever way we do it we're fucked ,bk2hdy
276,We're all on equal footing in America!,highereducation pig  all here was        american collegiate system in one if set    ,bk3xyy
277,Does anyone else feel like your boss/supervisor/whatever is trying to punish you after holidays?,i mean  every time after holidays  the whole damn office has so much work that we have to stay a good 1  1 5 hours extra  it's like they're punishing you for daring to have free time and you have to repay by doing extra work when you're back   i fucking hate office jobs  the twats you usually work with and office micro-politics  although the latter tempts me to just go chaotic evil on their asses and turn them against each other sometimes  if it weren't for some decent co-workers i hangout with occasionally  i would have quit and never looked back ,blhvv6
278,"New to this sub, curious about what you guys think should be the substitute economic model for our society instead of employments and human labor",please be as specific as you want  this is a genuine question  as i am not creative myself  i couldn't think of anything that could replace the current structure that we have on our modern world ,bjd67l
279,"SPOILER FOR GAME OF THRONES, (BUT ALSO RELEVANT.)",these bastards literally did nothing the entire series   upper management in a nutshell   gameofthrones      ,bk8gzd
280,Near future,it   reason   a  keatronn  the year is 2025  i pick up my adderall milkshake at of on the way to my job in the kidney nostalgia lines    take the crime same may express lanes to pick up my worker  doing my required five ride shares before work    make  0 25   1 34 of - 2019-05-02 - twitter for shone  2 131 retweets 12k likes    ,bkidsi
281,2fast4me,wha  what just happened       of of 1 of sssn  mrlovenstein com    ,bknjxd
282,Chipotle,i don t know why im still working with this company i started in january and i completly regret it from the start there has always been problems from them sending my payroll card to the wrong address and not having money for almost two months to them now lowering my hours to only one day a week  i broke my arm not long ago but jesus im perfectly fine now and its still the same thing  the work load is horrible people come in non-stop and working as a cashier is pure hell  1 people are rude like extremely rude leaving the place disgusting and full of icky leftovers  2 for 9 00   an hour its so not worth it you have to deal with giant lines make sure you have enough forks spoons and knives and thats every 10 minutes because you will run out extremely fast   3 cleaning the dinning room is hell since its always full you will never have space to broom and clean the tables properly    you will have to do other peoples job even if you repeatedly say no ive had to take out a bunch of heavy trash bags alone because someone did not want to do their job   the employe treatment is horrible too you cannot be absent ever unless you are extremely vomiting or have explosive shit the managers will threatened to fire you everytime you are actually sick to work  ex i had a really bad fever i called in and my hiring manager told me  what is your problem okay then that is a write up  and most of my breaks are directly at the start of my shift i have no in between that i would actually like to have since standing 9hr straight hurts extremely bad   honestly the money is good the treatment is horrible and the crazy hours from working an afternoon and then a morning are insaine  im planning on quitting before june arrives cause i honestly cant take how erratic and how emotionally draining this job is ,bkpwkk
