,title,body,is_image,id,author,url,num_comments,num_upvotes
0,"Yes, too many of us are in pointless jobs – but don’t despair",,False,2rj5z7,Capn_Blackbeard,http://www.theguardian.com/commentisfree/2015/jan/06/too-many-of-us-in-pointless-jobs-but-dont-despair,1,19
1,Some Advice for John Dishwasher (AbolishWork.com),,False,2twexa,AbolishWork,http://abolishwork.com/2015/01/25/advice-john-dishwasher/,0,8
2,In the Name of Love,,False,2sudha,Capn_Blackbeard,https://www.jacobinmag.com/2014/01/in-the-name-of-love/,0,10
3,Antiwork – a radical shift in how we view “jobs” : December 2014 : Contributoria,,False,2td57o,andoruB,https://contributoria.com/issue/2014-12/543d1c2487628e9a6500001b,0,16
4,"We Need Less Work, Not More",,False,2t5vqz,Capn_Blackbeard,http://labornotes.org/blogs/2015/01/we-need-less-work-not-more,0,18
5,A Stiff Upper Lip Doesn’t Make Politics Go Away (BOOK REVIEW) [AbolishWork.com],,False,2u8pne,AbolishWork,http://abolishwork.com/2015/01/30/stiff-upper-lip-doesnt-make-politics-go-away-book-review/,0,8
6,David Graeber on RT discussing 'Bullshit Jobs',,False,2sio73,ThinWildMercury1,https://www.youtube.com/watch?v=E-tIAlRgNpc&amp;feature=youtu.be,1,25
7,Should You do What You Love? (AbolishWork.com),"This is Nick Ford of AbolishWork.com. I'll try to post to this subreddit a little more often now that I have an account.

Hope you guys enjoy and feedback is *always* welcome!

EDIT: Not sure why it didn't link but here it is:

http://abolishwork.com/2015/01/13/love/",False,2sb47k,AbolishWork,http://www.reddit.com/r/antiwork/comments/2sb47k/should_you_do_what_you_love_abolishworkcom/,8,13
8,The Right Didn’t Steal Our Future - We Gave It Away,,False,2siqu5,hereandnotthere,http://c4ss.org/content/34976,0,6
9,How Nonemployed Americans Spend Their Weekdays: Men vs. Women,,False,2rim1l,phoenix_insurgent,http://www.nytimes.com/interactive/2015/01/06/upshot/how-nonemployed-americans-spend-their-weekdays-men-vs-women.html?smid=fb-nytimes&amp;smtyp=cur&amp;bicmp=AD&amp;bicmlukp=WT.mc_id&amp;bicmst=1409232722000&amp;bicmet=1419773522000&amp;abt=0002&amp;abg=1,0,8
10,Where Will All the Workers Go? by Nouriel Roubini,,False,2rgrir,andoruB,http://www.project-syndicate.org/commentary/technology-labor-automation-robotics-by-nouriel-roubini-2014-12,0,11
11,"Hidden devices scrutinize employees: 'The U.S. Office of Technology Assessment... warned that the trend might lead to poor office morale, staff turnover, worker slowdowns and even ""employee sabotage.""'",,False,2s2e23,phoenix_insurgent,http://www.mercurynews.com/business/ci_27132016/hidden-devices-scrutinize-employees,3,10
12,'Bullshit Jobs' adverts appear on the London Underground,,False,2recq6,ThinWildMercury1,https://www.facebook.com/media/set/?set=a.421295974685941.1073741871.139091076239767&amp;type=1,0,25
13,Poverty in USA - Interview with Linda Torado [x-post /r/TZM],,False,2su85b,andoruB,http://youtube.com/watch?v=6fJYAWG2RvQ&amp;t=11m35s,0,6
14,Tips for the Unproductive (AbolishWork.com),,False,2swehm,AbolishWork,http://abolishwork.com/2015/01/18/tips-unproductive/,2,7
